date,event,result,location,image_url
1,13.09.2025,,"Oleg Boltin,Shota Umino&Yuya UemuradefeatHouse Of Torture(Dick Togo,Don Fale&EVIL) (7:14)NJPW Road To Destruction 2025 - Tag 3- TV-Show @ Korakuen Hall in Tokyo, Japan",https://upload.wikimedia.org/wikipedia/commons/d/d2/BULLET_CLUB.JPG
2,10.09.2025,,"House Of Torture(Dick Togo,Don Fale&EVIL) defeatOleg Boltin,Shoma Kato&Shota Umino(9:25)NJPW Road To Destruction 2025 - Tag 2- Event @ Kuki City Gymnasium in Kuki, Saitama, Japan",https://upload.wikimedia.org/wikipedia/commons/d/d2/BULLET_CLUB.JPG
3,09.09.2025,,"House Of Torture(Dick Togo,Don Fale&EVIL) defeatKatsuya Murashima,Oleg Boltin&Yuya Uemura(8:10)NJPW Road To Destruction 2025 - Tag 1- Event @ Fujisan Messe in Fuji, Shizuoka, Japan",https://upload.wikimedia.org/wikipedia/commons/d/d2/BULLET_CLUB.JPG
4,07.09.2025,,"House Of Torture(Dick Togo,Don Fale&EVIL) defeatKatsuya Murashima,Oleg Boltin&Shoma Kato(7:24)NJPW Yuji Nagata Produce Blue Justice XVI- Online Stream @ Togane Arena in Togane, Chiba, Japan",https://upload.wikimedia.org/wikipedia/commons/d/d2/BULLET_CLUB.JPG
5,17.08.2025,,"House Of Torture(Don Fale,SANADA&Yoshinobu Kanemaru) defeatEl Phantasmo,Oleg Boltin&Tiger Mask(6:58)NJPW G1 Climax 35 - Tag 19- TV-Show @ Ariake Arena in Tokyo, Japan",https://upload.wikimedia.org/wikipedia/commons/d/d2/BULLET_CLUB.JPG
6,16.08.2025,,"House Of Torture(Don Fale&Yujiro Takahashi) defeatOleg Boltin&Tomoaki Honma(4:28)NJPW G1 Climax 35 - Tag 18- TV-Show @ Ariake Arena in Tokyo, Japan",https://upload.wikimedia.org/wikipedia/commons/d/d2/BULLET_CLUB.JPG
7,14.08.2025,,"House Of Torture(Don Fale,DOUKI&EVIL) defeatTMDK(Hartley Jackson,Ryohei Oiwa&Zack Sabre Jr.) (7:05)NJPW G1 Climax 35 - Tag 17- Online Stream @ Korakuen Hall in Tokyo, Japan",https://upload.wikimedia.org/wikipedia/commons/d/d2/BULLET_CLUB.JPG
8,04.07.2025,,"Don Fale,Liger& Maximillion defeat Dorian Webber,Horus& Soni Tupou (7:42)NJPW TAMASHII: Cold War- Event @ Mangere Arts Centre in Auckland, New Zealand",https://upload.wikimedia.org/wikipedia/commons/d/d2/BULLET_CLUB.JPG
9,23.06.2025,,"House Of Torture(Chase Owens,Don Fale,EVIL&SANADA) defeatGreat Bash Heel(Togi Makabe&Tomoaki Honma),Tiger Mask&YOSHI-HASHI(8:42)NJPW New Japan Soul 2025 - Tag 5- TV-Show @ Korakuen Hall in Tokyo, Japan",https://upload.wikimedia.org/wikipedia/commons/d/d2/BULLET_CLUB.JPG
10,22.06.2025,,"House Of Torture(Chase Owens,Don Fale,EVIL&SANADA) defeatJado,Oleg Boltin,Togi Makabe&YOSHI-HASHIby DQ (8:45)NJPW New Japan Soul 2025 - Tag 4- Event @ Toyota Crown Arena in Fukushima, Japan",https://upload.wikimedia.org/wikipedia/commons/d/d2/BULLET_CLUB.JPG
11,21.06.2025,,"House Of Torture(Chase Owens,Don Fale,EVIL&SANADA) defeatJado,Katsuya Murashima,Shoma Kato&YOSHI-HASHI(10:05)NJPW New Japan Soul 2025 - Tag 3- Online Stream @ Yamagata Big Wing in Yamagata, Japan",https://upload.wikimedia.org/wikipedia/commons/d/d2/BULLET_CLUB.JPG
12,19.06.2025,,"House Of Torture(Chase Owens,Don Fale,EVIL&SANADA) defeatJado,Oleg Boltin,Togi Makabe&YOSHI-HASHIby DQ (8:55)NJPW New Japan Soul 2025 - Tag 2- Online Stream @ Hachinohe City East Gymnasium in Hachinohe, Aomori, Japan",https://upload.wikimedia.org/wikipedia/commons/d/d2/BULLET_CLUB.JPG
13,18.06.2025,,"House Of Torture(Chase Owens,Don Fale,EVIL,SANADA&Yoshinobu Kanemaru) defeatGreat Bash Heel(Togi Makabe&Tomoaki Honma),Katsuya Murashima,Oleg Boltin&YOSHI-HASHI(9:44)NJPW New Japan Soul 2025 - Tag 1- Online Stream @ Aomori Martial Arts Hall in Hirosaki, Aomori, Japan",https://upload.wikimedia.org/wikipedia/commons/d/d2/BULLET_CLUB.JPG
14,15.06.2025,,"House Of Torture(Don Fale,Ren Narita,SANADA&Yujiro Takahashi) defeatBULLET CLUB War Dogs(Chase Owens,Clark Connors,Drilla Moloney&Taiji Ishimori) (6:44)NJPW Dominion 6.15 In Osaka-Jo Hall- TV-Show @ Osaka-Jo Hall in Osaka, Japan",https://upload.wikimedia.org/wikipedia/commons/d/d2/BULLET_CLUB.JPG
15,24.05.2025,,"The Pretty Boys (Magic Mark & Pretty Richie) defeatBad Luck Fale& Kurt Brown (9:48)Fale Dojo Lion's Den- Event @ Fale Dojo in Auckland, New Zealand",https://upload.wikimedia.org/wikipedia/commons/d/d2/BULLET_CLUB.JPG
16,16.05.2025,,"Cian Devin&HorusdefeatBad Luck Fale& Maximillion (11:00)NJPW TAMASHII: Mayhem- Online Stream @ Mangere Arts Centre in Auckland, New Zealand",https://upload.wikimedia.org/wikipedia/commons/d/d2/BULLET_CLUB.JPG
17,03.05.2025,,"The Pretty Boys (Magic Mark & Pretty Richie) defeatBad Luck Fale& MaximillionFale Dojo Lion's Den- Event @ Fale Dojo in Auckland, New Zealand",https://upload.wikimedia.org/wikipedia/commons/d/d2/BULLET_CLUB.JPG
18,26.04.2025,,"Bad Luck Fale&Nico Belldefeat Dorian Webber &Tyson HarrisNJPW TAMASHII Live In Hamilton- Event @ Te Whare Mauri o Te K&#333;hao in Hamilton, New Zealand",https://upload.wikimedia.org/wikipedia/commons/d/d2/BULLET_CLUB.JPG
19,29.03.2025,,"Bad Luck Fale& Maximillion defeatHorus&Vinny Dunn(7:24)NJPW TAMASHII: March To Glory- Online Stream @ Mangere Arts Centre in Auckland, New Zealand",https://upload.wikimedia.org/wikipedia/commons/d/d2/BULLET_CLUB.JPG
20,20.03.2025,,"BULLET CLUB(Bad Luck Fale,Chase Owens&SANADA) defeatJust 4 Guys(Taichi,TAKA Michinoku&Yuya Uemura) (8:26)NJPW New Japan Cup 2025 - Tag 9- TV-Show @ Aore Nagaoka in Nagaoka, Niigata, Japan",https://upload.wikimedia.org/wikipedia/commons/d/d2/BULLET_CLUB.JPG
21,17.03.2025,,"BULLET CLUB(Bad Luck Fale,Chase Owens&Gabe Kidd) vs.House Of Torture(Ren Narita,SHO&Yoshinobu Kanemaru) - Double Count Out (7:51)NJPW New Japan Cup 2025 - Tag 8- Online Stream @ Big Palette Fukushima in Koriyama, Fukushima, Japan",https://upload.wikimedia.org/wikipedia/commons/d/d2/BULLET_CLUB.JPG
22,16.03.2025,,"House Of Torture(EVIL,Ren Narita,SHO,Yoshinobu Kanemaru&Yujiro Takahashi) defeatBULLET CLUB(Bad Luck Fale,Chase Owens,Drilla Moloney,Gabe Kidd&SANADA) (8:29)NJPW New Japan Cup 2025 - Tag 7- TV-Show @ Twin Messe Shizuoka in Shizuoka, Japan",https://upload.wikimedia.org/wikipedia/commons/d/d2/BULLET_CLUB.JPG
23,14.03.2025,,"BULLET CLUB(Bad Luck Fale,Chase Owens,Gabe Kidd&SANADA) defeatHouse Of Torture(Ren Narita,SHO,Yoshinobu Kanemaru&Yujiro Takahashi) (0:23) by DQNJPW New Japan Cup 2025 - Tag 5- Online Stream @ Osaka Kanaoka Park Gymnasium in Sakai, Osaka, Japan",https://upload.wikimedia.org/wikipedia/commons/d/d2/BULLET_CLUB.JPG
24,14.03.2025,,"12 Man:House Of Torture(Dick Togo,EVIL,Ren Narita,SHO,Yoshinobu Kanemaru&Yujiro Takahashi) defeatBULLET CLUB(Bad Luck Fale,Chase Owens,David Finlay,Gabe Kidd,Gedo&SANADA) (6:56)NJPW New Japan Cup 2025 - Tag 5- Online Stream @ Osaka Kanaoka Park Gymnasium in Sakai, Osaka, Japan",https://upload.wikimedia.org/wikipedia/commons/d/d2/BULLET_CLUB.JPG
25,12.03.2025,,"House Of Torture(EVIL,Ren Narita,SHO,Yoshinobu Kanemaru&Yujiro Takahashi) defeatBULLET CLUB(Bad Luck Fale,Chase Owens,David Finlay,Drilla Moloney&SANADA) (6:44)NJPW New Japan Cup 2025 - Tag 4- Online Stream @ Uwajima City General Gymnasium in Uwajima, Ehime, Japan",https://upload.wikimedia.org/wikipedia/commons/d/d2/BULLET_CLUB.JPG
26,11.03.2025,,"United Empire(Callum Newman,Jeff Cobb&TJP) defeatBULLET CLUB(Bad Luck Fale,Chase Owens&Drilla Moloney) (8:48)NJPW New Japan Cup 2025 - Tag 3- Online Stream @ ZIP Arena Okayama in Okayama, Japan",https://upload.wikimedia.org/wikipedia/commons/d/d2/BULLET_CLUB.JPG
27,09.03.2025,,"New Japan Cup 2025 First Round:Oleg BoltindefeatsBad Luck Fale(7:11)NJPW New Japan Cup 2025 - Tag 2- TV-Show @ Baycom Gymnasium in Amagasaki, Hyogo, Japan",https://upload.wikimedia.org/wikipedia/commons/d/d2/BULLET_CLUB.JPG
28,06.03.2025,,"BULLET CLUB(Bad Luck Fale&Chase Owens) defeatTMDK(Hartley Jackson&Ryohei Oiwa) (6:52)NJPW 53rd Anniversary Event- TV-Show @ Ota City General Gymnasium in Tokyo, Japan",https://upload.wikimedia.org/wikipedia/commons/d/d2/BULLET_CLUB.JPG
29,16.02.2025,,"Rogue Army(Bad Luck Fale&Jack Bonza) defeatKulture(Moko Kai&Toa)NJPW TAMASHII- Event @ Superordinary in Hamilton, Queensland, Australia",https://upload.wikimedia.org/wikipedia/commons/d/d2/BULLET_CLUB.JPG
30,01.02.2025,,"Johnny Gunn& Sean Tohi defeatDon Fale& Xander Taylor (9:57)Fale Dojo Lion's Den- Event @ Fale Dojo in Auckland, New Zealand",https://upload.wikimedia.org/wikipedia/commons/d/d2/BULLET_CLUB.JPG
31,18.01.2025,,"Don Fale& TJ Illes defeat The Pretty Boys (Magic Mark & Pretty Richie) (11:05)Fale Dojo Lion's Den- Event @ Fale Dojo in Auckland, New Zealand",https://upload.wikimedia.org/wikipedia/commons/d/d2/BULLET_CLUB.JPG
32,11.01.2025,,"The Pretty Boys (Magic Mark & Pretty Rich) defeatBad Luck Fale& Maximillion (14:16)NJPW TAMASHII New Year's Showdown- Online Stream @ Mangere Arts Centre in Auckland, New Zealand",https://upload.wikimedia.org/wikipedia/commons/d/d2/BULLET_CLUB.JPG
33,23.11.2024,,"The Pretty Boys (Magic Mark & Pretty Richie) defeatBad Luck Fale&Cian DevinFale Dojo Lion's Den- Event @ Auckland, New Zealand",https://upload.wikimedia.org/wikipedia/commons/d/d2/BULLET_CLUB.JPG
34,15.11.2024,,"NJPW TAMASHII Oceania Cup Semi Final:Jack BonzadefeatsBad Luck Fale(2:40)NJPW TAMASHII Oceania Cup - Tag 4- Event @ Mangere Arts Centre in Auckland, New Zealand",https://upload.wikimedia.org/wikipedia/commons/d/d2/BULLET_CLUB.JPG
35,26.10.2024,,"AychPapi,Bad Luck Fale&Nikolai Anton-Belldefeat Fuiloaded, Magic Mark & Pretty RichieFale Dojo Lion's Den- Event @ Auckland, New Zealand",https://upload.wikimedia.org/wikipedia/commons/d/d2/BULLET_CLUB.JPG
36,19.10.2024,,"Bad Luck Fale&Nikolai Anton-Belldefeat Pretty Rich & Uce LeeRoyFale Dojo Lion's Den- Event @ Auckland, New Zealand",https://upload.wikimedia.org/wikipedia/commons/d/d2/BULLET_CLUB.JPG
37,14.10.2024,,"IWGP Tag Team Title:TMDK(Mikey Nicholls&Shane Haste) (c) defeatBULLET CLUB Rogue Army(Bad Luck Fale&Caveman Ugg) (7:49)NJPW King Of Pro-Wrestling 2024- TV-Show @ Ryogoku Kokugikan in Tokyo, Japan",https://upload.wikimedia.org/wikipedia/commons/d/d2/BULLET_CLUB.JPG
38,12.10.2024,,"BULLET CLUB(Bad Luck Fale,Caveman Ugg&Taiji Ishimori) defeatTMDK(Hartley Jackson,Mikey Nicholls&Shane Haste) (9:56)NJPW Road To King Of Pro-Wrestling 2024 - Tag 5- Event @ Kamisu Bousai Arena in Kamisu, Ibaraki, Japan",https://upload.wikimedia.org/wikipedia/commons/d/d2/BULLET_CLUB.JPG
39,11.10.2024,,"TMDK(Kosei Fujita,Mikey Nicholls&Shane Haste) defeatBULLET CLUB(Bad Luck Fale,Caveman Ugg&Taiji Ishimori) (9:55)NJPW Road To King Of Pro-Wrestling 2024 - Tag 4- Event @ Saku City Gymnasium in Saku, Nagano, Japan",https://upload.wikimedia.org/wikipedia/commons/d/d2/BULLET_CLUB.JPG
40,10.10.2024,,"BULLET CLUB(Bad Luck Fale,Caveman Ugg&Taiji Ishimori) defeatTMDK(Hartley Jackson,Mikey Nicholls&Shane Haste) (8:50)NJPW Road To King Of Pro-Wrestling 2024 - Tag 3- Event @ Kuki City Gymnasium in Kuki, Saitama, Japan",https://upload.wikimedia.org/wikipedia/commons/d/d2/BULLET_CLUB.JPG
41,08.10.2024,,"BULLET CLUB(Bad Luck Fale,Caveman Ugg&Taiji Ishimori) defeatTMDK(Kosei Fujita,Mikey Nicholls&Shane Haste) (9:57)NJPW Road To King Of Pro-Wrestling 2024 - Tag 2- Event @ Fujisan Messe in Fuji, Shizuoka, Japan",https://upload.wikimedia.org/wikipedia/commons/d/d2/BULLET_CLUB.JPG
42,06.10.2024,,"BULLET CLUB(Bad Luck Fale,Caveman Ugg&Taiji Ishimori) defeatTMDK(Hartley Jackson,Mikey Nicholls&Shane Haste) (7:15)NJPW Wrestling Life 40th Anniversary Yuji Nagata Produce Blue Justice XIV- TV-Show @ Togane Arena in Togane, Chiba, Japan",https://upload.wikimedia.org/wikipedia/commons/d/d2/BULLET_CLUB.JPG
43,05.10.2024,,"BULLET CLUB(Bad Luck Fale,Caveman Ugg&Taiji Ishimori) defeatTMDK(Hartley Jackson,Mikey Nicholls&Shane Haste) (7:33)NJPW Road To King Of Pro-Wrestling 2024 - Tag 1- Event @ Kumagaya Citizen Gymnasium in Kumagaya, Saitama, Japan",https://upload.wikimedia.org/wikipedia/commons/d/d2/BULLET_CLUB.JPG
44,28.09.2024,,"Bad Luck Fale, Chicharron & El Chomko defeat AychPapi &The Ungrateful 1s(TJ Illes &Trent Hooper) (8:19)Fale Dojo Lion's Den- Event @ Fale Dojo in Auckland, New Zealand",https://upload.wikimedia.org/wikipedia/commons/d/d2/BULLET_CLUB.JPG
45,15.09.2024,,"NJPW TAMASHII Oceania Cup Quarter Final:Bad Luck FaledefeatsNikolai Anton-Bell(9:22)NJPW TAMASHII Oceania Cup - Tag 3- Online Stream @ Manning Bar in Camperdown, New South Wales, Australia",https://upload.wikimedia.org/wikipedia/commons/d/d2/BULLET_CLUB.JPG
46,13.09.2024,,"Rogue Army(Bad Luck Fale,Jack J. Bonza,Stevie Filip&Tome Filip) defeat Team Hope (Emman Azman,Johnny Gardner,Luke Watts&Mitch Waterman) (11:34)NJPW TAMASHII Oceania Cup - Tag 2- Online Stream @ Prince Bandroom in St. Kilda, Victoria, Australia",https://upload.wikimedia.org/wikipedia/commons/d/d2/BULLET_CLUB.JPG
47,16.08.2024,,"NJPW TAMASHII Oceania Cup First Round:Bad Luck FaledefeatsBen Braxton(7:41)NJPW TAMASHII Oceania Cup - Tag 1- Online Stream @ The Metro Social in Sydney, New South Wales, Australia",https://upload.wikimedia.org/wikipedia/commons/d/d2/BULLET_CLUB.JPG
48,28.07.2024,,"The Pretty Boys (Mark Tui & Richard Mulu) defeatRogue Army(Bad Luck Fale&Jack Bonza)NJPW TAMASHII One Night Only- Event @ Rolleston College Auditorium in Christchurch, Canterbury, New Zealand",https://upload.wikimedia.org/wikipedia/commons/d/d2/BULLET_CLUB.JPG
49,18.05.2024,,"Rogue Army(Bad Luck Fale&Caveman Ugg) defeat Mark Tui & Richard Mulu (12:09)NJPW TAMASHII X- Online Stream @ Prince Bandroom in Melbourne, Australia",https://upload.wikimedia.org/wikipedia/commons/d/d2/BULLET_CLUB.JPG
50,17.05.2024,,"Bishamon(Hirooki Goto&YOSHI-HASHI) defeatRogue Army(Bad Luck Fale&Caveman Ugg) (12:44)NJPW TAMASHII IX- Online Stream @ Selina's Entertainment Center in Sydney, New South Wales, Australia",https://upload.wikimedia.org/wikipedia/commons/d/d2/BULLET_CLUB.JPG
51,10.12.2023,,"Monstersauce(Alex Zayne&Lance Archer),Minoru Suzuki&Yuji NagatadefeatBULLET CLUB(Alex Coughlin,Bad Luck Fale,Gabe Kidd&Jack Bonza) (8:49)NJPW World Tag League 2023 - Tag 16- TV-Show @ Grand Messe Kumamoto in Mashiki, Kumamoto, Japan",https://upload.wikimedia.org/wikipedia/commons/d/d2/BULLET_CLUB.JPG
52,08.12.2023,,"BULLET CLUB(Bad Luck Fale,Jack Bonza&Taiji Ishimori) defeatMaster Wato,Oskar Leube&Yuto Nakashima(8:44)NJPW World Tag League 2023 - Tag 15- Online Stream @ Kirishima City Makizono Arena in Kirishima, Kagoshima, Japan",https://upload.wikimedia.org/wikipedia/commons/d/d2/BULLET_CLUB.JPG
53,07.12.2023,,"World Tag League 2023 Block B:Minoru Suzuki&Yuji Nagata[4] defeatRogue Army(Bad Luck Fale&Jack Bonza) [4] (9:43)NJPW World Tag League 2023 - Tag 14- Online Stream @ Miyakonojo City Hayamizu Sports Culture Centre in Miyakonojo, Miyazaki, Japan",https://upload.wikimedia.org/wikipedia/commons/d/d2/BULLET_CLUB.JPG
54,06.12.2023,,"BULLET CLUB(Bad Luck Fale,Jack Bonza&Taiji Ishimori) defeatMinoru Suzuki,Ryusuke Taguchi&Yuji Nagata(8:16)NJPW World Tag League 2023 - Tag 13- Online Stream @ Karatsu Athletic Stadium in Karatsu, Saga, Japan",https://upload.wikimedia.org/wikipedia/commons/d/d2/BULLET_CLUB.JPG
55,04.12.2023,,"World Tag League 2023 Block B:Rogue Army(Bad Luck Fale&Jack Bonza) [4] defeatJust 5 Guys(Taichi&Yuya Uemura) [8] (11:06)NJPW World Tag League 2023 - Tag 12- Online Stream @ Kochi Prefectural Gymnasium in Kochi, Japan",https://upload.wikimedia.org/wikipedia/commons/d/d2/BULLET_CLUB.JPG
56,03.12.2023,,"BULLET CLUB(Bad Luck Fale,Jack Bonza&Taiji Ishimori) defeatJust 5 Guys(DOUKI,Taichi&Yuya Uemura) (8:42)NJPW World Tag League 2023 - Tag 11- Online Stream @ Arcrea Himeji in Himeji, Hyogo, Japan",https://upload.wikimedia.org/wikipedia/commons/d/d2/BULLET_CLUB.JPG
57,02.12.2023,,"World Tag League 2023 Block B:Guerrillas Of Destiny(El Phantasmo&Hikuleo) [6] defeatRogue Army(Bad Luck Fale&Jack Bonza) [2] (11:02)NJPW World Tag League 2023 - Tag 10- TV-Show @ EDION Arena Osaka #2 in Osaka, Japan",https://upload.wikimedia.org/wikipedia/commons/d/d2/BULLET_CLUB.JPG
58,01.12.2023,,"BULLET CLUB(Bad Luck Fale,Jack Bonza&Taiji Ishimori) defeatGuerrillas Of Destiny(El Phantasmo,Hikuleo&Jado) (7:05)NJPW World Tag League 2023 - Tag 9- Online Stream @ Wakayama Prefectural Gymnasium in Wakayama, Japan",https://upload.wikimedia.org/wikipedia/commons/d/d2/BULLET_CLUB.JPG
59,29.11.2023,,"World Tag League 2023 Block B:Rogue Army(Bad Luck Fale&Jack Bonza) [2] defeatYota Tsuji&Zandokan Jr.[4] (8:35)NJPW World Tag League 2023 - Tag 8- Online Stream @ Twin Messe Shizuoka in Shizuoka, Japan",https://upload.wikimedia.org/wikipedia/commons/d/d2/BULLET_CLUB.JPG
60,28.11.2023,,"Los Ingobernables de Japon(BUSHI,Shingo Takagi&Yota Tsuji) &Zandokan Jr.defeatBULLET CLUB(Bad Luck Fale,Gedo,Jack Bonza&Taiji Ishimori) (10:02)NJPW World Tag League 2023 - Tag 7- Online Stream @ Nagoya Congress Center Event Hall in Nagoya, Aichi, Japan",https://upload.wikimedia.org/wikipedia/commons/d/d2/BULLET_CLUB.JPG
61,26.11.2023,,"World Tag League 2023 Block B:Bishamon(Hirooki Goto&YOSHI-HASHI) [2] defeatRogue Army(Bad Luck Fale&Jack Bonza) [0] (11:14)NJPW World Tag League 2023 - Tag 6- Online Stream @ Big Palette Fukushima in Koriyama, Fukushima, Japan",https://upload.wikimedia.org/wikipedia/commons/d/d2/BULLET_CLUB.JPG
62,25.11.2023,,"CHAOS(Hirooki Goto,YOH&YOSHI-HASHI) &Ryusuke TaguchidefeatBULLET CLUB(Bad Luck Fale,Gedo,Jack Bonza&Taiji Ishimori) (8:54)NJPW World Tag League 2023 - Tag 5- Online Stream @ Fujisawa City Akibadai Cultural Gymnasium in Fujisawa, Kanagawa, Japan",https://upload.wikimedia.org/wikipedia/commons/d/d2/BULLET_CLUB.JPG
63,24.11.2023,,"World Tag League 2023 Block B:Atlantis Jr.&Soberano Jr.[4] defeatRogue Army(Bad Luck Fale&Jack Bonza) [0] (9:17)NJPW World Tag League 2023 - Tag 4- Online Stream @ Aimesse Yamanashi in Kofu, Yamanashi, Japan",https://upload.wikimedia.org/wikipedia/commons/d/d2/BULLET_CLUB.JPG
64,23.11.2023,,"BULLET CLUB(Bad Luck Fale,Jack Bonza&Taiji Ishimori) defeatAtlantis Jr.,Soberano Jr.&Tiger Mask(7:31)NJPW World Tag League 2023 - Tag 3- Online Stream @ Yokohama Budokan in Yokohama, Kanagawa, Japan",https://upload.wikimedia.org/wikipedia/commons/d/d2/BULLET_CLUB.JPG
65,21.11.2023,,"World Tag League 2023 Block B:Monstersauce(Alex Zayne&Lance Archer) [2] defeatRogue Army(Bad Luck Fale&Jack Bonza) [0] (11:15)NJPW World Tag League 2023 - Tag 2- TV-Show @ Korakuen Hall in Tokyo, Japan",https://upload.wikimedia.org/wikipedia/commons/d/d2/BULLET_CLUB.JPG
66,20.11.2023,,"Monstersauce(Alex Zayne&Lance Archer),Minoru Suzuki&Yuji NagatadefeatBULLET CLUB(Bad Luck Fale,Gedo,Jack Bonza&Taiji Ishimori) (7:08)NJPW World Tag League 2023 - Tag 1- TV-Show @ Korakuen Hall in Tokyo, Japan",https://upload.wikimedia.org/wikipedia/commons/d/d2/BULLET_CLUB.JPG
67,19.11.2023,,"BULLET CLUB(Bad Luck Fale,Jack Bonza&Taiji Ishimori) defeatMonstersauce(Alex Zayne&Lance Archer) &Ryusuke Taguchi(8:01)NJPW New Japan Road 2023 - Tag 9- Event @ Light Cube Utsunomiya in Utsunomiya, Tochigi, Japan",https://upload.wikimedia.org/wikipedia/commons/d/d2/BULLET_CLUB.JPG
68,15.09.2023,,"Rogue Army(Bad Luck Fale&Jack Bonza) defeatJoker And The Thief(Jimmy Townsend&Mick Moretti) (11:07)NJPW TAMASHII VIII- Event @ Crowbar Sydney in Sydney, New South Wales, Australia",https://upload.wikimedia.org/wikipedia/commons/d/d2/BULLET_CLUB.JPG
69,16.04.2023,,"Rogue Army(Bad Luck Fale&Jack Bonza) defeatThe Natural Classics(Stevie Filip&Tome Filip) (7:28)NJPW TAMASHII VII- Event @ The Croxton in Melbourne, Victoria, Australia",https://upload.wikimedia.org/wikipedia/commons/d/d2/BULLET_CLUB.JPG
70,14.04.2023,,"Rogue Army(Bad Luck Fale&Jack Bonza) defeatParty Guys(Banjo Powers&Party Guy Ty) (11:48)NJPW TAMASHII V- Event @ Hindley St. Music Hall in Adelaide, South Australia, Australia",https://upload.wikimedia.org/wikipedia/commons/d/d2/BULLET_CLUB.JPG
71,04.02.2023,,"Rogue Army(Bad Luck Fale&Jack Bonza) defeatAndrew Villalobos&Michael Richards(11:22)NJPW TAMASHII IV- Online Stream @ The Croxton in Thornbury, Victoria, Australia",https://upload.wikimedia.org/wikipedia/commons/d/d2/BULLET_CLUB.JPG
72,03.02.2023,,"United Empire(Aaron Henare&Kyle Fletcher) defeatRogue Army(Bad Luck Fale&Jack Bonza) by DQ (12:43)NJPW TAMASHII III- Online Stream @ Selina's Entertainment Center in Sydney, New South Wales, Australia",https://upload.wikimedia.org/wikipedia/commons/d/d2/BULLET_CLUB.JPG
73,27.01.2023,,"PWA Tag Team Premiership First Round:BULLET CLUB(Bad Luck Fale&Jack Bonza) defeatThe Green Dingoes(The Tuckman&Victor Langaz) (1:24)PWA Black Label Stories From Liberty Hall- Pay Per View @ Liberty Hall in Moore Park, New South Wales, Australia",https://upload.wikimedia.org/wikipedia/commons/d/d2/BULLET_CLUB.JPG
74,11.12.2022,,"Bad Luck FaledefeatsKosei Fujita(1:44)NJPW World Tag League 2022 & Super Junior Tag League 2022 - Tag 16- Online Stream @ Arcrea Himeji in Himeji, Hyogo, Japan",https://upload.wikimedia.org/wikipedia/commons/d/d2/BULLET_CLUB.JPG
75,10.12.2022,,"Los Ingobernables de Japon(Hiromu Takahashi,Shingo Takagi&Tetsuya Naito) defeatBULLET CLUB(Bad Luck Fale,Gedo&Taiji Ishimori) (9:18)NJPW World Tag League 2022 & Super Junior Tag League 2022 - Tag 15- Online Stream @ Uwajima City Overall Gymnasium in Uwajima, Ehime, Japan",https://upload.wikimedia.org/wikipedia/commons/d/d2/BULLET_CLUB.JPG
76,09.12.2022,,"Bad Luck FaledefeatsYuto Nakashima(4:04)NJPW World Tag League 2022 & Super Junior Tag League 2022 - Tag 14- Online Stream @ Kochi Prefectural Gymnasium in Kochi, Japan",https://upload.wikimedia.org/wikipedia/commons/d/d2/BULLET_CLUB.JPG
77,07.12.2022,,"Suzuki-gun(El Desperado,Lance Archer&Minoru Suzuki) defeatBULLET CLUB(Bad Luck Fale,Gedo&Taiji Ishimori) (8:46)NJPW World Tag League 2022 & Super Junior Tag League 2022 - Tag 13- Online Stream @ Sasebo City General Ground Gymnasium in Sasebo, Nagasaki, Japan",https://upload.wikimedia.org/wikipedia/commons/d/d2/BULLET_CLUB.JPG
78,05.12.2022,,"Bad Luck FaledefeatsOskar Leube(4:04)NJPW World Tag League 2022 & Super Junior Tag League 2022 - Tag 12- Online Stream @ Karatsu Athletic Stadium in Karatsu, Saga, Japan",https://upload.wikimedia.org/wikipedia/commons/d/d2/BULLET_CLUB.JPG
79,04.12.2022,,"Master Wato,Tomoaki Honma&YOSHI-HASHIdefeatBULLET CLUB(Bad Luck Fale,Gedo&Taiji Ishimori) (8:30)NJPW World Tag League 2022 & Super Junior Tag League 2022 - Tag 11- Online Stream @ Yamaguchi KDDI Ishin Hall in Yamaguchi, Japan",https://upload.wikimedia.org/wikipedia/commons/d/d2/BULLET_CLUB.JPG
80,03.12.2022,,"Bad Luck FaledefeatsRyohei Oiwa(3:04)NJPW World Tag League 2022 & Super Junior Tag League 2022 - Tag 10- Online Stream @ Kakogawa Gymnasium in Kakogawa, Hyogo, Japan",https://upload.wikimedia.org/wikipedia/commons/d/d2/BULLET_CLUB.JPG
81,30.11.2022,,"World Tag League 2022:BULLET CLUB(Bad Luck Fale&Chase Owens) [4] defeatAlex Coughlin&Gabriel Kidd[0] (10:05)NJPW World Tag League 2022 & Super Junior Tag League 2022 - Tag 8- Online Stream @ Twin Messe Shizuoka in Shizuoka, Japan",https://upload.wikimedia.org/wikipedia/commons/d/d2/BULLET_CLUB.JPG
82,27.11.2022,,"World Tag League 2022:Be-Bop Tag Team(Hiroshi Tanahashi&Toru Yano) [2] defeatBULLET CLUB(Bad Luck Fale&Chase Owens) [2] (3:35)NJPW World Tag League 2022 & Super Junior Tag League 2022 - Tag 6- Online Stream @ Aichi Prefectural Gymnasium in Nagoya, Aichi, Japan",https://upload.wikimedia.org/wikipedia/commons/d/d2/BULLET_CLUB.JPG
83,26.11.2022,,"World Tag League 2022:BULLET CLUB(Bad Luck Fale&Chase Owens) [2] defeatHouse Of Torture(EVIL&Yujiro Takahashi) [0] (8:28)NJPW World Tag League 2022 & Super Junior Tag League 2022 - Tag 5- Online Stream @ Fujisawa City Akibadai Cultural Gymnasium in Fujisawa, Kanagawa, Japan",https://upload.wikimedia.org/wikipedia/commons/d/d2/BULLET_CLUB.JPG
84,23.11.2022,,"BULLET CLUB(Bad Luck Fale,Chase Owens,Gedo&Taiji Ishimori) defeatHiroyoshi Tenzan,Jado,Master Wato&Tomoaki Honma(8:13)NJPW World Tag League 2022 & Super Junior Tag League 2022 - Tag 3- TV-Show @ Arena Tachikawa Tachihi in Tachikawa, Tokyo, Japan",https://upload.wikimedia.org/wikipedia/commons/d/d2/BULLET_CLUB.JPG
85,22.11.2022,,"World Tag League 2022:Suzuki-gun(Lance Archer&Minoru Suzuki) [2] defeatBULLET CLUB(Bad Luck Fale&Chase Owens) [0] (10:18)NJPW World Tag League 2022 & Super Junior Tag League 2022 - Tag 2- TV-Show @ Korakuen Hall in Tokyo, Japan",https://upload.wikimedia.org/wikipedia/commons/d/d2/BULLET_CLUB.JPG
86,13.11.2022,,"BULLET CLUB(Bad Luck Fale,Jack Bonza&KENTA) defeatMat Rogers&The VeloCities(Jude London&Paris De Silva) (10:10)NJPW TAMASHII II- Event @ Liberty Hall in Sydney, New South Wales, Australia",https://upload.wikimedia.org/wikipedia/commons/d/d2/BULLET_CLUB.JPG
87,11.11.2022,,"BULLET CLUB(Bad Luck Fale&Jack Bonza) defeatJake Taylor&Tony Kozina(9:30)NJPW TAMASHII I- Event @ Pioneer Recreation & Sports Centre in Christchurch, New Zealand",https://upload.wikimedia.org/wikipedia/commons/d/d2/BULLET_CLUB.JPG
88,25.09.2022,,"United Empire(Great-O-Khan&Jeff Cobb) defeatBULLET CLUB(Bad Luck Fale&Chase Owens) (7:57)NJPW Burning Spirit 2022 - Tag 14- TV-Show @ World Hall in Kobe, Hyogo, Japan",https://upload.wikimedia.org/wikipedia/commons/d/d2/BULLET_CLUB.JPG
89,23.09.2022,,"BULLET CLUB(Bad Luck Fale,Chase Owens&Hikuleo) defeatUnited Empire(Gideon Grey,Great-O-Khan&Jeff Cobb) (8:03)NJPW Burning Spirit 2022 - Tag 13- Online Stream @ Takamatsu City Gymnasium in Takamatsu, Kagawa, Japan",https://upload.wikimedia.org/wikipedia/commons/d/d2/BULLET_CLUB.JPG
90,21.09.2022,,"BULLET CLUB(Bad Luck Fale,Chase Owens&KENTA) defeatUnited Empire(Gideon Grey,Great-O-Khan&Jeff Cobb) (7:23)NJPW Burning Spirit 2022 - Tag 12- Event @ Gran Messe Kumamoto in Mashiki, Kumamoto, Japan",https://upload.wikimedia.org/wikipedia/commons/d/d2/BULLET_CLUB.JPG
91,17.09.2022,,"United Empire(Gideon Grey,Great-O-Khan&Jeff Cobb) defeatBULLET CLUB(Bad Luck Fale,Chase Owens&Gedo) (9:53)NJPW Burning Spirit 2022 - Tag 11- Event @ Ichiki Kushikino Gymnasium in Ichiki-Kushikino, Kagoshima, Japan",https://upload.wikimedia.org/wikipedia/commons/d/d2/BULLET_CLUB.JPG
