date,event,result,location,image_url
656,06.11.2013,,"Big E. Langston,Cody Rhodes&GoldustdefeatThe Shield(Dean Ambrose,Roman Reigns&Seth Rollins)WWE Live- House Show @ Odyssey Arena in Belfast, Northern Ireland, UK",https://upload.wikimedia.org/wikipedia/commons/c/cb/Dustin_Rhodes%2C_October_2019.jpg
657,04.11.2013,,"Cody Rhodes,Goldust&John CenadefeatDamien Sandow&The Real Americans(Antonio Cesaro&Jack Swagger) (19:13)WWE Monday Night RAW #1067- TV-Show @ Bon Secours Wellness Arena in Greenville, South Carolina, USA",https://upload.wikimedia.org/wikipedia/commons/c/cb/Dustin_Rhodes%2C_October_2019.jpg
658,29.10.2013,,"Cody Rhodes,Goldust&John CenadefeatDamien Sandow&The Real Americans(Antonio Cesaro&Jack Swagger) (16:56)WWE Friday Night SmackDown #741- TV-Show @ Tampa Bay Times Forum in Tampa, Florida, USA",https://upload.wikimedia.org/wikipedia/commons/c/cb/Dustin_Rhodes%2C_October_2019.jpg
659,28.10.2013,,"The Real Americans(Antonio Cesaro&Jack Swagger) defeatCody Rhodes&Goldust(12:17)WWE Monday Night RAW #1066- TV-Show @ Amway Center in Orlando, Florida, USA",https://upload.wikimedia.org/wikipedia/commons/c/cb/Dustin_Rhodes%2C_October_2019.jpg
660,27.10.2013,,"WWE Tag Team TitleTriple Threat:Cody Rhodes&Goldust(c) defeatThe Shield(Roman Reigns&Seth Rollins) andThe Usos(Jey Uso&Jimmy Uso) (14:38)WWE Hell In A Cell 2013- Pay Per View @ AmericanAirlines Arena in Miami, Florida, USA",https://upload.wikimedia.org/wikipedia/commons/c/cb/Dustin_Rhodes%2C_October_2019.jpg
661,22.10.2013,,"Seth RollinsdefeatsGoldust(11:39)WWE Main Event #56- TV-Show @ BJCC Arena in Birmingham, Alabama, USA",https://upload.wikimedia.org/wikipedia/commons/c/cb/Dustin_Rhodes%2C_October_2019.jpg
662,22.10.2013,,"Big E. Langston,Cody Rhodes,Daniel Bryan&GoldustdefeatRandy Orton&The Shield(Dean Ambrose,Roman Reigns&Seth Rollins) (22:13)WWE Friday Night SmackDown #740- TV-Show @ BJCC Arena in Birmingham, Alabama, USA",https://upload.wikimedia.org/wikipedia/commons/c/cb/Dustin_Rhodes%2C_October_2019.jpg
663,15.10.2013,,"Cody Rhodes,Daniel Bryan&GoldustdefeatThe Shield(Dean Ambrose,Roman Reigns&Seth Rollins) (13:18)WWE Friday Night SmackDown #739- TV-Show @ Sprint Center in Kansas City, Missouri, USA",https://upload.wikimedia.org/wikipedia/commons/c/cb/Dustin_Rhodes%2C_October_2019.jpg
664,14.10.2013,,"WWE Tag Team TitleNo Disqualification:Cody Rhodes&GoldustdefeatThe Shield(Roman Reigns&Seth Rollins) (c) (19:20) -TITLE CHANGE !!!WWE Monday Night RAW #1064- TV-Show @ Scottrade Center in St. Louis, Missouri, USA",https://upload.wikimedia.org/wikipedia/commons/c/cb/Dustin_Rhodes%2C_October_2019.jpg
665,08.10.2013,,"Cody Rhodes&GoldustdefeatThe Wyatt Family(Erick Rowan&Luke Harper) (10:34)WWE Friday Night SmackDown #738- TV-Show @ Nationwide Arena in Columbus, Ohio, USA",https://upload.wikimedia.org/wikipedia/commons/c/cb/Dustin_Rhodes%2C_October_2019.jpg
666,07.10.2013,,"No Disqualification:The Shield(Dean Ambrose,Roman Reigns&Seth Rollins) defeatCody Rhodes,Daniel Bryan&Goldust(12:22)WWE Monday Night RAW #1063- TV-Show @ Consol Energy Center in Pittsburgh, Pennsylvania, USA",https://upload.wikimedia.org/wikipedia/commons/c/cb/Dustin_Rhodes%2C_October_2019.jpg
667,06.10.2013,,"Cody Rhodes&GoldustdefeatThe Shield(Roman Reigns&Seth Rollins) (13:54)WWE Battleground 2013- Pay Per View @ First Niagara Center in Buffalo, New York, USA",https://upload.wikimedia.org/wikipedia/commons/c/cb/Dustin_Rhodes%2C_October_2019.jpg
668,27.09.2013,,"GoldustdefeatsGary RenoFTW Back To School Brawl- Event @ NYWC Sportatorium in Deer Park, New York, USA",https://upload.wikimedia.org/wikipedia/commons/c/cb/Dustin_Rhodes%2C_October_2019.jpg
669,13.09.2013,,"GoldustdefeatsPapadon(15:42)RWE Uprising- Event @ Nomads in South Windsor, Connecticut, USA",https://upload.wikimedia.org/wikipedia/commons/c/cb/Dustin_Rhodes%2C_October_2019.jpg
670,09.09.2013,,"Randy OrtondefeatsGoldust(14:51)WWE Monday Night RAW #1059- TV-Show @ Air Canada Centre in Toronto, Ontario, Canada",https://upload.wikimedia.org/wikipedia/commons/c/cb/Dustin_Rhodes%2C_October_2019.jpg
671,30.08.2013,,"C-Fed,G-Fed,Goldust&Nui TofigadefeatAdam Flash,Cobian,Drolix&Ronnie ZukkoMCW Rally In The Alley 2013- Event @ Della Roses Avenue Tavern in Nottingham, Maryland, USA",https://upload.wikimedia.org/wikipedia/commons/c/cb/Dustin_Rhodes%2C_October_2019.jpg
672,24.08.2013,,"GoldustdefeatsChachiWOW Under The Lights 2- Event @ USA Funstation in Staten, Island, New York, USA",https://upload.wikimedia.org/wikipedia/commons/c/cb/Dustin_Rhodes%2C_October_2019.jpg
673,15.06.2013,,"GoldustdefeatsMurder-1UIW- Event @ Villa Rica, Georgia, USA",https://upload.wikimedia.org/wikipedia/commons/c/cb/Dustin_Rhodes%2C_October_2019.jpg
674,01.06.2013,,"GoldustdefeatsDave Rayneby DQPCW No Retreat, No Surrender - Show 3- Event @ Lava Ignite in Preston, Lancashire, England, UK",https://upload.wikimedia.org/wikipedia/commons/c/cb/Dustin_Rhodes%2C_October_2019.jpg
675,31.05.2013,,"CJ Banks&Dave RaynedefeatGoldust&Mad Man MansonPCW No Retreat, No Surrender - Show 1- Event @ Lava Ignite in Preston, Lancashire, England, UK",https://upload.wikimedia.org/wikipedia/commons/c/cb/Dustin_Rhodes%2C_October_2019.jpg
676,18.05.2013,,"GoldustdefeatsFrankie The FaceMCPW Battle Ground 5- Event @ Kalkaska, Michigan, USA",https://upload.wikimedia.org/wikipedia/commons/c/cb/Dustin_Rhodes%2C_October_2019.jpg
677,11.05.2013,,"Goldust&The HurricanedefeatCriminal Justice(Bennett Cole&Rocky Reynolds)PWR- Event @  St. Johns Conference & Banquet Center in Girard, Pennsylvania, USA",https://upload.wikimedia.org/wikipedia/commons/c/cb/Dustin_Rhodes%2C_October_2019.jpg
678,10.05.2013,,"Freddie Midnight,Goldust&Jonny PumadefeatBrandon Thurston&The Flatliners(Asylum&Matt Burns)ESW BrawlFest 2013- Event @ Kenan Center in Lockport, New York, USA",https://upload.wikimedia.org/wikipedia/commons/c/cb/Dustin_Rhodes%2C_October_2019.jpg
679,04.05.2013,,"GoldustdefeatsJohn JohnsonHOW Jokes, Pokes & Chokes - Tag 1- Event @ Black Bear Casino in Carlton, Minnesota, USA",https://upload.wikimedia.org/wikipedia/commons/c/cb/Dustin_Rhodes%2C_October_2019.jpg
680,03.05.2013,,"GoldustdefeatsMike BennettNEW Wrestlefest XVII- Event @ Crosby High School in Waterbury, Connecticut, USA",https://upload.wikimedia.org/wikipedia/commons/c/cb/Dustin_Rhodes%2C_October_2019.jpg
681,13.04.2013,,"Colt Toombs,Facade,Goldust&Logan ShulodefeatTeam Big League(Jimmy Nutts,John McChesney,Joseph Brooks&Rex Lawless) (11:59)IWC Night Of The Superstars 2- Event @ Meadville Area High School in Meadville, Pennsylvania, USA",https://upload.wikimedia.org/wikipedia/commons/c/cb/Dustin_Rhodes%2C_October_2019.jpg
682,13.04.2013,,"IWC World Heavyweight Title:GoldustdefeatsJohn McChesney(c) by Count Out (4:12)IWC Night Of The Superstars 2- Event @ Meadville Area High School in Meadville, Pennsylvania, USA",https://upload.wikimedia.org/wikipedia/commons/c/cb/Dustin_Rhodes%2C_October_2019.jpg
683,08.03.2013,,"GoldustdefeatsEarl CooterFTW March Mayhem- Event @ NYWC Sportatorium in Deer Park, New York, USA",https://upload.wikimedia.org/wikipedia/commons/c/cb/Dustin_Rhodes%2C_October_2019.jpg
684,02.03.2013,,"Match (Special Referee: Shark Boy):GoldustdefeatsDean BaldwinTCW The Warren Perdue Memorial Wrestling Show VII- Event @ Waynesville Middle School Gym in Waynesville, Ohio, USA",https://upload.wikimedia.org/wikipedia/commons/c/cb/Dustin_Rhodes%2C_October_2019.jpg
685,27.01.2013,,"Royal Rumble:John CenadefeatsAntonio CesaroandBo DallasandBrodus ClayandChris JerichoandCody RhodesandDamien SandowandDaniel BryanandDarren YoungandDavid OtungaandDolph ZigglerandDrew McIntyreandGoldustandHeath SlaterandJinder MahalandKaneandKofi KingstonandRandy OrtonandRey MysterioandRybackandSantino MarellaandSheamusandSin CaraandTensaiandThe GodfatherandThe Great KhaliandThe MizandTitus O'NeilandWade BarrettandZack Ryder(55:04)WWE Royal Rumble 2013- Pay Per View @ US Airways Center in Phoenix, Arizona, USA",https://upload.wikimedia.org/wikipedia/commons/c/cb/Dustin_Rhodes%2C_October_2019.jpg
686,05.01.2013,,"GoldustdefeatsJake ManningTop Rope Pro Wrestling- Event @ Virginia Horse Center in Lexington, Virginia, USA",https://upload.wikimedia.org/wikipedia/commons/c/cb/Dustin_Rhodes%2C_October_2019.jpg
687,07.12.2012,,"GoldustdefeatsSami Callihan(13:10)PWS Fight Mare Before Christmas- Event @ SMG Sports Plex in Metuchen, New Jersey, USA",https://upload.wikimedia.org/wikipedia/commons/c/cb/Dustin_Rhodes%2C_October_2019.jpg
688,01.12.2012,,"GoldustdefeatsRyan MitchellVOW December Dawning- Event @ The Ice Mine in Connellsville, Pennsylvania, USA",https://upload.wikimedia.org/wikipedia/commons/c/cb/Dustin_Rhodes%2C_October_2019.jpg
689,27.10.2012,,"GoldustdefeatsChance ProphetIWA East Coast All That Glitters- Event @ Kings Way Outreach Center in Nitro, West Virginia, USA",https://upload.wikimedia.org/wikipedia/commons/c/cb/Dustin_Rhodes%2C_October_2019.jpg
690,20.10.2012,,"GoldustdefeatsLucifer DarksydeNWS- Event @ VFW Hall in Manville, New Jersey, USA",https://upload.wikimedia.org/wikipedia/commons/c/cb/Dustin_Rhodes%2C_October_2019.jpg
691,29.09.2012,,"Big Van Vader&GoldustdefeatBruce Santee&Kory ChavisNWA Ring Warriors Battle In The Bahamas 2: Return Of The Ring Warriors- Event @ The Kendal Isaacs Gymnasium in Nassau, Bahamas",https://upload.wikimedia.org/wikipedia/commons/c/cb/Dustin_Rhodes%2C_October_2019.jpg
692,29.09.2012,,"GoldustdefeatsKory Chavisby DQNWA Ring Warriors Battle In The Bahamas 2: Return Of The Ring Warriors- Event @ The Kendal Isaacs Gymnasium in Nassau, Bahamas",https://upload.wikimedia.org/wikipedia/commons/c/cb/Dustin_Rhodes%2C_October_2019.jpg
693,22.09.2012,,"Goldust& Joe Ausanio defeatLuke Robinson&Romeo RoselliNEW Wrestling Under The Stars- Event @ The Dutchess Stadium in Fishkill, New York, USA",https://upload.wikimedia.org/wikipedia/commons/c/cb/Dustin_Rhodes%2C_October_2019.jpg
694,15.09.2012,,"GoldustdefeatsAustin RobertsDREAMWAVE Good As Gold- Event @ Knights Of Columbus in LaSalle, Illinois, USA",https://upload.wikimedia.org/wikipedia/commons/c/cb/Dustin_Rhodes%2C_October_2019.jpg
695,11.08.2012,,"GoldustdefeatsMatty StarrBlitz WrestleFest III- Event @ St. Joseph Park in Joliet, Illinois, USA",https://upload.wikimedia.org/wikipedia/commons/c/cb/Dustin_Rhodes%2C_October_2019.jpg
696,04.08.2012,,"Crossfire Heavyweight TitleTournament First Round:Goldustvs.Kid Kash- Time Limit Draw (25:00)Crossfire Once In A Lifetime Opportunity- Event @ Tennessee State Fairgrounds in Nashville, Tennessee, USA",https://upload.wikimedia.org/wikipedia/commons/c/cb/Dustin_Rhodes%2C_October_2019.jpg
697,14.07.2012,,"Vordell WalkerdefeatsGoldustby DQNWA Ring Warriors Hollywood Heat Wave- Event @ The German American Clubhouse in Hollywood, Florida, USA",https://upload.wikimedia.org/wikipedia/commons/c/cb/Dustin_Rhodes%2C_October_2019.jpg
698,28.11.2010,,"GoldustdefeatsJackson Andrews(5:30)WWE RAW House Show- House Show @ Wicomico Civic Center in Salisbury, Maryland, USA",https://upload.wikimedia.org/wikipedia/commons/c/cb/Dustin_Rhodes%2C_October_2019.jpg
699,22.11.2010,,"Dark:Jackson AndrewsdefeatsGoldustWWE Monday Night RAW #913- Dark Match @ Amway Center in Orlando, Florida, USA",https://upload.wikimedia.org/wikipedia/commons/c/cb/Dustin_Rhodes%2C_October_2019.jpg
700,13.11.2010,,"GoldustdefeatsTed DiBiaseWWE RAW House Show- House Show @ Mediolanum Forum in Mailand, Italien",https://upload.wikimedia.org/wikipedia/commons/c/cb/Dustin_Rhodes%2C_October_2019.jpg
701,12.11.2010,,"GoldustdefeatsTed DiBiaseWWE RAW House Show- House Show @ Geneva Arena in Genf, Schweiz",https://upload.wikimedia.org/wikipedia/commons/c/cb/Dustin_Rhodes%2C_October_2019.jpg
702,11.11.2010,,"GoldustdefeatsTed DiBiaseWWE RAW House Show- House Show @ Zenith Arena in Nantes, Frankreich",https://upload.wikimedia.org/wikipedia/commons/c/cb/Dustin_Rhodes%2C_October_2019.jpg
703,10.11.2010,,"GoldustdefeatsTed DiBiaseWWE RAW House Show- House Show @ Olympiahalle in Innsbruck, Tirol, Österreich",https://upload.wikimedia.org/wikipedia/commons/c/cb/Dustin_Rhodes%2C_October_2019.jpg
704,08.11.2010,,"GoldustdefeatsTed DiBiase(3:21)WWE Monday Night RAW #911- TV-Show @ Manchester Evening News Arena in Manchester, England, UK",https://upload.wikimedia.org/wikipedia/commons/c/cb/Dustin_Rhodes%2C_October_2019.jpg
705,07.11.2010,,"GoldustdefeatsTed DiBiaseWWE RAW House Show- House Show @ Trent FM Arena Nottingham in Nottingham, Nottinghamshire, England, UK",https://upload.wikimedia.org/wikipedia/commons/c/cb/Dustin_Rhodes%2C_October_2019.jpg
706,06.11.2010,,"GoldustdefeatsTed DiBiaseWWE RAW House Show- House Show @ LG Arena in Birmingham, West Midlands, England, UK",https://upload.wikimedia.org/wikipedia/commons/c/cb/Dustin_Rhodes%2C_October_2019.jpg
707,05.11.2010,,"GoldustdefeatsTed DiBiaseWWE RAW House Show- House Show @ Cardiff International Arena in Cardiff, Wales, UK",https://upload.wikimedia.org/wikipedia/commons/c/cb/Dustin_Rhodes%2C_October_2019.jpg
708,04.11.2010,,"GoldustdefeatsTed DiBiaseWWE RAW House Show- House Show @ Montpellier Arena in Montpellier, Frankreich",https://upload.wikimedia.org/wikipedia/commons/c/cb/Dustin_Rhodes%2C_October_2019.jpg
709,31.10.2010,,"GoldustdefeatsTed DiBiaseWWE RAW House Show- House Show @ Bell Centre in Montreal, Quebec, Canada",https://upload.wikimedia.org/wikipedia/commons/c/cb/Dustin_Rhodes%2C_October_2019.jpg
710,30.10.2010,,"WWE Intercontinental Title#1 Contendership Battle Royal:The Big ShowdefeatsChris MastersandCody RhodesandDavid Hart SmithandDavid OtungaandDrew McIntyreandGoldustandHeath SlaterandHusky HarrisandJack SwaggerandJTGandJustin GabrielandKavalandMark HenryandMichael McGillicuttyandMontel Vontavious PorterandPrimoandR-TruthandTed DiBiaseandTyler ReksandTyson KiddandVladimir KozlovandYoshi TatsuandZack RyderWWE Fan Appreciation Night- House Show @ XL Center in Hartford, Connecticut, USA",https://upload.wikimedia.org/wikipedia/commons/c/cb/Dustin_Rhodes%2C_October_2019.jpg
711,26.10.2010,,"Mixed:Aksana&GoldustdefeatMaryse&Ted DiBiase(6:41)WWE NXT #36 - S3E8- Online Stream @ Bradley Center in Milwaukee, Wisconsin, USA",https://upload.wikimedia.org/wikipedia/commons/c/cb/Dustin_Rhodes%2C_October_2019.jpg
712,24.10.2010,,"Ted DiBiasedefeatsGoldust(7:37)WWE Bragging Rights 2010- Pay Per View @ Target Center in Minneapolis, Minnesota, USA",https://upload.wikimedia.org/wikipedia/commons/c/cb/Dustin_Rhodes%2C_October_2019.jpg
713,18.10.2010,,"GoldustdefeatsZack Ryder(0:28)WWE Monday Night RAW #908- TV-Show @ Scotiabank Saddledome in Calgary, Alberta, Canada",https://upload.wikimedia.org/wikipedia/commons/c/cb/Dustin_Rhodes%2C_October_2019.jpg
714,16.10.2010,,"GoldustdefeatsTed DiBiaseWWE House Show- House Show @ Toyota Center in Kennewick, Washington, USA",https://upload.wikimedia.org/wikipedia/commons/c/cb/Dustin_Rhodes%2C_October_2019.jpg
715,15.10.2010,,"GoldustdefeatsTed DiBiaseWWE RAW House Show- House Show @ Spokane Arena in Spokane, Washington, USA",https://upload.wikimedia.org/wikipedia/commons/c/cb/Dustin_Rhodes%2C_October_2019.jpg
716,10.10.2010,,"GoldustdefeatsTed DiBiaseWWE RAW House Show- House Show @ Valley Sundome in Yakima, Washington, USA",https://upload.wikimedia.org/wikipedia/commons/c/cb/Dustin_Rhodes%2C_October_2019.jpg
717,09.10.2010,,"GoldustdefeatsTed DiBiaseWWE RAW House Show- House Show @ Stockton Arena in Stockton, California, USA",https://upload.wikimedia.org/wikipedia/commons/c/cb/Dustin_Rhodes%2C_October_2019.jpg
718,08.10.2010,,"GoldustdefeatsTed DiBiaseWWE RAW House Show- House Show @ Honda Center in Anaheim, California, USA",https://upload.wikimedia.org/wikipedia/commons/c/cb/Dustin_Rhodes%2C_October_2019.jpg
719,03.10.2010,,"Dark:Goldust,Kofi Kingston&R-TruthdefeatCody Rhodes,Dolph Ziggler&Drew McIntyreWWE Hell In A Cell 2010- Dark Match @ American Airlines Center in Dallas, Texas, USA",https://upload.wikimedia.org/wikipedia/commons/c/cb/Dustin_Rhodes%2C_October_2019.jpg
720,25.09.2010,,"GoldustdefeatsDavid Otungaby DQWWE RAW House Show- House Show @ Palais Omnisports de Paris-Bercy in Paris, Frankreich",https://upload.wikimedia.org/wikipedia/commons/c/cb/Dustin_Rhodes%2C_October_2019.jpg
721,24.09.2010,,"GoldustdefeatsWilliam RegalWWE RAW House Show- House Show @ Palais Omnisports de Paris-Bercy in Paris, Frankreich",https://upload.wikimedia.org/wikipedia/commons/c/cb/Dustin_Rhodes%2C_October_2019.jpg
722,23.09.2010,,"GoldustdefeatsTed DiBiaseWWE RAW House Show- House Show @ Arena D'Coque in Luxemburg, Luxemburg",https://upload.wikimedia.org/wikipedia/commons/c/cb/Dustin_Rhodes%2C_October_2019.jpg
723,22.09.2010,,"GoldustdefeatsWilliam RegalWWE RAW House Show- House Show @ Zenith in Saint-Etienne, Loire, Frankreich",https://upload.wikimedia.org/wikipedia/commons/c/cb/Dustin_Rhodes%2C_October_2019.jpg
724,20.09.2010,,"GoldustdefeatsWilliam Regal(11:00)WWE Superstars #76- TV-Show @ U.S. Cellular Coliseum in Bloomington, Illinois, USA",https://upload.wikimedia.org/wikipedia/commons/c/cb/Dustin_Rhodes%2C_October_2019.jpg
725,13.09.2010,,"Trading Places:GoldustdefeatsWilliam Regal(0:20)WWE Monday Night RAW #903- TV-Show @ U.S. Bank Arena in Cincinnati, Ohio, USA",https://upload.wikimedia.org/wikipedia/commons/c/cb/Dustin_Rhodes%2C_October_2019.jpg
726,12.09.2010,,"Gail Kim&GoldustdefeatJey Uso&TaminaWWE RAW House Show- House Show @ Peterborough Memorial Centre in Peterborough, Ontario, Canada",https://upload.wikimedia.org/wikipedia/commons/c/cb/Dustin_Rhodes%2C_October_2019.jpg
727,11.09.2010,,"Gail Kim&GoldustdefeatJimmy Uso&TaminaWWE RAW House Show- House Show @ Copps Coliseum in Hamilton, Ontario, Canada",https://upload.wikimedia.org/wikipedia/commons/c/cb/Dustin_Rhodes%2C_October_2019.jpg
728,10.09.2010,,"GoldustdefeatsPrimoWWE RAW House Show- House Show @ Air Canada Centre in Toronto, Ontario, Canada",https://upload.wikimedia.org/wikipedia/commons/c/cb/Dustin_Rhodes%2C_October_2019.jpg
729,07.09.2010,,"Mixed:AJ&PrimodefeatAksana&Goldust(1:44)WWE NXT #29 - S3E1- TV-Show @ 1st Mariner Arena in Baltimore, Maryland, USA",https://upload.wikimedia.org/wikipedia/commons/c/cb/Dustin_Rhodes%2C_October_2019.jpg
730,06.09.2010,,"Mixed:Gail Kim&GoldustdefeatJillian&Primo(3:36)WWE Superstars #74- TV-Show @ 1st Mariner Arena in Baltimore, Maryland, USA",https://upload.wikimedia.org/wikipedia/commons/c/cb/Dustin_Rhodes%2C_October_2019.jpg
731,04.09.2010,,"GoldustdefeatsZack RyderWWE RAW House Show- House Show @ Coliseo De Puerto Rico Jose M. Agrelot in San Juan, Puerto Rico, USA",https://upload.wikimedia.org/wikipedia/commons/c/cb/Dustin_Rhodes%2C_October_2019.jpg
732,03.09.2010,,"GoldustdefeatsZack RyderWWE RAW House Show- House Show @ Auditorio Juan  in Ponce, Puerto Rico, USA",https://upload.wikimedia.org/wikipedia/commons/c/cb/Dustin_Rhodes%2C_October_2019.jpg
733,02.09.2010,,"GoldustdefeatsTed DiBiaseWWE RAW House Show- House Show @ Coliseo Manuel  in Arecibo, Puerto Rico, USA",https://upload.wikimedia.org/wikipedia/commons/c/cb/Dustin_Rhodes%2C_October_2019.jpg
734,30.08.2010,,"Ted DiBiasedefeatsGoldust(12:15)WWE Superstars #73- TV-Show @ Times Union Center in Albany, New York, USA",https://upload.wikimedia.org/wikipedia/commons/c/cb/Dustin_Rhodes%2C_October_2019.jpg
735,29.08.2010,,"GoldustdefeatsLuke GallowsWWE House Show- House Show @ Cape Cod Melody Tent in Hyannis, Massachusetts, USA",https://upload.wikimedia.org/wikipedia/commons/c/cb/Dustin_Rhodes%2C_October_2019.jpg
736,28.08.2010,,"GoldustdefeatsLuke GallowsWWE House Show- House Show @ South Shore Music Circus in Cohasset, Massachusetts, USA",https://upload.wikimedia.org/wikipedia/commons/c/cb/Dustin_Rhodes%2C_October_2019.jpg
737,27.08.2010,,"GoldustdefeatsLuke GallowsWWE House Show- House Show @ Casino Ballroom in Hampton Beach, New Hampshire, USA",https://upload.wikimedia.org/wikipedia/commons/c/cb/Dustin_Rhodes%2C_October_2019.jpg
738,21.08.2010,,"David OtungadefeatsGoldust(6:27)WWE RAW House Show- House Show @ Ryogoku Kokugikan in Tokyo, Japan",https://upload.wikimedia.org/wikipedia/commons/c/cb/Dustin_Rhodes%2C_October_2019.jpg
739,20.08.2010,,"GoldustdefeatsTed DiBiase(7:21)WWE RAW House Show- House Show @ Ryogoku Kokugikan in Tokyo, Japan",https://upload.wikimedia.org/wikipedia/commons/c/cb/Dustin_Rhodes%2C_October_2019.jpg
740,16.08.2010,,"William RegaldefeatsGoldust(10:30)WWE Superstars #72- TV-Show @ Save Mart Center At Fresno State in Fresno, California, USA",https://upload.wikimedia.org/wikipedia/commons/c/cb/Dustin_Rhodes%2C_October_2019.jpg
741,09.08.2010,,"The Usos(Jey Uso&Jimmy Uso) defeatGoldust&Yoshi Tatsu(10:00)WWE Superstars #70- TV-Show @ Sacramento, California, USA",https://upload.wikimedia.org/wikipedia/commons/c/cb/Dustin_Rhodes%2C_October_2019.jpg
742,08.08.2010,,"GoldustdefeatsPrimoWWE RAW House Show- House Show @ Coussoulis Arena in San Bernardino, California, USA",https://upload.wikimedia.org/wikipedia/commons/c/cb/Dustin_Rhodes%2C_October_2019.jpg
743,07.08.2010,,"GoldustdefeatsPrimoWWE RAW House Show- House Show @ San Diego Sports Center in San Diego, California, USA",https://upload.wikimedia.org/wikipedia/commons/c/cb/Dustin_Rhodes%2C_October_2019.jpg
744,01.08.2010,,"GoldustdefeatsWilliam RegalWWE RAW House Show- House Show @ Germain Arena in Fort Myers, Florida, USA",https://upload.wikimedia.org/wikipedia/commons/c/cb/Dustin_Rhodes%2C_October_2019.jpg
745,31.07.2010,,"GoldustdefeatsWilliam RegalWWE RAW House Show- House Show @ Ocean Center in Daytona Beach, Florida, USA",https://upload.wikimedia.org/wikipedia/commons/c/cb/Dustin_Rhodes%2C_October_2019.jpg
746,30.07.2010,,"GoldustdefeatsWilliam RegalWWE RAW House Show- House Show @ Civic Center in Tallahassee, Florida, USA",https://upload.wikimedia.org/wikipedia/commons/c/cb/Dustin_Rhodes%2C_October_2019.jpg
747,26.07.2010,,"SheamusdefeatsGoldust(2:05)WWE Monday Night RAW #897- TV-Show @ AT&T Center in San Antonio, Texas, USA",https://upload.wikimedia.org/wikipedia/commons/c/cb/Dustin_Rhodes%2C_October_2019.jpg
748,26.07.2010,,"14 Man Elimination:The Nexus(Darren Young,David Otunga,Heath Slater,Justin Gabriel,Michael Tarver,Skip Sheffield&Wade Barrett) defeatEvan Bourne,Goldust,Jerry Lawler,Mark Henry,The Hart Dynasty(David Hart Smith&Tyson Kidd) &Yoshi Tatsu(11:42)WWE Monday Night RAW #896- TV-Show @ AT&T Center in San Antonio, Texas, USA",https://upload.wikimedia.org/wikipedia/commons/c/cb/Dustin_Rhodes%2C_October_2019.jpg
749,25.07.2010,,"Ted DiBiasedefeatsGoldustWWE RAW House Show- House Show @ Beaumont, Texas, USA",https://upload.wikimedia.org/wikipedia/commons/c/cb/Dustin_Rhodes%2C_October_2019.jpg
750,24.07.2010,,"Ted DiBiasedefeatsGoldustWWE RAW House Show- House Show @ Hirsch Memorial Coliseum in Shreveport, Louisiana, USA",https://upload.wikimedia.org/wikipedia/commons/c/cb/Dustin_Rhodes%2C_October_2019.jpg
751,23.07.2010,,"Ted DiBiasedefeatsGoldustWWE RAW House Show- House Show @ Toyota Center in Houston, Texas, USA",https://upload.wikimedia.org/wikipedia/commons/c/cb/Dustin_Rhodes%2C_October_2019.jpg
752,19.07.2010,,"Dark:Alberto Del RiodefeatsGoldustWWE Monday Night RAW #895- Dark Match @ BOK Center in Tulsa, Oklahoma, USA",https://upload.wikimedia.org/wikipedia/commons/c/cb/Dustin_Rhodes%2C_October_2019.jpg
753,12.07.2010,,"Goldust,Santino Marella,The Great Khali&Vladimir KozlovdefeatDoink,Primo,William Regal&Zack Ryder(1:45)WWE Monday Night RAW #894- TV-Show @ Rupp Arena in Lexington, Kentucky, USA",https://upload.wikimedia.org/wikipedia/commons/c/cb/Dustin_Rhodes%2C_October_2019.jpg
754,09.07.2010,,"Cody Rhodes,Dusty Rhodes&GoldustdefeatCurt Hawkins&The Dudebusters(Caylen Croft&Trent Beretta) (12:18)FCW- Event @ Osceola Heritage Park in Kissimmee, Florida, USA",https://upload.wikimedia.org/wikipedia/commons/c/cb/Dustin_Rhodes%2C_October_2019.jpg
755,05.07.2010,,"Zack RyderdefeatsGoldust(7:47)WWE Superstars #65- TV-Show @ Philips Arena in Atlanta, Georgia, USA",https://upload.wikimedia.org/wikipedia/commons/c/cb/Dustin_Rhodes%2C_October_2019.jpg
756,28.06.2010,,"Primo&Zack RyderdefeatGoldust&Yoshi Tatsu(11:32)WWE Superstars #64- TV-Show @ Mohegan Sun Arena in Wilkes-Barre, Pennsylvania, USA",https://upload.wikimedia.org/wikipedia/commons/c/cb/Dustin_Rhodes%2C_October_2019.jpg
757,27.06.2010,,"GoldustdefeatsWilliam RegalWWE RAW House Show- House Show @ Wheeling, West Virginia, USA",https://upload.wikimedia.org/wikipedia/commons/c/cb/Dustin_Rhodes%2C_October_2019.jpg
758,26.06.2010,,"GoldustdefeatsWilliam RegalWWE RAW House Show- House Show @ Covelli Centre in Youngstown, Ohio, USA",https://upload.wikimedia.org/wikipedia/commons/c/cb/Dustin_Rhodes%2C_October_2019.jpg
759,25.06.2010,,"Goldust&Yoshi TatsudefeatWilliam Regal&Zack RyderWWE RAW House Show- House Show @ Tullio Center in Erie, Pennsylvania, USA",https://upload.wikimedia.org/wikipedia/commons/c/cb/Dustin_Rhodes%2C_October_2019.jpg
760,21.06.2010,,"Dark:Ted DiBiasedefeatsGoldustWWE Monday Night RAW #891- Dark Match @ Arena At Harbor Yard in Bridgeport, Connecticut, USA",https://upload.wikimedia.org/wikipedia/commons/c/cb/Dustin_Rhodes%2C_October_2019.jpg
761,14.06.2010,,"The Usos(Jey Uso&Jimmy Uso) defeatGoldust&Mark Henry(12:13)WWE Superstars #62- TV-Show @ RBC Center in Raleigh, North Carolina, USA",https://upload.wikimedia.org/wikipedia/commons/c/cb/Dustin_Rhodes%2C_October_2019.jpg
762,13.06.2010,,"Dos CarasdefeatsGoldustWWE RAW House Show- House Show @ Greensboro Coliseum in Greensboro, North Carolina, USA",https://upload.wikimedia.org/wikipedia/commons/c/cb/Dustin_Rhodes%2C_October_2019.jpg
763,12.06.2010,,"Dos CarasdefeatsGoldustWWE RAW House Show- House Show @ Roanoke Civic Center in Roanoke, Virginia, USA",https://upload.wikimedia.org/wikipedia/commons/c/cb/Dustin_Rhodes%2C_October_2019.jpg
764,11.06.2010,,"Dos CarasdefeatsGoldustWWE RAW House Show- House Show @ Charleston Civic Center in Charleston, West Virginia, USA",https://upload.wikimedia.org/wikipedia/commons/c/cb/Dustin_Rhodes%2C_October_2019.jpg
