date,event,result,location,image_url
1,31.07.2025,,"AEW TNT TitleChicago Street Fight:Kyle FletcherdefeatsDustin Rhodes(c) (16:43) -TITLE CHANGE !!!AEW Collision #104- TV-Show @ Byline Bank Aragon Ballroom in Chicago, Illinois, USA",https://upload.wikimedia.org/wikipedia/commons/c/cb/Dustin_Rhodes%2C_October_2019.jpg
2,26.07.2025,,"AEW TNT Title:Dustin Rhodes(c) defeatsLee Moriarty(16:33)AEW Collision #103- TV-Show @ Byline Bank Aragon Ballroom in Chicago, Illinois, USA",https://upload.wikimedia.org/wikipedia/commons/c/cb/Dustin_Rhodes%2C_October_2019.jpg
3,12.07.2025,,"The Sons Of Texas(Dustin Rhodes,Marshall von Erich,Ross von Erich&Sammy Guevara) defeatShane Taylor Promotions(Carlie Bravo,Lee Moriarty,Shane Taylor&Shawn Dean) (7:11)AEW All In Texas - Zero Hour- Online Stream @ Globe Life Field in Arlington, Texas, USA",https://upload.wikimedia.org/wikipedia/commons/c/cb/Dustin_Rhodes%2C_October_2019.jpg
4,12.07.2025,,"AEW TNT TitleFour Way Match (vakant):Dustin RhodesdefeatsDaniel GarciaandKyle FletcherandSammy Guevara(14:23) -TITLE CHANGE !!!AEW All In Texas- Pay Per View @ Globe Life Field in Arlington, Texas, USA",https://upload.wikimedia.org/wikipedia/commons/c/cb/Dustin_Rhodes%2C_October_2019.jpg
5,11.07.2025,,"ROH World Tag Team Title:The Sons Of Texas(Dustin Rhodes&Sammy Guevara) (c) defeatThe Infantry(Carlie Bravo&Shawn Dean) (15:04)ROH Supercard Of Honor 2025- Online Stream @ Esports Stadium Arlington in Arlington, Texas, USA",https://upload.wikimedia.org/wikipedia/commons/c/cb/Dustin_Rhodes%2C_October_2019.jpg
6,21.06.2025,,"The Sons Of Texas(Dustin Rhodes,Marshall von Erich,Ross von Erich&Sammy Guevara) defeatGrizzled Young Veterans(James Drake&Zack Gibson) &The Premier Athletes(Ariya Daivari&Tony Nese) (8:39)ROH on HonorClub #124- Online Stream @ accesso ShoWare Center in Kent, Washington, USA",https://upload.wikimedia.org/wikipedia/commons/c/cb/Dustin_Rhodes%2C_October_2019.jpg
7,25.05.2025,,"AEW World Tag Team Title:The Hurt Syndicate(Bobby Lashley&Shelton Benjamin) (c) defeatThe Sons Of Texas(Dustin Rhodes&Sammy Guevara) (12:38)AEW Double Or Nothing 2025- Pay Per View @ Desert Diamond Arena in Glendale, Arizona, USA",https://upload.wikimedia.org/wikipedia/commons/c/cb/Dustin_Rhodes%2C_October_2019.jpg
8,14.05.2025,,"AEW World Tag Team Title#1 Contendership:The Sons Of Texas(Dustin Rhodes&Sammy Guevara) defeatCRU(Action Andretti&Lio Rush) (11:53)AEW Collision #93 - Beach Break 2025 - Tag 2- TV-Show @ NOW Arena in Hoffman Estates, Illinois, USA",https://upload.wikimedia.org/wikipedia/commons/c/cb/Dustin_Rhodes%2C_October_2019.jpg
9,08.05.2025,,"The Sons Of Texas(Dustin Rhodes&Sammy Guevara) &The Von Erichs(Marshall von Erich&Ross von Erich) defeatMxM Collection(Mansoor&Mason Madden) &The Premier Athletes(Ariya Daivari&Tony Nese) (7:17)ROH on HonorClub #116- Online Stream @ Detroit, Michigan, USA",https://upload.wikimedia.org/wikipedia/commons/c/cb/Dustin_Rhodes%2C_October_2019.jpg
10,12.04.2025,,"ROH World Six Man Tag Team Title:Dustin Rhodes&The Von Erichs(Marshall von Erich&Ross von Erich) (c) defeatJohnny TV&MxM Collection(Mansoor&Mason Madden) (11:12)ROH on HonorClub #112- Online Stream @ MassMutual Center in Springfield, Massachusetts, USA",https://upload.wikimedia.org/wikipedia/commons/c/cb/Dustin_Rhodes%2C_October_2019.jpg
11,02.04.2025,,"Dustin Rhodes&The Von Erichs(Marshall von Erich&Ross von Erich) defeatDavey Bang,Dominic Garrini&Kevin Ku(4:46)ROH on HonorClub #111- Online Stream @ Peoria, Illinois, USA",https://upload.wikimedia.org/wikipedia/commons/c/cb/Dustin_Rhodes%2C_October_2019.jpg
12,29.03.2025,,"ROH World Tag Team TitleProving Ground:The Sons Of Texas(Dustin Rhodes&Sammy Guevara) defeatThe Frat House(Cole Karter&Griff Garrison) (7:50)ROH on HonorClub #110- Online Stream @ UW-Milwaukee Panther Arena in Milwaukee, Wisconsin, USA",https://upload.wikimedia.org/wikipedia/commons/c/cb/Dustin_Rhodes%2C_October_2019.jpg
13,15.03.2025,,"The Sons Of Texas(Dustin Rhodes&Sammy Guevara) &Willie MackdefeatJohnny TV&MxM Collection(Mansoor&Mason Madden) (8:34)ROH on HonorClub #109- Online Stream @ The Theater At Virgin Hotels Las Vegas in Las Vegas, Nevada, USA",https://upload.wikimedia.org/wikipedia/commons/c/cb/Dustin_Rhodes%2C_October_2019.jpg
14,01.03.2025,,"The Sons Of Texas(Dustin Rhodes&Sammy Guevara) defeatJon Cruz&Olumide(3:51)ROH on HonorClub #106- Online Stream @ Oakland, California, USA",https://upload.wikimedia.org/wikipedia/commons/c/cb/Dustin_Rhodes%2C_October_2019.jpg
15,15.02.2025,,"ROH World Tag Team Title:The Sons Of Texas(Dustin Rhodes&Sammy Guevara) (c) defeatMxM Collection(Mansoor&Mason Madden) (12:53)AEW/ROH Global Wars Australia- Online Stream @ Brisbane Entertainment Centre in Boondall, Queensland, Australia",https://upload.wikimedia.org/wikipedia/commons/c/cb/Dustin_Rhodes%2C_October_2019.jpg
16,11.02.2025,,"MJFdefeatsDustin Rhodesby referee's decision (11:13)AEW Dynamite #280- TV-Show @ H-E-B Center At Cedar Park in Cedar Park, Texas, USA",https://upload.wikimedia.org/wikipedia/commons/c/cb/Dustin_Rhodes%2C_October_2019.jpg
17,08.02.2025,,"Dustin RhodesdefeatsIzzy James(0:28)AEW Collision #80- TV-Show @ Fort Bend Epicenter in Rosenberg, Texas, USA",https://upload.wikimedia.org/wikipedia/commons/c/cb/Dustin_Rhodes%2C_October_2019.jpg
18,16.01.2025,,"Dustin RhodesdefeatsAdam Priest(2:12)AEW Collision #77 - Maximum Carnage - Tag 2- TV-Show @ The Andrew J Brady Music Center in Cincinnati, Ohio, USA",https://upload.wikimedia.org/wikipedia/commons/c/cb/Dustin_Rhodes%2C_October_2019.jpg
19,05.01.2025,,"Pre-ShowROH World Tag Team Title:The Sons Of Texas(Dustin Rhodes&Sammy Guevara) (c) defeatHouse Of Torture(SHO&Yoshinobu Kanemaru) (9:27)NJPW/CMLL/AEW Wrestle Dynasty- Pay Per View @ Tokyo Dome in Tokyo, Japan",https://upload.wikimedia.org/wikipedia/commons/c/cb/Dustin_Rhodes%2C_October_2019.jpg
20,20.12.2024,,"ROH World Tag Team TitleDouble Bullrope:The Sons Of Texas(Dustin Rhodes&Sammy Guevara) (c) defeatThe Righteous(Dutch&Vincent) (15:33)ROH Final Battle 2024- Online Stream @ Hammerstein Ballroom in New York City, New York, USA",https://upload.wikimedia.org/wikipedia/commons/c/cb/Dustin_Rhodes%2C_October_2019.jpg
21,07.12.2024,,"The Sons Of Texas(Dustin Rhodes&Sammy Guevara) defeatEric Dillinger&Josh Crane(3:39)ROH on HonorClub #94- Online Stream @ Greater Columbus Convention Center in Columbus, Ohio, USA",https://upload.wikimedia.org/wikipedia/commons/c/cb/Dustin_Rhodes%2C_October_2019.jpg
22,07.11.2024,,"The Sons Of Texas(Dustin Rhodes&Sammy Guevara) defeatShot Through The Heart(Love Doug&TJ Crawford) (2:44)ROH on HonorClub #90- Online Stream @ Amica Mutual Pavilion in Providence, Rhode Island, USA",https://upload.wikimedia.org/wikipedia/commons/c/cb/Dustin_Rhodes%2C_October_2019.jpg
23,25.09.2024,,"ROH World Six Man Tag Team TitleProving Ground:Dustin Rhodes&The Von Erichs(Marshall von Erich&Ross von Erich) [c] defeatThe Premier Athletes(Ariya Daivari,Mark Sterling&Tony Nese) (6:17)ROH on HonorClub #84- Online Stream @ New York City, New York, USA",https://upload.wikimedia.org/wikipedia/commons/c/cb/Dustin_Rhodes%2C_October_2019.jpg
24,21.09.2024,,"ROH World Tag Team TitleBunkhouse Brawl:Dustin Rhodes&Sammy Guevara(c) defeatThe Undisputed Kingdom(Matt Taven&Mike Bennett) (13:18)AEW Collision #63- TV-Show @ MassMutual Center in Springfield, Massachusetts, USA",https://upload.wikimedia.org/wikipedia/commons/c/cb/Dustin_Rhodes%2C_October_2019.jpg
25,07.09.2024,,"Dustin Rhodes,Hologram&Sammy GuevaradefeatThe Premier Athletes(Ariya Daivari,Josh Woods&Tony Nese) (9:51)AEW All Out 2024 - Zero Hour- Online Stream @ NOW Arena in Hoffman Estates, Illinois, USA",https://upload.wikimedia.org/wikipedia/commons/c/cb/Dustin_Rhodes%2C_October_2019.jpg
26,06.09.2024,,"Dustin Rhodes,Hologram&Sammy GuevaradefeatThe Dark Order(Alex Reynolds,Evil Uno&John Silver) (7:32)AEW Rampage #161- TV-Show @ NOW Arena in Hoffman Estates, Illinois, USA",https://upload.wikimedia.org/wikipedia/commons/c/cb/Dustin_Rhodes%2C_October_2019.jpg
27,31.08.2024,,"ROH World Tag Team TitleProving Ground:Dustin Rhodes&Sammy Guevara[c] defeatThe Dark Order(Alex Reynolds&Evil Uno) (7:24)ROH on HonorClub #82- Online Stream @ Denny Sanford Premier Center in Sioux Falls, South Dakota, USA",https://upload.wikimedia.org/wikipedia/commons/c/cb/Dustin_Rhodes%2C_October_2019.jpg
28,25.08.2024,,"Dustin Rhodes,Katsuyori Shibata,Sammy Guevara&The Von Erichs(Marshall von Erich&Ross von Erich) defeatCage Of Agony(Bishop Kaun,Brian Cage&Toa Liona) &The Undisputed Kingdom(Matt Taven&Mike Bennett) (13:08)AEW All In London 2024 - Zero Hour- Online Stream @ Wembley Stadium in London, England, UK",https://upload.wikimedia.org/wikipedia/commons/c/cb/Dustin_Rhodes%2C_October_2019.jpg
29,17.08.2024,,"ROH World Tag Team Title:Dustin Rhodes&Sammy GuevaradefeatThe Undisputed Kingdom(Matt Taven&Mike Bennett) (c) (12:02) -TITLE CHANGE !!!AEW Collision #58- TV-Show @ Esports Stadium Arlington in Arlington, Texas, USA",https://upload.wikimedia.org/wikipedia/commons/c/cb/Dustin_Rhodes%2C_October_2019.jpg
30,11.08.2024,,"Dustin Rhodes,Sammy Guevara&The Von Erichs(Marshall von Erich&Ross von Erich) defeatThe Undisputed Kingdom(Matt Taven&Mike Bennett) &The Dark Order(Alex Reynolds&John Silver) (12:17)ROH on HonorClub #78- Online Stream @ Esports Stadium Arlington in Arlington, Texas, USA",https://upload.wikimedia.org/wikipedia/commons/c/cb/Dustin_Rhodes%2C_October_2019.jpg
31,28.07.2024,,"Dustin Rhodes&Sammy GuevaradefeatThe Dark Order(Alex Reynolds&John Silver) (12:02)ROH on HonorClub #76- Online Stream @ Esports Stadium Arlington in Arlington, Texas, USA",https://upload.wikimedia.org/wikipedia/commons/c/cb/Dustin_Rhodes%2C_October_2019.jpg
32,28.07.2024,,"ROH World Six Man Tag Team Title:Dustin Rhodes&The Von Erichs(Marshall von Erich&Ross von Erich) (c) defeatIron Savages(Boulder,Bronson&Jacked Jameson) (12:18)ROH on HonorClub #75- Online Stream @ Esports Stadium Arlington in Arlington, Texas, USA",https://upload.wikimedia.org/wikipedia/commons/c/cb/Dustin_Rhodes%2C_October_2019.jpg
33,28.07.2024,,"ROH World Six Man Tag Team Title:Dustin Rhodes&The Von Erichs(Marshall von Erich&Ross von Erich) (c) defeatCage Of Agony(Bishop Kaun,Brian Cage&Toa Liona) by DQ (9:01)ROH on HonorClub #77- Online Stream @ Esports Stadium Arlington in Arlington, Texas, USA",https://upload.wikimedia.org/wikipedia/commons/c/cb/Dustin_Rhodes%2C_October_2019.jpg
34,27.07.2024,,"ROH World Six Man Tag Team TitleMatch (vakant):Dustin Rhodes&The Von Erichs(Marshall von Erich&Ross von Erich) defeatThe Undisputed Kingdom(Matt Taven,Mike Bennett&Roderick Strong) (13:27) -TITLE CHANGE !!!AEW Battle Of The Belts XI- TV-Show @ Esports Stadium Arlington in Arlington, Texas, USA",https://upload.wikimedia.org/wikipedia/commons/c/cb/Dustin_Rhodes%2C_October_2019.jpg
35,26.07.2024,,"ROH World Six Man Tag Team TitleEliminator:Dustin Rhodes&The Von Erichs(Marshall von Erich&Ross von Erich) defeatThe Dark Order(Alex Reynolds,Evil Uno&John Silver) (14:29)ROH Death Before Dishonor 2024- Online Stream @ Esports Stadium Arlington in Arlington, Texas, USA",https://upload.wikimedia.org/wikipedia/commons/c/cb/Dustin_Rhodes%2C_October_2019.jpg
36,12.06.2024,,"AEW TNT TitleForbidden Door Qualifying:Jack PerrydefeatsDustin Rhodes(10:05)AEW Dynamite #245- TV-Show @ Wells Fargo Arena in Des Moines, Iowa, USA",https://upload.wikimedia.org/wikipedia/commons/c/cb/Dustin_Rhodes%2C_October_2019.jpg
37,08.06.2024,,"Dustin RhodesdefeatsJohnny TV(9:33)AEW Collision #48- TV-Show @ Mid-America Center in Council Bluffs, Iowa, USA",https://upload.wikimedia.org/wikipedia/commons/c/cb/Dustin_Rhodes%2C_October_2019.jpg
38,10.04.2024,,"AEW World TitleEliminator:Samoa JoedefeatsDustin Rhodes(9:32)AEW Dynamite #236- TV-Show @ Charleston Coliseum in Charleston, West Virginia, USA",https://upload.wikimedia.org/wikipedia/commons/c/cb/Dustin_Rhodes%2C_October_2019.jpg
39,27.03.2024,,"Dustin RhodesdefeatsThe Butcher(10:36)AEW Rampage #138- TV-Show @ Centre Videotron in Quebec City, Quebec, Canada",https://upload.wikimedia.org/wikipedia/commons/c/cb/Dustin_Rhodes%2C_October_2019.jpg
40,14.02.2024,,"The Von Erichs(Marshall von Erich&Ross von Erich) &Dustin RhodesdefeatHitt,Romero Crews&Shimbashi(1:47)AEW Rampage #132- TV-Show @ H-E-B Center At Cedar Park in Cedar Park, Texas, USA",https://upload.wikimedia.org/wikipedia/commons/c/cb/Dustin_Rhodes%2C_October_2019.jpg
41,17.01.2024,,"AEW TNT Title:Christian Cage(c) defeatsDustin Rhodes(15:25)AEW Dynamite #224- TV-Show @ North Charleston Coliseum in North Charleston, South Carolina, USA",https://upload.wikimedia.org/wikipedia/commons/c/cb/Dustin_Rhodes%2C_October_2019.jpg
42,13.01.2024,,"Dustin RhodesdefeatsWillie Mack(4:06)AEW Collision #30- TV-Show @ Chartway Arena in Norfolk, Virginia, USA",https://upload.wikimedia.org/wikipedia/commons/c/cb/Dustin_Rhodes%2C_October_2019.jpg
43,10.01.2024,,"Adam Copeland,Dustin Rhodes,Orange Cassidy&Preston VancedefeatLance Archer&The Mogul Embassy(Bishop Kaun,Brian Cage&Toa Liona) (10:24)AEW Dynamite #223 - Homecoming 2024 - Tag 1- TV-Show @ Daily's Place in Jacksonville, Florida, USA",https://upload.wikimedia.org/wikipedia/commons/c/cb/Dustin_Rhodes%2C_October_2019.jpg
44,30.12.2023,,"Swerve StricklanddefeatsDustin Rhodes(9:28)AEW Worlds End 2023- Pay Per View @ Nassau Veterans Memorial Coliseum in Uniondale, New York, USA",https://upload.wikimedia.org/wikipedia/commons/c/cb/Dustin_Rhodes%2C_October_2019.jpg
45,04.11.2023,,"Mark Briscoe&Naturally Limitless(Dustin Rhodes&Keith Lee) defeatKip Sabian&The WorkHorsemen(Anthony Henry&JD Drake) (4:33)AEW Collision #21- TV-Show @ INTRUST Bank Arena in Wichita, Kansas, USA",https://upload.wikimedia.org/wikipedia/commons/c/cb/Dustin_Rhodes%2C_October_2019.jpg
46,18.10.2023,,"Dynamite Diamond Ring 2023 Battle Royal:Juice RobinsondefeatsDaniel GarciaandDustin RhodesandJake HagerandJeff HardyandJohnny TVandKomanderandMatt HardyandMatt MenardandMatt SydalandMax CasterandTrent Beretta(14:33)AEW Dynamite #211- TV-Show @ Fort Bend Epicenter in Rosenberg, Texas, USA",https://upload.wikimedia.org/wikipedia/commons/c/cb/Dustin_Rhodes%2C_October_2019.jpg
47,12.07.2023,,"Naturally Limitless(Dustin Rhodes&Keith Lee) defeatThe Jericho Appreciation Society(Angelo Parker&Matt Menard) (9:49)AEW Rampage #101- TV-Show @ SaskTel Centre in Saskatoon, Saskatchewan, Canada",https://upload.wikimedia.org/wikipedia/commons/c/cb/Dustin_Rhodes%2C_October_2019.jpg
48,29.06.2023,,"Owen Hart Foundation 2023 Men's Tournament Quarter Final:Powerhouse HobbsdefeatsDustin Rhodes(11:11)AEW Collision #3- TV-Show @ FirstOntario Centre in Hamilton, Ontario, Canada",https://upload.wikimedia.org/wikipedia/commons/c/cb/Dustin_Rhodes%2C_October_2019.jpg
49,28.05.2023,,"AEW International Title21 Man Blackjack Battle Royale:Orange Cassidy(c) defeatsAri DaivariandBandidoandBig BillandBrian CageandChuck TaylorandDustin RhodesandJay WhiteandJuice RobinsonandKeith LeeandKip SabianandKomanderandLee MoriartyandPenta El Zero MiedoandRey FenixandRicky StarksandSwerve StricklandandThe BladeandThe ButcherandTony NeseandTrent Beretta(22:29)AEW Double Or Nothing 2023- Pay Per View @ T-Mobile Arena in Paradise, Nevada, USA",https://upload.wikimedia.org/wikipedia/commons/c/cb/Dustin_Rhodes%2C_October_2019.jpg
50,17.05.2023,,"Dustin RhodesdefeatsBishop Kaun(8:58)AEW Rampage #93- TV-Show @ Moody Center in Austin, Texas, USA",https://upload.wikimedia.org/wikipedia/commons/c/cb/Dustin_Rhodes%2C_October_2019.jpg
51,26.04.2023,,"Naturally Limitless(Dustin Rhodes&Keith Lee) defeatBrady Pierce&Charlie James(2:07)AEW Rampage #90- TV-Show @ FLA Live Arena in Sunrise, Florida, USA",https://upload.wikimedia.org/wikipedia/commons/c/cb/Dustin_Rhodes%2C_October_2019.jpg
52,15.03.2023,,"Naturally Limitless(Dustin Rhodes&Keith Lee) defeatJessie V&Levi Night(2:41)AEW Dark: Elevation #107- Online Stream @ Canada Life Centre in Winnipeg, Manitoba, Canada",https://upload.wikimedia.org/wikipedia/commons/c/cb/Dustin_Rhodes%2C_October_2019.jpg
53,03.03.2023,,"Naturally Limitless(Dustin Rhodes&Keith Lee) defeatMogul Affiliates(Parker Boudreaux&Swerve Strickland) (11:04)AEW Rampage #82- TV-Show @ Cow Palace in Daly City, California, USA",https://upload.wikimedia.org/wikipedia/commons/c/cb/Dustin_Rhodes%2C_October_2019.jpg
54,15.02.2023,,"Dustin RhodesdefeatsSwerve Stricklandby DQ (12:26)AEW Rampage #80 - Slam Dunk 2023- TV-Show @ Sames Auto Arena in Laredo, Texas, USA",https://upload.wikimedia.org/wikipedia/commons/c/cb/Dustin_Rhodes%2C_October_2019.jpg
55,14.12.2022,,"Best Friends(Chuck Taylor&Trent Beretta),Dustin Rhodes&Orange CassidydefeatKip Sabian,The Butcher And The Blade(The Blade&The Butcher) &Trent Seven(10:42)AEW Rampage #71- TV-Show @ Curtis Culwell Center in Garland, Texas, USA",https://upload.wikimedia.org/wikipedia/commons/c/cb/Dustin_Rhodes%2C_October_2019.jpg
56,07.12.2022,,"Dynamite Diamond Ring 2022 Battle Royal:Ricky StarksdefeatsBrian CageandDalton CastleandDustin RhodesandEthan PageandJack PerryandKip SabianandLee MoriartyandMatt HardyandOrange CassidyandShawn DeanandThe Butcher(13:08)AEW Dynamite #166- TV-Show @ H-E-B Center At Cedar Park in Cedar Park, Texas, USA",https://upload.wikimedia.org/wikipedia/commons/c/cb/Dustin_Rhodes%2C_October_2019.jpg
57,24.08.2022,,"ROH World Title:Claudio Castagnoli(c) defeatsDustin Rhodes(12:27)AEW Rampage #55- TV-Show @ Wolstein Center in Cleveland, Ohio, USA",https://upload.wikimedia.org/wikipedia/commons/c/cb/Dustin_Rhodes%2C_October_2019.jpg
58,29.06.2022,,"Royal Rampage 2022:Brody KingdefeatsAdam PageandDante MartinandDarby AllinandDustin RhodesandFrankie KazarianandJohn SilverandKeith LeeandKonosuke TakeshitaandMatt HardyandMax CasterandOrange CassidyandPenta OscuroandPowerhouse HobbsandRicky StarksandRushandSwerve StricklandandThe BladeandThe ButcherandTony Nese(22:41)AEW Rampage #47 - Royal Rampage 2022- TV-Show @ Little Caesars Arena in Detroit, Michigan, USA",https://upload.wikimedia.org/wikipedia/commons/c/cb/Dustin_Rhodes%2C_October_2019.jpg
59,20.04.2022,,"CM PunkdefeatsDustin Rhodes(17:26)AEW Dynamite #133- TV-Show @ Petersen Events Center in Pittsburgh, Pennsylvania, USA",https://upload.wikimedia.org/wikipedia/commons/c/cb/Dustin_Rhodes%2C_October_2019.jpg
60,23.03.2022,,"Dustin RhodesdefeatsLance Archer(9:32)AEW Rampage #33- TV-Show @ H-E-B Center At Cedar Park in Cedar Park, Texas, USA",https://upload.wikimedia.org/wikipedia/commons/c/cb/Dustin_Rhodes%2C_October_2019.jpg
61,08.01.2022,,"AEW Interim TNT TitleMatch (vakant):Sammy GuevaradefeatsDustin Rhodes(16:15) -TITLE CHANGE !!!AEW Battle Of The Belts- TV-Show @ Bojangles Coliseum in Charlotte, North Carolina, USA",https://upload.wikimedia.org/wikipedia/commons/c/cb/Dustin_Rhodes%2C_October_2019.jpg
62,01.12.2021,,"The Nightmare Family(Brock Anderson,Dustin Rhodes&Lee Johnson) defeatThe Wingmen(Cezar Bononi,JD Drake&Peter Avalon) (5:04)AEW Dark: Elevation #40- Online Stream @ Gas South Arena in Duluth, Georgia, USA",https://upload.wikimedia.org/wikipedia/commons/c/cb/Dustin_Rhodes%2C_October_2019.jpg
63,23.10.2021,,"AEW World TitleEliminator Tournament First Round:Bryan DanielsondefeatsDustin Rhodesby referee's decision (14:28)AEW Dynamite #107 - Saturday Night Dynamite- TV-Show @ Addition Financial Arena in Orlando, Florida, USA",https://upload.wikimedia.org/wikipedia/commons/c/cb/Dustin_Rhodes%2C_October_2019.jpg
64,15.10.2021,,"Dustin RhodesdefeatsGustavo(1:18)AEW Dark: Elevation #33- Online Stream @ James L. Knight Center in Miami, Florida, USA",https://upload.wikimedia.org/wikipedia/commons/c/cb/Dustin_Rhodes%2C_October_2019.jpg
65,15.09.2021,,"Dustin RhodesdefeatsQT Marshall(6:36)AEW Dark: Elevation #29- Online Stream @ Prudential Center in Newark, New Jersey, USA",https://upload.wikimedia.org/wikipedia/commons/c/cb/Dustin_Rhodes%2C_October_2019.jpg
66,08.09.2021,,"Malakai BlackdefeatsDustin Rhodes(9:53)AEW Dynamite #101- TV-Show @ Fifth Third Arena in Cincinnati, Ohio, USA",https://upload.wikimedia.org/wikipedia/commons/c/cb/Dustin_Rhodes%2C_October_2019.jpg
67,14.07.2021,,"Dustin RhodesdefeatsAaron Solo(6:02)AEW Dark #98- Online Stream @ H-E-B Center At Cedar Park in Cedar Park, Texas, USA",https://upload.wikimedia.org/wikipedia/commons/c/cb/Dustin_Rhodes%2C_October_2019.jpg
68,26.06.2021,,"The Nightmare Family(Brock Anderson,Dustin Rhodes&Lee Johnson) defeatAdrian Alanis,Justin Corino&Liam Gray(4:24)AEW Dark: Elevation #16- Online Stream @ Daily's Place in Jacksonville, Florida, USA",https://upload.wikimedia.org/wikipedia/commons/c/cb/Dustin_Rhodes%2C_October_2019.jpg
69,05.06.2021,,"The Nightmare Family(Dustin Rhodes&Lee Johnson) defeatTravis Titan&VSK(3:07)AEW Dark: Elevation #14- Online Stream @ Daily's Place in Jacksonville, Florida, USA",https://upload.wikimedia.org/wikipedia/commons/c/cb/Dustin_Rhodes%2C_October_2019.jpg
70,04.06.2021,,"Bullrope:Dustin RhodesdefeatsNick Comoroto(10:05)AEW Dynamite #87 - Friday Night Dynamite- TV-Show @ Daily's Place in Jacksonville, Florida, USA",https://upload.wikimedia.org/wikipedia/commons/c/cb/Dustin_Rhodes%2C_October_2019.jpg
71,30.05.2021,,"Casino Battle Royale:Jungle BoydefeatsAaron SolowandAnthony BowensandBrian Pillman Jr.andChristian CageandColt CabanaandDustin RhodesandEvil UnoandGriff GarrisonandIsiah KassidyandLee JohnsonandLio RushandMarq QuenandMatt HardyandMatt SydalandMax CasterandNick ComorotoandPenta El Zero MiedoandPowerhouse HobbsandSerpenticoandTen(23:29)AEW Double Or Nothing 2021- Pay Per View @ Daily's Place in Jacksonville, Florida, USA",https://upload.wikimedia.org/wikipedia/commons/c/cb/Dustin_Rhodes%2C_October_2019.jpg
72,12.05.2021,,"Dustin RhodesdefeatsAaron Solow(9:47)AEW Dark: Elevation #10- Online Stream @ Daily's Place in Jacksonville, Florida, USA",https://upload.wikimedia.org/wikipedia/commons/c/cb/Dustin_Rhodes%2C_October_2019.jpg
73,22.04.2021,,"The Factory(Aaron Solow,Nick Comoroto&QT Marshall) defeatThe Nightmare Family(Billy Gunn,Dustin Rhodes&Lee Johnson) (6:44)AEW Dynamite #82- TV-Show @ Daily's Place in Jacksonville, Florida, USA",https://upload.wikimedia.org/wikipedia/commons/c/cb/Dustin_Rhodes%2C_October_2019.jpg
74,07.03.2021,,"Casino Tag Team Royale:Death Triangle(PAC&Rey Fenix) defeatBear Country(Bear Boulder&Bear Bronson) andJurassic Express(Jungle Boy&Luchasaurus) andMatt Sydal&Mike SydalandPrivate Party(Isiah Kassidy&Marq Quen) andSCU(Christopher Daniels&Frankie Kazarian) andThe Butcher And The Blade(The Blade&The Butcher) andThe Dark Order(Alex Reynolds&John Silver) andThe Dark Order(Evil Uno&Stu Grayson) andThe Dark Order(Five&Ten) andThe Gunn Club(Austin Gunn&Colten Gunn) andThe Inner Circle(Ortiz&Santana) andThe Natural Nightmares(Dustin Rhodes&QT Marshall) andThe Pretty Picture(Cezar Bononi&Peter Avalon) andThe Varsity Blonds(Brian Pillman Jr.&Griff Garrison) (26:45)AEW Revolution 2021- Pay Per View @ Daily's Place in Jacksonville, Florida, USA",https://upload.wikimedia.org/wikipedia/commons/c/cb/Dustin_Rhodes%2C_October_2019.jpg
75,03.03.2021,,"The Natural Nightmares(Dustin Rhodes&QT Marshall) defeatCezar Bononi&Peter Avalon(3:34)AEW Dark #78- Online Stream @ Daily's Place in Jacksonville, Florida, USA",https://upload.wikimedia.org/wikipedia/commons/c/cb/Dustin_Rhodes%2C_October_2019.jpg
76,03.02.2021,,"The Natural Nightmares(Dustin Rhodes&QT Marshall) &Nick ComorotodefeatThe Jersey Muscle Society(Steve Gibki&Tony Vincita) &Vary Morales(3:56)AEW Dark #74- Online Stream @ Daily's Place in Jacksonville, Florida, USA",https://upload.wikimedia.org/wikipedia/commons/c/cb/Dustin_Rhodes%2C_October_2019.jpg
77,21.01.2021,,"The Natural Nightmares(Dustin Rhodes&QT Marshall) &Nick ComorotodefeatTNT(Terrell Hughes&Terrence Hughes) &M'Badu(7:16)AEW Dark #73- Online Stream @ Daily's Place in Jacksonville, Florida, USA",https://upload.wikimedia.org/wikipedia/commons/c/cb/Dustin_Rhodes%2C_October_2019.jpg
78,20.01.2021,,"Dark:The Natural Nightmares(Dustin Rhodes&QT Marshall) &Nick ComorotodefeatRyan Nemeth,Shawn Dean&Vary MoralesAEW Dark #72- Dark Match @ Daily's Place in Jacksonville, Florida, USA",https://upload.wikimedia.org/wikipedia/commons/c/cb/Dustin_Rhodes%2C_October_2019.jpg
79,17.12.2020,,"Dustin RhodesdefeatsEvil Uno(8:27)AEW Dynamite #64 - Holiday Bash 2020- TV-Show @ Daily's Place in Jacksonville, Florida, USA",https://upload.wikimedia.org/wikipedia/commons/c/cb/Dustin_Rhodes%2C_October_2019.jpg
80,03.12.2020,,"Dustin RhodesdefeatsTen(2:49)AEW Dynamite #62- TV-Show @ Daily's Place in Jacksonville, Florida, USA",https://upload.wikimedia.org/wikipedia/commons/c/cb/Dustin_Rhodes%2C_October_2019.jpg
81,11.11.2020,,"Bunkhouse:The Natural Nightmares(Dustin Rhodes&QT Marshall) defeatThe Butcher And The Blade(The Blade&The Butcher) (13:02)AEW Dynamite #58- TV-Show @ Daily's Place in Jacksonville, Florida, USA",https://upload.wikimedia.org/wikipedia/commons/c/cb/Dustin_Rhodes%2C_October_2019.jpg
82,23.09.2020,,"The Natural Nightmares(Dustin Rhodes&QT Marshall) defeatColt Cabana&John Silver(6:32)AEW Dark #54- Online Stream @ Daily's Place in Jacksonville, Florida, USA",https://upload.wikimedia.org/wikipedia/commons/c/cb/Dustin_Rhodes%2C_October_2019.jpg
83,09.09.2020,,"AEW TNT Title:Mr. Brodie Lee(c) defeatsDustin Rhodes(10:28)AEW Dynamite #49- TV-Show @ Daily's Place in Jacksonville, Florida, USA",https://upload.wikimedia.org/wikipedia/commons/c/cb/Dustin_Rhodes%2C_October_2019.jpg
84,05.09.2020,,"The Natural Nightmares(Dustin Rhodes&QT Marshall),Matt Cardona&Scorpio SkydefeatColt Cabana&The Dark Order(Evil Uno,Mr. Brodie Lee&Stu Grayson) (15:04)AEW All Out 2020- Pay Per View @ Daily's Place in Jacksonville, Florida, USA",https://upload.wikimedia.org/wikipedia/commons/c/cb/Dustin_Rhodes%2C_October_2019.jpg
85,02.09.2020,,"The Natural Nightmares(Dustin Rhodes&QT Marshall) defeatThe Dark Order(Five&Ten) (8:02)AEW Dark #50- Online Stream @ Daily's Place in Jacksonville, Florida, USA",https://upload.wikimedia.org/wikipedia/commons/c/cb/Dustin_Rhodes%2C_October_2019.jpg
