date,event,result,location,image_url
1,30.08.2025,,"FWE United States Title:Chase Emery(c) defeatsMordecaiFWE Mind Games- Event @ Sports HQ in Cary, North Carolina, USA",https://upload.wikimedia.org/wikipedia/commons/e/ef/Kevin_Thorn_2016.jpg
2,15.12.2024,,"Caged Carnage Steel Cage:Team Skyler (Cam Jackson,Christopher Prince&John Skyler) defeat Team Cazana (AJ Cazana,Billy Brash&Gem Stone) and Team Thorn (Keith Mack,Kevin Thorn& Stuart Snodgrass) (15:13)OSCW Caged Carnage VI- Event @ Hanahan Recreation Center in Hanahan, South Carolina, USA",https://upload.wikimedia.org/wikipedia/commons/e/ef/Kevin_Thorn_2016.jpg
3,06.10.2024,,"Monster's Elimination Four Way:PCOdefeatsKahagasandKevin ThornandSinn Bodhi(10:58)OSCW SpookSlam- Event @ Hanahan Recreation Center in Hanahan, South Carolina, USA",https://upload.wikimedia.org/wikipedia/commons/e/ef/Kevin_Thorn_2016.jpg
4,28.07.2024,,"AJ Cabana &Kevin ThorndefeatCam Jackson&TJ BossOSCW- Event @ Hanahan Recreation Center in Hanahan, South Carolina, USA",https://upload.wikimedia.org/wikipedia/commons/e/ef/Kevin_Thorn_2016.jpg
5,30.03.2024,,"(Special Referee: Shark Boy):The Head Bangers(Mosh&Thrasher),Heather Owens&Kevin ThorndefeatHayley Shadows,Hooks,Matthew Taylor& Paul Hubris (7:32)SCX Expo IV Parade Of Champions- Online Stream @ The Wyndham in Indianapolis, Indiana, USA",https://upload.wikimedia.org/wikipedia/commons/e/ef/Kevin_Thorn_2016.jpg
6,08.03.2024,,"Kevin ThorndefeatsJay DeNiroSSW/sNs Horsepower II- Event @ Mahone Middle School in Kenosha, Wisconsin, USA",https://upload.wikimedia.org/wikipedia/commons/e/ef/Kevin_Thorn_2016.jpg
7,03.12.2023,,"KahagasdefeatsKevin Thorn(6:29)OSCW Championship Challenge- Event @ Hanahan Recreation Center Gymnasium in Hanahan, South Carolina, USA",https://upload.wikimedia.org/wikipedia/commons/e/ef/Kevin_Thorn_2016.jpg
8,28.10.2023,,"King Of The Damned:Gangrel&Wrecking Ball LegurskydefeatDark STG&Kevin Thorn(8:25)BCW The Witching Hour- Pay Per View @ 2300 Arena in Philadelphia, Pennsylvania, USA",https://upload.wikimedia.org/wikipedia/commons/e/ef/Kevin_Thorn_2016.jpg
9,28.10.2023,,"Monster Brawl Battle Royal:Kruledefeats Abel Booker and Austin O'Malley andBradley DiggsandCrazzy SteveandDevin O'Nealand Dr. Doom andGangreland J. Webb andJacksyn CrowleyandKevin ThornandLamonte PottsandMain Event Bradleyand Matt Williams andMikeyand Phil and Prince Gaston and Spidermane andSteven O'Nealand WaldoMemphis Wrestling #140- Online Stream @ Memphis Wrestling WrestleCenter in Memphis, Tennessee, USA",https://upload.wikimedia.org/wikipedia/commons/e/ef/Kevin_Thorn_2016.jpg
10,10.09.2023,,"Three On Two Handicap:The Bite Club(Gangrel&Kevin Thorn) defeatDrew Adler,Jamal The Titan& Steven Hunter (8:11)OSCW Wild Card- Event @ Hanahan Recreation Gym in Hanahan, South Carolina, USA",https://upload.wikimedia.org/wikipedia/commons/e/ef/Kevin_Thorn_2016.jpg
11,04.12.2022,,"Kevin ThorndefeatsJohn SkylerOSCW Merry Mayhem 2- Event @ Hanahan Recreation Gym in Hanahan, South Carolina, USA",https://upload.wikimedia.org/wikipedia/commons/e/ef/Kevin_Thorn_2016.jpg
12,03.12.2022,,"Mike CurkovdefeatsMordecaiGLCW Blizzard Brawl: ATTITUDE- Online Stream @ Waukesha County Expo Center in Waukesha, Wisconsin, USA",https://upload.wikimedia.org/wikipedia/commons/e/ef/Kevin_Thorn_2016.jpg
13,18.09.2022,,"The Bite Club(Gangrel&Kevin Thorn) defeatDrew Adler&Mason MylesOSCW Waging War- Event @ Hanahan Recreation Center in Hanahan, South Carolina, USA",https://upload.wikimedia.org/wikipedia/commons/e/ef/Kevin_Thorn_2016.jpg
14,15.01.2022,,"Men's Nightmare Rumble:Omar AmirdefeatsAmonandBig ZoandBrandon EspinosaandCash FloandD'Mone SolavinoandDeget BundlezandDimesandDustin JacksonandEric DarkstormandGustavoandHy-ZayaandJack VaughnandJoey AvalonandKal HerroandKevin ThornandKoda JacobsandLuscious LawrenceandMahabali SheraandMatt VineandRonnie RobertsandScotty 2 HottyandStar RiderandSteve MichaelsandTom CoffeyandTony BizoandTony EvansandTony GunnandTruth MagnumandTurbo Floyd(71:02)OVW Saturday Night Special - Nightmare Rumble 2022- Pay Per View @ Davis Arena in Louisville, Kentucky, USA",https://upload.wikimedia.org/wikipedia/commons/e/ef/Kevin_Thorn_2016.jpg
15,18.12.2021,,"King Of The Damned:GangreldefeatsKevin ThornBCW- Event @ 2300 Arena in Philadelphia, Pennsylvania, USA",https://upload.wikimedia.org/wikipedia/commons/e/ef/Kevin_Thorn_2016.jpg
16,05.12.2021,,"The Bite Club(Gangrel&Kevin Thorn) defeatDrew Adler&Francisco CiatsoOSCW Merry Mayhem- Event @ Hanahan, South Carolina, USA",https://upload.wikimedia.org/wikipedia/commons/e/ef/Kevin_Thorn_2016.jpg
17,04.12.2021,,"Mike Curkov&The Gunn Club(Austin Gunn&Colten Gunn) defeatKevin Fertig&The Express(Jeff Luxon&Ryan Kross)GLCW Blizzard Brawl 2021- Event @ Waukesha County Expo Center in Waukesha, Wisconsin, USA",https://upload.wikimedia.org/wikipedia/commons/e/ef/Kevin_Thorn_2016.jpg
18,24.10.2021,,"The Bite Club(Gangrel&Kevin Thorn) defeatTNT(Terrell Hughes&Terrence Hughes)OSCW Fall Feud- Event @ Hanahan, South Carolina, USA",https://upload.wikimedia.org/wikipedia/commons/e/ef/Kevin_Thorn_2016.jpg
19,09.10.2020,,"DanhausendefeatsMordecai(8:28)AIW Thunder In Indianapolis- Online Stream @ Marion County Fairgrounds in Indianapolis, Indiana, USA",https://upload.wikimedia.org/wikipedia/commons/e/ef/Kevin_Thorn_2016.jpg
20,26.05.2019,,"The East-West Express(Jeff Luxon&Ryan Kross) defeatThe Bite Club(Gangrel&Kevin Thorn)SSW/sNs SuperShow 2- Event @ The Brat Stop in Kenosha, Wisconsin, USA",https://upload.wikimedia.org/wikipedia/commons/e/ef/Kevin_Thorn_2016.jpg
21,26.04.2019,,"Kevin ThorndefeatsFlash FlanaganWRW Arabian Rumble 3- Event @ Pendleton Heights High School in Pendleton, Indiana, USA",https://upload.wikimedia.org/wikipedia/commons/e/ef/Kevin_Thorn_2016.jpg
22,23.02.2019,,"Dominic GarrinidefeatsKevin ThornAIW Hail To The King, Baby- Event @ Tadmor Shrine in Portage Lakes, Ohio, USA",https://upload.wikimedia.org/wikipedia/commons/e/ef/Kevin_Thorn_2016.jpg
23,01.12.2018,,"VCW Tag Team  Title:The Hell Cats(Jimmy Starz&Sexy Steve) defeatGangrel&Kevin Thorn(c) -TITLE CHANGE !!!VCW Tidings Of Destruction 2018- Event @ Masonic Temple in Norfolk, Virginia, USA",https://upload.wikimedia.org/wikipedia/commons/e/ef/Kevin_Thorn_2016.jpg
24,06.10.2018,,"VCW Tag Team  Title:Gangrel&Kevin Thorn(c) defeatNoise Pollution(Maxx Morrison&Roc Richards)VCW A Nightmare On Granby Street- Event @ Norfolk Masonic Temple in Norfolk, Virginia, USA",https://upload.wikimedia.org/wikipedia/commons/e/ef/Kevin_Thorn_2016.jpg
25,09.09.2018,,"Gangrel&Kevin ThorndefeatThe Beautiful Bald Besties(Michael Stevens&Zac Edwards)OSCW- Event @ Recreation Complex Gym in Hanahan, South Carolina, USA",https://upload.wikimedia.org/wikipedia/commons/e/ef/Kevin_Thorn_2016.jpg
26,28.07.2018,,"VCW Tag Team  Title:Gangrel&Kevin ThorndefeatThe Hell Cats(Jimmy Starz&Sexy Steve) (c) -TITLE CHANGE !!!VCW Liberty Lottery 2018- Event @ Masonic Temple in Norfolk, Virginia, USA",https://upload.wikimedia.org/wikipedia/commons/e/ef/Kevin_Thorn_2016.jpg
27,21.07.2018,,"Crazzy StevedefeatsKevin ThornTNT The Last Stand- Event @ Wilma Rudolph Event Center in Clarksville, Tennessee, USA",https://upload.wikimedia.org/wikipedia/commons/e/ef/Kevin_Thorn_2016.jpg
28,28.04.2018,,"Hardcore HollydefeatsKevin ThornHOH 41- Event @ Grand Wayne Convention Center in Fort Wayne, Indiana, USA",https://upload.wikimedia.org/wikipedia/commons/e/ef/Kevin_Thorn_2016.jpg
29,27.04.2018,,"Billy Gunn&Kevin ThorndefeatCrimson&Jax DaneWRW Arabian Rumble 2- Event @ Pendleton Heights High School in Pendleton, Indiana, USA",https://upload.wikimedia.org/wikipedia/commons/e/ef/Kevin_Thorn_2016.jpg
30,10.03.2018,,"Kevin ThorndefeatsDr. Daniel C. RockinghamAIW Enter The Dragon- Event @ Tadmore Shrine in Akron, Ohio, USA",https://upload.wikimedia.org/wikipedia/commons/e/ef/Kevin_Thorn_2016.jpg
31,24.02.2018,,"Otis Lee Bundy defeatsKevin ThornCIW- Event @ Union City High School in Union City, Michigan, USA",https://upload.wikimedia.org/wikipedia/commons/e/ef/Kevin_Thorn_2016.jpg
32,13.01.2018,,"RCP Heavyweight Title:Gene Snitsky(c) defeatsMordecaiRCP Opposite Elements- Event @ Boys & Girls Club in Newark, Delaware, USA",https://upload.wikimedia.org/wikipedia/commons/e/ef/Kevin_Thorn_2016.jpg
33,03.12.2017,,"Gangrel&Kevin Thorn) defeatAR Fox&Austin TheoryOSCW- Event @ Recreation Complex Gym in Hanahan, South Carolina, USA",https://upload.wikimedia.org/wikipedia/commons/e/ef/Kevin_Thorn_2016.jpg
34,02.12.2017,,"Benjamin Banks&Billy GunndefeatBrandon Scott&Kevin ThornVCW Lutz Memorial Cup 2017- Event @ Norfolk Masonic Temple in Norfolk, Virginia, USA",https://upload.wikimedia.org/wikipedia/commons/e/ef/Kevin_Thorn_2016.jpg
35,01.12.2017,,"Team Jacob (Gangrel&Kevin Thorn) defeat Team Edward (Air Wolf&Johnathan Wolf)BLP First Of The Month- Event @ On The Square Sports Academy in Crown Point, Indiana, USA",https://upload.wikimedia.org/wikipedia/commons/e/ef/Kevin_Thorn_2016.jpg
36,25.11.2017,,"Battle Royal:The HurricanedefeatsAxton Rayand Big Time Yah andBobby FultonandCrazzy SteveandD-Lo BrownandDarius LockhartandDave Dawsonand Dee Mack andJohn Skylerand Keith Mac andKevin ThornandKikutaroandMatt StrikerandMontana BlackandMovie MykandMr. HughesandStan LeeandSwoggleandTimmy Lou RettonandTracy SmothersandWhite Mike(8:20)WrestleCade SuperShow- Pay Per View @ Benton Convention Center in Winston-Salem, North Carolina, USA",https://upload.wikimedia.org/wikipedia/commons/e/ef/Kevin_Thorn_2016.jpg
37,18.11.2017,,"Stevie RichardsdefeatsMordecaiPCW A Night To Remember XI- Event @ Harpers Ferry KOA in Harpers Ferry, West Virginia, USA",https://upload.wikimedia.org/wikipedia/commons/e/ef/Kevin_Thorn_2016.jpg
38,04.11.2017,,"MordecaidefeatsKing MegaNYWC/Outlaw Wrestling- Event @ Saint Bernard Catholic Academy in New York City, New York, USA",https://upload.wikimedia.org/wikipedia/commons/e/ef/Kevin_Thorn_2016.jpg
39,29.10.2017,,"First Blood:GangreldefeatsKevin ThornHOW Heavy Halloween- Event @ Clyde Iron Works in Duluth, Minnesota, USA",https://upload.wikimedia.org/wikipedia/commons/e/ef/Kevin_Thorn_2016.jpg
40,23.09.2017,,"BLP Heavyweight TitleTournament First Round Three Way:Dasher HatfielddefeatsJoe GacyandMordecaiBLP The Darkest Timeline Tournament Phase 1- Event @ Square Sports Academy in Crown Point, Indiana, USA",https://upload.wikimedia.org/wikipedia/commons/e/ef/Kevin_Thorn_2016.jpg
41,23.09.2017,,"No Holds Barred:Kevin FertigdefeatsRuss JonesGLCW Hornswoggled- Event @ Circle B Recreation in Cedarburg, Wisconsin, USA",https://upload.wikimedia.org/wikipedia/commons/e/ef/Kevin_Thorn_2016.jpg
42,25.06.2017,,"Casket:The SoultakerdefeatsKevin ThornCIW- Event @ City Market in Flint, Michigan, USA",https://upload.wikimedia.org/wikipedia/commons/e/ef/Kevin_Thorn_2016.jpg
43,10.06.2017,,"Kevin ThorndefeatsBeefcake CharlieWrestlePro- Event @ St. Joseph R.C. Church in Keyport, New Jersey, USA",https://upload.wikimedia.org/wikipedia/commons/e/ef/Kevin_Thorn_2016.jpg
44,27.05.2017,,"JT Lightning Invitational Tournament 2017 Semi Final Four Way:Shawn SchultzdefeatsColt CabanaandMatthew JusticeandMordecaiAIW The JT Lightning Invitational Tournament 2017 - Tag 2- Event @ Our Lady Of Mt. Carmel School in Cleveland, Ohio, USA",https://upload.wikimedia.org/wikipedia/commons/e/ef/Kevin_Thorn_2016.jpg
45,26.05.2017,,"JT Lightning Invitational Tournament 2017 First Round:MordecaidefeatsSwoggleAIW The JT Lightning Invitational Tournament 2017 - Tag 1- Event @ Our Lady Of Mt. Carmel in Cleveland, Ohio, USA",https://upload.wikimedia.org/wikipedia/commons/e/ef/Kevin_Thorn_2016.jpg
46,23.05.2017,,"Billy Gunn&Kevin ThorndefeatDonovan Dijak&Jake SomethingWRW Arabian Rumble- Event @ Pendelton Heights High School in Pendleton, Indiana, USA",https://upload.wikimedia.org/wikipedia/commons/e/ef/Kevin_Thorn_2016.jpg
47,20.05.2017,,"Rod StreetdefeatsKevin ThornWFW- Event @ Grand Wayne Convention Center in Fort Wayne, Indiana, USA",https://upload.wikimedia.org/wikipedia/commons/e/ef/Kevin_Thorn_2016.jpg
48,05.05.2017,,"PWR Scramble TitleTen Man Scramble:AR Fox(c) defeatsArik CannonandCurt StallionandDavid StarrandEthan PageandJordan Len-XandKevin ThornandMyron ReedandSpace MonkeyandTrey MiguelREVOLVER Plead The Fifth- Event @ 7 Flags Event Center in Clive, Iowa, USA",https://upload.wikimedia.org/wikipedia/commons/e/ef/Kevin_Thorn_2016.jpg
49,22.04.2017,,"Extreme Rules:SadistdefeatsKevin ThornACW WaterCity WrestleCon 2017- Event @ Sunnyview Expo Center in Oshkosh, Wisconsin, USA",https://upload.wikimedia.org/wikipedia/commons/e/ef/Kevin_Thorn_2016.jpg
50,07.04.2017,,"MordecaidefeatsLightning Bolt JohnsonSPW- Event @ Inman's Bowling & Recreation Center in Valparaiso, Indiana, USA",https://upload.wikimedia.org/wikipedia/commons/e/ef/Kevin_Thorn_2016.jpg
51,31.03.2017,,"DDT Iron Man Heavy Metal Title20 Man Battle Royal:Swoggledefeats2 Cold ScorpioandAbyssandBilly GunnandColt CabanaandGangrelandGeorge SouthandGregory HelmsandJake ManningandJoey Ryan(c) andKevin ThornandKikutaroandMarty JannettyandMooseandMr. HughesandShane DouglasandShannon MooreandSuicideand The Underground Luchador (Matt Striker) andZane Riley(24:59) -TITLE CHANGE !!!WrestleCon SuperShow 2017- Event @ Wyndham Orlando Resort International Drive in Orlando, Florida, USA",https://upload.wikimedia.org/wikipedia/commons/e/ef/Kevin_Thorn_2016.jpg
52,25.03.2017,,"Kevin ThorndefeatsMojo McQueenCIW- Event @ Union City High School in Union City, Michigan, USA",https://upload.wikimedia.org/wikipedia/commons/e/ef/Kevin_Thorn_2016.jpg
53,18.03.2017,,"GangreldefeatsKevin ThornBWCW/XBW Battle Of The Vampires- Event @ American Legion Post 8 in Port Huron, Michigan, USA",https://upload.wikimedia.org/wikipedia/commons/e/ef/Kevin_Thorn_2016.jpg
54,08.03.2017,,"Flash FlanagandefeatsKevin ThornWrestleARTS 2: Warrior Rumble- Event @ 3030 N County Road in Whiteland, Indiana, USA",https://upload.wikimedia.org/wikipedia/commons/e/ef/Kevin_Thorn_2016.jpg
55,08.03.2017,,"WrestleARTS Global Openweight TitleRumble Match (vakant):Kevin Thorndefeats ??? andAnthony LeeandBrandon ProphetandDale PatricksandDave The RaveandDevin RazeandFlash FlanaganandHillbilly JedandJacob JohnsandJames ReevesandJoey OwensandJohnathan WolfandJoseph SchwartzandJosh CraneandMyron ReedandRic SavageandRob Kincaidand Rob The Janitor andShigehiro Irie-TITLE CHANGE !!!WrestleARTS 2: Warrior Rumble- Event @ 3030 N County Road in Whiteland, Indiana, USA",https://upload.wikimedia.org/wikipedia/commons/e/ef/Kevin_Thorn_2016.jpg
56,18.02.2017,,"BOTB Heavyweight TitleTournament Semi Final:Rob ConwaydefeatsKevin ThornBOTB Battle On The Border 2: Night Of Champions- Event @ MVP Sports in West Harrison, Indiana, USA",https://upload.wikimedia.org/wikipedia/commons/e/ef/Kevin_Thorn_2016.jpg
57,03.12.2016,,"Bull JamesdefeatsKevin ThornHOH XXI: Blizzard Brawl- Pay Per View @ Waukesha County Exposition Center in Waukesha, Wisconsin, USA",https://upload.wikimedia.org/wikipedia/commons/e/ef/Kevin_Thorn_2016.jpg
58,15.10.2016,,"Bull JamesdefeatsKevin ThornIWC/HOH XX- Event @ Court Time Sports Center in Elizabeth, Pennsylvania, USA",https://upload.wikimedia.org/wikipedia/commons/e/ef/Kevin_Thorn_2016.jpg
59,14.10.2016,,"Kevin ThorndefeatsBull JamesHOH XIX- Event @ The Odeon in Cleveland, Ohio, USA",https://upload.wikimedia.org/wikipedia/commons/e/ef/Kevin_Thorn_2016.jpg
60,08.10.2016,,"Kevin ThorndefeatsMatt ConardPCW Crimson Harvest- Event @ Leesburg, Virginia, USA",https://upload.wikimedia.org/wikipedia/commons/e/ef/Kevin_Thorn_2016.jpg
61,17.09.2016,,"Rik LuxurydefeatsKevin ThornWFC WrestleMayhem- Event @ James Luck High School in San Jose, California, USA",https://upload.wikimedia.org/wikipedia/commons/e/ef/Kevin_Thorn_2016.jpg
62,20.08.2016,,"Immortal WAR(Chase Stevens, Chris Thorn &Gangrel) defeatThe Lost Boys(Chris Michaels,Damien Wayne&Kevin Thorn)AWA War Of Gods: Unfinished Business Tour - Tag 2- Event @ The International in Knoxville, Tennessee, USA",https://upload.wikimedia.org/wikipedia/commons/e/ef/Kevin_Thorn_2016.jpg
63,19.08.2016,,"The Lost Boys(Chris Michaels,Damien Wayne&Kevin Thorn) defeatImmortal WAR(Chase Stevens, Chris Thorn &Gangrel)AWA War Of Gods: Unfinished Business Tour - Tag 1- Event @ Olympus Gym in Spring Hill, Tennessee, USA",https://upload.wikimedia.org/wikipedia/commons/e/ef/Kevin_Thorn_2016.jpg
64,30.07.2016,,"Jake OmendefeatsKevin ThornSSW/PWK/RCW When Worlds Collide II- Event @ Century Center in South Bend, Indiana, USA",https://upload.wikimedia.org/wikipedia/commons/e/ef/Kevin_Thorn_2016.jpg
65,23.07.2016,,"Extreme Rules:Bull JamesdefeatsKevin ThornWrestlePro- Event @ Columbia Club in Union County, New Jersey, USA",https://upload.wikimedia.org/wikipedia/commons/e/ef/Kevin_Thorn_2016.jpg
66,16.07.2016,,"GangreldefeatsKevin ThornAWA War Of Gods: Unexpected Tour - Tag 2- Event @ Community Center in Mount Pleasant, Tennessee, USA",https://upload.wikimedia.org/wikipedia/commons/e/ef/Kevin_Thorn_2016.jpg
67,12.06.2016,,"Kevin Thornvs.Shane Mercer- No ContestSPW/FWF Smash Funk IV- Event @ Inman's Bowling Alley in Valparaiso, Indiana, USA",https://upload.wikimedia.org/wikipedia/commons/e/ef/Kevin_Thorn_2016.jpg
68,25.03.2016,,"Jake OmendefeatsKevin Thornby DQSSW/PWK/RCW When Worlds Collide- Event @ South Bend, Indiana, USA",https://upload.wikimedia.org/wikipedia/commons/e/ef/Kevin_Thorn_2016.jpg
69,06.02.2016,,"Kevin ThorndefeatsAlexander JamesPCW Cold War- Event @ Harpers Ferry KOA in Harpers Ferry, West Virginia, USA",https://upload.wikimedia.org/wikipedia/commons/e/ef/Kevin_Thorn_2016.jpg
70,26.11.2015,,"Billy Gunn&Kevin Thorndefeat Brian Klass &Rod StreetNWA Circle City Wrestling- Event @ German Park in Indianapolis, Indiana, USA",https://upload.wikimedia.org/wikipedia/commons/e/ef/Kevin_Thorn_2016.jpg
71,15.11.2015,,"Kevin ThorndefeatsRuss JonesSPW Bowling Alley Brawl 8- Event @ Imman's Bowling & Recreation Center in Valparaiso, Indiana, USA",https://upload.wikimedia.org/wikipedia/commons/e/ef/Kevin_Thorn_2016.jpg
72,04.10.2015,,"Casket:Kevin ThorndefeatsBaron Von KaneNWA Circle City Wrestling Aftershock- Event @ German Park Saturday in Indianapolis, Indiana, USA",https://upload.wikimedia.org/wikipedia/commons/e/ef/Kevin_Thorn_2016.jpg
73,22.10.2011,,"Dave Manzo&Kevin ThorndefeatThe H3RD(Ded Vaughn&Tommy Treznik)CLASH From The Crypt- Event @ Taylor Town Trade Center in Taylor, Michigan, USA",https://upload.wikimedia.org/wikipedia/commons/e/ef/Kevin_Thorn_2016.jpg
74,17.09.2011,,"Ruff CrossingdefeatsKevin ThornIWAP- Event @ Olney, Illinois, USA",https://upload.wikimedia.org/wikipedia/commons/e/ef/Kevin_Thorn_2016.jpg
75,20.07.2011,,"JCW Heavyweight Title#1 Contendership:Corporal RobinsondefeatsKevin ThornJCW Above The Law- Pay Per View @ Clutch Cargos in Pontiac, Michigan, USA",https://upload.wikimedia.org/wikipedia/commons/e/ef/Kevin_Thorn_2016.jpg
76,15.07.2011,,"NWA Midwest Heavyweight TitleLeather Strap:The Sadist(c) defeatsKevin ThornBCW- Event @ Knights Of Columbus Hall in West Allis, Wisconsin, USA",https://upload.wikimedia.org/wikipedia/commons/e/ef/Kevin_Thorn_2016.jpg
77,09.04.2011,,"DREAMWAVE World TitleMatch (vakant):AciddefeatsKevin Thorn(18:06) -TITLE CHANGE !!!DREAMWAVE Anniversary II- Pay Per View @ Knights Of Columbus Hall in LaSalle, Illinois, USA",https://upload.wikimedia.org/wikipedia/commons/e/ef/Kevin_Thorn_2016.jpg
78,05.03.2011,,"Kevin Thorndefeats Scott KeyesDREAMWAVE Road To Anniversary- Event @ Knights of Columbus in LaSalle, Illinois, USA",https://upload.wikimedia.org/wikipedia/commons/e/ef/Kevin_Thorn_2016.jpg
79,25.02.2011,,"Bobby Valentino's ICW Career On The Line:Kevin ThorndefeatsBobby ValentinoICW Total Control, Total Takeover- Event @ Asalir in Milwaukee, Wisconsin, USA",https://upload.wikimedia.org/wikipedia/commons/e/ef/Kevin_Thorn_2016.jpg
80,19.12.2010,,"Los Perros del Mal(Damian 666,Halloween&Perro Aguayo Jr.) defeatBlue Demon Jr.,Kevin Thorn&OctagonPDM- Event @ Poliforum Zamna in Merida, Yucatan, Mexiko",https://upload.wikimedia.org/wikipedia/commons/e/ef/Kevin_Thorn_2016.jpg
81,04.12.2010,,"PT HustladefeatsKevin ThornIPW Hardcore Holiday 2010- Event @ Salvation Army Community Center in Indianapolis, Indiana, USA",https://upload.wikimedia.org/wikipedia/commons/e/ef/Kevin_Thorn_2016.jpg
82,13.11.2010,,"Cannonball GrizzlydefeatsMordecaiDWA Harley Night X- Event @ Dorfgemeinschaftshaus in Wittorf, Niedersachsen, Deutschland",https://upload.wikimedia.org/wikipedia/commons/e/ef/Kevin_Thorn_2016.jpg
83,07.11.2010,,"Christian York,Kevin Thorn&Tyler SteeldefeatBill Collier,Leslie Leatherman&The MaestroPCW November Reign- Event @ Kingwood, West Virginia, USA",https://upload.wikimedia.org/wikipedia/commons/e/ef/Kevin_Thorn_2016.jpg
84,06.11.2010,,"Kevin ThorndefeatsMark BravuraPCW A Night To Remember IV- Event @ Jefferson County Community Center in Charles Town, West Virginia, USA",https://upload.wikimedia.org/wikipedia/commons/e/ef/Kevin_Thorn_2016.jpg
85,16.10.2010,,"VIP Heavyweight Title#1 Contendership:Seven ThorndefeatsJamie EternalVIP Ring Of The Living Dead- Event @ American Legion Post 57 in Owosso, Michigan, USA",https://upload.wikimedia.org/wikipedia/commons/e/ef/Kevin_Thorn_2016.jpg
86,09.10.2010,,"Murat BosporusdefeatsKevin Thorn(12:42)GSW Unstoppable 2010- Event @ Huxleys Neue Welt in Berlin, Deutschland",https://upload.wikimedia.org/wikipedia/commons/e/ef/Kevin_Thorn_2016.jpg
87,21.08.2010,,"Kevin ThorndefeatsBilly RocIPW Reign Of The Insane - 9th Anniversary Show- Event @ Salvation Army Community Center in Indianapolis, Indiana, USA",https://upload.wikimedia.org/wikipedia/commons/e/ef/Kevin_Thorn_2016.jpg
88,14.08.2010,,"PG-13(JC Ice&Wolfie D) defeatGangrel&Kevin Thorn(11:29)JCW Flashlight Wrestling - Legends & Loonies- Event @ Hogrock Campground in Cave-In-Rock, Illinois, USA",https://upload.wikimedia.org/wikipedia/commons/e/ef/Kevin_Thorn_2016.jpg
89,07.07.2010,,"Bobby Fox,Danny Duggan&Zack MercurydefeatThe Brotherhood(Apoc,Gangrel&Thorn)WFX Heroes Vs. Villains- Event @ One World Studios in Winnipeg, Manitoba, Canada",https://upload.wikimedia.org/wikipedia/commons/e/ef/Kevin_Thorn_2016.jpg
90,29.05.2010,,"Last Man Standing:Kris TravisdefeatsKevin Thorn1PW The New Divide- Event @ Liverpool Olympia in Liverpool, Merseyside, England, UK",https://upload.wikimedia.org/wikipedia/commons/e/ef/Kevin_Thorn_2016.jpg
91,28.05.2010,,"Kevin ThorndefeatsKid FiteBCW- Event @ Citadel Leisure Centre in Ayr, South Ayrshire, Scotland, UK",https://upload.wikimedia.org/wikipedia/commons/e/ef/Kevin_Thorn_2016.jpg
92,22.05.2010,,"Jerry LawlerdefeatsKevin ThornAAPW Pro Wrestling Night II- Event @ Rent One Park in Marion, Illinois, USA",https://upload.wikimedia.org/wikipedia/commons/e/ef/Kevin_Thorn_2016.jpg
93,16.05.2010,,"XICW Midwest Heavyweight Title:Jaimy Coxxx(c) defeatsKevin Thornby DQXICW- Event @ The Ritz in Warren, Michigan, USA",https://upload.wikimedia.org/wikipedia/commons/e/ef/Kevin_Thorn_2016.jpg
94,07.05.2010,,"The Brotherhood(Apoc,Gangrel&Thorn) defeatBobby Fox&Midwest Ground And Air(Benjamin Sailer&Nate Bash)WFX Overload - Episode 10- TV-Show @ One World Studios in Winnipeg, Manitoba, Canada",https://upload.wikimedia.org/wikipedia/commons/e/ef/Kevin_Thorn_2016.jpg
95,07.05.2010,,"ThorndefeatsDarin CorbinWFX Overload - Episode 11- TV-Show @ One World Studios in Winnipeg, Manitoba, Canada",https://upload.wikimedia.org/wikipedia/commons/e/ef/Kevin_Thorn_2016.jpg
96,16.04.2010,,"Bob Holly&SabudefeatThe Brotherhood(Gangrel&Thorn)WFX Overload - Episode 9- TV-Show @ One World Studios in Winnipeg, Manitoba, Canada",https://upload.wikimedia.org/wikipedia/commons/e/ef/Kevin_Thorn_2016.jpg
97,10.04.2010,,"Kevin ThorndefeatsJimmy Jannettyby DQPCW Unleashed 2010- Event @ Jefferson County Community Center in Charles Town, West Virginia, USA",https://upload.wikimedia.org/wikipedia/commons/e/ef/Kevin_Thorn_2016.jpg
98,10.04.2010,,"Jimmy Cicero,Kevin Thorn&ZubovdefeatJimmy Jannetty&The Holy Rollers(Earl The Pearl&Ramblin' Rich)PCW Unleashed 2010- Event @ Jefferson County Community Center in Charles Town, West Virginia, USA",https://upload.wikimedia.org/wikipedia/commons/e/ef/Kevin_Thorn_2016.jpg
99,26.03.2010,,"WFX Tag Team TitleTournament First Round:Camikaze&EclipsedefeatThe Brotherhood(Apoc&Thorn) (4:05)WFX Overload - Episode 6- TV-Show @ One World Studios in Winnipeg, Manitoba, Canada",https://upload.wikimedia.org/wikipedia/commons/e/ef/Kevin_Thorn_2016.jpg
100,05.03.2010,,"ThorndefeatsU-Gene(8:22)WFX Overload - Episode 2- TV-Show @ One World Studios in Winnipeg, Manitoba, Canada",https://upload.wikimedia.org/wikipedia/commons/e/ef/Kevin_Thorn_2016.jpg
101,20.02.2010,,"Kevin ThorndefeatsRicky OrtizACW/CCW- Event @ Advantage Villiage Academy in St. Petersburg, Florida, USA",https://upload.wikimedia.org/wikipedia/commons/e/ef/Kevin_Thorn_2016.jpg
102,19.02.2010,,"U-GenedefeatsKevin ThornICW Global Showdown Korea Tour 2010- Event @ Yongsan Garrison's Collier Field House in Seoul, Südkorea",https://upload.wikimedia.org/wikipedia/commons/e/ef/Kevin_Thorn_2016.jpg
103,07.02.2010,,"Bad Bones&Traci BrooksdefeatAriel&Kevin ThornWrestling Legends Tour 2010 - Tag 2- Event @ Bürgersaal in Rotenburg, Niedersachsen, Deutschland",https://upload.wikimedia.org/wikipedia/commons/e/ef/Kevin_Thorn_2016.jpg
104,06.02.2010,,"Al SnowdefeatsKevin ThornWrestling Legends Tour 2010 - Tag 1- Event @ Stadthalle in Uelzen, Niedersachsen, Deutschland",https://upload.wikimedia.org/wikipedia/commons/e/ef/Kevin_Thorn_2016.jpg
105,02.01.2010,,"Seven ThorndefeatsDave DavidsonIPW Animosity 2010- Event @ Salvation Army Community Center in Indianapolis, Indiana, USA",https://upload.wikimedia.org/wikipedia/commons/e/ef/Kevin_Thorn_2016.jpg
106,19.12.2009,,"Match (Special Referee: Jake Roberts):Kevin Thorndefeats SC HellACW Death Monkiez- Event @ Bourbon Street Nightclub in New Port Richey, Florida, USA",https://upload.wikimedia.org/wikipedia/commons/e/ef/Kevin_Thorn_2016.jpg
