date,event,result,location,image_url
1,05.03.2016,,"Frankie The Pizza Guy,Jim Neidhart&Koko B. WaredefeatThe Cash Masters(Clay Drasher&Shawn Andrews) &Nikolai VolkoffBCW Night Of Legends- Event @ Liberty Arena in Williamsport, Pennsylvania, USA",https://upload.wikimedia.org/wikipedia/commons/2/29/Anvil20050721.jpg
2,20.09.2013,,"Harry Smith&Jim Neidhartdefeat911 Inc.(Deimos&Kennedy Kendrick)NWA FUW Silver Screen Showdown- TV-Show @ Tampa, Florida, USA",https://upload.wikimedia.org/wikipedia/commons/2/29/Anvil20050721.jpg
3,31.08.2013,,"Bruce Santee&Jim NeidhartdefeatDeimos&Kennedy KendrickNWA FUW Throwdown 6- Event @ Sports Center Tampa Bay in Tampa, Florida, USA",https://upload.wikimedia.org/wikipedia/commons/2/29/Anvil20050721.jpg
4,30.08.2013,,"Harry Smith&Jim Neidhartdefeat Aaron Matthews &Lumberjack JohnsonUCW Summer Explosion- Event @ Spryfield Lion's Rink in Spryfield, Nova Scotia, Canada",https://upload.wikimedia.org/wikipedia/commons/2/29/Anvil20050721.jpg
5,27.08.2013,,"Harry Smith&Jim NeidhartdefeatChris Cooke&Lumberjack JohnsonUCW Summer Explosion- Event @ Debert Legion in Debert, Nova Scotia, Canada",https://upload.wikimedia.org/wikipedia/commons/2/29/Anvil20050721.jpg
6,18.01.2013,,"Three Way:Jim Neidhart&Kat Von HeezdefeatDanyah&Johnny DevineandNikita Naridian&Ryan RollinsHLW Resurrection- Pay Per View @ Victoria Pavilion in Calgary, Alberta, Canada",https://upload.wikimedia.org/wikipedia/commons/2/29/Anvil20050721.jpg
7,09.03.2012,,"Johnny Thunder&Tito SantanadefeatJim Neidhart&Red Hot RussECPW Night Of Professional Wrestling- Event @ High School in Suffern, New York, USA",https://upload.wikimedia.org/wikipedia/commons/2/29/Anvil20050721.jpg
8,22.10.2011,,"Jim Neidhart&Joe E. LegenddefeatAbsolute Andy&Craig BCDWA Wrestling Fight Night- Event @ Stadthalle in Walsrode, Niedersachsen, Deutschland",https://upload.wikimedia.org/wikipedia/commons/2/29/Anvil20050721.jpg
9,04.06.2011,,"Jim Neidhart& Sgt. Jimmy Storm defeatCorey Havoc&DravenNWS- Event @ Long Hill Township Community Center in Stirling, New Jersey, USA",https://upload.wikimedia.org/wikipedia/commons/2/29/Anvil20050721.jpg
10,05.06.2010,,"Jim Neidhart&Vinny MarsegliadefeatThe Midnight Prowlers(The Midnight Prowler #1 & The Midnight Prowler #2)TRP- Event @ Adams Turners Hall in Adams, Massachusetts, USA",https://upload.wikimedia.org/wikipedia/commons/2/29/Anvil20050721.jpg
11,04.06.2010,,"Jim Neidhart&Matt TavendefeatThe Prestige(Matt Magnum&Ryan Waters)TRP- Event @ Police Athletic League Hall in Fall River, Massachusetts, USA",https://upload.wikimedia.org/wikipedia/commons/2/29/Anvil20050721.jpg
12,26.04.2010,,"CWI Heavyweight Title Match (vakant):Brutus BeefcakedefeatsJim Neidhartby Count Out -TITLE CHANGE !!!CWI Brawl At The Bush - Laying The Smackdown On Cancer- Event @ Iroquois Lacrosse Arena in Six Nations, Ontario, Canada",https://upload.wikimedia.org/wikipedia/commons/2/29/Anvil20050721.jpg
13,17.04.2010,,"Jim NeidhartdefeatsThe Masked SuperstarECPW Five Boros- Event @ New York City, New York, USA",https://upload.wikimedia.org/wikipedia/commons/2/29/Anvil20050721.jpg
14,28.02.2010,,"The Hart Corporation(Bobby Hart&Jim Neidhart) defeatRock Of Love(Billy Blade&Kadin Anthony)Vendetta Pro Retaliation- Event @ Radisson Hotel in Santa Maria, California, USA",https://upload.wikimedia.org/wikipedia/commons/2/29/Anvil20050721.jpg
15,05.12.2009,,"Jim Neidhart&Joey JaneladefeatCorey Havoc&Nicky OceansNWS- Event @ High School Gym in New Milford, Connecticut, USA",https://upload.wikimedia.org/wikipedia/commons/2/29/Anvil20050721.jpg
16,04.12.2009,,"Jim Neidhart&Joey JaneladefeatDanny Demanto&Kevin MatthewsNWS- Event @ Kenilworth Veterans Center in Kenilworth, New Jersey, USA",https://upload.wikimedia.org/wikipedia/commons/2/29/Anvil20050721.jpg
17,14.11.2009,,"Jim Neidhart&The NOW(Hale Collins&Vik Dalishus) defeatBull Dredd,Rob Eckos&Romeo RoselliNEW Autumn Ambush 2009- Event @ Washingtonville High School in Washingtonville, New York, USA",https://upload.wikimedia.org/wikipedia/commons/2/29/Anvil20050721.jpg
18,13.11.2009,,"Jim Neidhart&The NOW(Hale Collins&Vik Dalishus) defeatBob Evans,Rob Eckos&Tommaso CiampaNEW Hart Attack- Event @ Crosby High School in Waterbury, Connecticut, USA",https://upload.wikimedia.org/wikipedia/commons/2/29/Anvil20050721.jpg
19,03.11.2009,,"Jim NeidhartdefeatsJay Lethal(1:30)TNA iMPACT #281- TV-Show @ Universal Studios in Orlando, Florida, USA",https://upload.wikimedia.org/wikipedia/commons/2/29/Anvil20050721.jpg
20,12.09.2009,,"Jason HadesdefeatsJim NeidhartDREAMWAVE Hart Attack- Event @ Knights of Columbus in LaSalle, Illinois, USA",https://upload.wikimedia.org/wikipedia/commons/2/29/Anvil20050721.jpg
21,09.08.2009,,"PWO Tag Team Title:The Clash(Brian Bender&Ernie Ballz) defeatGreg Valentine&Jim Neidhart(c) -TITLE CHANGE !!!PWO Wrestlelution 2: A Coming Of Age- Event @ Nautica Pavilion in Cleveland, Ohio, USA",https://upload.wikimedia.org/wikipedia/commons/2/29/Anvil20050721.jpg
22,06.06.2009,,"PWO Tag Team Title:Greg Valentine&Jim Neidhart(c) defeatPirate Justice(Matthew Justice&Morty Rackem)PWO Slamming Into Summer 2009- Event @ Brunswick, Ohio, USA",https://upload.wikimedia.org/wikipedia/commons/2/29/Anvil20050721.jpg
23,05.06.2009,,"PWO Tag Team TitleMatch (vakant):Greg Valentine&Jim NeidhartdefeatThe Clash(Brian Bender&Ernie Ballz) -TITLE CHANGE !!!PWO Summer Splash 2009- Event @ Loyal Oak Lake Park in Norton, Ohio, USA",https://upload.wikimedia.org/wikipedia/commons/2/29/Anvil20050721.jpg
24,17.01.2009,,"Jim NeidhartdefeatsDerek St. HolmesAWA-Platinum Paying Dues- Event @ El Nopal Ballroom in Michigan City, Indiana, USA",https://upload.wikimedia.org/wikipedia/commons/2/29/Anvil20050721.jpg
25,16.01.2009,,"Frankie DeFalco&Jim Neidhartdefeat Jazon Parxxz &Matt LongtimeBCW Rise To Honor V- Event @ Christina's Banquet Hall in Waukesha, Wisconsin, USA",https://upload.wikimedia.org/wikipedia/commons/2/29/Anvil20050721.jpg
26,01.03.2008,,"Jim Neidhart&The Honky Tonk MandefeatL'Empereur&Shannon BallardBTW Wrestlefest- Event @ Newark, California, USA",https://upload.wikimedia.org/wikipedia/commons/2/29/Anvil20050721.jpg
27,10.12.2007,,"15th Anniversary Battle Royal:Ted DiBiasedefeatsAl SnowandBart GunnandBob BacklundandDoinkandFlash FunkandGangrelandGillbergandIrwin R. SchysterandJim NeidhartandPete GasandRepo ManandScotty 2 HottyandSgt. SlaughterandSkinnerandSteve BlackmanandThe Goon(5:45)WWE Monday Night RAW #759 - 15th Anniversary- TV-Show @ Arena At Harbor Yard in Bridgeport, Connecticut, USA",https://upload.wikimedia.org/wikipedia/commons/2/29/Anvil20050721.jpg
28,03.11.2007,,"Jim NeidhartdefeatsHelter SkelterPWU TV Taping- TV-Show @ Sportsplex in Feasterville, Pennsylvania, USA",https://upload.wikimedia.org/wikipedia/commons/2/29/Anvil20050721.jpg
29,27.10.2007,,"Gus Harlacher&Jim NeidhartdefeatBilly Bax&Rob EckosNEW Autumn Ambush 2007- Event @ Milford, Pennsylvania, USA",https://upload.wikimedia.org/wikipedia/commons/2/29/Anvil20050721.jpg
30,26.05.2007,,"Jim Neidhartvs.The Highlander- Double Count OutPWA Mayhem 2007- Event @ Edmonton, Alberta, Canada",https://upload.wikimedia.org/wikipedia/commons/2/29/Anvil20050721.jpg
31,25.05.2007,,"Jim Neidhartvs.Tito Santana- Double Count OutWrestling Supershow Bad News Allen Tribute Show- Event @ Cochrane, Alberta, Canada",https://upload.wikimedia.org/wikipedia/commons/2/29/Anvil20050721.jpg
32,24.03.2007,,"Jim NeidhartdefeatsSalvatore Sincere(4:10)IWC Night Of Legends 3- Event @ Franklin Area High School in Franklin, Pennsylvania, USA",https://upload.wikimedia.org/wikipedia/commons/2/29/Anvil20050721.jpg
33,10.03.2007,,"Jerry Lawler&Jim NeidhartdefeatSex And Violence(Dave Danger&Jeff Starr)NEW- Event @ Torrington Middle School in Torrington, Connecticut, USA",https://upload.wikimedia.org/wikipedia/commons/2/29/Anvil20050721.jpg
34,17.02.2007,,"Jim NeidhartdefeatsHack MeyersACW King Of Florida 2007- Event @ JJC Of Pasco in Port Richey, Florida, USA",https://upload.wikimedia.org/wikipedia/commons/2/29/Anvil20050721.jpg
35,27.01.2007,,"Jim Neidhart&The RoguedefeatBison Bravado&Danny DemantoNWS- Event @ Garden State Parkway in Brick, New Jersey, USA",https://upload.wikimedia.org/wikipedia/commons/2/29/Anvil20050721.jpg
36,26.01.2007,,"Jim NeidhartdefeatsBison BravadoNWS- Event @ The Elks Lodge in Woodbridge, New Jersey, USA",https://upload.wikimedia.org/wikipedia/commons/2/29/Anvil20050721.jpg
37,20.01.2007,,"KafudefeatsJim Neidhartby DQAPW Rumble In The Dome- Event @ Bakersfield Dome in Bakersfield, California, USA",https://upload.wikimedia.org/wikipedia/commons/2/29/Anvil20050721.jpg
38,19.01.2007,,"Jim Neidhart&L'EmpereurdefeatThe Ballard Brothers(Shane Ballard&Shannon Ballard)BTW- Event @ Newark Pavillion in Newark, California, USA",https://upload.wikimedia.org/wikipedia/commons/2/29/Anvil20050721.jpg
39,18.11.2006,,"Jim NeidhartdefeatsPretty FlyACW Dishonorable 2 - TV Taping- Event @ Bourbon Street Nightclub in New Port Richey, Florida, USA",https://upload.wikimedia.org/wikipedia/commons/2/29/Anvil20050721.jpg
40,28.10.2006,,"Jim NeidhartdefeatsShorty SmallsNWL/HoPWF- Event @ Blackhawk High School in Beaver Falls, Pennsylvania, USA",https://upload.wikimedia.org/wikipedia/commons/2/29/Anvil20050721.jpg
41,07.10.2006,,"911&Jim Neidhartdefeat LA Cash & The TrooperAAPW Benefit Show- Event @ Herrin Middle School in Herrin, Illinois, USA",https://upload.wikimedia.org/wikipedia/commons/2/29/Anvil20050721.jpg
42,23.09.2006,,"Jim NeidhartdefeatsNorman SmileyUXW Florida Debut Show- Event @ Orlando Downtown Recreation Complex in Orlando, Florida, USA",https://upload.wikimedia.org/wikipedia/commons/2/29/Anvil20050721.jpg
43,08.10.2005,,"Mixed:Jim Neidhart&Nattie NeidhartdefeatApocalypse&Belle LovitzPWA- Event @ NAIT Main Campus Gym in Edmonton, Alberta, Canada",https://upload.wikimedia.org/wikipedia/commons/2/29/Anvil20050721.jpg
44,24.09.2005,,"Jim NeidhartdefeatsRob StardomIWM- Event @ Doubles Fun Club in Winnipeg, Manitoba, Canada",https://upload.wikimedia.org/wikipedia/commons/2/29/Anvil20050721.jpg
45,22.09.2005,,"Jim Neidhart&Jon CutlerdefeatShane Madison&TJ BrattIWM- Event @ Portage la Prairie, Manitoba, Canada",https://upload.wikimedia.org/wikipedia/commons/2/29/Anvil20050721.jpg
46,30.04.2005,,"Eric Justice&Jim NeidhartdefeatHasheem Ali&Simon DiamondNWS Chris Candido Memorial J-Cup Tournament- Event @ Toms River, New Jersey, USA",https://upload.wikimedia.org/wikipedia/commons/2/29/Anvil20050721.jpg
47,18.03.2005,,"Balls Mahoney&Jim NeidhartdefeatChris Candido&Danny DoringNWS- Event @ VFW Hall in Manville, New Jersey, USA",https://upload.wikimedia.org/wikipedia/commons/2/29/Anvil20050721.jpg
48,16.12.2004,,"PCW Heavyweight   Title:Adam Knight(c) defeatsJim NeidhartPCW Christmas Classic- Event @ LID Nightclub in Winnipeg, Manitoba, Canada",https://upload.wikimedia.org/wikipedia/commons/2/29/Anvil20050721.jpg
49,14.08.2004,,"Jim NeidhartdefeatsJonny PumaBallpark Brawl III - Canadian Carnage- Event @ Dunn Tire Park in Buffalo, New York, USA",https://upload.wikimedia.org/wikipedia/commons/2/29/Anvil20050721.jpg
50,19.11.2003,,"Jim Duggan&The Honky Tonk MandefeatA-1&Jim NeidhartBCW- Event @ Conestoga College in Kitchener, Ontario, Canada",https://upload.wikimedia.org/wikipedia/commons/2/29/Anvil20050721.jpg
51,05.09.2003,,"Jim Duggan&Jim NeidhartdefeatA1&GQBCW- Event @ Varsity Arena in Toronto, Ontario, Canada",https://upload.wikimedia.org/wikipedia/commons/2/29/Anvil20050721.jpg
52,03.05.2003,,"Jim NeidhartdefeatsVance NevadaECCW- Event @ Courtenay, British Columbia, Canada",https://upload.wikimedia.org/wikipedia/commons/2/29/Anvil20050721.jpg
53,02.05.2003,,"Jim NeidhartdefeatsLadies ChoiceECCW- Event @ Duncan, British Columbia, Canada",https://upload.wikimedia.org/wikipedia/commons/2/29/Anvil20050721.jpg
54,08.03.2003,,"Jim Neidhart, Johnny Vegas &Ken AndersondefeatThe Lynch Mob(Adrian Lynch,Kevin Krueger&Kujo)ACW/NWA Wisconsin March Mayhem 2003- Event @ Neng Yee Performance Arena in Green Bay, Wisconsin, USA",https://upload.wikimedia.org/wikipedia/commons/2/29/Anvil20050721.jpg
55,19.01.2003,,"Dyson PrycedefeatsJim NeidhartMXPW Maximum Impact- Event @ Max Pro Arena in Livonia, Michigan, USA",https://upload.wikimedia.org/wikipedia/commons/2/29/Anvil20050721.jpg
56,18.01.2003,,"Da Munchies(Dick Trimmins&Sheik Abdul Hassan) &Jim NeidhartdefeatJ-Rocc&Southern Anarchy(??? &Chuck Brody) (15:33)NEPW- Event @ Norwalk, Ohio, USA",https://upload.wikimedia.org/wikipedia/commons/2/29/Anvil20050721.jpg
57,17.01.2003,,"Jim DuggandefeatsJim NeidhartBCW- Event @ Algonquin College in Ottawa, Ontario, Canada",https://upload.wikimedia.org/wikipedia/commons/2/29/Anvil20050721.jpg
58,16.01.2003,,"El Fuego&Jim DuggandefeatA1&Jim NeidhartBCW- Event @ Toronto, Ontario, Canada",https://upload.wikimedia.org/wikipedia/commons/2/29/Anvil20050721.jpg
59,01.12.2002,,"Jim NeidhartdefeatsJQ PublikFIW- Event @ Polish Hall in Burlington, Ontario, Canada",https://upload.wikimedia.org/wikipedia/commons/2/29/Anvil20050721.jpg
60,28.11.2002,,"Jim Neidhart&Road Warrior HawkdefeatElvis Elliot&Stevie LeeBCW Doug Chevalier Memorial Show- Event @ Oldcastle, Ontario, Canada",https://upload.wikimedia.org/wikipedia/commons/2/29/Anvil20050721.jpg
61,27.11.2002,,"FIW TitleNine Man Gauntlet Match (vakant):Tyson Duxdefeats Billy Boogie andCustom Made ManandEric YoungandJim NeidhartandJQ PublikandMarco MalaquiasandPrimo ScordinoandRuffy Silverstein-TITLE CHANGE !!!FIW- Event @ Paradise Convention Centre in Concord, Ontario, Canada",https://upload.wikimedia.org/wikipedia/commons/2/29/Anvil20050721.jpg
62,19.10.2002,,"Steve StardomdefeatsJim NeidhartNFW Ladysmith Rumble For Relief- Event @ Ladysmith, Wisconsin, USA",https://upload.wikimedia.org/wikipedia/commons/2/29/Anvil20050721.jpg
63,27.04.2002,,"Jim NeidhartdefeatsLayne FontaineECCW- Event @ Vancouver, British Columbia, Canada",https://upload.wikimedia.org/wikipedia/commons/2/29/Anvil20050721.jpg
64,26.04.2002,,"Ladies ChoicedefeatsJim NeidhartECCW- Event @ Bridgeview Hall in Surrey, British Columbia, Canada",https://upload.wikimedia.org/wikipedia/commons/2/29/Anvil20050721.jpg
65,09.08.2001,,"Jim Neidhart&Vance NevadadefeatAxe&Brian JewelTRCW- Event @ Portage la Prairie, Manitoba, Canada",https://upload.wikimedia.org/wikipedia/commons/2/29/Anvil20050721.jpg
66,08.06.2001,,"XWC World Title:Eric Young(c) defeatsJim Neidhartby DQXWC- Event @ Eastdale School in Welland, Ontario, Canada",https://upload.wikimedia.org/wikipedia/commons/2/29/Anvil20050721.jpg
67,11.04.2001,,"TRCW International Heavyweight Title(vakant):Axe&Brian JeweldefeatJim Neidhart&Vance Nevada-TITLE CHANGE !!!TRCW- Event @ Chalmers Community Club in Winnipeg, Manitoba, Canada",https://upload.wikimedia.org/wikipedia/commons/2/29/Anvil20050721.jpg
68,09.04.2001,,"Jim Neidhart&Vance NevadadefeatBrian Jewel&The AxeTRCW- Event @ William Glesby Centre in Portage La Prairie, Manitoba, Canada",https://upload.wikimedia.org/wikipedia/commons/2/29/Anvil20050721.jpg
69,08.04.2001,,"TRCW International Heavyweight Title:Jim Neidhart(c) vs.Brian Jewel- No ContestTRCW- Event @ Southdale Community Centre in Winnipeg, Manitoba, Canada",https://upload.wikimedia.org/wikipedia/commons/2/29/Anvil20050721.jpg
70,07.04.2001,,"TRCW International Heavyweight Title:Jim NeidhartdefeatsBrian Jewel(c) -TITLE CHANGE !!!TRCW- Event @ Keystone Centre in Brandon, Manitoba, Canada",https://upload.wikimedia.org/wikipedia/commons/2/29/Anvil20050721.jpg
71,31.03.2001,,"Andre Baker&Jim NeidhartdefeatJohnny Moss&SinnNWA-UK Hammerlock The Anvil Neidhart & Sinn Tour - Tag 8- Event @ Oakengates Theatre in Telford, West Midlands, England, UK",https://upload.wikimedia.org/wikipedia/commons/2/29/Anvil20050721.jpg
72,24.03.2001,,"Jim Neidhart&Paul VaultdefeatSeek N' Destroy(Dave McMillan & Tony McMillan)NWA-UK Hammerlock The Anvil Neidhart & Sinn Tour - Tag 2- Event @ Regional Sports Centre in Luton, Bedfordshire, England, UK",https://upload.wikimedia.org/wikipedia/commons/2/29/Anvil20050721.jpg
73,25.10.2000,,"Dr. Luther&Jim NeidhartdefeatJohnny Canuck&Michelle StarrECCW- Event @ Eagles Hall in New Westminster, British Columbia, Canada",https://upload.wikimedia.org/wikipedia/commons/2/29/Anvil20050721.jpg
74,22.10.2000,,"Michelle StarrdefeatsJim Neidhartby DQECCW- Event @ Penticton, British Columbia, Canada",https://upload.wikimedia.org/wikipedia/commons/2/29/Anvil20050721.jpg
75,20.10.2000,,"Jim NeidhartdefeatsJuggernautby DQECCW- Event @ Elks Hall in Kelowna, British Columbia, Canada",https://upload.wikimedia.org/wikipedia/commons/2/29/Anvil20050721.jpg
76,19.10.2000,,"Jim NeidhartdefeatsJuggernautby DQECCW- Event @ Kamloops, British Columbia, Canada",https://upload.wikimedia.org/wikipedia/commons/2/29/Anvil20050721.jpg
77,14.06.2000,,"Jim NeidhartdefeatsCurtis HughesMCW- Event @ Oxford, Mississippi, USA",https://upload.wikimedia.org/wikipedia/commons/2/29/Anvil20050721.jpg
78,29.04.2000,,"Jim NeidhartdefeatsMiles LongMCW- Event @ New Daisy Theater in Memphis, Tennessee, USA",https://upload.wikimedia.org/wikipedia/commons/2/29/Anvil20050721.jpg
79,12.04.2000,,"The Blue MeaniedefeatsJim NeidhartMCW- Event @ Casino in Tunica, Mississippi, USA",https://upload.wikimedia.org/wikipedia/commons/2/29/Anvil20050721.jpg
80,25.03.2000,,"Masked Man #1defeatsJim Neidhartby Count OutMCW TV- TV-Show @ Memphis, Tennessee, USA",https://upload.wikimedia.org/wikipedia/commons/2/29/Anvil20050721.jpg
81,18.03.2000,,"MCW Southern Heavyweight TitleTournament First Round:The Blue MeaniedefeatsJim NeidhartMCW TV- TV-Show @ Memphis, Tennessee, USA",https://upload.wikimedia.org/wikipedia/commons/2/29/Anvil20050721.jpg
82,11.03.2000,,"Jim Neidhart&The Blue Meaniedefeat ??? &K-KrushMCW TV- TV-Show @ Memphis, Tennessee, USA",https://upload.wikimedia.org/wikipedia/commons/2/29/Anvil20050721.jpg
83,12.02.2000,,"Jim Neidhartdefeats Dr. Bud GanjaMCW TV #3- TV-Show @ Memphis, Tennessee, USA",https://upload.wikimedia.org/wikipedia/commons/2/29/Anvil20050721.jpg
84,10.10.1999,,"Jim Neidhart&King Kong BundydefeatJake Roberts&Yokozuna(16:34)Heroes Of Wrestling- Pay Per View @ Casino Magic in Bay St. Louis, Mississippi, USA",https://upload.wikimedia.org/wikipedia/commons/2/29/Anvil20050721.jpg
85,11.09.1999,,"Jake Roberts&YokozunadefeatJim Neidhart&Julio SanchezNWA Northeast Rumble In The Lion's Den- Event @ Masuk High School in Monroe, Connecticut, USA",https://upload.wikimedia.org/wikipedia/commons/2/29/Anvil20050721.jpg
86,09.07.1999,,"Jim Neidhartdefeats Rocky ShoreNWA Northeast Heat Wave '99- Event @ PAL Building in Danbury, Connecticut, USA",https://upload.wikimedia.org/wikipedia/commons/2/29/Anvil20050721.jpg
87,21.05.1999,,"Stampede North American Heavyweight Title:Tatanka(c) defeatsJim Neidhartby DQStampede- Event @ Calgary Stampede Pavillion in Calgary, Alberta, Canada",https://upload.wikimedia.org/wikipedia/commons/2/29/Anvil20050721.jpg
88,20.05.1999,,"Stampede North American Heavyweight Title:Tatanka(c) defeatsJim Neidhartby DQStampede- Event @ Northlands Agricom in Edmonton, Alberta, Canada",https://upload.wikimedia.org/wikipedia/commons/2/29/Anvil20050721.jpg
89,02.05.1999,,"Three Way:Jimmy SnukadefeatsJim NeidhartandTony AtlasAWF Garden City Showdown- Event @ CAW Hall in St-Catherines, Ontario, Canada",https://upload.wikimedia.org/wikipedia/commons/2/29/Anvil20050721.jpg
90,20.03.1999,,"911defeatsJim Neidhart(2:09)ISPW- Event @ Lodi High School Gym in Lodi, New Jersey, USA",https://upload.wikimedia.org/wikipedia/commons/2/29/Anvil20050721.jpg
91,14.02.1999,,"Gauntlet Battle Royal:Jim NeidhartdefeatsAbdul Mustafaand Jim Fury andL'ArtisteandLee Awesomeand Maniac Mike and Ms. Demeanor and Redwing and The Mysterious MayhemAWF A Valentine To Remember- Event @ Cactus Pete's in Toronto, Ontario, Canada",https://upload.wikimedia.org/wikipedia/commons/2/29/Anvil20050721.jpg
92,07.10.1998,,"Rick SteinerdefeatsJim NeidhartWCW House Show- House Show @ Von Braun Center in Huntsville, Alabama, USA",https://upload.wikimedia.org/wikipedia/commons/2/29/Anvil20050721.jpg
93,04.10.1998,,"The BarbariandefeatsJim NeidhartWCW House Show- House Show @ Civic Center in Savannah, Georgia, USA",https://upload.wikimedia.org/wikipedia/commons/2/29/Anvil20050721.jpg
94,03.10.1998,,"The BarbariandefeatsJim NeidhartWCW House Show- House Show @ North Charleston Coliseum in Charleston, South Carolina, USA",https://upload.wikimedia.org/wikipedia/commons/2/29/Anvil20050721.jpg
95,02.10.1998,,"The BarbariandefeatsJim NeidhartWCW House Show- House Show @ Civic Center in Florence, South Carolina, USA",https://upload.wikimedia.org/wikipedia/commons/2/29/Anvil20050721.jpg
96,23.09.1998,,"Diamond Dallas PagedefeatsJim NeidhartWCW House Show- House Show @ Memorial Auditorium in Utica, New York, USA",https://upload.wikimedia.org/wikipedia/commons/2/29/Anvil20050721.jpg
97,22.09.1998,,"The nWo Hollywood(Stevie Ray&Vincent) defeatJim Neidhart&The British BulldogWCW Saturday Night- TV-Show @ Mullins Center in Amherst, Massachusetts, USA",https://upload.wikimedia.org/wikipedia/commons/2/29/Anvil20050721.jpg
98,13.09.1998,,"Jim Neidhart&The British BulldogdefeatAlex Wright&Disco Inferno(11:03)WCW/nWo Fall Brawl 1998 - War Games- Pay Per View @ Lawrence Joel Veterans Memorial Coliseum in Winston-Salem, North Carolina, USA",https://upload.wikimedia.org/wikipedia/commons/2/29/Anvil20050721.jpg
99,10.09.1998,,"Bret Hart&Lex LugerdefeatJim Neidhart&The British Bulldog(4:01)WCW Thunder #31- TV-Show @ Rupp Arena in Lexington, Kentucky, USA",https://upload.wikimedia.org/wikipedia/commons/2/29/Anvil20050721.jpg
100,08.09.1998,,"Jim NeidhartdefeatsStevie Rayby DQWCW Saturday Night- TV-Show @ Civic Center in Mobile, Alabama, USA",https://upload.wikimedia.org/wikipedia/commons/2/29/Anvil20050721.jpg
101,07.09.1998,,"WCW World Television Title:Chris Jericho(c) defeatsJim Neidhart(4:41)WCW Monday NITRO #156- TV-Show @ Civic Center in Pensacola, Florida, USA",https://upload.wikimedia.org/wikipedia/commons/2/29/Anvil20050721.jpg
102,26.08.1998,,"Scott NortondefeatsJim Neidhart(3:16)WCW Thunder #29- TV-Show @ Peoria Civic Center in Peoria, Illinois, USA",https://upload.wikimedia.org/wikipedia/commons/2/29/Anvil20050721.jpg
103,24.08.1998,,"KonnandefeatsJim Neidhart(2:34)WCW Monday NITRO #154- TV-Show @ United Center in Chicago, Illinois, USA",https://upload.wikimedia.org/wikipedia/commons/2/29/Anvil20050721.jpg
104,28.07.1998,,"Jim NeidhartdefeatsRoad BlockWCW Saturday Night- TV-Show @ Civic Center in Beaumont, Texas, USA",https://upload.wikimedia.org/wikipedia/commons/2/29/Anvil20050721.jpg
105,27.07.1998,,"Scott NortondefeatsJim Neidhart(0:15)WCW Monday NITRO #150- TV-Show @  Alamodome in San Antonio, Texas, USA",https://upload.wikimedia.org/wikipedia/commons/2/29/Anvil20050721.jpg
106,07.07.1998,,"Jim NeidhartdefeatsThe RenegadeWCW Saturday Night- TV-Show @ Macon Coliseum in Macon, Georgia, USA",https://upload.wikimedia.org/wikipedia/commons/2/29/Anvil20050721.jpg
107,06.07.1998,,"Diamond Dallas PagedefeatsJim Neidhart(2:22)WCW Monday NITRO #147- TV-Show @ Georgia Dome in Atlanta, Georgia, USA",https://upload.wikimedia.org/wikipedia/commons/2/29/Anvil20050721.jpg
108,01.07.1998,,"Jim Neidhart&The British Bulldogvs.The Public Enemy(Johnny Grunge&Rocco Rock) - No Contest (3:46)WCW Thunder #23- TV-Show @ Civic Center in Columbus, Georgia, USA",https://upload.wikimedia.org/wikipedia/commons/2/29/Anvil20050721.jpg
109,29.06.1998,,"Lex Luger&StingdefeatJim Neidhart&The British Bulldog(8:03)WCW Monday NITRO #146- TV-Show @ Ice Palace in Tampa, Florida, USA",https://upload.wikimedia.org/wikipedia/commons/2/29/Anvil20050721.jpg
110,25.06.1998,,"Jim Neidhart&The British BulldogdefeatThe Public Enemy(Johnny Grunge&Rocco Rock) (3:32)WCW Worldwide- TV-Show @ Universal Studios in Orlando, Florida, USA",https://upload.wikimedia.org/wikipedia/commons/2/29/Anvil20050721.jpg
111,25.06.1998,,"Jim Neidhart&The British BulldogdefeatDisorderly Conduct(Mean Mike&Tough Tom)WCW Worldwide- TV-Show @ Universal Studios in Orlando, Florida, USA",https://upload.wikimedia.org/wikipedia/commons/2/29/Anvil20050721.jpg
112,25.06.1998,,"Jim Neidhart&The British BulldogdefeatScott Armstrong&Steve ArmstrongWCW Worldwide- TV-Show @ Universal Studios in Orlando, Florida, USA",https://upload.wikimedia.org/wikipedia/commons/2/29/Anvil20050721.jpg
113,17.06.1998,,"Jim Neidhart&The British BulldogdefeatnWo Japan(Hiroyoshi Tenzan&Masahiro Chono) by DQ (4:19)WCW Thunder #21- TV-Show @ Corestates Spectrum in Philadelphia, Pennsylvania, USA",https://upload.wikimedia.org/wikipedia/commons/2/29/Anvil20050721.jpg
114,09.06.1998,,"Jim Neidhart&The British BulldogdefeatHugh Morrus&The BarbarianWCW Saturday Night- TV-Show @ Civic Center in Saginaw, Michigan, USA",https://upload.wikimedia.org/wikipedia/commons/2/29/Anvil20050721.jpg
115,28.05.1998,,"Jim Neidhart&The British BulldogdefeatHigh Voltage(Kenny Kaos&Robbie Rage)WCW House Show- House Show @ Knoxville Civic Coliseum in Knoxville, Tennessee, USA",https://upload.wikimedia.org/wikipedia/commons/2/29/Anvil20050721.jpg
116,27.05.1998,,"Jim Neidhart&The British BulldogdefeatHigh Voltage(Kenny Kaos&Robbie Rage) (3:03)WCW Thunder #18- TV-Show @ Municipal Auditorium in Nashville, Tennessee, USA",https://upload.wikimedia.org/wikipedia/commons/2/29/Anvil20050721.jpg
117,21.05.1998,,"WCW World Television Title:Fit Finlay(c) defeatsJim Neidhart(2:35)WCW Thunder #17- TV-Show @ CSU Convocation Center in Cleveland, Ohio, USA",https://upload.wikimedia.org/wikipedia/commons/2/29/Anvil20050721.jpg
118,19.05.1998,,"Jim NeidhartdefeatsKendall WindhamWCW Saturday Night- TV-Show @ Cumberland County Civic Center in Portland, Maine, USA",https://upload.wikimedia.org/wikipedia/commons/2/29/Anvil20050721.jpg
119,17.04.1998,,"Rick SteinerdefeatsJim NeidhartWCW House Show- House Show @ Sioux Falls Arena in Sioux Falls, South Dakota, USA",https://upload.wikimedia.org/wikipedia/commons/2/29/Anvil20050721.jpg
