date,event,result,location,image_url
1680,26.07.1985,,"Randy SavagedefeatsJose Luis RiveraWWF House Show- House Show @ St. Louis Arena in St. Louis, Missouri, USA",https://upload.wikimedia.org/wikipedia/commons/0/00/Lanny_Poffo_Hall_of_Fame_2015.jpg
1681,25.07.1985,,"George Wellsvs.Randy Savage- DrawWWF House Show- House Show @ Rochester Community War Memorial in Rochester, New York, USA",https://upload.wikimedia.org/wikipedia/commons/0/00/Lanny_Poffo_Hall_of_Fame_2015.jpg
1682,24.07.1985,,"Randy SavagedefeatsGeorge WellsWWF House Show- House Show @ Buffalo Memorial Auditorium in Buffalo, New York, USA",https://upload.wikimedia.org/wikipedia/commons/0/00/Lanny_Poffo_Hall_of_Fame_2015.jpg
1683,20.07.1985,,"Randy SavagedefeatsGeorge Wells(10:45)WWF Prime Time Wrestling- TV-Show @ Capital Centre in Landover, Maryland, USA",https://upload.wikimedia.org/wikipedia/commons/0/00/Lanny_Poffo_Hall_of_Fame_2015.jpg
1684,19.07.1985,,"Randy SavagedefeatsTony GareaWWF House Show- House Show @ UIC Pavilion in Chicago, Illinois, USA",https://upload.wikimedia.org/wikipedia/commons/0/00/Lanny_Poffo_Hall_of_Fame_2015.jpg
1685,18.07.1985,,"Randy SavagedefeatsBilly AndersonWWF House Show- House Show @ Arizona Veterans Memorial Coliseum in Phoenix, Arizona, USA",https://upload.wikimedia.org/wikipedia/commons/0/00/Lanny_Poffo_Hall_of_Fame_2015.jpg
1686,17.07.1985,,"Randy SavagedefeatsRick McGrawWWF House Show- House Show @ Convention Center in Long Beach, California, USA",https://upload.wikimedia.org/wikipedia/commons/0/00/Lanny_Poffo_Hall_of_Fame_2015.jpg
1687,16.07.1985,,"Randy SavagedefeatsRick McGrawWWF House Show- House Show @ Selland Arena in Fresno, California, USA",https://upload.wikimedia.org/wikipedia/commons/0/00/Lanny_Poffo_Hall_of_Fame_2015.jpg
1688,15.07.1985,,"Randy SavagedefeatsNelson Veilleux(3:03)WWF All-Star Wrestling- TV-Show @ Civic Centre in Brantford, Ontario, Canada",https://upload.wikimedia.org/wikipedia/commons/0/00/Lanny_Poffo_Hall_of_Fame_2015.jpg
1689,15.07.1985,,"Randy Savagedefeats Serge Jodoin (2:54)WWF All-Star Wrestling- TV-Show @ Civic Centre in Brantford, Ontario, Canada",https://upload.wikimedia.org/wikipedia/commons/0/00/Lanny_Poffo_Hall_of_Fame_2015.jpg
1690,14.07.1985,,"Randy SavagedefeatsRick McGraw(11:28)WWF House Show- House Show @ Maple Leaf Gardens in Toronto, Ontario, Canada",https://upload.wikimedia.org/wikipedia/commons/0/00/Lanny_Poffo_Hall_of_Fame_2015.jpg
1691,13.07.1985,,"Randy SavagedefeatsSD Jones(15:26)WWF House Show- House Show @ Beeghly Center in Youngstown, Ohio, USA",https://upload.wikimedia.org/wikipedia/commons/0/00/Lanny_Poffo_Hall_of_Fame_2015.jpg
1692,12.07.1985,,"Randy SavagedefeatsSD Jones(6:55)WWF House Show- House Show @ Civic Arena in Pittsburgh, Pennsylvania, USA",https://upload.wikimedia.org/wikipedia/commons/0/00/Lanny_Poffo_Hall_of_Fame_2015.jpg
1693,11.07.1985,,"Randy SavagedefeatsSD JonesWWF House Show- House Show @ Civic Center in Canton, Ohio, USA",https://upload.wikimedia.org/wikipedia/commons/0/00/Lanny_Poffo_Hall_of_Fame_2015.jpg
1694,09.07.1985,,"Randy SavagedefeatsMario Mancini(3:06)WWF Championship Wrestling- TV-Show @ Mid-Hudson Civic Center in Poughkeepsie, New York, USA",https://upload.wikimedia.org/wikipedia/commons/0/00/Lanny_Poffo_Hall_of_Fame_2015.jpg
1695,09.07.1985,,"Randy SavagedefeatsPaul Roma(2:04)WWF Championship Wrestling- TV-Show @ Mid-Hudson Civic Center in Poughkeepsie, New York, USA",https://upload.wikimedia.org/wikipedia/commons/0/00/Lanny_Poffo_Hall_of_Fame_2015.jpg
1696,08.07.1985,,"Randy SavagedefeatsSwede Hanson(11:51)WWF House Show- House Show @ Onondaga County War Memorial in Syracuse, New York, USA",https://upload.wikimedia.org/wikipedia/commons/0/00/Lanny_Poffo_Hall_of_Fame_2015.jpg
1697,08.07.1985,,"16 Man Battle Royal:Mike RotundodefeatsBarry OandBarry WindhamandBret HartandDavey Boy SmithandGeorge WellsandJim NeidhartandJohn StuddandLanny PoffoandMoondog SpotandRandy SavageandRene GouletandSwede HansonandThe Dynamite KidandThe Missing LinkandTony AtlasWWF House Show- House Show @ Onondaga County War Memorial in Syracuse, New York, USA",https://upload.wikimedia.org/wikipedia/commons/0/00/Lanny_Poffo_Hall_of_Fame_2015.jpg
1698,05.07.1985,,"Randy SavagedefeatsMr. Wrestling II(10:51)WWF House Show- House Show @ Brendan Byrne Arena in East Rutherford, New Jersey, USA",https://upload.wikimedia.org/wikipedia/commons/0/00/Lanny_Poffo_Hall_of_Fame_2015.jpg
1699,30.06.1985,,"Randy SavagedefeatsTony GareaWWF House Show- House Show @ St. Louis Arena in St. Louis, Missouri, USA",https://upload.wikimedia.org/wikipedia/commons/0/00/Lanny_Poffo_Hall_of_Fame_2015.jpg
1700,29.06.1985,,"Randy SavagedefeatsSwede Hanson(11:10)WWF on PRISM Network- TV-Show @ Philadelphia Spectrum in Philadelphia, Pennsylvania, USA",https://upload.wikimedia.org/wikipedia/commons/0/00/Lanny_Poffo_Hall_of_Fame_2015.jpg
1701,27.06.1985,,"Randy SavagedefeatsJose Luis RiveraWWF House Show- House Show @ Civic Center in Providence, Rhode Island, USA",https://upload.wikimedia.org/wikipedia/commons/0/00/Lanny_Poffo_Hall_of_Fame_2015.jpg
1702,26.06.1985,,"Randy SavagedefeatsSwede HansonWWF House Show- House Show @ JFK Coliseum in Manchester, New Hampshire, USA",https://upload.wikimedia.org/wikipedia/commons/0/00/Lanny_Poffo_Hall_of_Fame_2015.jpg
1703,26.06.1985,,"Randy SavagedefeatsJose Luis RiveraWWF House Show- House Show @ Nassau Veterans Memorial Coliseum in Uniondale, New York, USA",https://upload.wikimedia.org/wikipedia/commons/0/00/Lanny_Poffo_Hall_of_Fame_2015.jpg
1704,25.06.1985,,"Randy SavagedefeatsJose Luis RiveraWWF House Show- House Show @ George Wallace Centre in Fitchburg, Massachusetts, USA",https://upload.wikimedia.org/wikipedia/commons/0/00/Lanny_Poffo_Hall_of_Fame_2015.jpg
1705,22.06.1985,,"Randy SavagedefeatsSD Jones(7:23)WWF on NESN- TV-Show @ Boston Garden in Boston, Massachusetts, USA",https://upload.wikimedia.org/wikipedia/commons/0/00/Lanny_Poffo_Hall_of_Fame_2015.jpg
1706,21.06.1985,,"Randy SavagedefeatsRick McGraw(12:51)WWF on MSG Network- TV-Show @ Madison Square Garden in New York City, New York, USA",https://upload.wikimedia.org/wikipedia/commons/0/00/Lanny_Poffo_Hall_of_Fame_2015.jpg
1707,18.06.1985,,"Randy SavagedefeatsJim Young(2:14)WWF All-Star Wrestling- TV-Show @ Civic Centre in Brantford, Ontario, Canada",https://upload.wikimedia.org/wikipedia/commons/0/00/Lanny_Poffo_Hall_of_Fame_2015.jpg
1708,17.06.1985,,"Randy SavagedefeatsAldo Marino(2:45)WWF Championship Wrestling- TV-Show @ Mid-Hudson Civic Center in Poughkeepsie, New York, USA",https://upload.wikimedia.org/wikipedia/commons/0/00/Lanny_Poffo_Hall_of_Fame_2015.jpg
1709,06.06.1985,,"Loser Leaves Town:Jerry LawlerdefeatsRandy SavageCWA- Event @ Rupp Arena in Lexington, Kentucky, USA",https://upload.wikimedia.org/wikipedia/commons/0/00/Lanny_Poffo_Hall_of_Fame_2015.jpg
1710,04.06.1985,,"Tojo YamamotodefeatsRandy SavageCWA- Event @ Louisville Gardens in Louisville, Kentucky, USA",https://upload.wikimedia.org/wikipedia/commons/0/00/Lanny_Poffo_Hall_of_Fame_2015.jpg
1711,03.06.1985,,"AWA Southern Heavyweight TitleNo Disqualification Loser Leaves Town:Jerry LawlerdefeatsRandy Savage(c) (30:22) -TITLE CHANGE !!!CWA- Event @ Mid-South Coliseum in Memphis, Tennessee, USA",https://upload.wikimedia.org/wikipedia/commons/0/00/Lanny_Poffo_Hall_of_Fame_2015.jpg
1712,28.05.1985,,"Coal Miner's Glove:Jerry OskedefeatsRandy SavageCWA- Event @ Louisville Gardens in Louisville, Kentucky, USA",https://upload.wikimedia.org/wikipedia/commons/0/00/Lanny_Poffo_Hall_of_Fame_2015.jpg
1713,27.05.1985,,"Coal Miner's Glove:Jerry OskedefeatsRandy SavageCWA- Event @ Mid-South Coliseum in Memphis, Tennessee, USA",https://upload.wikimedia.org/wikipedia/commons/0/00/Lanny_Poffo_Hall_of_Fame_2015.jpg
1714,21.05.1985,,"AWA Southern Heavyweight Title:Randy Savage(c) defeatsJerry OskeCWA- Event @ Louisville Gardens in Louisville, Kentucky, USA",https://upload.wikimedia.org/wikipedia/commons/0/00/Lanny_Poffo_Hall_of_Fame_2015.jpg
1715,20.05.1985,,"AWA Southern Heavyweight Title:Randy Savage(c) defeatsJerry OskeCWA- Event @ Mid-South Coliseum in Memphis, Tennessee, USA",https://upload.wikimedia.org/wikipedia/commons/0/00/Lanny_Poffo_Hall_of_Fame_2015.jpg
1716,14.05.1985,,"Randy SavagedefeatsJerry OskeCWA- Event @ Louisville Gardens in Louisville, Kentucky, USA",https://upload.wikimedia.org/wikipedia/commons/0/00/Lanny_Poffo_Hall_of_Fame_2015.jpg
1717,13.05.1985,,"AWA Southern Heavyweight Title:Randy SavagedefeatsJerry Oske(c) -TITLE CHANGE !!!CWA- Event @ Mid-South Coliseum in Memphis, Tennessee, USA",https://upload.wikimedia.org/wikipedia/commons/0/00/Lanny_Poffo_Hall_of_Fame_2015.jpg
1718,09.05.1985,,"Randy SavagedefeatsJerry LawlerCWA- Event @ Rupp Arena in Lexington, Kentucky, USA",https://upload.wikimedia.org/wikipedia/commons/0/00/Lanny_Poffo_Hall_of_Fame_2015.jpg
1719,07.05.1985,,"AWA Southern Heavyweight Title:Jerry OskedefeatsRandy Savage(c) (31:02) -TITLE CHANGE !!!CWA- Event @ Louisville Gardens in Louisville, Kentucky, USA",https://upload.wikimedia.org/wikipedia/commons/0/00/Lanny_Poffo_Hall_of_Fame_2015.jpg
1720,06.05.1985,,"Bruiser Brody&Jerry Lawlervs.David Schultz&Randy Savage- Double CountoutCWA- Event @ Mid-South Coliseum in Memphis, Tennessee, USA",https://upload.wikimedia.org/wikipedia/commons/0/00/Lanny_Poffo_Hall_of_Fame_2015.jpg
1721,30.04.1985,,"AWA Southern Heavyweight TitleBest Two Out Of Three Falls:Jerry LawlerdefeatsRandy Savage(c) by DQCWA- Event @ Louisville Gardens in Louisville, Kentucky, USA",https://upload.wikimedia.org/wikipedia/commons/0/00/Lanny_Poffo_Hall_of_Fame_2015.jpg
1722,29.04.1985,,"Jerry LawlerdefeatsRandy SavageCWA- Event @ Mid-South Coliseum in Memphis, Tennessee, USA",https://upload.wikimedia.org/wikipedia/commons/0/00/Lanny_Poffo_Hall_of_Fame_2015.jpg
1723,23.04.1985,,"Jerry Lawlervs.Randy Savage- No ContestCWA- Event @ Louisville Gardens in Louisville, Kentucky, USA",https://upload.wikimedia.org/wikipedia/commons/0/00/Lanny_Poffo_Hall_of_Fame_2015.jpg
1724,22.04.1985,,"AWA Southern Heavyweight Title:Randy Savage(c) vs.Jerry Lawler- Double DQCWA- Event @ Mid-South Coliseum in Memphis, Tennessee, USA",https://upload.wikimedia.org/wikipedia/commons/0/00/Lanny_Poffo_Hall_of_Fame_2015.jpg
1725,17.04.1985,,"Lumberjack:The Fabulous Ones(Stan Lane&Steve Keirn) defeatLanny Poffo&Randy SavageCWA- Event @ Evansville, Indiana, USA",https://upload.wikimedia.org/wikipedia/commons/0/00/Lanny_Poffo_Hall_of_Fame_2015.jpg
1726,16.04.1985,,"Lumberjack:The Fabulous Ones(Stan Lane&Steve Keirn) defeatLanny Poffo&Randy SavageCWA- Event @ Louisville Gardens in Louisville, Kentucky, USA",https://upload.wikimedia.org/wikipedia/commons/0/00/Lanny_Poffo_Hall_of_Fame_2015.jpg
1727,15.04.1985,,"AWA Southern Heavyweight Title:Randy Savage(c) defeatsNick Bockwinkel(11:21)CWA- Event @ Mid South Coliseum in Memphis, Tennessee, USA",https://upload.wikimedia.org/wikipedia/commons/0/00/Lanny_Poffo_Hall_of_Fame_2015.jpg
1728,13.04.1985,,"AWA Southern Tag Team TitleLumberjack:The Fabulous Ones(Stan Lane&Steve Keirn) (c) defeatLanny Poffo&Randy SavageCWA- Event @ Nashville, Tennessee, USA",https://upload.wikimedia.org/wikipedia/commons/0/00/Lanny_Poffo_Hall_of_Fame_2015.jpg
1729,13.04.1985,,"Randy SavagedefeatsDavid HaskinsCWA Memphis Championship Wrestling TV- TV-Show @ WMC TV Studios in Memphis, Tennessee, USA",https://upload.wikimedia.org/wikipedia/commons/0/00/Lanny_Poffo_Hall_of_Fame_2015.jpg
1730,09.04.1985,,"AWA Southern Tag Team Title:The Fabulous Ones(Stan Lane&Steve Keirn) (c) defeatLanny Poffo&Randy Savageby DQCWA- Event @ Louisville Gardens in Louisville, Kentucky, USA",https://upload.wikimedia.org/wikipedia/commons/0/00/Lanny_Poffo_Hall_of_Fame_2015.jpg
1731,08.04.1985,,"AWA Southern Tag Team TitleLumberjack:The Fabulous Ones(Stan Lane&Steve Keirn) (c) vs.Lanny Poffo&Randy Savage- Double DQ (14:49)CWA- Event @ Mid-South Coliseum in Memphis, Tennessee, USA",https://upload.wikimedia.org/wikipedia/commons/0/00/Lanny_Poffo_Hall_of_Fame_2015.jpg
1732,06.04.1985,,"AWA Southern Tag Team Title:The Fabulous Ones(Stan Lane&Steve Keirn) (c) defeatLanny Poffo&Randy SavageCWA- Event @ Nashville, Tennessee, USA",https://upload.wikimedia.org/wikipedia/commons/0/00/Lanny_Poffo_Hall_of_Fame_2015.jpg
1733,06.04.1985,,"Lanny Poffo&Randy SavagedefeatSpeedy Tall Tree&Tracy SmothersCWA Memphis Championship Wrestling TV- TV-Show @ WMC TV Studios in Memphis, Tennessee, USA",https://upload.wikimedia.org/wikipedia/commons/0/00/Lanny_Poffo_Hall_of_Fame_2015.jpg
1734,04.04.1985,,"Randy SavagedefeatsDutch MantellCWA- Event @ Rupp Arena in Lexington, Kentucky, USA",https://upload.wikimedia.org/wikipedia/commons/0/00/Lanny_Poffo_Hall_of_Fame_2015.jpg
1735,02.04.1985,,"Randy SavagedefeatsDutch MantellCWA- Event @ Louisville Gardens in Louisville, Kentucky, USA",https://upload.wikimedia.org/wikipedia/commons/0/00/Lanny_Poffo_Hall_of_Fame_2015.jpg
1736,01.04.1985,,"AWA Southern Tag Team Title:Lanny Poffo&Randy SavagedefeatThe Fabulous Ones(Stan Lane&Steve Keirn) (c) by Count OutCWA- Event @ Mid-South Coliseum in Memphis, Tennessee, USA",https://upload.wikimedia.org/wikipedia/commons/0/00/Lanny_Poffo_Hall_of_Fame_2015.jpg
1737,26.03.1985,,"Dutch Mantellvs.Randy Savage- No ContestCWA- Event @ Louisville Gardens in Louisville, Kentucky, USA",https://upload.wikimedia.org/wikipedia/commons/0/00/Lanny_Poffo_Hall_of_Fame_2015.jpg
1738,25.03.1985,,"AWA Southern Heavyweight Title:Jerry LawlerdefeatsRandy Savage(c) by DQCWA- Event @ Mid-South Coliseum in Memphis, Tennessee, USA",https://upload.wikimedia.org/wikipedia/commons/0/00/Lanny_Poffo_Hall_of_Fame_2015.jpg
1739,24.03.1985,,"Jerry LawlerdefeatsRandy Savage(31:58)ICW- Event @ Cape Arena Building in Cape Girardeau, Missouri, USA",https://upload.wikimedia.org/wikipedia/commons/0/00/Lanny_Poffo_Hall_of_Fame_2015.jpg
1740,23.03.1985,,"Randy Savagedefeats David JohnsonCWA Memphis Championship Wrestling TV- TV-Show @ WMC TV Studios in Memphis, Tennessee, USA",https://upload.wikimedia.org/wikipedia/commons/0/00/Lanny_Poffo_Hall_of_Fame_2015.jpg
1741,18.03.1985,,"AWA Southern Heavyweight Title:Randy SavagedefeatsJerry Lawler(c) -TITLE CHANGE !!!CWA- Event @ Mid-South Coliseum in Memphis, Tennessee, USA",https://upload.wikimedia.org/wikipedia/commons/0/00/Lanny_Poffo_Hall_of_Fame_2015.jpg
1742,11.03.1985,,"Lumberjack:Randy SavagedefeatsAdrian StreetCWA- Event @ Mid-South Coliseum in Memphis, Tennessee, USA",https://upload.wikimedia.org/wikipedia/commons/0/00/Lanny_Poffo_Hall_of_Fame_2015.jpg
1743,07.03.1985,,"Jerry Lawler&Randy SavagedefeatEddie Gilbert&Mike SharpeCWA- Event @ Rupp Arena in Lexington, Kentucky, USA",https://upload.wikimedia.org/wikipedia/commons/0/00/Lanny_Poffo_Hall_of_Fame_2015.jpg
1744,07.03.1985,,"Randy SavagedefeatsAdrian StreetCWA- Event @ Rupp Arena in Lexington, Kentucky, USA",https://upload.wikimedia.org/wikipedia/commons/0/00/Lanny_Poffo_Hall_of_Fame_2015.jpg
1745,05.03.1985,,"Lanny Poffo&Randy SavagedefeatAdrian Street&Eddie GilbertCWA- Event @ Louisville Gardens in Louisville, Kentucky, USA",https://upload.wikimedia.org/wikipedia/commons/0/00/Lanny_Poffo_Hall_of_Fame_2015.jpg
1746,05.03.1985,,"Tag Team Battle Royal:The Fabulous Ones(Stan Lane&Steve Keirn) defeatAdrian Street&Eddie GilbertandThe Batten Twins(Bart Batten&Brad Batten) andThe Daydreamers(Daydreamer I & Daydreamer II) andThe Interns(Don Bass&Roger Smith) and The Wild Hogs (JR Hogg&King Harley Hogg) andJoe Lightfoot&Tojo YamamotoandLanny Poffo&Randy SavageandMike Sharpe& Strong Machine andJerry Bryant&Plowboy FrazierandMr. Wrestling& The Phantom Of The Opera andThe Rock 'n' Roll Express(Ricky Morton&Robert Gibson)CWA- Event @ Louisville Gardens in Louisville, Kentucky, USA",https://upload.wikimedia.org/wikipedia/commons/0/00/Lanny_Poffo_Hall_of_Fame_2015.jpg
1747,04.03.1985,,"Joe Lightfoot,Lanny Poffo&Randy SavagedefeatAdrian Street,Eddie Gilbert&Mr. Wrestling(15:51)CWA- Event @ Mid-South Coliseum in Memphis, Tennessee, USA",https://upload.wikimedia.org/wikipedia/commons/0/00/Lanny_Poffo_Hall_of_Fame_2015.jpg
1748,02.03.1985,,"WWC North American Heavyweight Title:Hercules AyaladefeatsRandy Savage(c) -TITLE CHANGE !!!Capitol Sports Promotions- Event @ Ponce, Puerto Rico, USA",https://upload.wikimedia.org/wikipedia/commons/0/00/Lanny_Poffo_Hall_of_Fame_2015.jpg
1749,25.02.1985,,"Lanny Poffo&Randy SavagedefeatAdrian Street&Eddie Gilbertby DQCWA- Event @ Mid-South Coliseum in Memphis, Tennessee, USA",https://upload.wikimedia.org/wikipedia/commons/0/00/Lanny_Poffo_Hall_of_Fame_2015.jpg
1750,23.02.1985,,"Lanny Poffo&Randy SavagedefeatJerry Bryant&Lou WinstonCWA Memphis Championship Wrestling TV- TV-Show @ WMC TV Studios in Memphis, Tennessee, USA",https://upload.wikimedia.org/wikipedia/commons/0/00/Lanny_Poffo_Hall_of_Fame_2015.jpg
1751,18.02.1985,,"No Time Limit No Disqualification:Adrian StreetdefeatsRandy Savage(3:23)CWA- Event @ Mid-South Coliseum in Memphis, Tennessee, USA",https://upload.wikimedia.org/wikipedia/commons/0/00/Lanny_Poffo_Hall_of_Fame_2015.jpg
1752,11.02.1985,,"Randy SavagedefeatsAdrian Streetby DQCWA- Event @ Mid-South Coliseum in Memphis, Tennessee, USA",https://upload.wikimedia.org/wikipedia/commons/0/00/Lanny_Poffo_Hall_of_Fame_2015.jpg
1753,05.02.1985,,"Randy SavagedefeatsAdrian StreetCWA- Event @ Louisville Gardens in Louisville, Kentucky, USA",https://upload.wikimedia.org/wikipedia/commons/0/00/Lanny_Poffo_Hall_of_Fame_2015.jpg
1754,05.02.1985,,"Randy Savagedefeats Johnny WilhoitCWA- Event @ Louisville Gardens in Louisville, Kentucky, USA",https://upload.wikimedia.org/wikipedia/commons/0/00/Lanny_Poffo_Hall_of_Fame_2015.jpg
1755,27.01.1985,,"Adrian Streetvs.Randy Savage- No ContestCWA- Event @ Mid-South Coliseum in Memphis, Tennessee, USA",https://upload.wikimedia.org/wikipedia/commons/0/00/Lanny_Poffo_Hall_of_Fame_2015.jpg
1756,22.01.1985,,"Adrian Streetvs.Randy Savage- No ContestCWA- Event @ Louisville Gardens in Louisville, Kentucky, USA",https://upload.wikimedia.org/wikipedia/commons/0/00/Lanny_Poffo_Hall_of_Fame_2015.jpg
1757,13.01.1985,,"AWA Southern Tag Team TitleTournament First Round:Lanny Poffo&Randy SavagedefeatJoe Lightfoot& Larry HaggarCWA- Event @ Mid-South Coliseum in Memphis, Tennessee, USA",https://upload.wikimedia.org/wikipedia/commons/0/00/Lanny_Poffo_Hall_of_Fame_2015.jpg
1758,13.01.1985,,"AWA Southern Tag Team TitleTournament Semi Final:The Interns(Intern I&Intern II) defeatLanny Poffo&Randy SavageCWA- Event @ Mid-South Coliseum in Memphis, Tennessee, USA",https://upload.wikimedia.org/wikipedia/commons/0/00/Lanny_Poffo_Hall_of_Fame_2015.jpg
1759,07.01.1985,,"NWA Mid-America Heavyweight Title:Randy SavagedefeatsMike Sharpe(c) by DQ (2:34)CWA- Event @ Mid-South Coliseum in Memphis, Tennessee, USA",https://upload.wikimedia.org/wikipedia/commons/0/00/Lanny_Poffo_Hall_of_Fame_2015.jpg
1760,25.12.1984,,"Hospital Eliminaton:Jimmy Valiant,Lanny Poffo,Randy Savage&Tojo YamamotodefeatThe Terminators(Rigs & Wolf) &The Interns(Intern I&Intern II)CWA- Event @ Louisville Gardens in Louisville, Kentucky, USA",https://upload.wikimedia.org/wikipedia/commons/0/00/Lanny_Poffo_Hall_of_Fame_2015.jpg
1761,17.12.1984,,"Jerry Lawler,Jimmy Valiant&Randy SavagedefeatThe Interns(Intern I&Intern II) &Plowboy Frazierby DQCWA- Event @ Mid-South Coliseum in Memphis, Tennessee, USA",https://upload.wikimedia.org/wikipedia/commons/0/00/Lanny_Poffo_Hall_of_Fame_2015.jpg
1762,11.12.1984,,"Lanny Poffo&Randy SavagedefeatEddie Gilbert&Mike SharpeCWA- Event @ Louisville Gardens in Louisville, Kentucky, USA",https://upload.wikimedia.org/wikipedia/commons/0/00/Lanny_Poffo_Hall_of_Fame_2015.jpg
1763,11.12.1984,,"The Interns(Intern I&Intern II) defeatRandy Savage&Tim AshleyCWA- Event @ Louisville Gardens in Louisville, Kentucky, USA",https://upload.wikimedia.org/wikipedia/commons/0/00/Lanny_Poffo_Hall_of_Fame_2015.jpg
1764,11.12.1984,,"Tag Team Battle Royal:The Interns(Intern I&Intern II) defeatThe Batten Twins(Bart Batten&Brad Batten) andLanny Poffo&Randy SavageandThe Dirty White Boys(Len Denton&Tony Anthony) andThe Terminators(Rigs & Wolf)CWA- Event @ Louisville Gardens in Louisville, Kentucky, USA",https://upload.wikimedia.org/wikipedia/commons/0/00/Lanny_Poffo_Hall_of_Fame_2015.jpg
1765,10.12.1984,,"AWA International Heavyweight Title:Randy SavagedefeatsEddie Gilbert(c) by DQCWA- Event @ Mid-South Coliseum in Memphis, Tennessee, USA",https://upload.wikimedia.org/wikipedia/commons/0/00/Lanny_Poffo_Hall_of_Fame_2015.jpg
1766,10.12.1984,,"AWA Southern Tag Team Title:The Interns(Intern I&Intern II) (c) defeatRandy Savage&Tim AshleyCWA- Event @ Mid-South Coliseum in Memphis, Tennessee, USA",https://upload.wikimedia.org/wikipedia/commons/0/00/Lanny_Poffo_Hall_of_Fame_2015.jpg
1767,04.12.1984,,"The Long Riders(Bill Irwin&Scott Irwin) defeatLanny Poffo&Randy SavageCWA- Event @ Louisville Gardens in Louisville, Kentucky, USA",https://upload.wikimedia.org/wikipedia/commons/0/00/Lanny_Poffo_Hall_of_Fame_2015.jpg
1768,03.12.1984,,"The Long Riders(Bill Irwin&Scott Irwin) defeatLanny Poffo&Randy SavageCWA- Event @ Mid-South Coliseum in Memphis, Tennessee, USA",https://upload.wikimedia.org/wikipedia/commons/0/00/Lanny_Poffo_Hall_of_Fame_2015.jpg
1769,27.11.1984,,"Loser Leaves Town:Lanny Poffo&Randy SavagedefeatEddie Gilbert&Tommy GilbertCWA- Event @ Mid-South Coliseum in Memphis, Tennessee, USA",https://upload.wikimedia.org/wikipedia/commons/0/00/Lanny_Poffo_Hall_of_Fame_2015.jpg
1770,25.11.1984,,"Randy Savage&Tojo YamamotodefeatThe Nightmares(Danny Davis&Ken Wayne)CWA- Event @ Louisville Gardens in Louisville, Kentucky, USA",https://upload.wikimedia.org/wikipedia/commons/0/00/Lanny_Poffo_Hall_of_Fame_2015.jpg
1771,25.11.1984,,"Randy SavagedefeatsEddie Gilbertby DQCWA- Event @ Louisville Gardens in Louisville, Kentucky, USA",https://upload.wikimedia.org/wikipedia/commons/0/00/Lanny_Poffo_Hall_of_Fame_2015.jpg
1772,20.11.1984,,"Coal Miners Glove:Lanny Poffo&Randy SavagedefeatEddie Gilbert&Tommy GilbertCWA- Event @ Louisville Gardens in Louisville, Kentucky, USA",https://upload.wikimedia.org/wikipedia/commons/0/00/Lanny_Poffo_Hall_of_Fame_2015.jpg
1773,19.11.1984,,"AWA International Heavyweight Title:Eddie Gilbert(c) defeatsRandy SavageCWA- Event @ Mid-South Coliseum in Memphis, Tennessee, USA",https://upload.wikimedia.org/wikipedia/commons/0/00/Lanny_Poffo_Hall_of_Fame_2015.jpg
1774,18.11.1984,,"NWA National Tag Team TitleTournament First Round:The Long Riders(Bill Irwin&Scott Irwin) defeatRandy Savage&Tommy RichCWG- Event @ Omni Coliseum in Atlanta, Georgia, USA",https://upload.wikimedia.org/wikipedia/commons/0/00/Lanny_Poffo_Hall_of_Fame_2015.jpg
1775,12.11.1984,,"Coal Miners Glove:Lanny Poffo&Randy SavagedefeatEddie Gilbert&Tommy GilbertCWA- Event @ Mid-South Coliseum in Memphis, Tennessee, USA",https://upload.wikimedia.org/wikipedia/commons/0/00/Lanny_Poffo_Hall_of_Fame_2015.jpg
1776,11.11.1984,,"Jerry Lawler,Randy Savage&Rick Rudevs.The Dirty White Boys(Len Denton&Tony Anthony) &King Kong Bundy- Double DQCWA- Event @ Louisville Gardens in Louisville, Kentucky, USA",https://upload.wikimedia.org/wikipedia/commons/0/00/Lanny_Poffo_Hall_of_Fame_2015.jpg
1777,11.11.1984,,"Eddie Gilbert&Tommy GilbertdefeatLanny Poffo&Randy SavageCWA- Event @ Louisville Gardens in Louisville, Kentucky, USA",https://upload.wikimedia.org/wikipedia/commons/0/00/Lanny_Poffo_Hall_of_Fame_2015.jpg
1778,06.11.1984,,"Eddie Gilbert&Tommy GilbertdefeatLanny Poffo&Randy SavageCWA- Event @ Louisville Gardens in Louisville, Kentucky, USA",https://upload.wikimedia.org/wikipedia/commons/0/00/Lanny_Poffo_Hall_of_Fame_2015.jpg
1779,05.11.1984,,"Eddie Gilbert&Tommy GilbertdefeatLanny Poffo&Randy SavageCWA- Event @ Mid-South Coliseum in Memphis, Tennessee, USA",https://upload.wikimedia.org/wikipedia/commons/0/00/Lanny_Poffo_Hall_of_Fame_2015.jpg
1780,05.11.1984,,"Randy SavagedefeatsPhil Hickersonby DQCWA- Event @ Mid-South Coliseum in Memphis, Tennessee, USA",https://upload.wikimedia.org/wikipedia/commons/0/00/Lanny_Poffo_Hall_of_Fame_2015.jpg
1781,03.11.1984,,"Lanny Poffo&Randy Savagedefeat Keith Robertson &Kurt von HessCWA Memphis Championship Wrestling TV- TV-Show @ WMC TV Studios in Memphis, Tennessee, USA",https://upload.wikimedia.org/wikipedia/commons/0/00/Lanny_Poffo_Hall_of_Fame_2015.jpg
1782,01.11.1984,,"Jerry Lawler,Jimmy Valiant&Randy SavagedefeatDr. Detroit,King Kong Bundy&Korstia Korchenko(10:35)CWA- Event @ Rupp Arena in Lexington, Kentucky, USA",https://upload.wikimedia.org/wikipedia/commons/0/00/Lanny_Poffo_Hall_of_Fame_2015.jpg
1783,01.11.1984,,"Korstia Korchenkovs.Randy Savage- DrawCWA- Event @ Rupp Arena in Lexington, Kentucky, USA",https://upload.wikimedia.org/wikipedia/commons/0/00/Lanny_Poffo_Hall_of_Fame_2015.jpg
1784,30.10.1984,,"The Dirty White Boys(Len Denton&Tony Anthony) defeatJimmy Valiant&Randy Savage(12:18)CWA- Event @ Louisville Gardens in Louisville, Kentucky, USA",https://upload.wikimedia.org/wikipedia/commons/0/00/Lanny_Poffo_Hall_of_Fame_2015.jpg
1785,29.10.1984,,"Lanny Poffo&Randy SavagedefeatEddie Gilbert&Tommy Gilbertby DQCWA- Event @ Mid-South Coliseum in Memphis, Tennessee, USA",https://upload.wikimedia.org/wikipedia/commons/0/00/Lanny_Poffo_Hall_of_Fame_2015.jpg
1786,22.10.1984,,"Jerry Lawler&Randy SavagedefeatThe Dirty White Boys(Len Denton&Tony Anthony) by DQCWA- Event @ Mid-South Coliseum in Memphis, Tennessee, USA",https://upload.wikimedia.org/wikipedia/commons/0/00/Lanny_Poffo_Hall_of_Fame_2015.jpg
1787,15.10.1984,,"Jerry Lawler,Jimmy Valiant&Randy SavagedefeatThe Dirty White Boys(Len Denton&Tony Anthony) &Phil HickersonCWA- Event @ Mid-South Coliseum in Memphis, Tennessee, USA",https://upload.wikimedia.org/wikipedia/commons/0/00/Lanny_Poffo_Hall_of_Fame_2015.jpg
1788,13.10.1984,,"Randy SavagedefeatsKurt von HessCWA Memphis Championship Wrestling TV- TV-Show @ WMC TV Studios in Memphis, Tennessee",https://upload.wikimedia.org/wikipedia/commons/0/00/Lanny_Poffo_Hall_of_Fame_2015.jpg
