date,event,result,location,image_url
519,29.06.2002,,"Joey MatthewsdefeatsMurder-1(5:27)3PW A War Renewed- Event @ Viking Hall in Philadelphia, Pennsylvania, USA",https://upload.wikimedia.org/wikipedia/commons/7/77/JoeyMatthewsXavier.png
520,28.06.2002,,"Larry McKenny&Stormin' NormandefeatChristian York&Joey MatthewsQWA It's Nothing Personal, It's Just Business- Event @ Deer Park Community Center in Deer Park, New York, USA",https://upload.wikimedia.org/wikipedia/commons/7/77/JoeyMatthewsXavier.png
521,21.06.2002,,"Mike Preston&Tank TolanddefeatChristian York&Joey MatthewsPCW- Event @ Pine Hill, New Jersey, USA",https://upload.wikimedia.org/wikipedia/commons/7/77/JoeyMatthewsXavier.png
522,19.06.2002,,"The Dupps(Bo Dupp&Stan Dupp) defeatChristian York&Joey Matthews(3:41)NWA Total Nonstop Action #1- Pay Per View @ Propst Arena At Von Braun Center in Huntsville, Alabama, USA",https://upload.wikimedia.org/wikipedia/commons/7/77/JoeyMatthewsXavier.png
523,09.06.2002,,"PWF Universal Tag Team TitleBest Two Out Of Three Falls:The SAT(Joel Maximo&Jose Maximo) (c) defeatChristian York&Joey Matthews[2:1] (11:34)PWF Lockdown In Pottstown- Event @ Academy Hall in Pottstown, Pennsylvania, USA",https://upload.wikimedia.org/wikipedia/commons/7/77/JoeyMatthewsXavier.png
524,08.06.2002,,"USA Pro Tag Team Title#1 Contendership Four Way:Larry McKenny&Stormin' NormandefeatChristian York&Joey MatthewsandHot Commodity(Chris Hamrick&Julio Dinero) andThe SAT(Joel Maximo&Jose Maximo)USA Pro Big Dick Dudley Memorial Show- Event @ Franklin Square Firehouse in Franklin Square, New York, USA",https://upload.wikimedia.org/wikipedia/commons/7/77/JoeyMatthewsXavier.png
525,22.05.2002,,"Christian York,Joey Matthews&Ricky MortondefeatGenesis&The Holy Rollers(Earl The Pearl&Rich Myers)MCW Tribute To The Legends- Event @ Rage TV Arena in Glen Burnie, Maryland, USA",https://upload.wikimedia.org/wikipedia/commons/7/77/JoeyMatthewsXavier.png
526,22.05.2002,,"MCW Tag Team Title:The Slackers(Chad Bowman&Dino Divine) defeatChristian York&Joey Matthews(c) -TITLE CHANGE !!!MCW Tribute To The Legends- Event @ Rage TV Arena in Glen Burnie, Maryland, USA",https://upload.wikimedia.org/wikipedia/commons/7/77/JoeyMatthewsXavier.png
527,19.05.2002,,"Christian York&Joey MatthewsdefeatDirty Money&Sonjay DuttVCW- Event @ Mitty's Nightclub in Newport News, Virginia, USA",https://upload.wikimedia.org/wikipedia/commons/7/77/JoeyMatthewsXavier.png
528,19.05.2002,,"Phil Brown&Steve PerezdefeatChristian York&Joey MatthewsVCW- Event @ Mitty's Nightclub in Newport News, Virginia, USA",https://upload.wikimedia.org/wikipedia/commons/7/77/JoeyMatthewsXavier.png
529,18.05.2002,,"Christian York&Joey MatthewsdefeatDylan Knight&Rapid Fire Maldonado(6:54)3PW Three Men & A Bodybag- Event @ Viking Hall in Philadelphia, Pennsylvania, USA",https://upload.wikimedia.org/wikipedia/commons/7/77/JoeyMatthewsXavier.png
530,18.05.2002,,"The Public Enemy(Johnny Grunge&Rocco Rock) defeatChristian York&Joey Matthews(16:20)3PW Three Men & A Bodybag- Event @ Viking Hall in Philadelphia, Pennsylvania, USA",https://upload.wikimedia.org/wikipedia/commons/7/77/JoeyMatthewsXavier.png
531,17.05.2002,,"Evolution(Frankie Kazarian&Nova) &Chris ChettidefeatCham-Pain,Christian York&Joey MatthewsPCW- Event @ Toms River, New Jersey, USA",https://upload.wikimedia.org/wikipedia/commons/7/77/JoeyMatthewsXavier.png
532,05.05.2002,,"Christian York&Joey MatthewsdefeatThe Damned(Draven&Mad Dog)PWF Last Stampede- Event @ Academy Hall in Pottstown, Pennsylvania, USA",https://upload.wikimedia.org/wikipedia/commons/7/77/JoeyMatthewsXavier.png
533,04.05.2002,,"NCW Tag Team       Title Tables, Ladders & Chairs:The Bad Crew(Bad Crew #1&Bad Crew #2) (c) defeatChristian York&Joey MatthewsNCW- Event @ Red Lion, Pennsylvania, USA",https://upload.wikimedia.org/wikipedia/commons/7/77/JoeyMatthewsXavier.png
534,03.05.2002,,"Tag Team Three Way:The Rachies(Adam Flash&Danny Rose) defeatChristian York&Joey MatthewsandNick Berk&Ty StreetHardway Wrestling TV #55- TV-Show @ Castle Hill, Pennsylvania, USA",https://upload.wikimedia.org/wikipedia/commons/7/77/JoeyMatthewsXavier.png
535,01.05.2002,,"Alexis Laree,Christian York&Joey Matthewsdefeat Devin Sturgis,Dirty Money& Korie JamesVCW- Event @ Smithfield, Virginia, USA",https://upload.wikimedia.org/wikipedia/commons/7/77/JoeyMatthewsXavier.png
536,28.04.2002,,"NWA Virginia Tag Team TitleTournament First Round:Christian York&Joey MatthewsdefeatX-Rated(Chris Taylor&Lance Dayton)NWA Virginia- Event @ Mainstreet Bar And Grill in Harrisonburg, Virginia, USA",https://upload.wikimedia.org/wikipedia/commons/7/77/JoeyMatthewsXavier.png
537,27.04.2002,,"Divine Storm(Chris Divine&Quiet Storm) defeatChristian York&Joey Matthews(8:47)ROH Night Of Appreciation- Event @ Murphy Recreation Center in Philadelphia, Pennsylvania, USA",https://upload.wikimedia.org/wikipedia/commons/7/77/JoeyMatthewsXavier.png
538,21.04.2002,,"VCW Tag Team  Title:Sean Lei&Sonjay DuttdefeatChristian York&Joey Matthews(c) -TITLE CHANGE !!!VCW- Event @ Newport News, Virginia, USA",https://upload.wikimedia.org/wikipedia/commons/7/77/JoeyMatthewsXavier.png
539,20.04.2002,,"MCW Tag Team TitleFour Way:Christian York&Joey Matthews(c) defeatThe Backseat Boyz(Johnny Kashmere&Trent Acid) andThe Holy Rollers(Earl The Pearl&Rich Myers) andThe Ghetto Mafia(2-Dope&Sydeswype)MCW TV Taping- Event @ Harrington, Delaware, USA",https://upload.wikimedia.org/wikipedia/commons/7/77/JoeyMatthewsXavier.png
540,13.04.2002,,"FOW Tag Team Title#1 Contendership:The Vandalz(Ricky Vandal&Tommy Vandal) defeatChristian York&Joey MatthewsFOW 4th Anniversary Bash- Event @ Bergeron Rodeo Arena in Davie, Florida, USA",https://upload.wikimedia.org/wikipedia/commons/7/77/JoeyMatthewsXavier.png
541,07.04.2002,,"PWF Universal Tag Team Title#1 Contendership:The SAT(Joel Maximo&Jose Maximo) defeatChristian York&Joey Matthews(11:52)PWF One Year Anniversary- Event @ Pottstown, Pennsylvania, USA",https://upload.wikimedia.org/wikipedia/commons/7/77/JoeyMatthewsXavier.png
542,05.04.2002,,"Christian York&Joey MatthewsdefeatThe Holy Rollers(Earl The Pearl&Rich Myers)PCW- Event @ Toms River, New Jersey, USA",https://upload.wikimedia.org/wikipedia/commons/7/77/JoeyMatthewsXavier.png
543,30.03.2002,,"Christian York&Joey MatthewsdefeatCW Anderson&Elax(7:05)ROH Round Robin Challenge- Event @ Murphy Recreation Center in Philadelphia, Pennsylvania, USA",https://upload.wikimedia.org/wikipedia/commons/7/77/JoeyMatthewsXavier.png
544,27.03.2002,,"MCW Tag Team Title:Christian York&Joey Matthews(c) defeatThe Backseat Boyz(Johnny Kashmere&Trent Acid)MCW- Event @ Glen Burnie, Maryland, USA",https://upload.wikimedia.org/wikipedia/commons/7/77/JoeyMatthewsXavier.png
545,23.03.2002,,"Christian York&Joey MatthewsdefeatMadd Maxx&MalakiWFA- Event @ Manteo, North Carolina, USA",https://upload.wikimedia.org/wikipedia/commons/7/77/JoeyMatthewsXavier.png
546,23.03.2002,,"VCW Tag Team  Title:Christian York&Joey Matthews(c) defeat2 Damn Badd&Preston QuinnVCW- Event @ Newport News, Virginia, USA",https://upload.wikimedia.org/wikipedia/commons/7/77/JoeyMatthewsXavier.png
547,02.03.2002,,"NWA Wildside Junior Heavyweight Title:Jeremy Lopez(c) defeatsJoey MatthewsNWA Wildside TV Taping- Event @ NWA Arena in Cornelia, Georgia, USA",https://upload.wikimedia.org/wikipedia/commons/7/77/JoeyMatthewsXavier.png
548,16.02.2002,,"The Ghetto Mafia(2-Dope&Sydeswype),Christian York&Joey MatthewsdefeatThe Holy Rollers(Earl The Pearl&Rich Myers),Doug Delicious&Marcus JordanMCW TV Taping- Event @ Harrington, Delaware, USA",https://upload.wikimedia.org/wikipedia/commons/7/77/JoeyMatthewsXavier.png
549,16.02.2002,,"MCW Rage Television Title:Marcus Jordan(c) defeatsJoey MatthewsMCW TV Taping- Event @ Harrington, Delaware, USA",https://upload.wikimedia.org/wikipedia/commons/7/77/JoeyMatthewsXavier.png
550,15.02.2002,,"Christian York,Joey Matthews&Ric BladedefeatCM Punk,Colt Cabana&Paul E. Normous(16:22)3PW Inaugural Show- Event @ Viking Hall in Philadelphia, Pennsylvania, USA",https://upload.wikimedia.org/wikipedia/commons/7/77/JoeyMatthewsXavier.png
551,09.02.2002,,"Billy Fives&Bruno SassidefeatChristian York&Joey MatthewsFOW Valentines & Violence- Event @ Bergeron Rodeo Arena in Davie, Florida, USA",https://upload.wikimedia.org/wikipedia/commons/7/77/JoeyMatthewsXavier.png
552,09.02.2002,,"Christian York&Joey MatthewsdefeatDave Johnson&Hack MeyersFOW Valentines & Violence- Event @ Bergeron Rodeo Arena in Davie, Florida, USA",https://upload.wikimedia.org/wikipedia/commons/7/77/JoeyMatthewsXavier.png
553,08.02.2002,,"IPW Tag Team   Title/NWA Florida Tag Team TitleThree Way:Wrongful Death(Dagon Briggs&Naphtali) defeatChristian York&Joey MatthewsandQuickieMart(Agent Steele& Yassar Arafat Jr.) (c) -TITLE CHANGE !!!IPW Hardcore Valentine's Vengeance- Event @ Florida WrestlePlex in St. Petersburg, Florida, USA",https://upload.wikimedia.org/wikipedia/commons/7/77/JoeyMatthewsXavier.png
554,02.02.2002,,"Christian York&Joey MatthewsdefeatThe SAT(Joel Maximo&Jose Maximo) (10:00)WFA Inaugural Brawl- Event @ Richmond Raceway Complex Exhibition Hall in Richmond, Virginia, USA",https://upload.wikimedia.org/wikipedia/commons/7/77/JoeyMatthewsXavier.png
555,12.01.2002,,"Billy Bax&Japanese Pool Boyvs.Christian York&Joey MatthewsECWA- Event @ Wilmington, Delaware, USA",https://upload.wikimedia.org/wikipedia/commons/7/77/JoeyMatthewsXavier.png
556,09.12.2001,,"VCW Tag Team  Title:Christian York&Joey Matthews(c) defeatJulio Dinero&Rich MyersVCW- Event @ Mitty's Nightclub in Newport News, Virginia, USA",https://upload.wikimedia.org/wikipedia/commons/7/77/JoeyMatthewsXavier.png
557,01.12.2001,,"VCW Tag Team  Title:Christian York&Joey MatthewsdefeatMark Anthony&Ray Storm(c) -TITLE CHANGE !!!VCW- Event @ Smithfield, Virginia, USA",https://upload.wikimedia.org/wikipedia/commons/7/77/JoeyMatthewsXavier.png
558,10.11.2001,,"MCW Tag Team Title:Christian York&Joey Matthews(c) defeatThe Holy Rollers(Earl The Pearl&Rich Myers)MCW- Event @ North Carroll High School in Hampstead, Maryland, USA",https://upload.wikimedia.org/wikipedia/commons/7/77/JoeyMatthewsXavier.png
559,09.11.2001,,"MCW Tag Team Title:Christian York&Joey Matthews(c) defeatTQM(Chad Bowman&Dino Divine)MCW- Event @ Donegal High School in Mount Joy, Pennsylvania, USA",https://upload.wikimedia.org/wikipedia/commons/7/77/JoeyMatthewsXavier.png
560,03.11.2001,,"MCW Tag Team Title:Christian York&Joey MatthewsdefeatThe Holy Rollers(Earl The Pearl&Rich Myers) (c) -TITLE CHANGE !!!MCW- Event @ Paw Paw Schools in Paw Paw, West Virginia, USA",https://upload.wikimedia.org/wikipedia/commons/7/77/JoeyMatthewsXavier.png
561,02.11.2001,,"Christian York&Joey MatthewsdefeatDoug Delicious&Marcus JordanMCW- Event @ The Cain Athletic Center in Chestertown, Maryland, USA",https://upload.wikimedia.org/wikipedia/commons/7/77/JoeyMatthewsXavier.png
562,31.10.2001,,"(Special Referee: Gillberg):Christian York&Joey MatthewsdefeatGenesis&Rich MyersMCW- Event @ Glen Burnie, Maryland, USA",https://upload.wikimedia.org/wikipedia/commons/7/77/JoeyMatthewsXavier.png
563,25.10.2001,,"Dewey Cheatum&ScabdefeatChristian York&Joey MatthewsSCW- Event @ SCW Arena in Raleigh, North Carolina, USA",https://upload.wikimedia.org/wikipedia/commons/7/77/JoeyMatthewsXavier.png
564,11.08.2001,,"Chris Chetti&Danny DoringdefeatChristian York&Joey MatthewsMECW Inaugural Show- Event @ Viking Hall in Philadelphia, Pennsylvania, USA",https://upload.wikimedia.org/wikipedia/commons/7/77/JoeyMatthewsXavier.png
565,09.08.2001,,"MCW Tag Team TitleThree Way:The Holy Rollers(Earl The Pearl&Rich Myers) (c) defeatThe Ghetto Mafia(2-Dope&Sydeswype),Christian York&Joey MatthewsMCW Slam In The Sand 3- Event @ Ocean City Convention Center in Ocean City, Maryland, USA",https://upload.wikimedia.org/wikipedia/commons/7/77/JoeyMatthewsXavier.png
566,04.08.2001,,"Jayson Reign&Low KidefeatChristian York&Joey MatthewsMCW- Event @ St. Rita High School in Chicago, Illinois, USA",https://upload.wikimedia.org/wikipedia/commons/7/77/JoeyMatthewsXavier.png
567,28.07.2001,,"MCW Tag Team Title:The Holy Rollers(Earl The Pearl&Rich Myers) (c) defeatChristian York&Joey MatthewsandRomeo Valentino&Ronnie ZukkoMCW- Event @ Bel Air, Maryland, USA",https://upload.wikimedia.org/wikipedia/commons/7/77/JoeyMatthewsXavier.png
568,20.07.2001,,"PCW Tag Team         TitleTriple Threat:Evolution(Frankie Kazarian&Nova) defeatThe Backseat Boyz(Johnny Kashmere&Trent Acid) (c) andChristian York&Joey Matthews-TITLE CHANGE !!!IWC- Event @ Monroeville Sports Center in Monroeville, Pennsylvania, USA",https://upload.wikimedia.org/wikipedia/commons/7/77/JoeyMatthewsXavier.png
569,18.07.2001,,"Shane Shamrock Memorial Cup 2001 Final:Joey MatthewsdefeatsAmazing RedandMike QuackenbushandMikey WhipwreckandQenaan CreedandScoot AndrewsMCW Shane Shamrock Memorial Cup 2001- Event @ Glen Burnie, Maryland, USA",https://upload.wikimedia.org/wikipedia/commons/7/77/JoeyMatthewsXavier.png
570,18.07.2001,,"Shane Shamrock Memorial Cup 2001 Qualifying:Joey MatthewsdefeatsNick BerkMCW Shane Shamrock Memorial Cup 2001- Event @ Glen Burnie, Maryland, USA",https://upload.wikimedia.org/wikipedia/commons/7/77/JoeyMatthewsXavier.png
571,07.07.2001,,"Bitty Little& Dylan Douglas defeatChristian York&Joey MatthewsMCW- Event @ Manila, Arkansas, USA",https://upload.wikimedia.org/wikipedia/commons/7/77/JoeyMatthewsXavier.png
572,07.07.2001,,"Joey MatthewsdefeatsBitty LittleMCW- Event @ Manila, Arkansas, USA",https://upload.wikimedia.org/wikipedia/commons/7/77/JoeyMatthewsXavier.png
573,05.07.2001,,"Christian York&Joey MatthewsdefeatLance Cade&SevenMCW- Event @ Newburn, Tennessee, USA",https://upload.wikimedia.org/wikipedia/commons/7/77/JoeyMatthewsXavier.png
574,23.06.2001,,"Joey MatthewsdefeatsAmerican DragonMCW- Event @ Paragould, Arkansas, USA",https://upload.wikimedia.org/wikipedia/commons/7/77/JoeyMatthewsXavier.png
575,22.06.2001,,"Christian York&Joey MatthewsdefeatJoey Abs&Russ HaasMCW- Event @ Newburn, Tennessee, USA",https://upload.wikimedia.org/wikipedia/commons/7/77/JoeyMatthewsXavier.png
576,16.06.2001,,"The APA(Bradshaw&Faarooq) defeatChristian York&Joey MatthewsMCW- Event @ Jackson, Tennessee, USA",https://upload.wikimedia.org/wikipedia/commons/7/77/JoeyMatthewsXavier.png
577,15.06.2001,,"Christian York&Joey MatthewsdefeatAmerican Dragon&Jerry LynnMCW- Event @ Corinth, Mississippi, USA",https://upload.wikimedia.org/wikipedia/commons/7/77/JoeyMatthewsXavier.png
578,14.06.2001,,"Christian York&Joey MatthewsdefeatThe Haas Brothers(Charlie Haas&Russ Haas)MCW- Event @ Jonesboro, Arkansas, USA",https://upload.wikimedia.org/wikipedia/commons/7/77/JoeyMatthewsXavier.png
579,13.06.2001,,"Christian York&Joey MatthewsdefeatThe Island Boys(Kimo&OG Ekmo)MCW Slammin Summer Showdown- Event @ Popular Bluff, Arkansas, USA",https://upload.wikimedia.org/wikipedia/commons/7/77/JoeyMatthewsXavier.png
580,27.04.2001,,"Christian York&Joey MatthewsdefeatThe Haas Brothers(Charlie Haas&Russ Haas)MCW- Event @ Paragould, Arkansas, USA",https://upload.wikimedia.org/wikipedia/commons/7/77/JoeyMatthewsXavier.png
581,16.03.2001,,"Chad Bowman& Chip Bowman defeatChristian York&Joey MatthewsMCW- Event @ Fort Meade Army Base in Odenton, Maryland, USA",https://upload.wikimedia.org/wikipedia/commons/7/77/JoeyMatthewsXavier.png
582,10.03.2001,,"MCW Heavyweight Title#1 Contendership Battle Royal:Corporal PunishmentdefeatsAdam FlashandBilly Redwoodand Chip Bowman andChristian YorkandDino DivineandEarl The PearlandJoey MatthewsandJulio DineroandKing Kong BundyandQenaan CreedandRich MyersandRomeo ValentinoandRonnie ZukkoandThe BruiserMCW- Event @ Paw Paw Schools in Paw Paw, West Virginia, USA",https://upload.wikimedia.org/wikipedia/commons/7/77/JoeyMatthewsXavier.png
583,10.03.2001,,"Tag Team Street Fight:Christian York&Joey MatthewsdefeatCorporal Punishment&Jimmy Cicero(21:15)MCW- Event @ Paw Paw Schools in Paw Paw, West Virginia, USA",https://upload.wikimedia.org/wikipedia/commons/7/77/JoeyMatthewsXavier.png
584,21.02.2001,,"Adam Flash,Christian York&Joey MatthewsdefeatChad Bowman, Chip Bowman &Corporal Punishment(13:06)MCW- Event @ Michael's Eighth Ave in Glen Burnie, Maryland, USA",https://upload.wikimedia.org/wikipedia/commons/7/77/JoeyMatthewsXavier.png
585,17.02.2001,,"NWA World Tag Team    Title:Bad Attitude(David Young&Rick Michaels) defeatChristian York&Joey Matthews(c) -TITLE CHANGE !!!NWA Wildside TV Taping- Event @ NCW Arena in Cornelia, Georgia, USA",https://upload.wikimedia.org/wikipedia/commons/7/77/JoeyMatthewsXavier.png
586,13.01.2001,,"Christian York&Joey MatthewsdefeatEZ Money&Julio DineroECW- Event @ Pine Bluff Convention Center in Pine Bluff, Arkansas, USA",https://upload.wikimedia.org/wikipedia/commons/7/77/JoeyMatthewsXavier.png
587,12.01.2001,,"Christian York&Joey MatthewsdefeatThe FBI(Little Guido&Tony Mamaluke) (7:30)ECW- Event @ Black River Coliseum in Poplar Bluff, Missouri, USA",https://upload.wikimedia.org/wikipedia/commons/7/77/JoeyMatthewsXavier.png
588,07.01.2001,,"Cyrus&Jerry LynndefeatChristian York&Joey Matthews(2:41)ECW Guilty As Charged 2001- Pay Per View @ Hammerstein Ballroom in New York City, New York, USA",https://upload.wikimedia.org/wikipedia/commons/7/77/JoeyMatthewsXavier.png
589,23.12.2000,,"Hot Commodity(Chris Hamrick,EZ Money&Julio Dinero) defeatYoung Blood(Christian York,Joey Matthews&Tommy Dreamer)ECW Holiday Hell 2000- Event @ ECW Arena in Philadelphia, Pennsylvania, USA",https://upload.wikimedia.org/wikipedia/commons/7/77/JoeyMatthewsXavier.png
590,06.12.2000,,"MCW Rage Television TitleTournament Quarter Final:Earl The PearldefeatsJoey Matthews(8:18)MCW- Event @ Michael's Eight Avenue in Glen Burnie, Maryland, USA",https://upload.wikimedia.org/wikipedia/commons/7/77/JoeyMatthewsXavier.png
591,03.12.2000,,"Christian York&Joey MatthewsdefeatSimon Diamond&Swinger(5:39)ECW Massacre On 34th Street- Pay Per View @ Hammerstein Ballroom in New York City, New York, USA",https://upload.wikimedia.org/wikipedia/commons/7/77/JoeyMatthewsXavier.png
592,01.12.2000,,"Christian York&Joey Matthewsvs.Shane Helms&Shannon Moore- No Contest (12:24)OMEGA Reunion Show- Event @ National Guard Armory in Southern Pines, North Carolina, USA",https://upload.wikimedia.org/wikipedia/commons/7/77/JoeyMatthewsXavier.png
593,17.11.2000,,"The Holy Rollers(Earl The Pearl&Rich MyersdefeatChristian York&Joey Matthews(11:17)MCW- Event @ Fort Meade Army Base in Odenton, Maryland, USA",https://upload.wikimedia.org/wikipedia/commons/7/77/JoeyMatthewsXavier.png
594,11.11.2000,,"Falls Count Anywhere:Young Blood(Christian York,Joey Matthews&Tommy Dreamer) defeatCW Anderson,Simon Diamond&Swinger(10:33)ECW Hardcore TV #397- TV-Show @ Mid-Hudson Civic Center in Poughkeepsie, New York, USA",https://upload.wikimedia.org/wikipedia/commons/7/77/JoeyMatthewsXavier.png
595,10.11.2000,,"Da Baldies(Angel&DeVito) defeatChristian York&Joey MatthewsECW- House Show @ Sportsplex in Schenectady, New York, USA",https://upload.wikimedia.org/wikipedia/commons/7/77/JoeyMatthewsXavier.png
596,05.11.2000,,"Simon Diamond&SwingerdefeatChristian York&Joey Matthews(5:21)ECW November To Remember 2000- Pay Per View @ Odeum Expo Center in Villa Park, Illinois, USA",https://upload.wikimedia.org/wikipedia/commons/7/77/JoeyMatthewsXavier.png
597,21.10.2000,,"Christian York&Joey MatthewsdefeatBio-Hazard&Chris KruegerECW- House Show @ EMU Convocation Center  in Ypsilanti, Michigan, USA",https://upload.wikimedia.org/wikipedia/commons/7/77/JoeyMatthewsXavier.png
598,20.10.2000,,"The Unholy Alliance(Mikey Whipwreck&Yoshihiro Tajiri) defeatChristian York&Joey Matthews(6:29)ECW Hardcore TV #393- TV-Show @ Kellogg Arena in Battle Creek, Michigan, USA",https://upload.wikimedia.org/wikipedia/commons/7/77/JoeyMatthewsXavier.png
599,13.10.2000,,"ECW Tag Team Title:The FBI(Guido Maritato&Tony Mamaluke) (c) defeatChristian York&Joey MatthewsECW- House Show @ Siegel Center in Richmond, Virginia, USA",https://upload.wikimedia.org/wikipedia/commons/7/77/JoeyMatthewsXavier.png
600,12.10.2000,,"ECW World Tag Team Title:The FBI(Guido Maritato&Tony Mamaluke) (c) defeatChristian York&Joey MatthewsECW- House Show @ Civic Center in Salem, Virginia, USA",https://upload.wikimedia.org/wikipedia/commons/7/77/JoeyMatthewsXavier.png
601,07.10.2000,,"Christian York&Joey MatthewsdefeatChris Chetti&Simon Diamond(4:12)ECW Hardcore TV #390- TV-Show @ The Rave in Milwaukee, Wisconsin, USA",https://upload.wikimedia.org/wikipedia/commons/7/77/JoeyMatthewsXavier.png
602,06.10.2000,,"ECW World Tag Team Title:The FBI(Guido Maritato&Tony Mamaluke) (c) defeatChristian York&Joey MatthewsECW- House Show @ Brown County Veterans Memorial Arena in Green Bay, Wisconsin, USA",https://upload.wikimedia.org/wikipedia/commons/7/77/JoeyMatthewsXavier.png
603,01.10.2000,,"Danny Doring&RoadkilldefeatChristian York&Joey Matthews(7:10)ECW Anarchy Rulz 2000- Pay Per View @ Roy Wilkins Auditorium in St. Paul, Minnesota, USA",https://upload.wikimedia.org/wikipedia/commons/7/77/JoeyMatthewsXavier.png
604,27.09.2000,,"MCW Tag Team Title:Christopher Carmichael&Dino Divine(c) defeatChristian York&Joey Matthews(11:20)MCW- Event @ Michael's Eight Avenue in Glen Burnie, Maryland, USA",https://upload.wikimedia.org/wikipedia/commons/7/77/JoeyMatthewsXavier.png
605,23.09.2000,,"Christian York&Joey MatthewsdefeatChris Chetti&Simon DiamondECW- House Show @ O'Neill Center in Danbury, Conneticut, USA",https://upload.wikimedia.org/wikipedia/commons/7/77/JoeyMatthewsXavier.png
606,22.09.2000,,"Johnny Swinger&Simon DiamonddefeatChristian York&Joey Matthews(5:25)ECW Hardcore TV #389- TV-Show @ Ice Palace in Salem, New Hampshire, USA",https://upload.wikimedia.org/wikipedia/commons/7/77/JoeyMatthewsXavier.png
607,09.09.2000,,"Johnny Swinger&Simon DiamonddefeatChristian York&Joey MatthewsECW- House Show @ Hershey Center in Mississauga, Ontario, Canada",https://upload.wikimedia.org/wikipedia/commons/7/77/JoeyMatthewsXavier.png
608,08.09.2000,,"Danny Doring&RoadkilldefeatChristian York&Joey Matthews(6:29)ECW Hardcore TV #386- TV-Show @ Flickinger Center in Buffalo, New York, USA",https://upload.wikimedia.org/wikipedia/commons/7/77/JoeyMatthewsXavier.png
609,07.09.2000,,"Christian York&Joey MatthewsdefeatBelvis Wesley&ProdigyECW- House Show @ Agora Theater in Cleveland, Ohio, USA",https://upload.wikimedia.org/wikipedia/commons/7/77/JoeyMatthewsXavier.png
610,26.08.2000,,"Christian York,Joey Matthews&Tommy DreamerdefeatHot Commodity(Chris Hamrick,EZ Money&Julio Dinero) (10:02)ECW- House Show @ Hammerstein Ballroom in New York City, New York, USA",https://upload.wikimedia.org/wikipedia/commons/7/77/JoeyMatthewsXavier.png
611,25.08.2000,,"ECW World Tag Team TitleTournament First Round:Hot Commodity(EZ Money&Julio Dinero) defeatChristian York&Joey Matthews(3:57)ECW Hardcore TV #384- TV-Show @ Hammerstein Ballroom in New York City, New York, USA",https://upload.wikimedia.org/wikipedia/commons/7/77/JoeyMatthewsXavier.png
612,20.08.2000,,"The FBI(Guido Maritato&Tony Mamaluke) defeatChristian York&Joey MatthewsECW- House Show @ ECW Arena in Philadelphia, Pennsylvania, USA",https://upload.wikimedia.org/wikipedia/commons/7/77/JoeyMatthewsXavier.png
613,18.08.2000,,"The FBI(Guido Maritato&Tony Mamaluke) defeatChristian York&Joey MatthewsECW- House Show @ GTE Ampitheater in Virginia Beach, Virginia, USA",https://upload.wikimedia.org/wikipedia/commons/7/77/JoeyMatthewsXavier.png
614,12.08.2000,,"Christian York,Joey Matthews&Tommy DreamerdefeatChris Hamrick,EZ Money&Julio DineroECW- House Show @ The Coliseum in St. Petersburg, Florida, USA",https://upload.wikimedia.org/wikipedia/commons/7/77/JoeyMatthewsXavier.png
615,11.08.2000,,"Three Way Dance:EZ Money&Julio DinerodefeatChristian York&Joey MatthewsandChris Chetti&Nova(6:01)ECW Hardcore TV #382- TV-Show @ War Memorial Auditorium in Fort Lauderdale, Florida, USA",https://upload.wikimedia.org/wikipedia/commons/7/77/JoeyMatthewsXavier.png
616,05.08.2000,,"Danny Doring&RoadkilldefeatChristian York&Joey MatthewsECW- House Show @ Newport Music Hall in Columbus, Ohio, USA",https://upload.wikimedia.org/wikipedia/commons/7/77/JoeyMatthewsXavier.png
617,02.08.2000,,"MCW Tag Team Title:Christopher Carmichael&Dino DivinedefeatChristian York&Joey Matthews(c) and The Executioners (Executioner 26 & Executioner 70) andThe Ghetto Mafia(2-Dope&Sydeswype) (11:07) -TITLE CHANGE !!!MCW- Event @ Ocean City Convention Center in Ocean City, Maryland, USA",https://upload.wikimedia.org/wikipedia/commons/7/77/JoeyMatthewsXavier.png
618,29.07.2000,,"Johnny Swinger&Simon DiamonddefeatChristian York&Joey Matthews(4:39)ECW Hardcore TV #380- TV-Show @ Astroarena in Houston, Texas, USA",https://upload.wikimedia.org/wikipedia/commons/7/77/JoeyMatthewsXavier.png
619,28.07.2000,,"Da Baldies(Spanish Angel&Tony DeVito) defeatChristian York&Joey MatthewsECW- House Show @ Bronco Bowl in Dallas, Texas, USA",https://upload.wikimedia.org/wikipedia/commons/7/77/JoeyMatthewsXavier.png
620,22.07.2000,,"Johnny Swinger&Simon DiamonddefeatChristian York&Joey MatthewsECW- House Show @ Civic Center in Peoria, Illinois, USA",https://upload.wikimedia.org/wikipedia/commons/7/77/JoeyMatthewsXavier.png
621,21.07.2000,,"The FBI(Guido Maritato&Tony Mamaluke) defeatChristian York&Joey MatthewsECW- House Show @ Civic Center in Decatur, Illinois, USA",https://upload.wikimedia.org/wikipedia/commons/7/77/JoeyMatthewsXavier.png
622,19.07.2000,,"Second Annual Shane Shamrock Memorial Cup 200 Six Way Elimination:Qenaan CreeddefeatsAdam FlashandChris ChettiandChristian YorkandJoey MatthewsandMikey Whipwreck(26:55)MCW- Event @ Michael's Eight Avenue in Glen Burnie, Maryland, USA",https://upload.wikimedia.org/wikipedia/commons/7/77/JoeyMatthewsXavier.png
