date,event,result,location,image_url
1,15.07.2018,,"SwoggledefeatsJoey MercuryHOH 49- Event @ Aussie World in Sunshine Coast, Queensland, Australia",https://upload.wikimedia.org/wikipedia/commons/7/77/JoeyMatthewsXavier.png
2,14.07.2018,,"Joey MercurydefeatsCaveman UggHOH 48- Event @ Hurtsville Entertainment Centre in Hurtsville, New South Wales, Australia",https://upload.wikimedia.org/wikipedia/commons/7/77/JoeyMatthewsXavier.png
3,13.07.2018,,"First Blood:Tommy DreamerdefeatsJoey MercuryHOH 47- Event @ Melbourne Pavilion in Melbourne, Victoria, Australia",https://upload.wikimedia.org/wikipedia/commons/7/77/JoeyMatthewsXavier.png
4,11.07.2018,,"Hardcore:Al SnowdefeatsJoey MercuryHOH 46- Event @ Gate One Theatre in Claremont, Western Australia, Australia",https://upload.wikimedia.org/wikipedia/commons/7/77/JoeyMatthewsXavier.png
5,03.06.2018,,"The Northern Tournament First Round:Tyson DuxdefeatsJoey MercurySmash The Northern 2018 - Show 1- Event @ Phoenix Concert Theatre in Toronto, Ontario, Canada",https://upload.wikimedia.org/wikipedia/commons/7/77/JoeyMatthewsXavier.png
6,20.05.2018,,"XICW Midwest Heavyweight Title:Jimmy Jacobs(c) defeatsJoey MercuryXICW- Event @ Fraser Lions Club in Fraser, Michigan, USA",https://upload.wikimedia.org/wikipedia/commons/7/77/JoeyMatthewsXavier.png
7,19.05.2018,,"Bull JamesdefeatsJoey MercuryHOH 43- Event @ 2300 Arena in Philadelphia, Pennsylvania, USA",https://upload.wikimedia.org/wikipedia/commons/7/77/JoeyMatthewsXavier.png
8,18.05.2018,,"Joey MercurydefeatsAce RomeroHOH 42- Event @ Starland Sportsplex & Fun Park in Hanover, Massachusetts, USA",https://upload.wikimedia.org/wikipedia/commons/7/77/JoeyMatthewsXavier.png
9,12.05.2018,,"Colin DelaneydefeatsJoey MercuryUPW Anniversary Anarchy 15- Event @ Premier Sports Center in Webster, New York, USA",https://upload.wikimedia.org/wikipedia/commons/7/77/JoeyMatthewsXavier.png
10,11.05.2018,,"Brady PhillipsdefeatsJoey MercurySWE Cruel Intentions 2018- Event @ Gordon Craig Theatre in Stevenage, Hertfordshire, England, UK",https://upload.wikimedia.org/wikipedia/commons/7/77/JoeyMatthewsXavier.png
11,06.05.2018,,"Sean KustomdefeatsJoey MercurySWE Notorious 8- Event @ Priory Centre in St. Neots, Cambridgeshire, England, UK",https://upload.wikimedia.org/wikipedia/commons/7/77/JoeyMatthewsXavier.png
12,05.05.2018,,"Dirty DragandefeatsJoey Mercury(12:47)wXw Superstars Of Wrestling 2018- Event @ Turbinenhalle 1 in Oberhausen, Nordrhein-Westfalen, Deutschland",https://upload.wikimedia.org/wikipedia/commons/7/77/JoeyMatthewsXavier.png
13,20.04.2018,,"Joey MercurydefeatsBlake MaxwellNEW New Republic Rumble- Event @ CLB Armoury in St. John's, Newfoundland, Canada",https://upload.wikimedia.org/wikipedia/commons/7/77/JoeyMatthewsXavier.png
14,14.04.2018,,"MCW Heavyweight TitleSteel Cage:The BruiserdefeatsJoey Mercury(c) -TITLE CHANGE !!!MCW Spring Fever 2018 - Tag 1- Event @ Hollywood Volunteer Fire Department in Hollywood, Maryland, USA",https://upload.wikimedia.org/wikipedia/commons/7/77/JoeyMatthewsXavier.png
15,24.03.2018,,"MCW Heavyweight TitleSteel Cage:Joey MercurydefeatsThe Bruiser(c) -TITLE CHANGE !!!MCW Breakthrough: Proving Grounds- Event @ MCW Arena in Joppa, Maryland, USA",https://upload.wikimedia.org/wikipedia/commons/7/77/JoeyMatthewsXavier.png
16,23.03.2018,,"Street Fight:Tommy DreamerdefeatsJoey MercuryHOH 38- Event @ Sports Arena in New York City, New York, USA",https://upload.wikimedia.org/wikipedia/commons/7/77/JoeyMatthewsXavier.png
17,18.03.2018,,"NEW Heavyweight Title:Flip Gordon(c) defeatsJoey MercuryNEW March Mayhem 2018- Event @ NEW Arena in Bethany, Connecticut, USA",https://upload.wikimedia.org/wikipedia/commons/7/77/JoeyMatthewsXavier.png
18,17.03.2018,,"Jordan Len-XdefeatsJoey MercuryMPX Destiny- Event @ MPX Event Center in Bedford, Texas, USA",https://upload.wikimedia.org/wikipedia/commons/7/77/JoeyMatthewsXavier.png
19,02.03.2018,,"Flip Gordon&Rey Mysterio Jr.defeatCaleb Konley&Joey MercuryNEW Wrestlefest XXII- Event @ Wilby High School in Waterbury, Connecticut, USA",https://upload.wikimedia.org/wikipedia/commons/7/77/JoeyMatthewsXavier.png
20,02.03.2018,,"The Monster Matanza CuetodefeatsJoey Wrestling(2:55)Lucha Underground #4.13 - The Circle Of Life- TV-Show @ New Lucha Underground Temple in Los Angeles, California, USA",https://upload.wikimedia.org/wikipedia/commons/7/77/JoeyMatthewsXavier.png
21,24.02.2018,,"MCW Heavyweight Title:The BruiserdefeatsJoey Mercury(c) -TITLE CHANGE !!!MCW Winter Blast 2018- Event @ Hollywood Volunteer Fire Department in Hollywood, Maryland, USA",https://upload.wikimedia.org/wikipedia/commons/7/77/JoeyMatthewsXavier.png
22,17.02.2018,,"MCW Heavyweight Title:Joey MercurydefeatsThe Bruiser(c) -TITLE CHANGE !!!MCW Horsemen Anniversary- Event @ MCW Arena in Joppa, Maryland, USA",https://upload.wikimedia.org/wikipedia/commons/7/77/JoeyMatthewsXavier.png
23,10.02.2018,,"Kyle MatthewsdefeatsJoey Mercury(13:35)Scenic City Rumble 2018- Event @ Ooltewah High School in Ooltewah, Tennessee, USA",https://upload.wikimedia.org/wikipedia/commons/7/77/JoeyMatthewsXavier.png
24,26.01.2018,,"Billy Gunn&Tommy DreamerdefeatJoey Mercury&Nick AldisHOH 37- Online Stream @ 2300 Arena in Philadelphia, Pennsylvania, USA",https://upload.wikimedia.org/wikipedia/commons/7/77/JoeyMatthewsXavier.png
25,14.01.2018,,"PWX Heavyweight  Title:Anthony Henry(c) defeatsJoey MercuryPWX X16 Tournament 2018 - Tag 2- Event @ Cabarrus Arena & Events Center in Concord, North Carolina, USA",https://upload.wikimedia.org/wikipedia/commons/7/77/JoeyMatthewsXavier.png
26,13.01.2018,,"NEW Heavyweight Title:Joey MercurydefeatsFlip Gordon(c) by DQNEW Over The Top 2018- Event @ NEW Arena in Bethany, Connecticut, USA",https://upload.wikimedia.org/wikipedia/commons/7/77/JoeyMatthewsXavier.png
27,09.12.2017,,"Joey MercurydefeatsChris WyldeDCW Rumble For Glory 2017- Event @ Milford Community Center in Milford, Delaware, USA",https://upload.wikimedia.org/wikipedia/commons/7/77/JoeyMatthewsXavier.png
28,02.12.2017,,"Austin AriesdefeatsJoey MercuryHOH 36 - Blizzard Brawl 2017- Online Stream @ Waukesha County Expo in Waukesha, Wisconsin, USA",https://upload.wikimedia.org/wikipedia/commons/7/77/JoeyMatthewsXavier.png
29,01.12.2017,,"MCW Heavyweight TitleNo Count Out No Disqualification:The BruiserdefeatsJoey Matthews(c) -TITLE CHANGE !!!MCW Seasons Beatings 2017- Event @ MCW Arena in Joppa, Maryland, USA",https://upload.wikimedia.org/wikipedia/commons/7/77/JoeyMatthewsXavier.png
30,25.11.2017,,"RybackdefeatsJoey Mercury(12:52)WrestleCade SuperShow- Pay Per View @ Benton Convention Center in Winston-Salem, North Carolina, USA",https://upload.wikimedia.org/wikipedia/commons/7/77/JoeyMatthewsXavier.png
31,18.11.2017,,"First Blood:Joey MercurydefeatsTommy DreamerHOH 35- Online Stream @ 2300 Arena in Philadelphia, Pennsylvania, USA",https://upload.wikimedia.org/wikipedia/commons/7/77/JoeyMatthewsXavier.png
32,17.11.2017,,"Elimination:Little Guido,Shane Douglas,Super Crazy&Tommy DreamerdefeatJoey Matthews,Nick Aldis&The Spirit Squad(Kenny&Mikey)HOH 34- Event @ The Sports Arena in St. James, New York, USA",https://upload.wikimedia.org/wikipedia/commons/7/77/JoeyMatthewsXavier.png
33,11.11.2017,,"MCW Heavyweight Title:Joey Mercury(c),Dante Caballero&Joe KeysdefeatBrandon Scott,Lance Anoai&The BruiserMCW Autumn Armageddon Tour 2017- Event @ Hollywood Volunteer Fire Department in Hollywood, Maryland, USA",https://upload.wikimedia.org/wikipedia/commons/7/77/JoeyMatthewsXavier.png
34,11.11.2017,,"MCW Heavyweight Title:The BruiserdefeatsJoey Mercury(c) by DQMCW Autumn Armageddon Tour 2017- Event @ Hollywood Volunteer Fire Department in Hollywood, Maryland, USA",https://upload.wikimedia.org/wikipedia/commons/7/77/JoeyMatthewsXavier.png
35,10.11.2017,,"MCW Heavyweight Title:Joey Mercury(c) defeatsLance AnoaiMCW Autumn Armageddon Tour 2017- Event @ MCW Arena in Joppa, Maryland, USA",https://upload.wikimedia.org/wikipedia/commons/7/77/JoeyMatthewsXavier.png
36,04.11.2017,,"Billy Gunn&Bull JamesdefeatAdam Rose&Joey MercuryNYWC/Outlaw Wrestling- Event @ Saint Bernard Catholic Academy in New York City, New York, USA",https://upload.wikimedia.org/wikipedia/commons/7/77/JoeyMatthewsXavier.png
37,03.11.2017,,"Billy GunndefeatsJoey MercuryNYWC/Outlaw Wrestling- Event @ Ronkonkoma Fire Department in Lake Ronkonkoma, New York, USA",https://upload.wikimedia.org/wikipedia/commons/7/77/JoeyMatthewsXavier.png
38,27.10.2017,,"Four Way:Alex ReynoldsdefeatsJoey MercuryandMax CasterandPat BuckCAP Welcome To The Dungeon- Event @ The Sports Arena in St. James, New York, USA",https://upload.wikimedia.org/wikipedia/commons/7/77/JoeyMatthewsXavier.png
39,21.10.2017,,"MCW Heavyweight Title:Joey Mercury(c),Dante Caballero&Joe KeysdefeatBrandon Scott,Greg Excellent&The BruiserMCW Autumn Armageddon Tour 2017- Event @ Manchester Valley High School in Manchester, Maryland, USA",https://upload.wikimedia.org/wikipedia/commons/7/77/JoeyMatthewsXavier.png
40,21.10.2017,,"MCW Heavyweight Title:The BruiserdefeatsJoey Mercury(c) by DQMCW Autumn Armageddon Tour 2017- Event @ Manchester Valley High School in Manchester, Maryland, USA",https://upload.wikimedia.org/wikipedia/commons/7/77/JoeyMatthewsXavier.png
41,30.09.2017,,"Battle Royal:Winner:Joey MatthewsMCW Tribute To The Legends- Event @ MCW Arena in Joppa, Maryland, USA",https://upload.wikimedia.org/wikipedia/commons/7/77/JoeyMatthewsXavier.png
42,30.09.2017,,"MCW Heavyweight Title:Joey MatthewsdefeatsThe Bruiser(c) -TITLE CHANGE !!!MCW Tribute To The Legends- Event @ MCW Arena in Joppa, Maryland, USA",https://upload.wikimedia.org/wikipedia/commons/7/77/JoeyMatthewsXavier.png
43,23.09.2017,,"PCW Heavyweight  Title:Joey MatthewsdefeatsKen Dixon(c) by DQPCW Revolution Rumble: Enter The Dragon- Event @ Ranson Civic Center in Ranson, West Virginia, USA",https://upload.wikimedia.org/wikipedia/commons/7/77/JoeyMatthewsXavier.png
44,22.09.2017,,"Joey Mercury&John MorrisondefeatReno SCUM(Adam Thornstowe&Luster The Legend)APW Gym Wars- Event @ Jefferson High School in Daly City, California, USA",https://upload.wikimedia.org/wikipedia/commons/7/77/JoeyMatthewsXavier.png
45,12.08.2017,,"Joey MercurydefeatsTommy DreamerHOH 33- Event @ 2300 Arena in Philadelphia, Pennsylvania, USA",https://upload.wikimedia.org/wikipedia/commons/7/77/JoeyMatthewsXavier.png
46,11.08.2017,,"Joey MercurydefeatsBull JamesHOH 32- Event @ IPlay America in Freehold, New Jersey, USA",https://upload.wikimedia.org/wikipedia/commons/7/77/JoeyMatthewsXavier.png
47,15.07.2017,,"Shane Shamrock Memorial Cup XVII Final:Joey MatthewsdefeatsAnthony HenryandBrandon ScottandJoey JanelaandLio RushandShaheem AliMCW Shane Shamrock Memorial Cup XVII - Tag 2- Event @ MCW Arena in Joppa, Maryland, USA",https://upload.wikimedia.org/wikipedia/commons/7/77/JoeyMatthewsXavier.png
48,14.07.2017,,"Shane Shamrock Memorial Cup XVII First Round:Joey MatthewsdefeatsJoe KeysMCW Shane Shamrock Memorial Cup XVII - Tag 1- Event @ MCW Arena in Joppa, Maryland, USA",https://upload.wikimedia.org/wikipedia/commons/7/77/JoeyMatthewsXavier.png
49,08.06.2015,,"Two On One Handicap:J&J Security(Jamie Noble&Joey Mercury) defeatSeth Rollins(9:01)WWE Monday Night RAW #1150- TV-Show @ Smoothie King Center in New Orleans, Louisiana, USA",https://upload.wikimedia.org/wikipedia/commons/7/77/JoeyMatthewsXavier.png
50,11.05.2015,,"Two On One Handicap:Dean AmbrosedefeatsJ&J Security(Jamie Noble&Joey Mercury) (5:18)WWE Monday Night RAW #1146- TV-Show @ U.S. Bank Arena in Cincinnati, Ohio, USA",https://upload.wikimedia.org/wikipedia/commons/7/77/JoeyMatthewsXavier.png
51,23.03.2015,,"Three On One Handicap:Randy OrtondefeatsThe Authority(Jamie Noble,Joey Mercury&Seth Rollins) (3:21)WWE Monday Night RAW #1139- TV-Show @ Staples Center in Los Angeles, California, USA",https://upload.wikimedia.org/wikipedia/commons/7/77/JoeyMatthewsXavier.png
52,09.02.2015,,"Five On Two Handicap:Daniel Bryan&Roman ReignsdefeatThe Authority(Jamie Noble,Joey Mercury,Kane,Seth Rollins&The Big Show) (7:38)WWE Monday Night RAW #1133- TV-Show @ Value City Arena At The Jerome Schottenstein Center in Columbus, Ohio, USA",https://upload.wikimedia.org/wikipedia/commons/7/77/JoeyMatthewsXavier.png
53,03.02.2015,,"Three On One Handicap:Daniel BryandefeatsThe Authority(Jamie Noble,Joey Mercury&Seth Rollins) (14:12)WWE Thursday Night SmackDown #807- TV-Show @ World Arena in Colorado Springs, Colorado, USA",https://upload.wikimedia.org/wikipedia/commons/7/77/JoeyMatthewsXavier.png
54,24.11.2014,,"Three On Two Handicap:Dolph Ziggler&John CenadefeatThe Authority(Jamie Noble,Joey Mercury&Seth Rollins) (10:05)WWE Monday Night RAW #1122- TV-Show @ Bankers Life Fieldhouse in Indianapolis, Indiana, USA",https://upload.wikimedia.org/wikipedia/commons/7/77/JoeyMatthewsXavier.png
55,15.08.2010,,"Three On One Handicap:The Big ShowdefeatsThe Straight Edge Society(CM Punk,Joseph Mercury&Luke Gallows) (6:50)WWE SummerSlam 2010- Pay Per View @ Staples Center in Los Angeles, California, USA",https://upload.wikimedia.org/wikipedia/commons/7/77/JoeyMatthewsXavier.png
56,14.08.2010,,"Unified WWE Tag Team Title:The Hart Dynasty(David Hart Smith&Tyson Kidd) (c) defeatThe Straight Edge Society(Joseph Mercury&Luke Gallows)WWE SummerSlam Axxess 2010 - Tag 1- Event @ Nokia Plaza in Los Angeles, California, USA",https://upload.wikimedia.org/wikipedia/commons/7/77/JoeyMatthewsXavier.png
57,05.08.2010,,"Two On One Handicap:The Big ShowdefeatsJoey Mercury&Luke GallowsWWE SmackDown House Show- House Show @ Vector Arena in Auckland, New Zealand",https://upload.wikimedia.org/wikipedia/commons/7/77/JoeyMatthewsXavier.png
58,04.08.2010,,"Unified WWE Tag Team Title:The Hart Dynasty(David Hart Smith&Tyson Kidd) (c) defeatJoey Mercury&Luke GallowsWWE SmackDown House Show- House Show @ Burswood Dome in Perth, Western Australia, Australia",https://upload.wikimedia.org/wikipedia/commons/7/77/JoeyMatthewsXavier.png
59,03.08.2010,,"Unified WWE Tag Team Title:The Hart Dynasty(David Hart Smith&Tyson Kidd) (c) defeatJoey Mercury&Luke GallowsWWE SmackDown House Show- House Show @ Adelaide Entertainment Centre in Adelaide, South Australia, Australia",https://upload.wikimedia.org/wikipedia/commons/7/77/JoeyMatthewsXavier.png
60,02.08.2010,,"Unified WWE Tag Team Title:The Hart Dynasty(David Hart Smith&Tyson Kidd) (c) defeatJoey Mercury&Luke GallowsWWE SmackDown House Show- House Show @ Brisbane Entertainment Centre in Boondall, Queensland, Australia",https://upload.wikimedia.org/wikipedia/commons/7/77/JoeyMatthewsXavier.png
61,02.08.2010,,"World Heavyweight Title#1 Contendership / Brisbane Cup Battle Royal:The Big ShowdefeatsAlberto Del RioandChavo GuerreroandChristianandCody RhodesandDavid Hart SmithandDolph ZigglerandDrew McIntyreandJack SwaggerandJoey MercuryandKofi KingstonandLuke GallowsandMatt HardyandMontel Vontavious PorterandTyson KiddWWE SmackDown House Show- House Show @ Brisbane Entertainment Centre in Boondall, Queensland, Australia",https://upload.wikimedia.org/wikipedia/commons/7/77/JoeyMatthewsXavier.png
62,01.08.2010,,"Unified WWE Tag Team Title:The Hart Dynasty(David Hart Smith&Tyson Kidd) (c) defeatJoey Mercury&Luke GallowsWWE SmackDown House Show- House Show @ Rod Laver Arena in Melbourne, Victoria, Australia",https://upload.wikimedia.org/wikipedia/commons/7/77/JoeyMatthewsXavier.png
63,31.07.2010,,"Unified WWE Tag Team Title:The Hart Dynasty(David Hart Smith&Tyson Kidd) (c) defeatJoey Mercury&Luke GallowsWWE SmackDown House Show- House Show @ Acer Arena in Sydney, Australia",https://upload.wikimedia.org/wikipedia/commons/7/77/JoeyMatthewsXavier.png
64,28.07.2010,,"The Straight Edge Society(CM Punk,Joseph Mercury&Luke Gallows) defeatChris Masters,JTG&Montel Vontavious Porter(3:03)WWE Friday Night SmackDown #572- TV-Show @ Laredo Energy Arena in Laredo, Texas, USA",https://upload.wikimedia.org/wikipedia/commons/7/77/JoeyMatthewsXavier.png
65,20.07.2010,,"The Big ShowdefeatsJoey Mercury(1:30)WWE Friday Night SmackDown #570- TV-Show @ Verizon Arena in North Little Rock, Arkansas, USA",https://upload.wikimedia.org/wikipedia/commons/7/77/JoeyMatthewsXavier.png
66,11.07.2010,,"Two On One Handicap:The Big ShowdefeatsJoey Mercury&Luke GallowsWWE SmackDown House Show- House Show @ Roberts Municipal Stadium in Evansville, Indiana, USA",https://upload.wikimedia.org/wikipedia/commons/7/77/JoeyMatthewsXavier.png
67,10.07.2010,,"Two On One Handicap:The Big ShowdefeatsJoey Mercury&Luke GallowsWWE SmackDown House Show- House Show @ Van Andel Arena in Grand Rapids, Michigan, USA",https://upload.wikimedia.org/wikipedia/commons/7/77/JoeyMatthewsXavier.png
68,05.07.2010,,"Christian&Montel Vontavious PorterdefeatJoey Mercury&Luke GallowsWWE SmackDown House Show- House Show @ Savannah, Georgia, USA",https://upload.wikimedia.org/wikipedia/commons/7/77/JoeyMatthewsXavier.png
69,19.06.2010,,"Christian&Montel Vontavious PorterdefeatJoey Mercury&Luke GallowsWWE House Show- House Show @ Madison Square Garden in New York City, New York, USA",https://upload.wikimedia.org/wikipedia/commons/7/77/JoeyMatthewsXavier.png
70,13.06.2010,,"Unified WWE Tag Team Title:The Hart Dynasty(David Hart Smith&Tyson Kidd) (c) defeatJoey Mercury&Luke Gallowsby DQWWE SmackDown House Show- House Show @ Hampton, Virginia, USA",https://upload.wikimedia.org/wikipedia/commons/7/77/JoeyMatthewsXavier.png
71,12.06.2010,,"Unified WWE Tag Team Title:The Hart Dynasty(David Hart Smith&Tyson Kidd) (c) defeatJoey Mercury&Luke Gallowsby DQWWE SmackDown House Show- House Show @ Show Place Arena in Upper Marlboro, Maryland, USA",https://upload.wikimedia.org/wikipedia/commons/7/77/JoeyMatthewsXavier.png
72,06.06.2010,,"Two On One Handicap:KanedefeatsJoey Mercury&Luke GallowsWWE SmackDown House Show- House Show @ Conseco Fieldhouse in Indianapolis, Indiana, USA",https://upload.wikimedia.org/wikipedia/commons/7/77/JoeyMatthewsXavier.png
73,30.05.2010,,"Kane&Montel Vontavious PorterdefeatJoey Mercury&Luke GallowsWWE SmackDown House Show- House Show @ Santa Ana Star Center in Rio Rancho, New Mexico, USA",https://upload.wikimedia.org/wikipedia/commons/7/77/JoeyMatthewsXavier.png
74,29.05.2010,,"Kane&Montel Vontavious PorterdefeatJoey Mercury&Luke GallowsWWE SmackDown House Show- House Show @ Pan Am Center in Las Cruces, New Mexico, USA",https://upload.wikimedia.org/wikipedia/commons/7/77/JoeyMatthewsXavier.png
75,22.05.2010,,"Unified WWE Tag Team Title:The Hart Dynasty(David Hart Smith&Tyson Kidd) (c) defeatJoey Mercury&Luke GallowsWWE House Show- House Show @ U.S. Bank Arena in Cincinnati, Ohio, USA",https://upload.wikimedia.org/wikipedia/commons/7/77/JoeyMatthewsXavier.png
76,16.05.2010,,"Christian&Rey MysteriodefeatJoey Mercury&Luke GallowsWWE SmackDown Afternoon House Show- House Show @ Moncton, New Brunswick, Canada",https://upload.wikimedia.org/wikipedia/commons/7/77/JoeyMatthewsXavier.png
77,16.05.2010,,"Christian&Rey MysteriodefeatJoey Mercury&Luke GallowsWWE SmackDown Evening House Show- House Show @ Harbour Station in St. John, New Brunswick, Canada",https://upload.wikimedia.org/wikipedia/commons/7/77/JoeyMatthewsXavier.png
78,15.05.2010,,"Christian&Rey MysteriodefeatJoey Mercury&Luke GallowsWWE SmackDown House Show- House Show @ Halifax, Nova Scotia, Canada",https://upload.wikimedia.org/wikipedia/commons/7/77/JoeyMatthewsXavier.png
79,20.04.2010,,"Dark:Shelton BenjamindefeatsJoey MercuryWWE Friday Night SmackDown #557- Dark Match @ Mohegan Sun Arena in Uncasville, Connecticut, USA",https://upload.wikimedia.org/wikipedia/commons/7/77/JoeyMatthewsXavier.png
80,28.09.2008,,"TitusdefeatsJoey MercuryECPW Autumn Aggression- Event @ The Forum in North Sydney, Nova Scotia, Canada",https://upload.wikimedia.org/wikipedia/commons/7/77/JoeyMatthewsXavier.png
81,27.09.2008,,"IWS World Heavyweight Title:Kevin Steen(c) defeatsJoey Mercury(14:08)IWS Un F'n Sanctioned 2008- Event @ Le Medley in Montreal, Quebec, Canada",https://upload.wikimedia.org/wikipedia/commons/7/77/JoeyMatthewsXavier.png
82,06.09.2008,,"Joey MatthewsdefeatsJimmy JacobsAAW Hostile Intentions 2008- Event @ Berwyn Eagles Club in Berwyn, Illinois, USA",https://upload.wikimedia.org/wikipedia/commons/7/77/JoeyMatthewsXavier.png
83,03.09.2008,,"OVW Heavyweight Title:Anthony Bravado(c) defeatsJoey MatthewsOVW TV #474- TV-Show @ Davis Arena in Louisville, Kentucky, USA",https://upload.wikimedia.org/wikipedia/commons/7/77/JoeyMatthewsXavier.png
84,30.08.2008,,"Doug WilliamsdefeatsJoey MatthewsGSW Night In Motion XIII - Lucky 13- Event @ Siedlerheim in Mannheim, Baden-Württemberg, Deutschland",https://upload.wikimedia.org/wikipedia/commons/7/77/JoeyMatthewsXavier.png
85,23.08.2008,,"Derek Frazier&RuckusdefeatChristian York&Joey MatthewsMCW Summer Heat 2008- Event @ The New Green Room in Dundalk, Maryland, USA",https://upload.wikimedia.org/wikipedia/commons/7/77/JoeyMatthewsXavier.png
86,20.08.2008,,"Joey Matthews&Rudy SwitchbladedefeatAnthony Bravado&JD MichaelsOVW TV #472- TV-Show @ Davis Arena in Louisville, Kentucky, USA",https://upload.wikimedia.org/wikipedia/commons/7/77/JoeyMatthewsXavier.png
87,18.08.2008,,"Best Two Out Of Three Falls:Canibal Samoano,Joey Mercury&PumadefeatLos Perros del Mal(Averno&Mephisto) &El TerribleCMLL Lunes Palenque Expomex- Event @ Palenque Expomex in Nuevo Laredo, Tamaulipas, Mexiko",https://upload.wikimedia.org/wikipedia/commons/7/77/JoeyMatthewsXavier.png
88,13.08.2008,,"Joey MatthewsdefeatsAl BaroneOVW TV #471- TV-Show @ Davis Arena in Louisville, Kentucky, USA",https://upload.wikimedia.org/wikipedia/commons/7/77/JoeyMatthewsXavier.png
89,06.08.2008,,"Joey MatthewsdefeatsLightfootOVW TV #470- TV-Show @ Davis Arena in Louisville, Kentucky, USA",https://upload.wikimedia.org/wikipedia/commons/7/77/JoeyMatthewsXavier.png
90,30.07.2008,,"Joey MatthewsdefeatsJamin OlivenciaOVW TV #469- TV-Show @ Davis Arena in Louisville, Kentucky, USA",https://upload.wikimedia.org/wikipedia/commons/7/77/JoeyMatthewsXavier.png
91,23.07.2008,,"Two On One Handicap:Fake Rojo Numero Dos (Joey Matthews) & Rojo Numero Uno defeatJamin Olivenciaby DQOVW TV #468- TV-Show @ Davis Arena in Louisville, Kentucky, USA",https://upload.wikimedia.org/wikipedia/commons/7/77/JoeyMatthewsXavier.png
92,20.07.2008,,"Four Way:AzriealdefeatsClaudio CastagnoliandDeliriousandJoey Matthews(22:05)VPW Summer Bash- Event @ Alhambra Arena in Philadelphia, Pennsylvania, USA",https://upload.wikimedia.org/wikipedia/commons/7/77/JoeyMatthewsXavier.png
93,19.07.2008,,"Shane Shamrock Memorial Cup 2008 Final Six Way Elimination Match (Special Referee: Bill Alfonso):Derek FrazierdefeatsClaudio CastagnoliandDevon StormandJoey MatthewsandJosh DanielsandRhett TitusMCW Shane Shamrock Memorial Cup 2008 - Tag 2- Event @ North Point Arena in Dundalk, Maryland, USA",https://upload.wikimedia.org/wikipedia/commons/7/77/JoeyMatthewsXavier.png
94,18.07.2008,,"Shane Shamrock Memorial Cup 2008 Qualifying:Joey MatthewsdefeatsRuckusMCW Shane Shamrock Memorial Cup 2008 - Tag 1- Event @ North Point Arena in Dundalk, Maryland, USA",https://upload.wikimedia.org/wikipedia/commons/7/77/JoeyMatthewsXavier.png
95,17.07.2008,,"Joey MatthewsdefeatsGavin GarrisonDCW TV #52- TV-Show @ Davis Arena in Louisville, Kentucky, USA",https://upload.wikimedia.org/wikipedia/commons/7/77/JoeyMatthewsXavier.png
96,27.06.2008,,"El Generico&Kevin SteendefeatThe Age Of The Fall(Jimmy Jacobs&Joey Matthews) (10:45)ROH Battle For Supremacy- Event @ Montgomery County Fairgrounds Coliseum in Dayton, Ohio, USA",https://upload.wikimedia.org/wikipedia/commons/7/77/JoeyMatthewsXavier.png
97,26.06.2008,,"Joey Matthews,Nick Dinsmore&Rob ConwaydefeatAnthony Bravado,Apoc&Vaughn LilasOVW- Event @ Charleston, Indiana, USA",https://upload.wikimedia.org/wikipedia/commons/7/77/JoeyMatthewsXavier.png
98,14.06.2008,,"Best Two Out Of Three Falls:Dos Caras Jr.,LA Park&Marco CorleonedefeatBilly Blade,Gangrel&Joey Mercury[2:1]CMLL Tercera Guerra- Event @ Plaza de Toros La Monumental in Monterrey, Nuevo Leon, Mexiko",https://upload.wikimedia.org/wikipedia/commons/7/77/JoeyMatthewsXavier.png
99,11.06.2008,,"Jamin Olivenciavs.Joey Matthews- No ContestOVW TV #462- TV-Show @ Davis Arena in Louisville, Kentucky, USA",https://upload.wikimedia.org/wikipedia/commons/7/77/JoeyMatthewsXavier.png
100,07.06.2008,,"GLCW Heavyweight Title:Al Snow(c) defeatsJoey MercuryGLCW Taste Of Summer- Event @ Waukesha County Expo Center in Waukesha, Wisconsin, USA",https://upload.wikimedia.org/wikipedia/commons/7/77/JoeyMatthewsXavier.png
101,04.06.2008,,"Joey MatthewsdefeatsTed McNalerOVW TV #461- TV-Show @ Davis Arena in Louisville, Kentucky, USA",https://upload.wikimedia.org/wikipedia/commons/7/77/JoeyMatthewsXavier.png
102,30.05.2008,,"Rudy SwitchbladedefeatsJoey MatthewsOVW Six Flags Summer Sizzler Series- Event @ Paramarx Arena in Louisville, Kentucky, USA",https://upload.wikimedia.org/wikipedia/commons/7/77/JoeyMatthewsXavier.png
103,28.05.2008,,"Joey MatthewsdefeatsRudy SwitchbladeOVW TV #460- TV-Show @ Davis Arena in Louisville, Kentucky, USA",https://upload.wikimedia.org/wikipedia/commons/7/77/JoeyMatthewsXavier.png
104,24.05.2008,,"IWC Tag Team Title:Babyface Fire(Jason Gory&Shiima Xion) (c) defeatChristian York&Joey MatthewsSteel City Wrestlefest- Event @ Rostraver Ice Gardens in Belle Vernon, Pennsylvania, USA",https://upload.wikimedia.org/wikipedia/commons/7/77/JoeyMatthewsXavier.png
105,23.05.2008,,"Jamin OlivenciadefeatsJoey MatthewsOVW Six Flags Summer Sizzler Series- Event @ Paramarx Arena in Louisville, Kentucky, USA",https://upload.wikimedia.org/wikipedia/commons/7/77/JoeyMatthewsXavier.png
106,21.05.2008,,"Joey MatthewsdefeatsJosh LowryOVW TV #459- TV-Show @ Davis Arena in Louisville, Kentucky, USA",https://upload.wikimedia.org/wikipedia/commons/7/77/JoeyMatthewsXavier.png
107,21.05.2008,,"Dark:John MorrisondefeatsJoey MatthewsOVW TV #459- Dark Match @ Davis Arena in Louisville, Kentucky, USA",https://upload.wikimedia.org/wikipedia/commons/7/77/JoeyMatthewsXavier.png
