date,event,result,location,image_url
406,29.09.1999,,"Eddie GuerrerodefeatsPerry SaturnWCW House Show- House Show @ Von Braun Center in Huntsville, Alabama, USA",https://upload.wikimedia.org/wikipedia/commons/5/5d/Flag_of_the_United_States_%2823px%29.png
407,27.09.1999,,"KonnandefeatsPerry Saturnby DQ (9:29)WCW Monday NITRO #210- TV-Show @ Philips Arena in Atlanta, Georgia, USA",https://upload.wikimedia.org/wikipedia/commons/5/5d/Flag_of_the_United_States_%2823px%29.png
408,23.09.1999,,"Perry SaturndefeatsChavo Guerrero Jr.(6:15)WCW Thunder #81- TV-Show @ Norfolk Scope in Norfolk, Virginia, USA",https://upload.wikimedia.org/wikipedia/commons/5/5d/Flag_of_the_United_States_%2823px%29.png
409,20.09.1999,,"Perry SaturndefeatsEddie Guerrero(7:48)WCW Monday NITRO #209- TV-Show @ Firstar Center in Cincinnati, Ohio, USA",https://upload.wikimedia.org/wikipedia/commons/5/5d/Flag_of_the_United_States_%2823px%29.png
410,14.09.1999,,"Perry SaturndefeatsAdrian ByrdWCW Worldwide- TV-Show @ Roanoke Civic Center in Roanoke, Virginia, USA",https://upload.wikimedia.org/wikipedia/commons/5/5d/Flag_of_the_United_States_%2823px%29.png
411,13.09.1999,,"Perry SaturndefeatsEddie Guerrero(9:19)WCW Monday NITRO #208- TV-Show @ Dean E. Smith Student Activities Center in Chapel Hill, North Carolina, USA",https://upload.wikimedia.org/wikipedia/commons/5/5d/Flag_of_the_United_States_%2823px%29.png
412,12.09.1999,,"WCW World Television Title:Rick Steiner(c) defeatsPerry Saturn(9:23)WCW Fall Brawl 1999 - ""Sting & Hogan Brawl For It All!""- Pay Per View @ Lawrence Joel Veterans Memorial Coliseum in Winston-Salem, North Carolina, USA",https://upload.wikimedia.org/wikipedia/commons/5/5d/Flag_of_the_United_States_%2823px%29.png
413,06.09.1999,,"Perry SaturndefeatsHugh Morrus(10:04)WCW Monday NITRO #207- TV-Show @ Miami Arena in Miami, Florida, USA",https://upload.wikimedia.org/wikipedia/commons/5/5d/Flag_of_the_United_States_%2823px%29.png
414,06.09.1999,,"Battle Royal:Chris BenoitandDean MalenkodefeatBarry WindhamandBrian KnobbsandCurt HennigandHugh MorrusandJerry FlynnandKendall WindhamandSaturnandShane DouglasandThe BarbarianandVincent(7:24)WCW Monday NITRO #207- TV-Show @ Miami Arena in Miami, Florida, USA",https://upload.wikimedia.org/wikipedia/commons/5/5d/Flag_of_the_United_States_%2823px%29.png
415,05.09.1999,,"Perry SaturndefeatsEddie GuerreroWCW House Show- House Show @ James H. Gray Civic Center in Albany, Georgia, USA",https://upload.wikimedia.org/wikipedia/commons/5/5d/Flag_of_the_United_States_%2823px%29.png
416,04.09.1999,,"Perry SaturndefeatsEddie GuerreroWCW House Show- House Show @ Leon County Civic Center in Tallahassee, Florida, USA",https://upload.wikimedia.org/wikipedia/commons/5/5d/Flag_of_the_United_States_%2823px%29.png
417,03.09.1999,,"Perry SaturndefeatsEddie GuerreroWCW House Show- House Show @ Civic Center in Pensacola, Florida, USA",https://upload.wikimedia.org/wikipedia/commons/5/5d/Flag_of_the_United_States_%2823px%29.png
418,02.09.1999,,"Perry SaturndefeatsSid Viciousby DQ (5:40)WCW Thunder #78- TV-Show @ Wendler Arena in Saginaw, Michigan, USA",https://upload.wikimedia.org/wikipedia/commons/5/5d/Flag_of_the_United_States_%2823px%29.png
419,02.09.1999,,"The Revolution(Chris Benoit,Perry Saturn&Shane Douglas) defeatChris Adams,Dave Taylor&Steven Regal(6:22)WCW Thunder #79- TV-Show @ Wendler Arena in Saginaw, Michigan, USA",https://upload.wikimedia.org/wikipedia/commons/5/5d/Flag_of_the_United_States_%2823px%29.png
420,01.09.1999,,"Perry SaturndefeatsEddie GuerreroWCW House Show- House Show @ McMorran Place in Port Huron, Michigan, USA",https://upload.wikimedia.org/wikipedia/commons/5/5d/Flag_of_the_United_States_%2823px%29.png
421,31.08.1999,,"Perry SaturndefeatsBobby BlazeWCW Saturday Night- TV-Show @ Broome County Arena in Binghamton, New York, USA",https://upload.wikimedia.org/wikipedia/commons/5/5d/Flag_of_the_United_States_%2823px%29.png
422,23.08.1999,,"Brian Knobbs,Hugh Morrus&The BarbariandefeatDean Malenko,Perry Saturn&Shane Douglas(4:47)WCW Monday NITRO #205- TV-Show @ MGM Grand Garden Arena in Las Vegas, Nevada, USA",https://upload.wikimedia.org/wikipedia/commons/5/5d/Flag_of_the_United_States_%2823px%29.png
423,19.08.1999,,"Rick Steiner&Sid ViciousdefeatChris Benoit&Perry Saturn(9:19)WCW Thunder #77- TV-Show @ Municipal Coliseum in Lubbock, Texas, USA",https://upload.wikimedia.org/wikipedia/commons/5/5d/Flag_of_the_United_States_%2823px%29.png
424,19.08.1999,,"WCW World Television Title:Perry SaturndefeatsRick Steiner(c) by DQ (8:05)WCW Thunder #76- TV-Show @ Municipal Coliseum in Lubbock, Texas, USA",https://upload.wikimedia.org/wikipedia/commons/5/5d/Flag_of_the_United_States_%2823px%29.png
425,18.08.1999,,"Chris Benoit&Perry SaturndefeatThe Public Enemy(Johnny Grunge&Rocco Rock)WCW House Show- House Show @ Civic Center in Amarillo, Texas, USA",https://upload.wikimedia.org/wikipedia/commons/5/5d/Flag_of_the_United_States_%2823px%29.png
426,17.08.1999,,"Perry SaturndefeatsMikey WhipwreckWCW Saturday Night- TV-Show @ Casper Events Center in Casper, Wyoming, USA",https://upload.wikimedia.org/wikipedia/commons/5/5d/Flag_of_the_United_States_%2823px%29.png
427,16.08.1999,,"Perry SaturndefeatsBam Bam Bigelow(7:25)WCW Monday NITRO #204- TV-Show @ World Arena in Colorado Springs, Colorado, USA",https://upload.wikimedia.org/wikipedia/commons/5/5d/Flag_of_the_United_States_%2823px%29.png
428,14.08.1999,,"The Revolution(Dean Malenko,Perry Saturn&Shane Douglas) defeatThe West Texas Rednecks(Barry Windham,Bobby Duncum Jr.&Curt Hennig) (10:57)WCW Road Wild 1999- Pay Per View @ Sturgis Rally And Race in Sturgis, South Dakota, USA",https://upload.wikimedia.org/wikipedia/commons/5/5d/Flag_of_the_United_States_%2823px%29.png
429,08.08.1999,,"Bam Bam BigelowdefeatsPerry SaturnWCW House Show- House Show @ America West Arena in Phoenix, Arizona, USA",https://upload.wikimedia.org/wikipedia/commons/5/5d/Flag_of_the_United_States_%2823px%29.png
430,07.08.1999,,"Chris Benoit&Perry SaturndefeatBam Bam Bigelow&Diamond Dallas PageWCW House Show- House Show @ Convention Center in Tucson, Arizona, USA",https://upload.wikimedia.org/wikipedia/commons/5/5d/Flag_of_the_United_States_%2823px%29.png
431,06.08.1999,,"Perry SaturndefeatsBam Bam BigelowWCW House Show- House Show @ Don Haskins Center in El Paso, Texas, USA",https://upload.wikimedia.org/wikipedia/commons/5/5d/Flag_of_the_United_States_%2823px%29.png
432,04.08.1999,,"Perry SaturndefeatsScotty RiggsWCW House Show- House Show @ Five Seasons Center in Cedar Rapids, Iowa, USA",https://upload.wikimedia.org/wikipedia/commons/5/5d/Flag_of_the_United_States_%2823px%29.png
433,02.08.1999,,"Perry SaturndefeatsCurt Hennigby DQ (4:35)WCW Monday NITRO #202- TV-Show @ Sioux Falls Arena in Sioux Falls, South Dakota, USA",https://upload.wikimedia.org/wikipedia/commons/5/5d/Flag_of_the_United_States_%2823px%29.png
434,01.08.1999,,"Perry SaturndefeatsKanyonWCW House Show- House Show @ Kellogg Arena in Battle Creek, Michigan, USA",https://upload.wikimedia.org/wikipedia/commons/5/5d/Flag_of_the_United_States_%2823px%29.png
435,31.07.1999,,"Perry SaturndefeatsKanyonWCW House Show- House Show @ Van Andel Arena in Grand Rapids, Michigan, USA",https://upload.wikimedia.org/wikipedia/commons/5/5d/Flag_of_the_United_States_%2823px%29.png
436,30.07.1999,,"Perry SaturndefeatsKanyonWCW House Show- House Show @ IMA Sports Arena in Flint, Michigan, USA",https://upload.wikimedia.org/wikipedia/commons/5/5d/Flag_of_the_United_States_%2823px%29.png
437,22.07.1999,,"Ric Flair&The Triad(Diamond Dallas Page&Kanyon) defeatChris Benoit,Dean Malenko&Perry Saturn(7:56)WCW Thunder #73- TV-Show @ Mark of the Quad in Moline, Illinois, USA",https://upload.wikimedia.org/wikipedia/commons/5/5d/Flag_of_the_United_States_%2823px%29.png
438,21.07.1999,,"Perry SaturndefeatsCurt HennigWCW House Show- House Show @ Peoria Civic Center in Peoria, Illinois, USA",https://upload.wikimedia.org/wikipedia/commons/5/5d/Flag_of_the_United_States_%2823px%29.png
439,19.07.1999,,"Chris Benoit&Perry SaturndefeatThe West Texas Rednecks(Barry Windham&Curt Hennig) by DQ (6:38)WCW Monday NITRO #200- TV-Show @ Metro Center in Rockford, Illinois, USA",https://upload.wikimedia.org/wikipedia/commons/5/5d/Flag_of_the_United_States_%2823px%29.png
440,11.07.1999,,"WCW World Tag Team TitleThree On Two Handicap:The Triad(Bam Bam Bigelow,Diamond Dallas Page&Kanyon) (c) defeatChris Benoit&Perry Saturn(23:17)WCW Bash At The Beach 1999- Pay Per View @ National Car Rental Center in Sunrise, Florida, USA",https://upload.wikimedia.org/wikipedia/commons/5/5d/Flag_of_the_United_States_%2823px%29.png
441,06.07.1999,,"Chris Benoit,Dean Malenko&Perry SaturndefeatChavo Guerrero Jr.,Juventud Guerrera&PsychosisWCW Saturday Night- TV-Show @ Civic Center in Columbus, Georgia, USA",https://upload.wikimedia.org/wikipedia/commons/5/5d/Flag_of_the_United_States_%2823px%29.png
442,05.07.1999,,"Chris Benoit,Dean Malenko&Perry SaturndefeatThe Triad(Bam Bam Bigelow,Diamond Dallas Page&Kanyon) (9:23)WCW Monday NITRO #198- TV-Show @ Georgia Dome in Atlanta, Georgia, USA",https://upload.wikimedia.org/wikipedia/commons/5/5d/Flag_of_the_United_States_%2823px%29.png
443,28.06.1999,,"Chris Benoit&Perry SaturndefeatFit Finlay&Steven Regal(11:01)WCW Monday NITRO #197- TV-Show @ United Center in Chicago, Illinois, USA",https://upload.wikimedia.org/wikipedia/commons/5/5d/Flag_of_the_United_States_%2823px%29.png
444,27.06.1999,,"Perry SaturndefeatsKanyonWCW House Show- House Show @ Milwaukee Arena in Milwaukee, Wisconsin, USA",https://upload.wikimedia.org/wikipedia/commons/5/5d/Flag_of_the_United_States_%2823px%29.png
445,26.06.1999,,"Perry SaturndefeatsKanyonWCW House Show- House Show @ Allen County War Memorial in Fort Wayne, Indiana, USA",https://upload.wikimedia.org/wikipedia/commons/5/5d/Flag_of_the_United_States_%2823px%29.png
446,25.06.1999,,"Perry SaturndefeatsKanyonWCW House Show- House Show @ The Palace of Auburn Hills in Auburn Hills, Michigan, USA",https://upload.wikimedia.org/wikipedia/commons/5/5d/Flag_of_the_United_States_%2823px%29.png
447,24.06.1999,,"Chris Benoit&Perry SaturndefeatDave Taylor&Fit Finlay(9:34)WCW Thunder #68- TV-Show @ Cajundome in Lafayette, Louisiana, USA",https://upload.wikimedia.org/wikipedia/commons/5/5d/Flag_of_the_United_States_%2823px%29.png
448,24.06.1999,,"Perry SaturndefeatsDiamond Dallas Pageby DQ (8:17)WCW Thunder #69- TV-Show @ Cajundome in Lafayette, Louisiana, USA",https://upload.wikimedia.org/wikipedia/commons/5/5d/Flag_of_the_United_States_%2823px%29.png
449,23.06.1999,,"Perry SaturndefeatsHoraceWCW House Show- House Show @ Rapides Coliseum in Alexandria, Louisiana, USA",https://upload.wikimedia.org/wikipedia/commons/5/5d/Flag_of_the_United_States_%2823px%29.png
450,14.06.1999,,"Buff Bagwell,Chris Benoit,Dean Malenko&Perry SaturndefeatRic Flair,Roddy Piper&The Triad(Diamond Dallas Page&Kanyon) (15:28)WCW Monday NITRO #195- TV-Show @ MCI Center in Washington, District Of Columbia, USA",https://upload.wikimedia.org/wikipedia/commons/5/5d/Flag_of_the_United_States_%2823px%29.png
451,13.06.1999,,"WCW World Tag Team Title:The Triad(Diamond Dallas Page&Kanyon) defeatChris Benoit&Perry Saturn(c) (19:13) -TITLE CHANGE !!!WCW The Great American Bash 1999- Pay Per View @ Baltimore Arena in Baltimore, Maryland, USA",https://upload.wikimedia.org/wikipedia/commons/5/5d/Flag_of_the_United_States_%2823px%29.png
452,10.06.1999,,"Perry SaturndefeatsKanyonby DQ (13:23)WCW Thunder #66- TV-Show @ Onandoga War Memorial Arena in Syracuse, New York, USA",https://upload.wikimedia.org/wikipedia/commons/5/5d/Flag_of_the_United_States_%2823px%29.png
453,10.06.1999,,"WCW World Tag Team Title:Chris Benoit&Perry SaturndefeatDiamond Dallas Page&Kanyon(c) (3:24) -TITLE CHANGE !!!WCW Thunder #66- TV-Show @ Onandoga War Memorial Arena in Syracuse, New York, USA",https://upload.wikimedia.org/wikipedia/commons/5/5d/Flag_of_the_United_States_%2823px%29.png
454,08.06.1999,,"Perry SaturndefeatsSgt. Buddy Lee ParkerWCW Worldwide- TV-Show @ Cambria County War Memorial  in Johnstown, Pennsylvania, USA",https://upload.wikimedia.org/wikipedia/commons/5/5d/Flag_of_the_United_States_%2823px%29.png
455,07.06.1999,,"WCW World Tag Team Title:Chris Benoit&Perry SaturndefeatBam Bam Bigelow&Diamond Dallas Page(c) (12:26)WCW Monday NITRO #194- TV-Show @ CSU Convocation Center in Cleveland, Ohio, USA",https://upload.wikimedia.org/wikipedia/commons/5/5d/Flag_of_the_United_States_%2823px%29.png
456,31.05.1999,,"WCW World Tag Team Title:Bam Bam Bigelow&Diamond Dallas PagedefeatKanyon[Replacement for Raven] &Perry Saturn(c) (11:33) -TITLE CHANGE !!!WCW Monday NITRO #193- TV-Show @ Astrodome in Houston, Texas, USA",https://upload.wikimedia.org/wikipedia/commons/5/5d/Flag_of_the_United_States_%2823px%29.png
457,25.05.1999,,"Perry SaturndefeatsSgt. Buddy Lee ParkerWCW Saturday Night TV Taping- Event @ Augusta-Richmond County Civic Center in Augusta, Georgia, USA",https://upload.wikimedia.org/wikipedia/commons/5/5d/Flag_of_the_United_States_%2823px%29.png
458,17.05.1999,,"WCW World Tag Team Title:Perry Saturn&Raven(c) defeatThe Four Horsemen(Chris Benoit&Dean Malenko) (16:48)WCW Monday NITRO #191- TV-Show @ Five Seasons Center in Cedar Rapids, Iowa, USA",https://upload.wikimedia.org/wikipedia/commons/5/5d/Flag_of_the_United_States_%2823px%29.png
459,13.05.1999,,"WCW World Tag Team TitleNo Disqualification:Perry Saturn&Raven(c) defeatThe nWo B-Team(Horace&Vincent) (7:24)WCW Thunder #63- TV-Show @ Kansas Coliseum in Wichita, Kansas, USA",https://upload.wikimedia.org/wikipedia/commons/5/5d/Flag_of_the_United_States_%2823px%29.png
460,11.05.1999,,"WCW World Tag Team Title:Hugh Morrus&The BarbariandefeatPerry Saturn&Raven(c) by DQWCW Saturday Night- TV-Show @ Show Me Center in Cape Girardeau, Missouri, USA",https://upload.wikimedia.org/wikipedia/commons/5/5d/Flag_of_the_United_States_%2823px%29.png
461,09.05.1999,,"WCW World Tag Team TitleTriangle:Perry Saturn&RavendefeatThe Four Horsemen(Chris Benoit&Dean Malenko) andKidman&Rey Mysterio Jr.(c) (17:28) -TITLE CHANGE !!!WCW Slamboree 1999- Pay Per View @ TWA Dome in St. Louis, Missouri, USA",https://upload.wikimedia.org/wikipedia/commons/5/5d/Flag_of_the_United_States_%2823px%29.png
462,02.05.1999,,"Perry Saturn&RavendefeatChris Benoit&Dean MalenkoWCW House Show- House Show @ Norfolk Scope in Norfolk, Virginia, USA",https://upload.wikimedia.org/wikipedia/commons/5/5d/Flag_of_the_United_States_%2823px%29.png
463,01.05.1999,,"Bam Bam BigelowdefeatsPerry SaturnWCW House Show- House Show @ First Union Spectrum in Philadelphia, Pennsylvania, USA",https://upload.wikimedia.org/wikipedia/commons/5/5d/Flag_of_the_United_States_%2823px%29.png
464,30.04.1999,,"Hardcore:Bam Bam BigelowdefeatsPerry SaturnWCW House Show- House Show @ Nassau Veterans Memorial Coliseum in Uniondale, New York, USA",https://upload.wikimedia.org/wikipedia/commons/5/5d/Flag_of_the_United_States_%2823px%29.png
465,29.04.1999,,"No Disqualification:Perry Saturn&RavendefeatMike Enos&Scotty Riggs(9:00)WCW Thunder #62- TV-Show @ Bryce Jordan Center in State College, Pennsylvania, USA",https://upload.wikimedia.org/wikipedia/commons/5/5d/Flag_of_the_United_States_%2823px%29.png
466,23.04.1999,,"Perry SaturndefeatsScott NortonWCW House Show- House Show @ UTC Arena in Chattanooga, Tennessee, USA",https://upload.wikimedia.org/wikipedia/commons/5/5d/Flag_of_the_United_States_%2823px%29.png
467,15.04.1999,,"Perry Saturn&RavendefeatDisorderly Conduct(Mean Mike&Tough Tom) (6:58)WCW Thunder #59- TV-Show @ Orlando Arena in Orlando, Florida, USA",https://upload.wikimedia.org/wikipedia/commons/5/5d/Flag_of_the_United_States_%2823px%29.png
468,15.04.1999,,"Chris Benoit,Dean Malenko&KidmandefeatPerry Saturn,Raven&Rey Mysterio Jr.(13:11)WCW Thunder #60- TV-Show @ Orlando Arena in Orlando, Florida, USA",https://upload.wikimedia.org/wikipedia/commons/5/5d/Flag_of_the_United_States_%2823px%29.png
469,13.04.1999,,"Perry Saturn&RavendefeatDamien&Silver KingWCW Saturday Night- TV-Show @ Idaho Center in Boise, Idaho, USA",https://upload.wikimedia.org/wikipedia/commons/5/5d/Flag_of_the_United_States_%2823px%29.png
470,11.04.1999,,"The Four Horsemen(Chris Benoit&Dean Malenko) defeatPerry Saturn&Raven(14:11)WCW Spring Stampede 1999 - """"The Good. The Bad. The Showdown.""- Pay Per View @ Tacoma Dome in Tacoma, Washington, USA",https://upload.wikimedia.org/wikipedia/commons/5/5d/Flag_of_the_United_States_%2823px%29.png
471,05.04.1999,,"WCW World Tag Team Title:Kidman&Rey Mysterio Jr.(c) defeatPerry Saturn&Raven(7:17)WCW Monday NITRO #186- TV-Show @ MGM Grand Arena in Las Vegas, Nevada, USA",https://upload.wikimedia.org/wikipedia/commons/5/5d/Flag_of_the_United_States_%2823px%29.png
472,01.04.1999,,"Perry Saturn&RavendefeatBobby Duncum Jr.&Mike Enos(6:11)WCW Thunder #57- TV-Show @ Richmond Coliseum in Richmond, Virginia, USA",https://upload.wikimedia.org/wikipedia/commons/5/5d/Flag_of_the_United_States_%2823px%29.png
473,30.03.1999,,"Perry Saturn&RavendefeatScott Armstrong&Silver KingWCW Saturday Night- TV-Show @ Kitchener Memorial Auditorium in Kitchener, Ontario, Canada",https://upload.wikimedia.org/wikipedia/commons/5/5d/Flag_of_the_United_States_%2823px%29.png
474,28.03.1999,,"Perry SaturndefeatsChris JerichoWCW House Show- House Show @ Wings Stadium in Kalamazoo, Michigan, USA",https://upload.wikimedia.org/wikipedia/commons/5/5d/Flag_of_the_United_States_%2823px%29.png
475,27.03.1999,,"Perry SaturndefeatsChris JerichoWCW House Show- House Show @ The Palace of Auburn Hills in Auburn Hills, Michigan, USA",https://upload.wikimedia.org/wikipedia/commons/5/5d/Flag_of_the_United_States_%2823px%29.png
476,26.03.1999,,"Perry SaturndefeatsChris JerichoWCW House Show- House Show @ Morran Arena in Port Huron, Michigan, USA",https://upload.wikimedia.org/wikipedia/commons/5/5d/Flag_of_the_United_States_%2823px%29.png
477,22.03.1999,,"WCW World Tag Team Title:Chris Benoit&Dean Malenko(c) defeatPerry Saturn&Ravenby DQ (9:58)WCW Monday NITRO #184 - Spring Break-Out 1999- TV-Show @ Club La Vela in Panama City Beach, Florida, USA",https://upload.wikimedia.org/wikipedia/commons/5/5d/Flag_of_the_United_States_%2823px%29.png
478,18.03.1999,,"WCW United States Heavyweight TitleTournament First Round:Booker TdefeatsPerry Saturn(9:17)WCW Thunder #56- TV-Show @ Rupp Arena in Lexington, Kentucky, USA",https://upload.wikimedia.org/wikipedia/commons/5/5d/Flag_of_the_United_States_%2823px%29.png
479,17.03.1999,,"Perry SaturndefeatsChris JerichoWCW House Show- House Show @ Hara Arena Conference & Exhibition Center in Dayton, Ohio, USA",https://upload.wikimedia.org/wikipedia/commons/5/5d/Flag_of_the_United_States_%2823px%29.png
480,16.03.1999,,"Chris JerichodefeatsPerry Saturnby DQWCW Saturday Night- TV-Show @ Sports Arena in Toledo, Ohio, USA",https://upload.wikimedia.org/wikipedia/commons/5/5d/Flag_of_the_United_States_%2823px%29.png
481,14.03.1999,,"Dog Collar:Perry SaturndefeatsChris Jericho(11:50)WCW Uncensored 1999- Pay Per View @ Freedom Hall in Louisville, Kentucky, USA",https://upload.wikimedia.org/wikipedia/commons/5/5d/Flag_of_the_United_States_%2823px%29.png
482,07.03.1999,,"Perry SaturndefeatsChris JerichoWCW House Show- House Show @ Blue Cross Arena in Rochester, New York, USA",https://upload.wikimedia.org/wikipedia/commons/5/5d/Flag_of_the_United_States_%2823px%29.png
483,06.03.1999,,"Perry SaturndefeatsChris JerichoWCW House Show- House Show @ Stabler Arena in Bethlehem, Pennsylvania, USA",https://upload.wikimedia.org/wikipedia/commons/5/5d/Flag_of_the_United_States_%2823px%29.png
484,05.03.1999,,"Perry SaturndefeatsChris JerichoWCW House Show- House Show @ Civic Center in Florence, South Carolina, USA",https://upload.wikimedia.org/wikipedia/commons/5/5d/Flag_of_the_United_States_%2823px%29.png
485,03.03.1999,,"Perry SaturndefeatsChris JerichoWCW House Show- House Show @ Ramsey Center Coliseum in Cullowhee, North Carolina, USA",https://upload.wikimedia.org/wikipedia/commons/5/5d/Flag_of_the_United_States_%2823px%29.png
486,02.03.1999,,"Perry SaturndefeatsEl DandyWCW Saturday Night- TV-Show @ Winthrop University in Rock Hill, South Carolina, USA",https://upload.wikimedia.org/wikipedia/commons/5/5d/Flag_of_the_United_States_%2823px%29.png
487,01.03.1999,,"Hugh MorrusdefeatsPerry Saturn(9:26)WCW Monday NITRO #181- TV-Show @ Dean Smith Centre in Chapel Hill, North Carolina, USA",https://upload.wikimedia.org/wikipedia/commons/5/5d/Flag_of_the_United_States_%2823px%29.png
488,28.02.1999,,"Perry SaturndefeatsThe BarbarianWCW House Show- House Show @ BI-LO Center in Greenville, South Carolina, USA",https://upload.wikimedia.org/wikipedia/commons/5/5d/Flag_of_the_United_States_%2823px%29.png
489,21.02.1999,,"Chris JerichodefeatsPerry Saturnby Count Out (11:17)WCW SuperBrawl IX- Pay Per View @ Oakland Arena in Oakland, California, USA",https://upload.wikimedia.org/wikipedia/commons/5/5d/Flag_of_the_United_States_%2823px%29.png
490,16.02.1999,,"Perry SaturndefeatsSgt. Buddy Lee ParkerWCW Saturday Night- TV-Show @ Lakeland, Florida, USA",https://upload.wikimedia.org/wikipedia/commons/5/5d/Flag_of_the_United_States_%2823px%29.png
491,15.02.1999,,"Jerry FlynndefeatsPerry Saturn(8:03)WCW Monday NITRO #179- TV-Show @ Florida State Fairgrounds in Tampa, Florida, USA",https://upload.wikimedia.org/wikipedia/commons/5/5d/Flag_of_the_United_States_%2823px%29.png
492,02.02.1999,,"Perry SaturndefeatsDave TaylorWCW Saturday Night- TV-Show @ LaCrosse Center in LaCrosse, Wisconsin, USA",https://upload.wikimedia.org/wikipedia/commons/5/5d/Flag_of_the_United_States_%2823px%29.png
493,25.01.1999,,"Perry SaturndefeatsNorman Smiley(10:46)WCW Monday NITRO #176- TV-Show @ Reunion Arena in Dallas, Texas, USA",https://upload.wikimedia.org/wikipedia/commons/5/5d/Flag_of_the_United_States_%2823px%29.png
494,23.01.1999,,"King Of The Beach Crown Six Man Battle Royal:Chris JerichodefeatsBilly KidmanandChavo Guerrero Jr.andHugh MorrusandPerry SaturnandRey Mysterio Jr.(8:48)WCW MTV Beach Brawl- TV-Show @ Fat Tuesday in Cancun, Mexiko",https://upload.wikimedia.org/wikipedia/commons/5/5d/Flag_of_the_United_States_%2823px%29.png
495,21.01.1999,,"Perry SaturndefeatsAl Green(2:53)WCW Thunder #47- TV-Show @ Market Square Arena in Indianapolis, Indiana, USA",https://upload.wikimedia.org/wikipedia/commons/5/5d/Flag_of_the_United_States_%2823px%29.png
496,19.01.1999,,"Perry SaturndefeatsBobby BlazeWCW Saturday Night- TV-Show @ Hara Arena Conference & Exhibition Center in Dayton, Ohio, USA",https://upload.wikimedia.org/wikipedia/commons/5/5d/Flag_of_the_United_States_%2823px%29.png
497,18.01.1999,,"Scott SteinerdefeatsPerry Saturn(6:04)WCW Monday NITRO #175- TV-Show @ Value City Arena at The Jerome Schottenstein Center in Columbus, Ohio, USA",https://upload.wikimedia.org/wikipedia/commons/5/5d/Flag_of_the_United_States_%2823px%29.png
498,17.01.1999,,"Loser Wears A Dress:Chris JerichodefeatsPerry Saturn(11:44)WCW Souled Out 1999- Pay Per View @ Charleston Civic Center in Charleston, West Virginia, USA",https://upload.wikimedia.org/wikipedia/commons/5/5d/Flag_of_the_United_States_%2823px%29.png
499,11.01.1999,,"The CatdefeatsPerry Saturnby DQ (4:28)WCW Monday NITRO #174- TV-Show @ Thompson-Boling Arena at Food City Center in Knoxville, Tennessee, USA",https://upload.wikimedia.org/wikipedia/commons/5/5d/Flag_of_the_United_States_%2823px%29.png
500,07.01.1999,,"The CatdefeatsPerry Saturn(3:04)WCW Thunder #45- TV-Show @ Richmond Coliseum in Richmond, Virginia, USA",https://upload.wikimedia.org/wikipedia/commons/5/5d/Flag_of_the_United_States_%2823px%29.png
501,05.01.1999,,"Villano VdefeatsPerry SaturnWCW Saturday Night Taping- Event @ Georgia Mountains Center in Gainesville, Georgia, USA",https://upload.wikimedia.org/wikipedia/commons/5/5d/Flag_of_the_United_States_%2823px%29.png
502,04.01.1999,,"Chris JerichodefeatsSaturnby DQ (8:12)WCW Monday NITRO #173- TV-Show @ Georgia Dome in Atlanta, Georgia, USA",https://upload.wikimedia.org/wikipedia/commons/5/5d/Flag_of_the_United_States_%2823px%29.png
503,03.01.1999,,"Perry SaturndefeatsThe CatWCW House Show- House Show @ Civic Center in Columbus, Georgia, USA",https://upload.wikimedia.org/wikipedia/commons/5/5d/Flag_of_the_United_States_%2823px%29.png
504,02.01.1999,,"Perry SaturndefeatsThe CatWCW House Show- House Show @ Macon Coliseum in Macon, Georgia, USA",https://upload.wikimedia.org/wikipedia/commons/5/5d/Flag_of_the_United_States_%2823px%29.png
505,30.12.1998,,"SaturndefeatsFit FinlayWCW House Show- House Show @ First Union Spectrum in Philadelphia, Pennsylvania, USA",https://upload.wikimedia.org/wikipedia/commons/5/5d/Flag_of_the_United_States_%2823px%29.png
506,29.12.1998,,"SaturndefeatsFit FinlayWCW House Show- House Show @ Nassau Veterans Memorial Coliseum in Uniondale, New York, USA",https://upload.wikimedia.org/wikipedia/commons/5/5d/Flag_of_the_United_States_%2823px%29.png
507,27.12.1998,,"Perry SaturndefeatsThe Cat(7:07)WCW Starrcade 1998- Pay Per View @ MCI Center in Washington, District Of Columbia, USA",https://upload.wikimedia.org/wikipedia/commons/5/5d/Flag_of_the_United_States_%2823px%29.png
508,20.12.1998,,"SaturndefeatsFit FinlayWCW House Show- House Show @ Kemper Arena in Kansas City, Missouri, USA",https://upload.wikimedia.org/wikipedia/commons/5/5d/Flag_of_the_United_States_%2823px%29.png
509,19.12.1998,,"SaturndefeatsFit FinlayWCW House Show- House Show @ Shrine Mosque in Springfield, Missouri, USA",https://upload.wikimedia.org/wikipedia/commons/5/5d/Flag_of_the_United_States_%2823px%29.png
510,18.12.1998,,"Fit FinlaydefeatsSaturnWCW House Show- House Show @ Convention Center in Tulsa, Oklahoma, USA",https://upload.wikimedia.org/wikipedia/commons/5/5d/Flag_of_the_United_States_%2823px%29.png
