date,event,result,location,image_url
1,25.05.2017,,"Vaderdefeats The IronmanWrestleJam V- Event @ Colonnade Civic Center in Ringgold, Georgia, USA",https://upload.wikimedia.org/wikipedia/commons/f/fd/Big_Van_Vader_%281996%29.jpg
2,23.04.2017,,"Riki Choshu,Tatsumi Fujinami&VaderdefeatShiro Koshinaka,Takuma Sano&Yoshiaki Fujiwara(8:09)Dradition Tatsumi Fujinami Debut 45th Anniversary Tour In Osaka- Event @ EDION Arena Osaka #2 in Osaka, Japan",https://upload.wikimedia.org/wikipedia/commons/f/fd/Big_Van_Vader_%281996%29.jpg
3,22.04.2017,,"Koji Kanemoto,Shiro Koshinaka&Tatsumi FujinamidefeatTakuma Sano,Vader&Yoshiaki Fujiwara(10:30)Dradition Tatsumi Fujinami Debut 45th Anniversary Tour In Fukuoka- Event @ Hakata Starlanes in Fukuoka, Japan",https://upload.wikimedia.org/wikipedia/commons/f/fd/Big_Van_Vader_%281996%29.jpg
4,20.04.2017,,"Riki Choshu,Shiro Koshinaka&Tatsumi FujinamidefeatAKIRA,Keiji Muto&Vader(13:09)Dradition Tatsumi Fujinami Debut 45th Anniversary Tour In Tokyo- TV-Show @ Korakuen Hall in Tokyo, Japan",https://upload.wikimedia.org/wikipedia/commons/f/fd/Big_Van_Vader_%281996%29.jpg
5,11.03.2017,,"VaderdefeatsStan LeeBTW- Event @ Bluefield, West Virginia, USA",https://upload.wikimedia.org/wikipedia/commons/f/fd/Big_Van_Vader_%281996%29.jpg
6,10.03.2017,,"VaderdefeatsJeff Lewis NealBTW- Event @ Morganton, North Carolina, USA",https://upload.wikimedia.org/wikipedia/commons/f/fd/Big_Van_Vader_%281996%29.jpg
7,28.08.2016,,"Bob Evans,Gangrel&VaderdefeatFranky Vain, Jimmy Milonas &KongoTRP Summer Showdown 2016- Event @ Shaw's Conference Center in Brockton, Massachusetts, USA",https://upload.wikimedia.org/wikipedia/commons/f/fd/Big_Van_Vader_%281996%29.jpg
8,14.08.2016,,"VaderdefeatsSid ScalaXWA 42: The Summer Supershow- Event @ Charter Hall in Colchester, Essex, England, UK",https://upload.wikimedia.org/wikipedia/commons/f/fd/Big_Van_Vader_%281996%29.jpg
9,12.08.2016,,"VaderdefeatsWill Ospreay(6:44)RevPro Uprising 2016- Event @ York Hall in London, England, UK",https://upload.wikimedia.org/wikipedia/commons/f/fd/Big_Van_Vader_%281996%29.jpg
10,12.09.2015,,"The Steiner Brothers(Rick Steiner&Scott Steiner) defeatAndrew Anderson&Big Van VaderDoIt2It- Event @ Tulsa Fairgrounds Pavillion in Tulsa, Oklahoma, USA",https://upload.wikimedia.org/wikipedia/commons/f/fd/Big_Van_Vader_%281996%29.jpg
11,11.09.2015,,"Big Van Vader&Drake GallowsdefeatLargus RagnaBrok&Rick RussoMSWA- Event @ Plaza Mayor in Oklahoma City, Oklahoma, USA",https://upload.wikimedia.org/wikipedia/commons/f/fd/Big_Van_Vader_%281996%29.jpg
12,29.08.2015,,"Big Van VaderdefeatsDamon DivineAPWA Gold Rush II- Event @ Shinnston, West Virginia, USA",https://upload.wikimedia.org/wikipedia/commons/f/fd/Big_Van_Vader_%281996%29.jpg
13,02.08.2015,,"VaderdefeatsSonny ViceARW Arena Warfare- Event @ Hara Arena in Dayton, Ohio, USA",https://upload.wikimedia.org/wikipedia/commons/f/fd/Big_Van_Vader_%281996%29.jpg
14,24.06.2015,,"VaderdefeatsBramby DQ (3:40)IMPACT Wrestling #571- TV-Show @ Universal Studios in Orlando, Florida, USA",https://upload.wikimedia.org/wikipedia/commons/f/fd/Big_Van_Vader_%281996%29.jpg
15,29.11.2014,,"WrestleCade Title#1 Contendership 25 Man Battle Royal:Sean WaltmandefeatsBobby FultonandCaleb KonleyandCody HallandColt CabanaandCW AndersonandDeimosandHollywood NovaandJimmy ValiantandLittle GuidoandLodiandMr. 450andRick SteinerandSabuandShane DouglasandSonjay DuttandSteve CorinoandStevie RichardsandStroandThe Blue MeanieandThe PatriotandTracy SmothersandVaderandZane DawsonandZane RileyWrestleCade 2014- Event @ Benton Convention Center in Winstom Salem, North Carolina, USA",https://upload.wikimedia.org/wikipedia/commons/f/fd/Big_Van_Vader_%281996%29.jpg
16,02.11.2014,,"Big Van Vader&Jesse WhitedefeatThe Saints Of Pro Wrestling(Scott Sanders&Shawn Sanders)MSWA- Event @ Farmers Market in Oklahoma City, Oklahoma, USA",https://upload.wikimedia.org/wikipedia/commons/f/fd/Big_Van_Vader_%281996%29.jpg
17,13.09.2014,,"Big Van Vader, Houston &Jesse Whitedefeat Big Red,Simon Reed& TJ O'RileyUCW Ashlynn McClure Memorial 2- Event @ Bill Dundee Battlezone in Union City, Tennessee, USA",https://upload.wikimedia.org/wikipedia/commons/f/fd/Big_Van_Vader_%281996%29.jpg
18,05.04.2014,,"Fallah,Harley&VaderdefeatTeam Torment(Jack Gallow&Jason Kross) &Abdul NasirWOW Hostile Takeover- Event @ Bishop Ford Central Catholic High School in New York City, New York, USA",https://upload.wikimedia.org/wikipedia/commons/f/fd/Big_Van_Vader_%281996%29.jpg
19,29.03.2014,,"Vaderdefeats ShadyNEFW Slamrock 2- Event @ West Springfield United Methodist Church in West Springfield, Massachusetts, USA",https://upload.wikimedia.org/wikipedia/commons/f/fd/Big_Van_Vader_%281996%29.jpg
20,28.03.2014,,"VaderdefeatsJimmy PrestonNEW Wrestlefest 18- Event @ Crosby High School in Waterbury, Connecticut, USA",https://upload.wikimedia.org/wikipedia/commons/f/fd/Big_Van_Vader_%281996%29.jpg
21,08.03.2014,,"VaderdefeatsJohn BryerBTW- Event @ Oxford Hills Comprehensive High School in South Paris, Maine, USA",https://upload.wikimedia.org/wikipedia/commons/f/fd/Big_Van_Vader_%281996%29.jpg
22,07.03.2014,,"VaderdefeatsAaron AmadeusBTW- Event @ St. Michael's Hall in Lynn, Massachusetts, USA",https://upload.wikimedia.org/wikipedia/commons/f/fd/Big_Van_Vader_%281996%29.jpg
23,01.03.2014,,"VaderdefeatsZane RileyBTW- Event @ Prince George High School in Prince George, Virginia, USA",https://upload.wikimedia.org/wikipedia/commons/f/fd/Big_Van_Vader_%281996%29.jpg
24,28.02.2014,,"BTW Heavyweight  Title:Flex Armstrong(c) vs.Vader- No ContestBTW- Event @ Spartanburg Memorial Auditorium in Spartanburg, South Carolina, USA",https://upload.wikimedia.org/wikipedia/commons/f/fd/Big_Van_Vader_%281996%29.jpg
25,28.12.2013,,"VaderdefeatsDrolixMCW Tribute To Legends- Event @ The New Green Room in Dundalk, Maryland, USA",https://upload.wikimedia.org/wikipedia/commons/f/fd/Big_Van_Vader_%281996%29.jpg
26,08.12.2013,,"Vader&WolfgangdefeatJack Jester&James ScottBCW No Blood, No Sympathy XI - Tag 2- Event @ Grand Hall in Kilmarnock, East Ayrshire, Scotland, UK",https://upload.wikimedia.org/wikipedia/commons/f/fd/Big_Van_Vader_%281996%29.jpg
27,07.12.2013,,"Grado&VaderdefeatRed Lightning&TJ RageBCW No Blood, No Sympathy XI - Tag 1- Event @ Ballerup Hall in East Kilbride, South Lanarkshire, Scotland, UK",https://upload.wikimedia.org/wikipedia/commons/f/fd/Big_Van_Vader_%281996%29.jpg
28,06.12.2013,,"Dave MastiffdefeatsVaderby DQ (3:10)PCW Festive Fury 3- Event @ Evoque in Preston, Lancashire, England, UK",https://upload.wikimedia.org/wikipedia/commons/f/fd/Big_Van_Vader_%281996%29.jpg
29,23.11.2013,,"Marek Brave,Shane Hollister&Vaderdefeat The Fallen Idol Army (Christian Rose,Markus Crane&Tyler Priegel)SCW Vader Time- Event @ Walcott Coliseum in Walcott, Iowa, USA",https://upload.wikimedia.org/wikipedia/commons/f/fd/Big_Van_Vader_%281996%29.jpg
30,16.11.2013,,"Big Van VaderdefeatsJustin Credible(6:11)PWS Wrestle Bowl- Pay Per View @ Center Circle in Rahway, New Jersey, USA",https://upload.wikimedia.org/wikipedia/commons/f/fd/Big_Van_Vader_%281996%29.jpg
31,11.05.2013,,"Big Van Vader&Fast EddiedefeatJD Smooth&Kyle WinantFWF- Event @ St. Catherine's Church Hall in North Middletown, New Jersey, USA",https://upload.wikimedia.org/wikipedia/commons/f/fd/Big_Van_Vader_%281996%29.jpg
32,27.04.2013,,"Big Van Vader& LB Johnson defeatDanny Demanto&JD SmoothFWF- Event @ The Elk's Lodge in Brick, New Jersey, USA",https://upload.wikimedia.org/wikipedia/commons/f/fd/Big_Van_Vader_%281996%29.jpg
33,20.04.2013,,"ECPW Heavyweight Title:Big Van VaderdefeatsAndrew Anderson(c) by Count Out (6:02)ECPW Five Boros- Event @ Our Lady Of Guadalupe School in New York City, New York, USA",https://upload.wikimedia.org/wikipedia/commons/f/fd/Big_Van_Vader_%281996%29.jpg
34,13.04.2013,,"Two On One Handicap:VaderdefeatsChest Flexor&Corey Futuristic(3:49)IWC Night Of The Superstars 2- Event @ Meadville Area High School in Meadville, Pennsylvania, USA",https://upload.wikimedia.org/wikipedia/commons/f/fd/Big_Van_Vader_%281996%29.jpg
35,05.04.2013,,"Big Van VaderdefeatsAC GamblePWS Super Card 2013 - Tag 2- Pay Per View @ SMG Sports Plex in Metuchen, New Jersey, USA",https://upload.wikimedia.org/wikipedia/commons/f/fd/Big_Van_Vader_%281996%29.jpg
36,17.03.2013,,"XWA Heavyweight Title:Vader(c) defeatsKristian FrostXWA It's Time- Event @ West Warwick Civic Center in West Warwick, Rhode Island, USA",https://upload.wikimedia.org/wikipedia/commons/f/fd/Big_Van_Vader_%281996%29.jpg
37,11.12.2012,,"Big Van Vader&Keiji MutodefeatBambikiller&Franz Dynamite(6:22)AJPW 40th Anniversary Final Tour 2012 - Tag 6- TV-Show @ Nagano White Ring in Nagano, Japan",https://upload.wikimedia.org/wikipedia/commons/f/fd/Big_Van_Vader_%281996%29.jpg
38,08.12.2012,,"SMOP(Akebono&Ryota Hama) &Big Van VaderdefeatLast Revolution(Joe Doering&Suwama) &Yasufumi Nakanoue(8:23)AJPW 40th Anniversary Final Tour 2012 - Tag 5- Event @ Kimitsu Citizen Gymnasium in Kimitsu, Chiba, Japan",https://upload.wikimedia.org/wikipedia/commons/f/fd/Big_Van_Vader_%281996%29.jpg
39,07.12.2012,,"Big Van Vader,Keiji Muto&KENSOdefeatBambikiller,Franz Dynamite&MAZADA(10:40)AJPW 40th Anniversary Final Tour 2012 - Tag 4- TV-Show @ Niigata City Gymnasium in Niigata, Japan",https://upload.wikimedia.org/wikipedia/commons/f/fd/Big_Van_Vader_%281996%29.jpg
40,12.10.2012,,"Big Van Vader&RikishidefeatEnhancement Talent(Jobber Dustin&Jobber Justin)PWS House Party 5- Event @ Rahway Rec Center in Rahway, New Jersey, USA",https://upload.wikimedia.org/wikipedia/commons/f/fd/Big_Van_Vader_%281996%29.jpg
41,06.10.2012,,"Big Van VaderdefeatsMad Man PondoPWF Making A Statement- Event @ Corbin Civic Center in Corbin, Kentucky, USA",https://upload.wikimedia.org/wikipedia/commons/f/fd/Big_Van_Vader_%281996%29.jpg
42,29.09.2012,,"Big Van Vader&GoldustdefeatBruce Santee&Kory ChavisNWA Ring Warriors Battle In The Bahamas 2: Return Of The Ring Warriors- Event @ The Kendal Isaacs Gymnasium in Nassau, Bahamas",https://upload.wikimedia.org/wikipedia/commons/f/fd/Big_Van_Vader_%281996%29.jpg
43,22.09.2012,,"VaderdefeatsTony NeseNEW Wrestling Under The Stars- Event @ The Dutchess Stadium in Fishkill, New York, USA",https://upload.wikimedia.org/wikipedia/commons/f/fd/Big_Van_Vader_%281996%29.jpg
44,08.09.2012,,"VaderdefeatsJesse NealNWA Ring Warriors September Storm- Event @ The German American Clubhouse in Hollywood, Florida, USA",https://upload.wikimedia.org/wikipedia/commons/f/fd/Big_Van_Vader_%281996%29.jpg
45,12.08.2012,,"Scott Steiner&VaderdefeatRoderick Street& Shaun SummersJCW Bloodymania 6- Pay Per View @ Hogrock Campground in Cave-In-Rock, Illinois, USA",https://upload.wikimedia.org/wikipedia/commons/f/fd/Big_Van_Vader_%281996%29.jpg
46,11.06.2012,,"VaderdefeatsHeath Slater(3:20)WWE Monday Night RAW #994- TV-Show @ XL Center in Hartford, Connecticut, USA",https://upload.wikimedia.org/wikipedia/commons/f/fd/Big_Van_Vader_%281996%29.jpg
47,02.06.2012,,"2 Cold Scorpio&Big Van VaderdefeatReality Check(Devon Moore&Jay Lethal) (15:43)PWS Five Year Anniversary Weekend - Tag 2- Pay Per View @ Rahway Rec Center in Rahway, New Jersey, USA",https://upload.wikimedia.org/wikipedia/commons/f/fd/Big_Van_Vader_%281996%29.jpg
48,01.06.2012,,"Big Van Vaderdefeats2 Cold Scorpio(9:33)PWS Five Year Anniversary Weekend - Tag 1- Pay Per View @ Rahway Recreation Center in Rahway, New Jersey, USA",https://upload.wikimedia.org/wikipedia/commons/f/fd/Big_Van_Vader_%281996%29.jpg
49,11.05.2012,,"VaderdefeatsJay BradleyRPW A Small Deadly Space- Event @ Teamster Auditorium in Chicago, Illinois, USA",https://upload.wikimedia.org/wikipedia/commons/f/fd/Big_Van_Vader_%281996%29.jpg
50,05.05.2012,,"Three Way:VaderdefeatsAlextremeandHandsome JFTOW #9- Event @ Centre Pierre Charbonneau in Montreal, Quebec, Canada",https://upload.wikimedia.org/wikipedia/commons/f/fd/Big_Van_Vader_%281996%29.jpg
51,14.04.2012,,"VaderdefeatsNecro Butcher(5:49)PWS- Event @ Doubletree By Hilton in Toronto, Ontario, Canada",https://upload.wikimedia.org/wikipedia/commons/f/fd/Big_Van_Vader_%281996%29.jpg
52,31.03.2012,,"Two On One Handicap:Vaderdefeats Rick Fury &Steve Stasiak(5:16)PWS Tribute To Championship Wrestling From Florida- Event @ Deauville Beach Resort in Miami Beach, Florida, USA",https://upload.wikimedia.org/wikipedia/commons/f/fd/Big_Van_Vader_%281996%29.jpg
53,16.03.2012,,"Big Van VaderdefeatsTiger Shark(6:36)RJPW Daybreak- TV-Show @ Korakuen Hall in Tokyo, Japan",https://upload.wikimedia.org/wikipedia/commons/f/fd/Big_Van_Vader_%281996%29.jpg
54,28.04.2011,,"Big Van Vadervs.Tatsumi Fujinami- Time Limit Draw (10:00)IGF Genome15- TV-Show @ Tokyo Dome City Hall in Tokyo, Japan",https://upload.wikimedia.org/wikipedia/commons/f/fd/Big_Van_Vader_%281996%29.jpg
55,27.03.2011,,"Big Van Vader&Jesse WhitedefeatDaichi Hashimoto&Shinjiro Otani(16:32)ZERO1 Yasukuni Shrine Festival- TV-Show @ Yasukuni Shrine Sumo Wrestling Place in Tokyo, Japan",https://upload.wikimedia.org/wikipedia/commons/f/fd/Big_Van_Vader_%281996%29.jpg
56,25.03.2011,,"Big Van Vader,Jesse White&Tomohiko HashimotodefeatKintaro Kanemura,Tetsuhiro Kuroda&Tomohiro Waki(14:18)Apache Pro- Event @ Shin-Kiba 1st RING in Tokyo, Japan",https://upload.wikimedia.org/wikipedia/commons/f/fd/Big_Van_Vader_%281996%29.jpg
57,21.03.2011,,"Big Van Vader,Jesse White&Ryota HamadefeatVoodoo Murders(MAZADA,Rene Dupree&TARU) (12:16)AJPW Pro-Wrestling Love In Ryogoku Vol. 11- Pay Per View @ Ryogoku Kokugikan in Tokyo, Japan",https://upload.wikimedia.org/wikipedia/commons/f/fd/Big_Van_Vader_%281996%29.jpg
58,29.04.2010,,"Big Van Vader,Jesse White&ScorpiodefeatMakoto Hashi,Tamon Honda&Tatsumi Fujinami(22:55)Team Vader Vader Time 5 ~ Return Of The Emperor ~- Event @ Shinjuku FACE in Tokyo, Japan",https://upload.wikimedia.org/wikipedia/commons/f/fd/Big_Van_Vader_%281996%29.jpg
59,18.04.2010,,"Big Van Vader,Jesse White&The Bad BoydefeatDane Griffin,Shane Rawls&XaviorMSWA- Event @ Golden Goose Flea Market in Midwest City, Oklahoma, USA",https://upload.wikimedia.org/wikipedia/commons/f/fd/Big_Van_Vader_%281996%29.jpg
60,08.10.2006,,"Manabu Nakanishi,Michiyoshi Ohara&Super Strong MachinedefeatBig Van Vader&Makai Club(Makai 11& Makai 14) (8:53)NJPW WRESTLE LAND 5- TV-Show @ Korakuen Hall in Tokyo, Japan",https://upload.wikimedia.org/wikipedia/commons/f/fd/Big_Van_Vader_%281996%29.jpg
61,03.09.2006,,"Big Van Vader&Makai Club(Makai 12 & Makai 13) defeatMichiyoshi Ohara,Super Strong Machine&Taichi Ishikari(13:34)NJPW WRESTLE LAND 4- TV-Show @ Korakuen Hall in Tokyo, Japan",https://upload.wikimedia.org/wikipedia/commons/f/fd/Big_Van_Vader_%281996%29.jpg
62,17.07.2006,,"Dick Togo&Great Sasukedefeat Soul Tiger &Vader(7:42)Shinjuku Pro Wrestling Final- Event @ Kabukicho Club Heights in Tokyo, Japan",https://upload.wikimedia.org/wikipedia/commons/f/fd/Big_Van_Vader_%281996%29.jpg
63,16.07.2006,,"Gauntlet:726,Antonio Koinoki,Kazuhiro Tamura,Kyosuke Sasaki&Shuji IshikawadefeatBig Van Vader(15:59)MAKEHEN 2006- TV-Show @ Shin-Kiba 1st RING in Tokyo, Japan",https://upload.wikimedia.org/wikipedia/commons/f/fd/Big_Van_Vader_%281996%29.jpg
64,27.05.2006,,"Ten Man Battle Royal:VaderdefeatsAngeloandDaniel CrossandDerek StoneandKeith WalkerandKraig KeesamanandNasty BillandRicky MurdockandTy DaltonandWade ChismWLW- Event @ Admiral Coontz Armory in Hannibal, Missouri, USA",https://upload.wikimedia.org/wikipedia/commons/f/fd/Big_Van_Vader_%281996%29.jpg
65,19.03.2006,,"Bad Boy,Big Van Vader&Michael FaithdefeatThe Real Impact Players(Aaron Neil&Se7en) &Angel WilliamsMSWA- Event @ City Nights Event Center in Oklahoma City, Oklahoma, USA",https://upload.wikimedia.org/wikipedia/commons/f/fd/Big_Van_Vader_%281996%29.jpg
66,18.03.2006,,"IZW TitleSteel Cage:Aaron NeildefeatsBig Van Vader(c) -TITLE CHANGE !!!IZW March Mayhem- Event @ Great Plains Coliseum in Lawton, Oklahoma, USA",https://upload.wikimedia.org/wikipedia/commons/f/fd/Big_Van_Vader_%281996%29.jpg
67,10.02.2006,,"Big Van Vaderdefeats Ace GigoloRCW Physical Distortion- Event @ Portsmouth, Ohio, USA",https://upload.wikimedia.org/wikipedia/commons/f/fd/Big_Van_Vader_%281996%29.jpg
68,08.02.2006,,"Two On One Handicap:Big Van VaderdefeatsCrowza&The Juggulator(2:58)IWA East Coast A Need To Bleed 2006- Event @ South Charleston Community Center in South Charleston, West Virginia, USA",https://upload.wikimedia.org/wikipedia/commons/f/fd/Big_Van_Vader_%281996%29.jpg
69,15.01.2006,,"Big Van VaderdefeatsJon DavisMSWA- Event @ City Nights Event Center in Oklahoma City, Oklahoma, USA",https://upload.wikimedia.org/wikipedia/commons/f/fd/Big_Van_Vader_%281996%29.jpg
70,14.01.2006,,"IZW Title:Big Van Vader(c) defeatsAaron NeilIZW- Event @ Salvation Army Boys & Girls Club in Lawton, Oklahoma, USA",https://upload.wikimedia.org/wikipedia/commons/f/fd/Big_Van_Vader_%281996%29.jpg
71,10.12.2005,,"Big Van Vader& The Old School Assassins (Brad Michaels&Dexter Hardaway) vs.Impact Inc.(Aaron Neil,Bernie Donderwitz&John Zorthos) - Double DQIZW- Event @ Salvation Army Boys & Girls Club in Lawton, Oklahoma, USA",https://upload.wikimedia.org/wikipedia/commons/f/fd/Big_Van_Vader_%281996%29.jpg
72,10.12.2005,,"The Angry Americans(Bad Boy&Glen Steel) &Big Van VaderdefeatAl Farat,Slash bin Rotten&The OutlawMSWA- Event @ Pan American Concert Hall in Oklahoma City, Oklahoma, USA",https://upload.wikimedia.org/wikipedia/commons/f/fd/Big_Van_Vader_%281996%29.jpg
73,26.11.2005,,"Big Van VaderdefeatsDanny DemantoUXW Pure Torture- Event @ Skate Safe America in Old Bethpage, New York, USA",https://upload.wikimedia.org/wikipedia/commons/f/fd/Big_Van_Vader_%281996%29.jpg
74,19.11.2005,,"The Disciples Of Allah (Al Farat&Kareem Sadat) &Slash bin RottendefeatThe Patriots(Bad Boy&Glen Steel) &Big Van VaderMSWA- Event @ Pan American Concert Hall in Oklahoma City, Oklahoma, USA",https://upload.wikimedia.org/wikipedia/commons/f/fd/Big_Van_Vader_%281996%29.jpg
75,19.11.2005,,"IZW Title:Big Van Vader(c) defeatsBrandon Bishopby DQIZW- Event @ Salvation Army Boys & Girls Club in Lawton, Oklahoma, USA",https://upload.wikimedia.org/wikipedia/commons/f/fd/Big_Van_Vader_%281996%29.jpg
76,22.10.2005,,"IZW Title:Big Van VaderdefeatsAaron Neil(c) -TITLE CHANGE !!!IZW- Event @ National Guard Armory in Lawton, Oklahoma, USA",https://upload.wikimedia.org/wikipedia/commons/f/fd/Big_Van_Vader_%281996%29.jpg
77,22.10.2005,,"Two On One Handicap:Big Van VaderdefeatsJohn O'Malley&StrikerMSWA- Event @ Pan American Concert Hall in Oklahoma City, Oklahoma, USA",https://upload.wikimedia.org/wikipedia/commons/f/fd/Big_Van_Vader_%281996%29.jpg
78,24.09.2005,,"Brad Michaels,Dusty Rhodes&VaderdefeatAaron Neil&Impact Inc.(Bernie Donderwitz&John Zorthos)IZW September Slam- Event @ Great Plains Coliseum in Lawton, Oklahoma, USA",https://upload.wikimedia.org/wikipedia/commons/f/fd/Big_Van_Vader_%281996%29.jpg
79,25.07.2005,,"Big Van Vader&Tomohiko HashimotodefeatKenshin&Riki Senshu(9:09)DDT Summer Vacation 2005- TV-Show @ Korakuen Hall in Tokyo, Japan",https://upload.wikimedia.org/wikipedia/commons/f/fd/Big_Van_Vader_%281996%29.jpg
80,05.12.2004,,"Kohei Suwama Seven Match Trial Series #1:VaderdefeatsKohei Suwama(6:28)AJPW The Unchained World- TV-Show @ Ryogoku Kokugikan in Tokyo, Japan",https://upload.wikimedia.org/wikipedia/commons/f/fd/Big_Van_Vader_%281996%29.jpg
81,05.06.2004,,"Mike Awesome&VaderdefeatDan Maff&Samoa Joe(11:34)JAPW When Worlds Collide- Event @ Rahway Rec Center in Rahway, New Jersey, USA",https://upload.wikimedia.org/wikipedia/commons/f/fd/Big_Van_Vader_%281996%29.jpg
82,04.01.2004,,"Shinya HashimotodefeatsVaderby Count Out (9:59)HUSTLE 1- Pay Per View @ Saitama Super Arena in Saitama, Japan",https://upload.wikimedia.org/wikipedia/commons/f/fd/Big_Van_Vader_%281996%29.jpg
83,20.07.2003,,"Big VaderdefeatsDon Fryeby DQ (11:27)WJ MAGMA03- Pay Per View @ Ryogoku Kokugikan in Tokyo, Japan",https://upload.wikimedia.org/wikipedia/commons/f/fd/Big_Van_Vader_%281996%29.jpg
84,11.07.2003,,"Kensuke Sasaki&Shiro KoshinakadefeatBig Vader&Ichiro Yaguchi(11:51)WJ MAGMA02 Series 2003 - Tag 9- Event @ Niigata City Gymnasium in Niigata, Japan",https://upload.wikimedia.org/wikipedia/commons/f/fd/Big_Van_Vader_%281996%29.jpg
85,09.07.2003,,"Kensuke Sasaki&Shiro KoshinakadefeatBig Vader&Dick Togo(10:58)WJ MAGMA02 Series 2003 - Tag 8- Event @ Yamagata Sports Center Sub Arena in Yamagata, Japan",https://upload.wikimedia.org/wikipedia/commons/f/fd/Big_Van_Vader_%281996%29.jpg
86,08.07.2003,,"Dan Bobish&Todd ShanedefeatBig Vader&Dick Togo(10:57)WJ MAGMA02 Series 2003 - Tag 7- Event @ Iwate Prefectural Gymnasium in Morioka, Iwate, Japan",https://upload.wikimedia.org/wikipedia/commons/f/fd/Big_Van_Vader_%281996%29.jpg
87,07.07.2003,,"Big VaderdefeatsTodd Shane(4:25)WJ MAGMA02 Series 2003 - Tag 6- Event @ Ishinomaki City Gymnasium in Ishinomaki, Miyagi, Japan",https://upload.wikimedia.org/wikipedia/commons/f/fd/Big_Van_Vader_%281996%29.jpg
88,05.07.2003,,"Big VaderdefeatsBig Vito(6:24)WJ MAGMA02 Series 2003 - Tag 5- Event @ Aomori Budokan in Hirosaki, Aomori, Japan",https://upload.wikimedia.org/wikipedia/commons/f/fd/Big_Van_Vader_%281996%29.jpg
89,04.07.2003,,"Kensuke Sasaki&Riki ChoshudefeatBig Vader&Yoji Anjo(7:38)WJ MAGMA02 Series 2003 - Tag 4- Event @ Hachinohe City Gymnasium in Hachinohe, Aomori, Japan",https://upload.wikimedia.org/wikipedia/commons/f/fd/Big_Van_Vader_%281996%29.jpg
90,03.07.2003,,"Dan Bobish&Riki ChoshudefeatBig Vader&Kenzo Suzukiby DQ (7:18)WJ MAGMA02 Series 2003 - Tag 3- Event @ Asahikawa Citizen Center Gymnasium in Asahikawa, Hokkaido, Japan",https://upload.wikimedia.org/wikipedia/commons/f/fd/Big_Van_Vader_%281996%29.jpg
91,01.07.2003,,"The Road Warriors(Animal&Hawk) defeatBig Vader&Dick Togo(14:21)WJ MAGMA02 Series 2003 - Tag 2- Event @ Sapporo Teisen Hall in Sapporo, Hokkaido, Japan",https://upload.wikimedia.org/wikipedia/commons/f/fd/Big_Van_Vader_%281996%29.jpg
92,29.06.2003,,"Big Vadervs.Dan Bobish- No Contest (6:35)WJ MAGMA02 Series 2003 - Tag 1- TV-Show @ Hokkaido Sports Center in Sapporo, Hokkaido, Japan",https://upload.wikimedia.org/wikipedia/commons/f/fd/Big_Van_Vader_%281996%29.jpg
93,14.06.2003,,"Takao OmoridefeatsBig Vaderby DQ (6:06)WJ Prologue Of MAGMA02 Series 2003 - Tag 3- Event @ Differ Ariake in Tokyo, Japan",https://upload.wikimedia.org/wikipedia/commons/f/fd/Big_Van_Vader_%281996%29.jpg
94,09.06.2003,,"Big Vader&Steve MadisondefeatKoichiro Kimura&Takao Omori(10:44)WJ Prologue Of MAGMA02 Series 2003 - Tag 2- Event @ Isesaki Citizen Gymnasium in Isesaki, Gunma, Japan",https://upload.wikimedia.org/wikipedia/commons/f/fd/Big_Van_Vader_%281996%29.jpg
95,08.06.2003,,"Big VaderdefeatsKenzo Suzuki(7:27)WJ Prologue Of MAGMA02 Series 2003 - Tag 1- Event @ Hamamatsu City Gymnasium in Hamamatsu, Shizuoka, Japan",https://upload.wikimedia.org/wikipedia/commons/f/fd/Big_Van_Vader_%281996%29.jpg
96,31.05.2003,,"Dan Bobish&Kenzo SuzukidefeatBig Vader&Dick Togo(11:48)WJ May Storm Series 2003 - May Storm In Hiroshima- Event @ Hiroshima Sun Plaza in Hiroshima, Japan",https://upload.wikimedia.org/wikipedia/commons/f/fd/Big_Van_Vader_%281996%29.jpg
97,26.02.2003,,"Dusty Rhodes&VaderdefeatThe Harris Brothers(Don Harris&Ron Harris) by DQ (6:17)NWA Total Nonstop Action #34- Pay Per View @ Tennessee State Fairgrounds in Nashville, Tennessee, USA",https://upload.wikimedia.org/wikipedia/commons/f/fd/Big_Van_Vader_%281996%29.jpg
98,15.01.2003,,"Ron Harris&VaderdefeatMasato Tanaka&Shinjiro Otani(10:17)NOAH The First Navigation 2003 - Tag 2- Event @ Matsue City Messe in Matsue, Shimane, Japan",https://upload.wikimedia.org/wikipedia/commons/f/fd/Big_Van_Vader_%281996%29.jpg
99,13.01.2003,,"VaderdefeatsMakoto Hashi(6:01)NOAH The First Navigation 2003 - Tag 1- TV-Show @ KBS Hall in Kyoto, Japan",https://upload.wikimedia.org/wikipedia/commons/f/fd/Big_Van_Vader_%281996%29.jpg
100,07.12.2002,,"VaderdefeatsAkitoshi Saito(5:53)NOAH Navigation, Uprising Spirit 2002 - Tag 15- TV-Show @ Yokohama Bunka Gymnasium in Yokohama, Kanagawa, Japan",https://upload.wikimedia.org/wikipedia/commons/f/fd/Big_Van_Vader_%281996%29.jpg
101,05.12.2002,,"Bison Smith,Scorpio&VaderdefeatAkira Taue,Daisuke Ikeda&Takashi Sugiura(18:51)NOAH Navigation, Uprising Spirit 2002 - Tag 14- Event @ Ishioka Movement Park Gymnasium in Ishioka, Ibaraki, Japan",https://upload.wikimedia.org/wikipedia/commons/f/fd/Big_Van_Vader_%281996%29.jpg
102,04.12.2002,,"Scorpio&VaderdefeatJun Izumida&Kenta Kobashi(18:28)NOAH Navigation, Uprising Spirit 2002 - Tag 13- Event @ Kira Messe Numazu in Numazu, Shizuoka, Japan",https://upload.wikimedia.org/wikipedia/commons/f/fd/Big_Van_Vader_%281996%29.jpg
103,01.12.2002,,"GHC Tag Team Title:Akitoshi Saito&Jun Akiyama(c) defeatScorpio&Vader(20:07)NOAH Navigation, Uprising Spirit 2002 - Tag 12- TV-Show @ Tsukisamu Green Dome in Sapporo, Hokkaido, Japan",https://upload.wikimedia.org/wikipedia/commons/f/fd/Big_Van_Vader_%281996%29.jpg
104,30.11.2002,,"VaderdefeatsIZU(4:17)NOAH Navigation, Uprising Spirit 2002 - Tag 11- Event @ Asahikawa Citizen Center Gymnasium in Asahikawa, Hokkaido, Japan",https://upload.wikimedia.org/wikipedia/commons/f/fd/Big_Van_Vader_%281996%29.jpg
105,28.11.2002,,"Bison Smith,Scorpio&VaderdefeatTakashi Sugiura,Takuma Sano&Yoshinari Ogawa(16:26)NOAH Navigation, Uprising Spirit 2002 - Tag 10- Event @ Hachinohe City Gymnasium in Aomori, Japan",https://upload.wikimedia.org/wikipedia/commons/f/fd/Big_Van_Vader_%281996%29.jpg
106,26.11.2002,,"Scorpio&VaderdefeatJun Izumida&Takashi Sugiura(11:07)NOAH Navigation, Uprising Spirit 2002 - Tag 9- Event @ Odate Citizen Gymnasium in Akita, Japan",https://upload.wikimedia.org/wikipedia/commons/f/fd/Big_Van_Vader_%281996%29.jpg
107,24.11.2002,,"Bison Smith,Scorpio&VaderdefeatKishin Kawabata,Masashi Aoyagi&Takeshi Morishima(11:51)NOAH Navigation, Uprising Spirit 2002 - Tag 8- Event @ Miyagi Sports Center in Sendai, Miyagi, Japan",https://upload.wikimedia.org/wikipedia/commons/f/fd/Big_Van_Vader_%281996%29.jpg
