date,event,result,location,image_url
1,31.03.2022,,"Joey JaneladefeatsX-Pac(19:19)GCW Joey Janela's Spring Break 6 Part 1- Pay Per View @ Fair Park in Dallas, Texas, USA",https://upload.wikimedia.org/wikipedia/commons/d/d3/1-2-3_Kid_in_1995.jpg
2,25.02.2022,,"Joey Janela&X-PacdefeatThe Major Players(Brian Myers&Matt Cardona) (20:02)GCW Welcome To Heartbreak- Pay Per View @ Ukrainian Culture Center in Los Angeles, California, USA",https://upload.wikimedia.org/wikipedia/commons/d/d3/1-2-3_Kid_in_1995.jpg
3,04.04.2019,,"Hurricane Helms,Jushin Thunder Liger&X-PacdefeatRevolt!(Caleb Konley,Jake Manning&Zane Riley) (13:38)WrestleCon Mark Hitchcock Memorial SuperShow 2019- Pay Per View @ Hilton New York Midtown Ballroom in New York City, New York, USA",https://upload.wikimedia.org/wikipedia/commons/d/d3/1-2-3_Kid_in_1995.jpg
4,26.10.2018,,"Elimination:Team Insane Generation X (Billy Gunn,Grado,Lionheart,Sha Samuels&X-Pac) defeat Team Polo Promotions (Aaron Echo,Jackie Polo,Joe Coffey,Kenny Williams&Mark Coffey)SWA- Event @ Paisley Lagoon Leisure Centre in Paisley, Renfrewshire, Scotland, UK",https://upload.wikimedia.org/wikipedia/commons/d/d3/1-2-3_Kid_in_1995.jpg
5,19.10.2018,,"Buff Bagwell,Scott Norton&Sean WaltmandefeatDanny Adams,Kevin Lee Davidson&Mike OutlawGlory Pro Unsanctioned- Event @ Pop's Nightclub in Sauget, Illinois, USA",https://upload.wikimedia.org/wikipedia/commons/d/d3/1-2-3_Kid_in_1995.jpg
6,29.07.2018,,"Arik Cannon&Sean WaltmandefeatDarin Corbin&Rob JusticeHOW FortuneBaynia- Event @ Fortune Bay Resort & Casino in Tower, Minnesota, USA",https://upload.wikimedia.org/wikipedia/commons/d/d3/1-2-3_Kid_in_1995.jpg
7,13.07.2018,,"JT Dunn&X-PacdefeatKillanova Inc(Christian Casanova&Triplelicious)CW- Event @ Game Time Sports & Fitness Center in Lowell, Massachusetts, USA",https://upload.wikimedia.org/wikipedia/commons/d/d3/1-2-3_Kid_in_1995.jpg
8,23.06.2018,,"Nick Dinsmore&Sean WaltmandefeatThe Stud Club(AJ Smooth&Ray Feuring)IPW- Event @ The Keg Stand in Des Moines, Iowa, USA",https://upload.wikimedia.org/wikipedia/commons/d/d3/1-2-3_Kid_in_1995.jpg
9,28.04.2018,,"Randy Myers&X-PacdefeatDr. Kliever&DrexlDEFY Legendary- Event @ People's Center in Tacoma, Washington, USA",https://upload.wikimedia.org/wikipedia/commons/d/d3/1-2-3_Kid_in_1995.jpg
10,17.03.2018,,"Georgia Heat(Cody Roberts&Josh Cantrell) &X-PacdefeatCyrus The Destroyer,Josey Quinn&QT Marshall(13:58)GPW- Event @ Old Buffington Elementary School Gym in Canton, Georgia, USA",https://upload.wikimedia.org/wikipedia/commons/d/d3/1-2-3_Kid_in_1995.jpg
11,30.12.2017,,"Connor Braxton&Jake SomethingdefeatPACO&Sean Waltman(8:41)AAW Windy City Classic XIII- Event @ 115 Bourbon Street in Merrionette Park, Illinois, USA",https://upload.wikimedia.org/wikipedia/commons/d/d3/1-2-3_Kid_in_1995.jpg
12,27.11.2017,,"Concrete Davidson,Joey Ryan&X-PacdefeatThe Four Nations(Adam Hoffman,Jack Bonza&Mick Moretti)WSW International Assault Tour 2K17 - Tag 4- Event @ Penrith Panthers in Penrith, New South Wales, Australia",https://upload.wikimedia.org/wikipedia/commons/d/d3/1-2-3_Kid_in_1995.jpg
13,26.11.2017,,"Austin Aries&X-PacdefeatThe Basso Brothers(Chris Basso&Matt Basso)WSW International Assault Tour 2K17 - Tag 3- Event @ Tivoli Theatre in Fortitude Valley, Queensland, Australia",https://upload.wikimedia.org/wikipedia/commons/d/d3/1-2-3_Kid_in_1995.jpg
14,25.11.2017,,"Brodie Marshall&X-PacdefeatThe Rude Ones(Bulldog McKenzie&Marvel)WSW International Assault Tour 2K17 - Tag 2- Event @ Dom Polski Centre in Adelaide, South Australia, Australia",https://upload.wikimedia.org/wikipedia/commons/d/d3/1-2-3_Kid_in_1995.jpg
15,24.11.2017,,"Danny Psycho&X-PacdefeatThe Basso Brothers(Chris Basso&Matt Basso)WSW International Assault Tour 2K17 - Tag 1- Event @ South Eastern Entertainment Centre in Ferntree Gully, Victoria, Australia",https://upload.wikimedia.org/wikipedia/commons/d/d3/1-2-3_Kid_in_1995.jpg
16,21.10.2017,,"Team Bischoff (Buff Bagwell,Ed House,Richie Nightmare,Rockin' Rebel&X-Pac) defeat Team Smith (CM Serenyi,Eric Deshields,Louis G. Rich, Maxwell Abrams &Ty Reno)PWE Clash Of The Titans II- Event @ Zembo Shrine in Harrisburg, Pennsylvania, USA",https://upload.wikimedia.org/wikipedia/commons/d/d3/1-2-3_Kid_in_1995.jpg
17,07.10.2017,,"Shane Kody&X-Pacdefeat Clint Steele &Shane BallardBTW Salinas Spectacular- Event @ Salinas PAL Armory in Salinas, California, USA",https://upload.wikimedia.org/wikipedia/commons/d/d3/1-2-3_Kid_in_1995.jpg
18,06.10.2017,,"Chico Navarro,Shane Kody&X-PacdefeatThe Ballard Brothers(Shane Ballard&Shannon Ballard) &Devin DangerBTW 21st Anniversary Show- Event @ Irvington High School in Fremont, California, USA",https://upload.wikimedia.org/wikipedia/commons/d/d3/1-2-3_Kid_in_1995.jpg
19,07.09.2017,,"Ethan Carter III,JTG,Luchasaurus&X-PacdefeatBrian Cage,Eli Drake,Hot Young Briley&Joey Ryan(18:56)Bar Wrestling 4: Autumn In LA- Event @ 4725 Maine Avenue in Baldwin Park, California, USA",https://upload.wikimedia.org/wikipedia/commons/d/d3/1-2-3_Kid_in_1995.jpg
20,24.06.2017,,"The Models(Danny Hope&Joey Hayes) &X-PacdefeatIestyn Rees,Lionheart&Sha SamuelsPCW Tribute To The Troops 2017 - Show 3- Event @ Preston Guild Hall in Preston, Lancashire, England, UK",https://upload.wikimedia.org/wikipedia/commons/d/d3/1-2-3_Kid_in_1995.jpg
21,23.06.2017,,"Moose&X-PacdefeatIestyn Rees&Zack GibsonPCW Tribute To The Troops 2017 - Show 1- Event @ Evoque in Preston, Lancashire, England, UK",https://upload.wikimedia.org/wikipedia/commons/d/d3/1-2-3_Kid_in_1995.jpg
22,10.06.2017,,"Elijah Burke&X-PacdefeatThe Head Bangers(Mosh&Thrasher)FEW Summer Showdown 2- Event @ Coral Springs High School in Coral Springs, Florida, USA",https://upload.wikimedia.org/wikipedia/commons/d/d3/1-2-3_Kid_in_1995.jpg
23,06.05.2017,,"30 Man Battle Royal:Jacob Fatudefeats ??? and ??? and ??? andAmish JohnsonandBison BraddockandBobby HartandBoyce LeGrandeandChicano FlameandChris MastersandDalton FrostandGangrelandJody KristoffersonandJohnny DynamoandJu Dizzand Lucian D. Light andMatt CarlosandMichael ModestandMr. PrimetimeandNate CoyandPaul IsadoraandRik LuxuryandSir SamuraiandStykerandSuper BeastandSynnandThe Almighty SheikandThe Berkeley BrawlerandTony JonesandWillie MackandX-PacAPW Cow Palace Royale- Event @ Cow Palace in Daly City, California, USA",https://upload.wikimedia.org/wikipedia/commons/d/d3/1-2-3_Kid_in_1995.jpg
24,08.04.2017,,"Krotch&X-PacdefeatMason Beck&Matt CageSCW Epic 2017- Event @ Col Ballroom in Davenport, Iowa, USA",https://upload.wikimedia.org/wikipedia/commons/d/d3/1-2-3_Kid_in_1995.jpg
25,07.01.2017,,"MPX Tag Team Title:Jerome Daniels&X-PacdefeatDown To Fight(Andy Dalton&Scott McKenzie) (c) -TITLE CHANGE !!!MPX The X-Factor- Event @ MPX Event Center in Bedford, Texas, USA",https://upload.wikimedia.org/wikipedia/commons/d/d3/1-2-3_Kid_in_1995.jpg
26,18.11.2016,,"J. Spade&X-PacdefeatBu Ku Dao&Luke HawxWildKat- Event @ VR-54 Hangar in New Orleans, Louisiana, USA",https://upload.wikimedia.org/wikipedia/commons/d/d3/1-2-3_Kid_in_1995.jpg
27,30.10.2016,,"The Lads From The Flats(Paddy M&Workie) &X-PacdefeatThe Wards(Luther Ward, Paddy Ward &Rocky Mac)OTT Invasion Of The Bodyslams- Event @ Black Box Theatre in Galway, Co. Galway, Ireland",https://upload.wikimedia.org/wikipedia/commons/d/d3/1-2-3_Kid_in_1995.jpg
28,29.10.2016,,"The Kings Of The North(Bonesaw,Damien Corvin&Dunkan Disorderly) defeatAbyss,Tron&X-PacOTT Wrestlecon - Tag 2- Event @ Tivoli Theatre in Dublin, Ireland",https://upload.wikimedia.org/wikipedia/commons/d/d3/1-2-3_Kid_in_1995.jpg
29,28.10.2016,,"Grado,Martina&X-PacdefeatThe Gymnasties(B. Cool,Justin Shape&Sammy D)OTT Wrestlecon - Tag 1- Event @ Tivoli Theatre in Dublin, Ireland",https://upload.wikimedia.org/wikipedia/commons/d/d3/1-2-3_Kid_in_1995.jpg
30,15.10.2016,,"Johnny Clash&X-PacdefeatThe Taboo Crew(Craig Steele&Sandy Mann)WrestlePro- Event @ New York City, New York, USA",https://upload.wikimedia.org/wikipedia/commons/d/d3/1-2-3_Kid_in_1995.jpg
31,08.10.2016,,"Iceberg&X-PacdefeatCJ Awesome&Scotty BeachWrestleMerica- Event @ Barnesville Academy Gym in Barnesville, Georgia, USA",https://upload.wikimedia.org/wikipedia/commons/d/d3/1-2-3_Kid_in_1995.jpg
32,17.09.2016,,"Bobby Shields,Dirty Money&X-PacdefeatBlack Wallstreet(Aaron Ray,Chuck Lennox&Marcellus Prime)PCW  	Revolution Rumble- Event @ Ranson, West Virginia, USA",https://upload.wikimedia.org/wikipedia/commons/d/d3/1-2-3_Kid_in_1995.jpg
33,10.09.2016,,"Team Vergara (Eddie Vergara,Harold Rock&X-Pac) defeat Team Levy (Ariel Levy,Coke&Engranaje Jack)CNL Conflicto Internacional- Event @ Teatro Teleton in Santiago de Chile, Chile",https://upload.wikimedia.org/wikipedia/commons/d/d3/1-2-3_Kid_in_1995.jpg
34,04.09.2016,,"Tag Team Gauntlet:D-Generation X(Billy Gunn&X-Pac) defeatThe Devastation Corporation(Blaster McMassive&Flex Rumblecrunch) andN_R_G(Hype Rockwell&Race Jaxon) andRick Roland&Sloan CapriceandTeam Sea Stars(Ashley Vox&Delmi Exo) andLos Ice Creams(El Hijo del Ice Cream&Ice Cream Jr.) andDez Peloton(Donald Kluger&Jasper Tippins) andCornelius Crummels&Sonny DefargeandHermit Crab&Rock LobsterandThe Bloc Party(Prakash Sabar&The Proletariat Boar Of Moldova) andDrew Gulak&Orange Cassidy(41:50)CHIKARA King Of Trios 2016 - Tag 3- Event @ The Palmer Center in Easton, Pennsylvania, USA",https://upload.wikimedia.org/wikipedia/commons/d/d3/1-2-3_Kid_in_1995.jpg
35,19.08.2016,,"Marcus Lewis&X-PacdefeatJoey Ryan&The Berkeley BrawlerAPW Bay Area Bash- Event @ Pacelli Event Center in Daly City, California, USA",https://upload.wikimedia.org/wikipedia/commons/d/d3/1-2-3_Kid_in_1995.jpg
36,19.08.2016,,"DDT Iron Man Heavy Metal Title:X-PacdefeatsJoey Ryan(c) -TITLE CHANGE !!!APW Bay Area Bash- Event @ Pacelli Event Center in Daly City, California, USA",https://upload.wikimedia.org/wikipedia/commons/d/d3/1-2-3_Kid_in_1995.jpg
37,23.07.2016,,"Grado,Kenny Williams&X-PacdefeatAndy Wild,Joe Hendry&Stevie XavierPWE Five Year Anniversary - Tag 2: Dar Wars - The Final Episode- Event @ The Citadel in Ayr, South Ayrshire, Scotland, UK",https://upload.wikimedia.org/wikipedia/commons/d/d3/1-2-3_Kid_in_1995.jpg
38,22.07.2016,,"Billy Gunn&X-PacdefeatThe New Age Kliq(BT Gunn&Chris Renfrew)PWE Five Year Anniversary - Tag 1: Break It Down!- Event @ The Citadel in Ayr, South Ayrshire, Scotland, UK",https://upload.wikimedia.org/wikipedia/commons/d/d3/1-2-3_Kid_in_1995.jpg
39,16.07.2016,,"Billy Gunn&X-PacdefeatMontego Seeka&MooseIWR OklaMania 2016 - Tag 1- Event @ Firelake Arena in Shawnee, Oklahoma, USA",https://upload.wikimedia.org/wikipedia/commons/d/d3/1-2-3_Kid_in_1995.jpg
40,18.06.2016,,"Billy Gunn&X-PacdefeatThe Dixon Line Security(Joe Keys&Rob Locke)MCW Base Brawl- Event @ Blue Crabs Stadium in Waldorf, Maryland, USA",https://upload.wikimedia.org/wikipedia/commons/d/d3/1-2-3_Kid_in_1995.jpg
41,04.06.2016,,"Jason Blade&X-PacdefeatThe Devil's Doormen(Brandon Webb&Franky Vain)TRP Steel Cage Showdown 2016- Event @ Bridgewater Vets Club in Bridgewater, Massachusetts, USA",https://upload.wikimedia.org/wikipedia/commons/d/d3/1-2-3_Kid_in_1995.jpg
42,21.05.2016,,"Billy Gunn&X-PacdefeatCloudy&Ethan PageESW Brawl Fest- Event @ Kenan Center Arena in Lockport, New York, USA",https://upload.wikimedia.org/wikipedia/commons/d/d3/1-2-3_Kid_in_1995.jpg
43,13.05.2016,,"The UK Hooligans(Roy Knight&Zak Knight),Ricky Knight&Sean WaltmandefeatBash, Kid Kendo,King Kendo&Steve QuintainWAW Thetford Thunder 7- Event @ Thetford, Norfolk, England, UK",https://upload.wikimedia.org/wikipedia/commons/d/d3/1-2-3_Kid_in_1995.jpg
44,07.05.2016,,"Chase Owens&X-PacdefeatChris Richards&Jordan KageNWA Smoky Mountain Collision Course 2016- Event @ Civic Auditorium in Kingsport, Tennessee, USA",https://upload.wikimedia.org/wikipedia/commons/d/d3/1-2-3_Kid_in_1995.jpg
45,23.04.2016,,"Billy Gunn,Brandon Scott,Lio Rush&X-PacdefeatKen Dixon,Ryan McBride&The Dixon Line Security(Joe Keys&Rob Locke)MCW Spring Fever Tour 2016 - Tag 3- Event @ MCW Arena in Joppa, Maryland, USA",https://upload.wikimedia.org/wikipedia/commons/d/d3/1-2-3_Kid_in_1995.jpg
46,09.04.2016,,"Brandon Scott,Fenix Fury&Sean WaltmandefeatKen Dixon&The Dixon Line Security(Joe Keys&Rob Locke)MCW Spring Fever Tour 2016 - Tag 2- Event @ Volunteer Fire Hall in Galena, Maryland, USA",https://upload.wikimedia.org/wikipedia/commons/d/d3/1-2-3_Kid_in_1995.jpg
47,19.03.2016,,"David Starr&X-PacdefeatHavoc&Samuel AdamsPPW Attitude- Event @ Holy Family Academy in Hazleton, Pennsylvania, USA",https://upload.wikimedia.org/wikipedia/commons/d/d3/1-2-3_Kid_in_1995.jpg
48,18.03.2016,,"No Disqualification:Ron Hunt&X-PacdefeatBLK OUT(BLK Jeez&Robby Illuminati) (12:31)WAR- Event @ Thiel College in Greenville, Pennsylvania, USA",https://upload.wikimedia.org/wikipedia/commons/d/d3/1-2-3_Kid_in_1995.jpg
49,16.01.2016,,"Scott Steiner&X-PacdefeatThe House Of Atticus(Griffin&Guy Atticus)IWR When Worlds Collide- Event @ Firelake Arena in Shawnee, Oklahoma, USA",https://upload.wikimedia.org/wikipedia/commons/d/d3/1-2-3_Kid_in_1995.jpg
50,28.11.2015,,"Dave Rayne,The Hooligans(Roy Knight&Zak Knight) &X-PacdefeatBubblegum,Iestyn Rees&Team Single(Rampage Brown&T-Bone) (12:46)PCW/ROH SuperShow Of Honor #2 - Show 3- Event @ Evoque in Preston, Lancashire, England, UK",https://upload.wikimedia.org/wikipedia/commons/d/d3/1-2-3_Kid_in_1995.jpg
51,31.10.2015,,"John Shipley,Stixx&X-PacdefeatBarricade,HC Dyer&Paul MalenLCW Hallowicked 2015- Event @ Brockington College in Enderby, Leicestershire, England, UK",https://upload.wikimedia.org/wikipedia/commons/d/d3/1-2-3_Kid_in_1995.jpg
52,25.10.2015,,"The Bigger Picture(Damian Dunne,Robbie X&Ryan Smile) defeatThe Hunter Brothers(Jim Hunter&Lee Hunter) &X-PacKamikaze Pro Bank On It! 3- Event @ Meadway Sports & Social Club in Birmingham, West Midlands, England, UK",https://upload.wikimedia.org/wikipedia/commons/d/d3/1-2-3_Kid_in_1995.jpg
53,24.10.2015,,"SWE Tag Team Title:The Second City Collective(Damian Dunne&Ryan Smile) (c) defeatRobbie X&X-PacSWE 5th Anniversary Show- Event @ Gordon Craig Theatre in Stevenage, Hertfordshire, England, UK",https://upload.wikimedia.org/wikipedia/commons/d/d3/1-2-3_Kid_in_1995.jpg
54,23.10.2015,,"Kris Navarro,Mad Dog Maxx&X-PacdefeatBig Paulie,Johnny Thunder&Tom MasonPWL- Event @ Saddlers Club in Walsall, West Midlands, England, UK",https://upload.wikimedia.org/wikipedia/commons/d/d3/1-2-3_Kid_in_1995.jpg
55,17.10.2015,,"Bruiser,Lio Rush&Sean WaltmandefeatRyan McBride&The Ecktourage(Dirty Money&Eric Chapel)MCW Autumn Armageddon Tour 2015 - Tag 3- Event @ Indoor Sports Center in Frederick, Maryland, USA",https://upload.wikimedia.org/wikipedia/commons/d/d3/1-2-3_Kid_in_1995.jpg
56,25.09.2015,,"Mike Verna&X-PacdefeatStockade&TJ MarconiFBW Too Sweet- Event @ American Legion in New York City, New York, USA",https://upload.wikimedia.org/wikipedia/commons/d/d3/1-2-3_Kid_in_1995.jpg
57,08.08.2015,,"Little Guido&X-PacdefeatJustin Credible& Tony VegaECPW- Event @ Provident Bank Park in Pomona, New York, USA",https://upload.wikimedia.org/wikipedia/commons/d/d3/1-2-3_Kid_in_1995.jpg
58,25.07.2015,,"Justin Credible&X-PacdefeatJake Omen&Scotty YoungHLW Heroes & Legends V- Event @ SportOne Parkview Icehouse in Fort Wayne, Indiana, USA",https://upload.wikimedia.org/wikipedia/commons/d/d3/1-2-3_Kid_in_1995.jpg
59,19.06.2015,,"Chuck Deep&X-PacdefeatThe Scumbag Nation(Logan Black&Riley)Dynasty Fight Pub- Event @ Paper City Brewery in Holyoke, Massachusetts, USA",https://upload.wikimedia.org/wikipedia/commons/d/d3/1-2-3_Kid_in_1995.jpg
60,13.06.2015,,"Jake Roberts&Sean WaltmandefeatThe Playaz Club(Danny Demanto&Erik Andretti)JCW Six Flags Event- Event @ Six Flags Boulevard in Jackson, New Jersey, USA",https://upload.wikimedia.org/wikipedia/commons/d/d3/1-2-3_Kid_in_1995.jpg
61,23.05.2015,,"The Lionhearts(Eddie Ryan&Jason Larusso) &X-PacdefeatAntonio De Luca&The Bruisers(Crippler Gordon&Crusher Lomaxx)4FW Global Takeover 2015- Event @ M.E.C.A. in Swindon, Wiltshire, England, UK",https://upload.wikimedia.org/wikipedia/commons/d/d3/1-2-3_Kid_in_1995.jpg
62,17.05.2015,,"Jake Roberts,Santana Garrett&X-PacdefeatThe Playaz Club(Chasyn Rance,Danny Demanto&Erik Andretti)JCW Skate And Surf Festival - Tag 2- Event @ Bradley Park & Ocean Ave in Asbury Park, New Jersey, USA",https://upload.wikimedia.org/wikipedia/commons/d/d3/1-2-3_Kid_in_1995.jpg
63,16.05.2015,,"JCW Tag Team  Title:EYFBO(Angel Ortiz&Mike Draztik) defeatJoey Janela&X-Pac(c) -TITLE CHANGE !!!JCW Skate And Surf Festival - Tag 1- Event @ Bradley Park & Ocean Ave in Asbury Park, New Jersey, USA",https://upload.wikimedia.org/wikipedia/commons/d/d3/1-2-3_Kid_in_1995.jpg
64,15.05.2015,,"Sean Carr&X-PacdefeatCheech&Slyck Wagner Brown2CW Liberation- Event @ Horace J. Inman Senior Center in Amsterdam, New York, USA",https://upload.wikimedia.org/wikipedia/commons/d/d3/1-2-3_Kid_in_1995.jpg
65,08.05.2015,,"JCW Tag Team  Title:Joey Janela&X-PacdefeatThe Playaz Club(Damien Darling&Erik Andretti) (c) -TITLE CHANGE !!!JCW- Event @ Brick Elks Lodge in Brick, New Jersey, USA",https://upload.wikimedia.org/wikipedia/commons/d/d3/1-2-3_Kid_in_1995.jpg
66,03.05.2015,,"Absolute Andy,Big Daddy Walter,John Klinger&X-PacdefeatKeel Holding(Aaron Insane&Kim Ray),Karsten Beck&Kevin RoadsterwXw Superstars Of Wrestling II - Tag 2- Event @ Alte Seilerei in Mannheim, Baden-Württemberg, Deutschland",https://upload.wikimedia.org/wikipedia/commons/d/d3/1-2-3_Kid_in_1995.jpg
67,02.05.2015,,"Absolute Andy&X-PacdefeatKeel Holding(Kim Ray&Sasa Keel) (12:24)wXw Superstars Of Wrestling II - Tag 1- Event @ Turbinenhalle in Oberhausen, Nordrhein-Westfalen, Deutschland",https://upload.wikimedia.org/wikipedia/commons/d/d3/1-2-3_Kid_in_1995.jpg
68,19.04.2015,,"Kevin Nash&X-PacdefeatDamien Darling&Danny DemantoBTW- Event @ Sukee Arena in Winslow, Maine, USA",https://upload.wikimedia.org/wikipedia/commons/d/d3/1-2-3_Kid_in_1995.jpg
69,07.03.2015,,"Steve Boz&X-PacdefeatJason Dukes&Willie RichardsonCSW- Event @ Ridgewood High Scool in Norridge, Illinois, USA",https://upload.wikimedia.org/wikipedia/commons/d/d3/1-2-3_Kid_in_1995.jpg
70,01.03.2015,,"Stixx&X-PacdefeatThe Righteous Army(Joseph Conners&Kay Lee Ray)SWE Battle Of The Egos 5- Event @ Priory Centre in St. Neots, Cambridgeshire, England, UK",https://upload.wikimedia.org/wikipedia/commons/d/d3/1-2-3_Kid_in_1995.jpg
71,28.02.2015,,"The StarbuX(Mark Haskins&Robbie X) &X-PacdefeatDJ Z,Marty Scurll&Pete DunneSWE Supremacy 2015- Event @ Circus Tavern in Purfleet, Essex, England, UK",https://upload.wikimedia.org/wikipedia/commons/d/d3/1-2-3_Kid_in_1995.jpg
72,27.02.2015,,"Robbie X&X-PacdefeatThe Hunter Brothers(Jim Hunter&Lee Hunter)SWE X-Pendables- Event @ Rushcliffe Arena in West Bridgford, Nottinghamshire, England, UK",https://upload.wikimedia.org/wikipedia/commons/d/d3/1-2-3_Kid_in_1995.jpg
73,25.01.2015,,"WrestleCade TitleThree Way:Matt Hardy(c) defeatsX-PacandZane DawsonAML Wrestling- Event @ AML Arena in Winston Salem, North Carolina, USA",https://upload.wikimedia.org/wikipedia/commons/d/d3/1-2-3_Kid_in_1995.jpg
74,27.12.2014,,"Gunner Trash&Sean WaltmandefeatThe Playaz Club(Damien Darling&Danny Demanto)JCW Jingle Brawl- Event @ VFW Hall in Hasbrouck, New Jersey, USA",https://upload.wikimedia.org/wikipedia/commons/d/d3/1-2-3_Kid_in_1995.jpg
75,06.12.2014,,"2 Tuff Tony, Mitchell Huff &X-PacdefeatDalton Diamond,Mikey McFinnegan&Zakk SawyersSNPW- Event @ Naughty & Nice in Crossville, Illinois, USA",https://upload.wikimedia.org/wikipedia/commons/d/d3/1-2-3_Kid_in_1995.jpg
76,05.12.2014,,"The X-Factor(Justin Credible&X-Pac) defeatBiff And Ted's Excellent Tag Team(Biff Busick&Ted Goodz)2CW Christmas Vacation- Event @ American Legion 80 in Binghamton, New York, USA",https://upload.wikimedia.org/wikipedia/commons/d/d3/1-2-3_Kid_in_1995.jpg
77,29.11.2014,,"WrestleCade Title#1 Contendership 25 Man Battle Royal:Sean WaltmandefeatsBobby FultonandCaleb KonleyandCody HallandColt CabanaandCW AndersonandDeimosandHollywood NovaandJimmy ValiantandLittle GuidoandLodiandMr. 450andRick SteinerandSabuandShane DouglasandSonjay DuttandSteve CorinoandStevie RichardsandStroandThe Blue MeanieandThe PatriotandTracy SmothersandVaderandZane DawsonandZane RileyWrestleCade 2014- Event @ Benton Convention Center in Winstom Salem, North Carolina, USA",https://upload.wikimedia.org/wikipedia/commons/d/d3/1-2-3_Kid_in_1995.jpg
78,11.10.2014,,"Antonio Rivera,John Cannon&Scotty PriestdefeatBA Kidd,Benjamin Quinn&X-PacWOW Livewire 2014- Event @ Funstation USA in New York City, New York, USA",https://upload.wikimedia.org/wikipedia/commons/d/d3/1-2-3_Kid_in_1995.jpg
79,13.09.2014,,"NRG(Anton Leveigh & Ricky Andrews) &X-PacdefeatDerrick King& Hard Steel (Austin Steele& Xander Legend)UCW Ashlynn McClure Memorial 2- Event @ Bill Dundee Battlezone in Union City, Tennessee, USA",https://upload.wikimedia.org/wikipedia/commons/d/d3/1-2-3_Kid_in_1995.jpg
80,23.08.2014,,"Craven Knyte&Sean WaltmandefeatArik Cannon&Ben SailerHOW Legendary- Event @ Waters Casion Resort in Redcliff, Wisconsin, USA",https://upload.wikimedia.org/wikipedia/commons/d/d3/1-2-3_Kid_in_1995.jpg
81,09.08.2014,,"X-PacdefeatsJimmy RockwellBlitz WrestleFest 5- Event @ Joliet Park District in Joliet, Illinois, USA",https://upload.wikimedia.org/wikipedia/commons/d/d3/1-2-3_Kid_in_1995.jpg
82,15.06.2014,,"30 Man Red Carpet Rumble:Willie MackdefeatsAlexander PaulandBig DukeandCedric The HitmanandChe CabreraandDan JosephandEric CrossandEthan HDandFidel BravoandHoss SuttonandIan W. SuttonandJake RobertsandJarek MatthewsandJoey RyanandJohnny GoodtimeandJohnny YumaandLeo BlazeandMatt StrikerandMikey O'SheaandNick MadridandOthelloandPeter AvalonandRyan TaylorandSasha DarevkoandSean WaltmanandStu StoneandThe HoboandTito EscondidoandTodd ChandlerandTyler BatemanCWFH Red Carpet Rumble 2014- Event @ Oceanview Pavillion in Port Hueneme, California, USA",https://upload.wikimedia.org/wikipedia/commons/d/d3/1-2-3_Kid_in_1995.jpg
83,14.06.2014,,"Rikishi&X-PacdefeatGangrel&Matt StrikerHOH VI: The West Coast Invasion- Event @ Harrah's Rincon Casino in Valley Center, California, USA",https://upload.wikimedia.org/wikipedia/commons/d/d3/1-2-3_Kid_in_1995.jpg
84,06.06.2014,,"QT Marshall&Sean WaltmandefeatDamien Darling&Danny DemantoJCW- Event @ Barnegat High School in Barnegat, New Jersey, USA",https://upload.wikimedia.org/wikipedia/commons/d/d3/1-2-3_Kid_in_1995.jpg
85,31.05.2014,,"Cody Hall&X-PacdefeatThe Sons Of Samoa(Afa Jr.&LA Smooth)WXW C4- Event @ Sunbury, Pennsylvania, USA",https://upload.wikimedia.org/wikipedia/commons/d/d3/1-2-3_Kid_in_1995.jpg
86,11.05.2014,,"Robbie X&X-PacdefeatProject Ego(Kris Travis&Martin Kirby)SWE X-Factor- Event @ Rushcliffe Arena in West Bridgford, Nottinghamshire, England, UK",https://upload.wikimedia.org/wikipedia/commons/d/d3/1-2-3_Kid_in_1995.jpg
87,10.05.2014,,"Mr. Paterson,Scotty Swift&X-PacdefeatRevolution(Chris Archer,Damien&Johnny Lions)WrestleZone Aberdeen Anarchy 2014- Event @ Beach Ballroom in Aberdeen, Scotland, UK",https://upload.wikimedia.org/wikipedia/commons/d/d3/1-2-3_Kid_in_1995.jpg
88,25.04.2014,,"Nui Tofiga&Sean WaltmandefeatThe Appalachian Outlaws(Bo Nekoda&Hoss Hagood)MCW Body Slam Autism 4- Event @ The New Green Room in Dundalk, Maryland, USA",https://upload.wikimedia.org/wikipedia/commons/d/d3/1-2-3_Kid_in_1995.jpg
89,18.01.2014,,"Lance Anoai&X-PacdefeatHavoc&Tommy SuedePPW Redemption- Event @ Freeland Event Center in Freeland, Pennsylvania, USA",https://upload.wikimedia.org/wikipedia/commons/d/d3/1-2-3_Kid_in_1995.jpg
90,31.12.2013,,"Bryson Michaels,Dory Funk Jr.,Jessica Hill,Johnny Magnum&Sean Waltmandefeat Hector Alicea,Hollywood Heather, Moose McNamara, Ryan Passmore &Shane ChungFC !BANG!- Event @ Ocala, Florida, USA",https://upload.wikimedia.org/wikipedia/commons/d/d3/1-2-3_Kid_in_1995.jpg
91,07.12.2013,,"Garok &X-Pacdefeat Karcamo &Tommy Dreamer1WS Amo Del Hexagono 2013- Event @ Gimnasio Central De San Sebastian in San Sebastian, San Jose, Costa Rica",https://upload.wikimedia.org/wikipedia/commons/d/d3/1-2-3_Kid_in_1995.jpg
92,16.11.2013,,"Cody Hall&X-Pacdefeat ??? &Luke GallowsSuperstars Of Wrestling 1- Pay Per View @ Rome Civic Center in Rome, Georgia, USA",https://upload.wikimedia.org/wikipedia/commons/d/d3/1-2-3_Kid_in_1995.jpg
93,09.11.2013,,"Terry Funk&Tommy DreamerdefeatLance Storm&Sean Waltman(15:26)HOH III- Event @ Mid-Hudson Civic Center in Poughkeepsie, New York, USA",https://upload.wikimedia.org/wikipedia/commons/d/d3/1-2-3_Kid_in_1995.jpg
94,03.11.2013,,"Marty Jannetty&Sean WaltmandefeatThe Highlanders(Robbie McAllister&Rory McAllister)Legends Of Wrestling- Event @ Covelli Centre in Youngstown, Ohio, USA",https://upload.wikimedia.org/wikipedia/commons/d/d3/1-2-3_Kid_in_1995.jpg
95,18.10.2013,,"Guido Maritato,Matt Striker&X-PacdefeatDrew Blood,Justin Toxic&KC BladeICW- Event @ Elk's Lodge in New York City, New York, USA",https://upload.wikimedia.org/wikipedia/commons/d/d3/1-2-3_Kid_in_1995.jpg
96,13.09.2013,,"Riley&Tommy DreamerdefeatLogan Black&X-PacWOW Wrestling Spectacular 2- Event @ Edison, New Jersey, USA",https://upload.wikimedia.org/wikipedia/commons/d/d3/1-2-3_Kid_in_1995.jpg
97,07.09.2013,,"Coach Joe,The Two Star Heroes(Chris Castro&Matt Knicks) &X-PacdefeatBody Magic(Ashton Vuitton&Eric St. Vaughn) &Love-Hate(Remi Wilkins&Trevor Court)RPW Alive- Event @ Saint Laurence High School in Burbank, Illinois, USA",https://upload.wikimedia.org/wikipedia/commons/d/d3/1-2-3_Kid_in_1995.jpg
98,23.03.2013,,"Fatal Four Way:Jerry LynndefeatsHorace The PsychopathandJB TraskandSean WaltmanHOW The Last F'n Show: Jerry Lynn's Retirement Show- Event @ Minneapolis Convention Center in Minneapolis, Minnesota, USA",https://upload.wikimedia.org/wikipedia/commons/d/d3/1-2-3_Kid_in_1995.jpg
99,08.03.2013,,"HallowickeddefeatsSean Waltman(9:48)CHIKARA Just Shadows In The Fog- Event @ The Orpheum in Tampa, Florida, USA",https://upload.wikimedia.org/wikipedia/commons/d/d3/1-2-3_Kid_in_1995.jpg
