date,event,result,location,image_url
296,09.03.2002,,"Match (Special Referee: The Canadian Bad Boy):BombshelldefeatsMadisonCAPW- Event @ Cleveland, Ohio, USA",https://upload.wikimedia.org/wikipedia/commons/a/af/Jillian-Hall-Singing%2C-RLA-Melb-10.11.2007.jpg
297,09.02.2002,,"Lady VictoriadefeatsMacaela MercedesNEPW- Event @ Painesville, Ohio, USA",https://upload.wikimedia.org/wikipedia/commons/a/af/Jillian-Hall-Singing%2C-RLA-Melb-10.11.2007.jpg
298,26.01.2002,,"Macaela MercedesdefeatsLady VictoriaNEPW- Event @ Painesville, Ohio, USA",https://upload.wikimedia.org/wikipedia/commons/a/af/Jillian-Hall-Singing%2C-RLA-Melb-10.11.2007.jpg
299,13.10.2001,,"Lexie FyfedefeatsMacaela MercedesNEPW United We Stand- Event @ St. Gabriel's Gym in Cleveland, Ohio, USA",https://upload.wikimedia.org/wikipedia/commons/a/af/Jillian-Hall-Singing%2C-RLA-Melb-10.11.2007.jpg
300,27.07.2001,,"EWF Women's Title:Lexie Fyfe(c) defeatsMercedesEWF- Event @ Kentland, Indiana, USA",https://upload.wikimedia.org/wikipedia/commons/a/af/Jillian-Hall-Singing%2C-RLA-Melb-10.11.2007.jpg
301,26.07.2001,,"Lexie FyfedefeatsMercedesEWF- Event @ Porter County Fair in Valparaiso, Indiana, USA",https://upload.wikimedia.org/wikipedia/commons/a/af/Jillian-Hall-Singing%2C-RLA-Melb-10.11.2007.jpg
302,07.07.2001,,"EWF Women's Title Match (vakant):Lexie FyfedefeatsMercedes-TITLE CHANGE !!!EWF- Event @ EWF Arena in Marion, Indiana, USA",https://upload.wikimedia.org/wikipedia/commons/a/af/Jillian-Hall-Singing%2C-RLA-Melb-10.11.2007.jpg
