date,event,result,location,image_url
423,16.11.2003,,"Survivor Series Elimination:Team Angle (Bradshaw,Chris Benoit,Hardcore Holly,John Cena&Kurt Angle) defeat Team Lesnar (Brock Lesnar,Matt Morgan,Nathan Jones,The A-Train&The Big Show) (13:17)WWE Survivor Series 2003- Pay Per View @ American Airlines Center in Dallas, Texas, USA",https://upload.wikimedia.org/wikipedia/commons/b/ba/Bradshaw.jpg
424,11.11.2003,,"BradshawdefeatsThe A-Train(6:21)WWE SmackDown #222- TV-Show @ Continental Airlines Arena in East Rutherford, New Jersey, USA",https://upload.wikimedia.org/wikipedia/commons/b/ba/Bradshaw.jpg
425,10.11.2003,,"Elimination:Bradshaw,Hardcore Holly&Kurt AngledefeatA-Train,Matt Morgan&Nathan JonesWWE SmackDown House Show- House Show @ Arena At Harbor Yard in Bridgeport, Connecticut, USA",https://upload.wikimedia.org/wikipedia/commons/b/ba/Bradshaw.jpg
426,09.11.2003,,"Elimination:Bradshaw,Hardcore Holly&Kurt AngledefeatA-Train,Matt Morgan&Nathan JonesWWE SmackDown House Show- House Show @ Centrum Centre in Worcester, Massachusetts, USA",https://upload.wikimedia.org/wikipedia/commons/b/ba/Bradshaw.jpg
427,08.11.2003,,"Elimination:Bradshaw,Chris Benoit&Hardcore HollydefeatA-Train,Matt Morgan&Nathan JonesWWE SmackDown House Show- House Show @ Mid-Hudson Civic Center in Poughkeepsie, New York, USA",https://upload.wikimedia.org/wikipedia/commons/b/ba/Bradshaw.jpg
428,04.11.2003,,"The Big ShowdefeatsBradshaw(3:53)WWE SmackDown #221- TV-Show @ HSBC Arena in Buffalo, New York, USA",https://upload.wikimedia.org/wikipedia/commons/b/ba/Bradshaw.jpg
429,03.11.2003,,"BradshawdefeatsChuck PalumboWWE SmackDown House Show- House Show @ Corel Centre in Ottawa, Ontario, Canada",https://upload.wikimedia.org/wikipedia/commons/b/ba/Bradshaw.jpg
430,02.11.2003,,"WWE United States Title:The Big Show(c) defeatsBradshawWWE SmackDown House Show- House Show @ Bell Centre in Montreal, Quebec, Canada",https://upload.wikimedia.org/wikipedia/commons/b/ba/Bradshaw.jpg
431,01.11.2003,,"BradshawdefeatsHorshuWWE SmackDown House Show- House Show @ Kitchener Memorial Auditorium in Kitchener, Ontario, Canada",https://upload.wikimedia.org/wikipedia/commons/b/ba/Bradshaw.jpg
432,28.10.2003,,"The APA(Bradshaw&Faarooq) defeatBrock Lesnar&The Big Showby DQ (3:10)WWE SmackDown #220- TV-Show @ Philips Arena in Atlanta, Georgia, USA",https://upload.wikimedia.org/wikipedia/commons/b/ba/Bradshaw.jpg
433,20.10.2003,,"Elimination:The APA(Bradshaw&Faarooq) defeatThe Basham Brothers(Danny Basham&Doug Basham) andThe World's Greatest Tag Team(Charlie Haas&Shelton Benjamin)WWE SmackDown House Show- House Show @ Westchester County Center in White Plains, New York, USA",https://upload.wikimedia.org/wikipedia/commons/b/ba/Bradshaw.jpg
434,19.10.2003,,"The Basham Brothers(Danny Basham&Doug Basham) defeatThe APA(Bradshaw&Faarooq) (8:55)WWE No Mercy 2003- Pay Per View @ Baltimore Arena in Baltimore, Maryland, USA",https://upload.wikimedia.org/wikipedia/commons/b/ba/Bradshaw.jpg
435,14.10.2003,,"The Acolytes(Bradshaw&Faarooq) defeatChuck Palumbo&NunzioWWE Velocity #74- TV-Show @ U.S. Bank Arena in Cincinnati, Ohio, USA",https://upload.wikimedia.org/wikipedia/commons/b/ba/Bradshaw.jpg
436,07.10.2003,,"The A-Train&The Basham Brothers(Danny Basham&Doug Basham) defeatChris Benoit&The APA(Bradshaw&Faarooq) (3:43)WWE SmackDown #217- TV-Show @ Hartford Civic Center in Hartford, Connecticut, USA",https://upload.wikimedia.org/wikipedia/commons/b/ba/Bradshaw.jpg
437,06.10.2003,,"BradshawdefeatsRhyno(2:23)WWE SmackDown House Show- House Show @ Sovereign Bank Arena in Trenton, New Jersey, USA",https://upload.wikimedia.org/wikipedia/commons/b/ba/Bradshaw.jpg
438,30.09.2003,,"The Basham Brothers(Danny Basham&Doug Basham) defeatThe APA(Bradshaw&Faarooq) (4:38)WWE SmackDown #216- TV-Show @ Bradley Center in Milwaukee, Wisconsin, USA",https://upload.wikimedia.org/wikipedia/commons/b/ba/Bradshaw.jpg
439,29.09.2003,,"The APA(Bradshaw&Faarooq) defeatSean O'Haire&The A-TrainWWE SmackDown House Show- House Show @ Athletic & Recreation Center in Valparaiso, Indiana, USA",https://upload.wikimedia.org/wikipedia/commons/b/ba/Bradshaw.jpg
440,27.09.2003,,"BradshawdefeatsA-TrainWWE SmackDown House Show- House Show @ Winnipeg Arena in Winnipeg, Manitoba, Canada",https://upload.wikimedia.org/wikipedia/commons/b/ba/Bradshaw.jpg
441,23.09.2003,,"Bradshaw&Jamie NobledefeatThe Basham Brothers(Danny Basham&Doug Basham) by DQ (4:18)WWE SmackDown #215- TV-Show @ Wachovia Center in Philadelphia, Pennsylvania, USA",https://upload.wikimedia.org/wikipedia/commons/b/ba/Bradshaw.jpg
442,15.09.2003,,"WWE Tag Team Title:The World's Greatest Tag Team(Charlie Haas&Shelton Benjamin) (c) defeatThe APA(Bradshaw&Faarooq)WWE SmackDown House Show- House Show @ Minges Coliseum in Greenville, North Carolina, USA",https://upload.wikimedia.org/wikipedia/commons/b/ba/Bradshaw.jpg
443,14.09.2003,,"WWE Tag Team Title:The World's Greatest Tag Team(Charlie Haas&Shelton Benjamin) (c) defeatThe APA(Bradshaw&Faarooq)WWE SmackDown House Show- House Show @ Richmond Coliseum in Richmond, Virginia, USA",https://upload.wikimedia.org/wikipedia/commons/b/ba/Bradshaw.jpg
444,13.09.2003,,"WWE Tag Team Title:The World's Greatest Tag Team(Charlie Haas&Shelton Benjamin) (c) defeatThe APA(Bradshaw&Faarooq)WWE SmackDown House Show- House Show @ Roanoke Civic Center in Roanoke, Virginia, USA",https://upload.wikimedia.org/wikipedia/commons/b/ba/Bradshaw.jpg
445,09.09.2003,,"The APA(Bradshaw&Faarooq) defeatMatt Hardy Version 1.0&Shannon Moore(3:12)WWE SmackDown #213- TV-Show @ Jefferson Civic Center in Birmingham, Alabama, USA",https://upload.wikimedia.org/wikipedia/commons/b/ba/Bradshaw.jpg
446,08.09.2003,,"WWE Tag Team Title:The World's Greatest Tag Team(Charlie Haas&Shelton Benjamin) (c) defeatThe APA(Bradshaw&Faarooq)WWE SmackDown House Show- House Show @ Civic Center in Columbus, Georgia, USA",https://upload.wikimedia.org/wikipedia/commons/b/ba/Bradshaw.jpg
447,07.09.2003,,"WWE Tag Team Title:The World's Greatest Tag Team(Charlie Haas&Shelton Benjamin) (c) defeatThe APA(Bradshaw&Faarooq)WWE SmackDown House Show- House Show @ Office Depot Center in Sunrise, Florida, USA",https://upload.wikimedia.org/wikipedia/commons/b/ba/Bradshaw.jpg
448,02.09.2003,,"WWE Tag Team Title:The World's Greatest Tag Team(Charlie Haas&Shelton Benjamin) (c) defeatThe APA(Bradshaw&Faarooq) (5:21)WWE SmackDown #212- TV-Show @ New Orleans Arena in New Orleans, Louisiana, USA",https://upload.wikimedia.org/wikipedia/commons/b/ba/Bradshaw.jpg
449,31.08.2003,,"WWE Tag Team Title:The World's Greatest Tag Team(Charlie Haas&Shelton Benjamin) (c) defeatThe APA(Bradshaw&Faarooq)WWE SmackDown House Show- House Show @ Nassau Veterans Memorial Coliseum in Uniondale, New York, USA",https://upload.wikimedia.org/wikipedia/commons/b/ba/Bradshaw.jpg
450,30.08.2003,,"WWE Tag Team Title:The World's Greatest Tag Team(Charlie Haas&Shelton Benjamin) (c) defeatThe APA(Bradshaw&Faarooq)WWE SmackDown House Show- House Show @ FleetCenter in Boston, Massachusetts, USA",https://upload.wikimedia.org/wikipedia/commons/b/ba/Bradshaw.jpg
451,26.08.2003,,"The World's Greatest Tag Team(Charlie Haas&Shelton Benjamin) defeatThe APA(Bradshaw&Faarooq) (5:59)WWE Velocity #67- TV-Show @ Haskins Center in El Paso, Texas, USA",https://upload.wikimedia.org/wikipedia/commons/b/ba/Bradshaw.jpg
452,19.08.2003,,"BradshawdefeatsShelton Benjamin(6:47)WWE Velocity #66- TV-Show @ Joe Louis Arena in Detroit, Michigan, USA",https://upload.wikimedia.org/wikipedia/commons/b/ba/Bradshaw.jpg
453,18.08.2003,,"WWE Tag Team TitleTriple Threat:The World's Greatest Tag Team(Charlie Haas&Shelton Benjamin) (c) defeatA-Train&Sean O'HaireandThe APA(Bradshaw&Faarooq)WWE SmackDown House Show- House Show @ Sports & Entertainment Centre in Sarnia, Ontario, Canada",https://upload.wikimedia.org/wikipedia/commons/b/ba/Bradshaw.jpg
454,17.08.2003,,"WWE Tag Team Title:The World's Greatest Tag Team(Charlie Haas&Shelton Benjamin) (c) defeatThe APA(Bradshaw&Faarooq)WWE SmackDown House Show- House Show @ Copps Coliseum in Hamilton, Ontario, Canada",https://upload.wikimedia.org/wikipedia/commons/b/ba/Bradshaw.jpg
455,16.08.2003,,"WWE Tag Team Title:The World's Greatest Tag Team(Charlie Haas&Shelton Benjamin) (c) defeatThe APA(Bradshaw&Faarooq)WWE SmackDown House Show- House Show @ Target Center in Minneapolis, Minnesota, USA",https://upload.wikimedia.org/wikipedia/commons/b/ba/Bradshaw.jpg
456,11.08.2003,,"WWE Tag Team Title:The World's Greatest Tag Team(Charlie Haas&Shelton Benjamin) (c) defeatThe APA(Bradshaw&Faarooq)WWE SmackDown House Show- House Show @ Kemper Arena in Kansas City, Missouri, USA",https://upload.wikimedia.org/wikipedia/commons/b/ba/Bradshaw.jpg
457,10.08.2003,,"WWE Tag Team Title:The World's Greatest Tag Team(Charlie Haas&Shelton Benjamin) (c) defeatThe APA(Bradshaw&Faarooq)WWE SmackDown House Show- House Show @ Kansas Coliseum in Wichita, Kansas, USA",https://upload.wikimedia.org/wikipedia/commons/b/ba/Bradshaw.jpg
458,05.08.2003,,"The APA(Bradshaw&Faarooq) defeatThe FBI(Chuck Palumbo&Johnny Stamboli) (5:45)WWE Velocity #64- TV-Show @ Skyreach Centre in Kelowna, British Columbia, Canada",https://upload.wikimedia.org/wikipedia/commons/b/ba/Bradshaw.jpg
459,03.08.2003,,"WWE Tag Team TitleTriple Threat:The World's Greatest Tag Team(Charlie Haas&Shelton Benjamin) (c) defeatThe APA(Bradshaw&Faarooq) andThe Basham Brothers(Danny Basham&Doug Basham)WWE SmackDown House Show- House Show @ Skyreach Center in Edmonton, Alberta, Canada",https://upload.wikimedia.org/wikipedia/commons/b/ba/Bradshaw.jpg
460,02.08.2003,,"WWE Tag Team TitleFatal Four Way:The World's Greatest Tag Team(Charlie Haas&Shelton Benjamin) (c) defeatMatt Hardy Version 1.0&Shannon MooreandThe APA(Bradshaw&Faarooq) andThe Basham Brothers(Danny Basham&Doug Basham)WWE SmackDown House Show- House Show @ Pengrowth Saddledome in Calgary, Alberta, Canada",https://upload.wikimedia.org/wikipedia/commons/b/ba/Bradshaw.jpg
461,29.07.2003,,"Sean O'Haire&The Basham Brothers(Danny Basham&Doug Basham) defeatFunaki&The APA(Bradshaw&Faarooq)WWE Velocity #63- TV-Show @ World Arena in Colorado Springs, Colorado, USA",https://upload.wikimedia.org/wikipedia/commons/b/ba/Bradshaw.jpg
462,27.07.2003,,"APA Invitational Bar Room Brawl:BradshawdefeatsBrian KendrickandBrother LoveandChris KanyonandChuck PalumboandConquistador DosandConquistador UnoandDanny BashamandDoinkandDoug BashamandFaarooqandFunakiandJohn HenniganandJohnny StamboliandMatt CappotelliandMatt Hardy Version 1.0andNunzioandOrlando JordanandSean O'HaireandShannon MooreandThe Brooklyn Brawlerand The Easter Bunny (Aaron Stevens) (4:33)WWE Vengeance 2003- Pay Per View @ Pepsi Center in Denver, Colorado, USA",https://upload.wikimedia.org/wikipedia/commons/b/ba/Bradshaw.jpg
463,22.07.2003,,"The APA(Bradshaw&Ron Simmons) defeatThe FBI(Chuck Palumbo&Johnny Stamboli) (0:27)WWE SmackDown #206- TV-Show @ Selland Arena in Fresno, California, USA",https://upload.wikimedia.org/wikipedia/commons/b/ba/Bradshaw.jpg
464,08.07.2003,,"Four Way Elimination:Billy Kidman&Rey MysteriodefeatThe APA(Bradshaw&Faarooq) andThe Basham Brothers(Danny Basham&Doug Basham) andThe FBI(Chuck Palumbo&Johnny Stamboli) (10:49)WWE SmackDown #204- TV-Show @ Air Canada Centre in Toronto, Ontario, Canada",https://upload.wikimedia.org/wikipedia/commons/b/ba/Bradshaw.jpg
465,07.07.2003,,"The APA(Bradshaw&Faarooq) defeatThe FBI(Chuck Palumbo&Johnny Stamboli)WWE SmackDown House Show- House Show @ Gund Arena in Cleveland, Ohio, USA",https://upload.wikimedia.org/wikipedia/commons/b/ba/Bradshaw.jpg
466,06.07.2003,,"The APA(Bradshaw&Faarooq) defeatThe FBI(Chuck Palumbo&Johnny Stamboli)WWE SmackDown House Show- House Show @ Convention Center in Ocean City, Maryland, USA",https://upload.wikimedia.org/wikipedia/commons/b/ba/Bradshaw.jpg
467,05.07.2003,,"The APA(Bradshaw&Faarooq) defeatThe FBI(Chuck Palumbo&Johnny Stamboli)WWE SmackDown House Show- House Show @ Harry Grove Stadium in Frederick, Maryland, USA",https://upload.wikimedia.org/wikipedia/commons/b/ba/Bradshaw.jpg
468,30.06.2003,,"Spanky&The APA(Bradshaw&Faarooq) defeatThe FBI(Chuck Palumbo,Johnny Stamboli&Nunzio)WWE SmackDown House Show- House Show @ Memorial Auditorium in Utica, New York, USA",https://upload.wikimedia.org/wikipedia/commons/b/ba/Bradshaw.jpg
469,29.06.2003,,"The FBI(Chuck Palumbo,Johnny Stamboli&Nunzio) defeatSpanky&The APA(Bradshaw&Faarooq)WWE SmackDown House Show- House Show @ Civic Center in Augusta, Maine, USA",https://upload.wikimedia.org/wikipedia/commons/b/ba/Bradshaw.jpg
470,28.06.2003,,"Spanky&The APA(Bradshaw&Faarooq) defeatThe FBI(Chuck Palumbo,Johnny Stamboli&Nunzio)WWE SmackDown House Show- House Show @ Dunkin' Donuts Center in Providence, Rhode Island, USA",https://upload.wikimedia.org/wikipedia/commons/b/ba/Bradshaw.jpg
471,24.06.2003,,"The APA(Bradshaw&Ron Simmons) &The UndertakerdefeatThe FBI(Chuck Palumbo,Johnny Stamboli&Nunzio) (6:23)WWE SmackDown #202- TV-Show @ Madison Square Garden in New York City, New York, USA",https://upload.wikimedia.org/wikipedia/commons/b/ba/Bradshaw.jpg
472,30.05.2003,,"OVW Southern Tag Team Title:The APA(Bradshaw&Faarooq) (c) defeatLance Cade&Mark JindrakOVW Six Flags Summer Sizzler Series- Event @ Paramarx Arena in Louisville, Kentucky, USA",https://upload.wikimedia.org/wikipedia/commons/b/ba/Bradshaw.jpg
473,07.05.2003,,"Lance Cade,Mark Jindrak&Rene DupreedefeatBilly Gunn&The APA(Bradshaw&Faarooq)OVW TV- TV-Show @ Davis Arena in Louisville, Kentucky, USA",https://upload.wikimedia.org/wikipedia/commons/b/ba/Bradshaw.jpg
474,11.04.2003,,"OVW Southern Tag Team Title:The APA(Bradshaw&Faarooq) (c) defeatLance Cade&Rene Dupree(9:33)OVW Spring Breakout 2003- Event @ Paramarx Arena in Louisville, Kentucky, USA",https://upload.wikimedia.org/wikipedia/commons/b/ba/Bradshaw.jpg
475,26.03.2003,,"The APA(Bradshaw&Faarooq) defeatLance Cade&Rene Dupreeby DQOVW TV- TV-Show @ Davis Arena in Louisville, Kentucky, USA",https://upload.wikimedia.org/wikipedia/commons/b/ba/Bradshaw.jpg
476,16.03.2003,,"Two On One Handicap:BradshawdefeatsLance Cade&Rene Dupreeby DQOVW TV- TV-Show @ Davis Arena in Louisville, Kentucky, USA",https://upload.wikimedia.org/wikipedia/commons/b/ba/Bradshaw.jpg
477,12.03.2003,,"Chris Kanyon,Damaja&Doug Bashamvs.Bradshaw,Johnny Jeter&Nick Dinsmore- No ContestOVW TV- TV-Show @ Davis Arena in Louisville, Kentucky, USA",https://upload.wikimedia.org/wikipedia/commons/b/ba/Bradshaw.jpg
478,09.09.2002,,"WWE World Tag Team Title:Christian&Lance Storm(c) defeatBradshaw&Kane(6:49)WWE RAW #485- TV-Show @ Hilton Coliseum in Ames, Iowa, USA",https://upload.wikimedia.org/wikipedia/commons/b/ba/Bradshaw.jpg
479,08.09.2002,,"BradshawdefeatsSteven RichardsWWE RAW House Show- House Show @ U.S. Cellular Center in Cedar Rapids, Iowa, USA",https://upload.wikimedia.org/wikipedia/commons/b/ba/Bradshaw.jpg
480,07.09.2002,,"WWE World Tag Team TitleThree Way Elimination:Christian&Lance Storm(c) defeatBradshaw&GoldustandChristopher Nowinski&William RegalWWE RAW House Show- House Show @ Rushmore Plaza Civic Center in Rapid City, South Dakota, USA",https://upload.wikimedia.org/wikipedia/commons/b/ba/Bradshaw.jpg
481,06.09.2002,,"BradshawdefeatsChristopher NowinskiWWE RAW House Show- House Show @ Sioux Falls Arena in Sioux Falls, South Dakota, USA",https://upload.wikimedia.org/wikipedia/commons/b/ba/Bradshaw.jpg
482,01.09.2002,,"Bradshaw&Spike DudleydefeatChristopher Nowinski&William RegalWWE RAW House Show- House Show @ Allstate Arena in Rosemont, Illinois, USA",https://upload.wikimedia.org/wikipedia/commons/b/ba/Bradshaw.jpg
483,31.08.2002,,"BradshawdefeatsLance Storm(6:45)WWE RAW House Show- House Show @ Prairie Capital Convention Center in Springfield, Illinois, USA",https://upload.wikimedia.org/wikipedia/commons/b/ba/Bradshaw.jpg
484,30.08.2002,,"BradshawdefeatsLance StormWWE RAW House Show- House Show @ Pershing Center in Lincoln, Nebraska, USA",https://upload.wikimedia.org/wikipedia/commons/b/ba/Bradshaw.jpg
485,26.08.2002,,"BradshawdefeatsJustin Credible(3:27)WWE Sunday Night Heat #213- TV-Show @ Madison Square Garden in New York City, New York, USA",https://upload.wikimedia.org/wikipedia/commons/b/ba/Bradshaw.jpg
486,24.08.2002,,"Christopher Nowinski&William RegaldefeatBradshaw&Jeff HardyWWE RAW House Show- House Show @ Sovereign Bank Arena in Trenton, New Jersey, USA",https://upload.wikimedia.org/wikipedia/commons/b/ba/Bradshaw.jpg
487,23.08.2002,,"Bradshaw&Jeff HardydefeatChristopher Nowinski&William RegalWWE RAW House Show- House Show @ Beeghly Center in Youngstown, Ohio, USA",https://upload.wikimedia.org/wikipedia/commons/b/ba/Bradshaw.jpg
488,19.08.2002,,"WWE Hardcore TitleSix Minute Challenge:Tommy Dreamer(c) defeatsBradshawandBubba Ray DudleyandCrashandJeff HardyandJohnny StamboliandSpike DudleyandSteven RichardsandTerri Runnels(6:00)WWE RAW #482- TV-Show @ Norfolk Scope in Norfolk, Virginia, USA",https://upload.wikimedia.org/wikipedia/commons/b/ba/Bradshaw.jpg
489,18.08.2002,,"Christopher NowinskidefeatsBradshawWWE RAW House Show- House Show @ Roberts Stadium in Evansville, Indiana, USA",https://upload.wikimedia.org/wikipedia/commons/b/ba/Bradshaw.jpg
490,17.08.2002,,"BradshawdefeatsChristopher NowinskiWWE RAW House Show- House Show @ ISU Hulman Center in Terre Haute, Indiana, USA",https://upload.wikimedia.org/wikipedia/commons/b/ba/Bradshaw.jpg
491,12.08.2002,,"BradshawdefeatsShawn StasiakWWE Sunday Night Heat #211- TV-Show @ KeyArena in Seattle, Washington, USA",https://upload.wikimedia.org/wikipedia/commons/b/ba/Bradshaw.jpg
492,11.08.2002,,"BradshawdefeatsChristopher NowinskiWWE RAW House Show- House Show @ PNE Coliseum in Vancouver, British Columbia, Canada",https://upload.wikimedia.org/wikipedia/commons/b/ba/Bradshaw.jpg
493,10.08.2002,,"BradshawdefeatsChristopher NowinskiWWE RAW House Show- House Show @ Sport Mart Place in Kamloops, British Columbia, Canada",https://upload.wikimedia.org/wikipedia/commons/b/ba/Bradshaw.jpg
494,09.08.2002,,"BradshawdefeatsChristopher NowinskiWWE RAW House Show- House Show @ Skyreach Place Arena in Kelowna, British Columbia, Canada",https://upload.wikimedia.org/wikipedia/commons/b/ba/Bradshaw.jpg
495,05.08.2002,,"WWE Hardcore Title:Tommy Dreamer(c) defeatsBradshaw(5:24)WWE RAW #480- TV-Show @ Baltimore Arena in Baltimore, Maryland, USA",https://upload.wikimedia.org/wikipedia/commons/b/ba/Bradshaw.jpg
496,04.08.2002,,"WWE Hardcore Title:BradshawdefeatsTommy Dreamer(c) (6:30) -TITLE CHANGE !!!WWE RAW House Show- House Show @ Mellon Arena in Pittsburgh, Pennsylvania, USA",https://upload.wikimedia.org/wikipedia/commons/b/ba/Bradshaw.jpg
497,03.08.2002,,"WWE Hardcore Title:BradshawdefeatsTommy Dreamer(c) -TITLE CHANGE !!!WWE RAW House Show- House Show @ AmericanAirlines Arena in Miami, Florida, USA",https://upload.wikimedia.org/wikipedia/commons/b/ba/Bradshaw.jpg
498,29.07.2002,,"WWE Hardcore Title:Jeff HardydefeatsBradshaw(c) (4:35) -TITLE CHANGE !!!WWE RAW #479- TV-Show @ Greensboro Coliseum in Greensboro, North Carolina, USA",https://upload.wikimedia.org/wikipedia/commons/b/ba/Bradshaw.jpg
499,28.07.2002,,"WWE Hardcore Title:Bradshaw(c) vs.Shawn Stasiak- No ContestWWE RAW House Show- House Show @ Carolina Coliseum in Columbia, South Carolina, USA",https://upload.wikimedia.org/wikipedia/commons/b/ba/Bradshaw.jpg
500,27.07.2002,,"WWE Hardcore Title:Bradshaw(c) vs.Shawn Stasiak- No ContestWWE RAW House Show- House Show @ Freeman Coliseum in San Antonio, Texas, USA",https://upload.wikimedia.org/wikipedia/commons/b/ba/Bradshaw.jpg
501,26.07.2002,,"WWE Hardcore Title:Bradshaw(c) vs.Shawn Stasiak- No ContestWWE RAW House Show- House Show @ Compaq Center in Houston, Texas, USA",https://upload.wikimedia.org/wikipedia/commons/b/ba/Bradshaw.jpg
502,22.07.2002,,"WWE Hardcore Title:Bradshaw(c) defeatsJohnny StamboliWWE Sunday Night Heat #208- TV-Show @ Van Andel Arena in Grand Rapids, Michigan, USA",https://upload.wikimedia.org/wikipedia/commons/b/ba/Bradshaw.jpg
503,15.07.2002,,"WWE Hardcore Title:Bradshaw(c) vs.Christopher Nowinski- No Contest (2:01)WWE RAW #477- TV-Show @ Continental Airlines Arena in East Rutherford, New Jersey, USA",https://upload.wikimedia.org/wikipedia/commons/b/ba/Bradshaw.jpg
504,14.07.2002,,"WWE Hardcore Title:Bradshaw(c) vs.Shawn Stasiak- No ContestWWE RAW House Show- House Show @ Stabler Arena in Bethlehem, Pennsylvania, USA",https://upload.wikimedia.org/wikipedia/commons/b/ba/Bradshaw.jpg
505,13.07.2002,,"WWE Hardcore Title:Justin CredibledefeatsBradshaw(c) -TITLE CHANGE !!!WWE RAW House Show- House Show @ Ocean Center in Daytona Beach, Florida, USA",https://upload.wikimedia.org/wikipedia/commons/b/ba/Bradshaw.jpg
506,12.07.2002,,"WWE Hardcore Title:Bradshaw(c) vs.The Big Show- No ContestWWE RAW House Show- House Show @ Lakeland, Florida, USA",https://upload.wikimedia.org/wikipedia/commons/b/ba/Bradshaw.jpg
507,08.07.2002,,"Mixed:Bradshaw&Trish StratusdefeatChristopher Nowinski&Jackie Gayda(3:15)WWE RAW #476- TV-Show @ First Union Center in Philadelphia, Pennsylvania, USA",https://upload.wikimedia.org/wikipedia/commons/b/ba/Bradshaw.jpg
508,08.07.2002,,"WWE Hardcore Title:Bradshaw(c) defeatsRaven(5:03)WWE Sunday Night Heat #206- TV-Show @ First Union Center in Philadelphia, Pennsylvania, USA",https://upload.wikimedia.org/wikipedia/commons/b/ba/Bradshaw.jpg
509,07.07.2002,,"WWE Hardcore Title:Steven RichardsdefeatsBradshaw(c) -TITLE CHANGE !!!WWE RAW House Show- House Show @ Wildwood, New Jersey, USA",https://upload.wikimedia.org/wikipedia/commons/b/ba/Bradshaw.jpg
510,06.07.2002,,"WWE Hardcore Title:Steven RichardsdefeatsBradshaw(c) -TITLE CHANGE !!!WWE RAW House Show- House Show @ Harry Grove Stadium in Frederick, Maryland, USA",https://upload.wikimedia.org/wikipedia/commons/b/ba/Bradshaw.jpg
511,01.07.2002,,"Christopher NowinskidefeatsBradshaw(0:57)WWE RAW #475- TV-Show @ Verizon Wireless Arena in Manchester, New Hampshire, USA",https://upload.wikimedia.org/wikipedia/commons/b/ba/Bradshaw.jpg
512,30.06.2002,,"WWE Hardcore Title:RavendefeatsBradshaw(c) -TITLE CHANGE !!!WWE RAW House Show- House Show @ Mohegan Sun in Uncasville, Connecticut, USA",https://upload.wikimedia.org/wikipedia/commons/b/ba/Bradshaw.jpg
513,29.06.2002,,"WWE Hardcore Title:Shawn StasiakdefeatsBradshaw(c) -TITLE CHANGE !!!WWE RAW House Show- House Show @ Madison Square Garden in New York City, New York, USA",https://upload.wikimedia.org/wikipedia/commons/b/ba/Bradshaw.jpg
514,28.06.2002,,"WWE Hardcore Title:Shawn StasiakdefeatsBradshaw(c) -TITLE CHANGE !!!WWE RAW House Show- House Show @ MCI Center in Washington, District Of Columbia, USA",https://upload.wikimedia.org/wikipedia/commons/b/ba/Bradshaw.jpg
515,24.06.2002,,"Christopher Nowinski&William RegaldefeatBradshaw&Spike Dudley(2:46)WWE RAW #474- TV-Show @ Gund Arena in Cleveland, Ohio, USA",https://upload.wikimedia.org/wikipedia/commons/b/ba/Bradshaw.jpg
516,22.06.2002,,"WWE Hardcore Title:RavendefeatsBradshaw(c) -TITLE CHANGE !!!WWE RAW House Show- House Show @ U.S. Bank Arena in Cincinnati, Ohio, USA",https://upload.wikimedia.org/wikipedia/commons/b/ba/Bradshaw.jpg
517,17.06.2002,,"WWE Hardcore TitleMatch (Special Guest Referee: Jacqueline):Bradshaw(c) defeatsJustin CredibleWWE Sunday Night Heat (International Version)- TV-Show @ Oakland Arena in Oakland, California, USA",https://upload.wikimedia.org/wikipedia/commons/b/ba/Bradshaw.jpg
518,16.06.2002,,"Brock LesnardefeatsBradshawWWE RAW House Show- House Show @ Centennial Garden Arena in Bakersfield, California, USA",https://upload.wikimedia.org/wikipedia/commons/b/ba/Bradshaw.jpg
519,15.06.2002,,"Brock LesnardefeatsBradshawWWE RAW House Show- House Show @ Sports Arena in San Diego, California, USA",https://upload.wikimedia.org/wikipedia/commons/b/ba/Bradshaw.jpg
520,14.06.2002,,"Brock LesnardefeatsBradshawWWE RAW House Show- House Show @ The Pit in Albuquerque, New Mexico, USA",https://upload.wikimedia.org/wikipedia/commons/b/ba/Bradshaw.jpg
521,10.06.2002,,"WWE European Title:William Regal(c) defeatsBradshaw(3:42)WWE RAW #472- TV-Show @ Philips Arena in Atlanta, Georgia, USA",https://upload.wikimedia.org/wikipedia/commons/b/ba/Bradshaw.jpg
522,09.06.2002,,"WWE Hardcore Title:Bradshaw(c) defeatsThe Big ShowWWE RAW House Show- House Show @ Civic Center in Columbus, Georgia, USA",https://upload.wikimedia.org/wikipedia/commons/b/ba/Bradshaw.jpg
523,08.06.2002,,"WWE Hardcore Title:Bradshaw(c) defeatsThe Big ShowWWE RAW House Show- House Show @ Thompson-Boling Arena At Food City Center in Knoxville, Tennessee, USA",https://upload.wikimedia.org/wikipedia/commons/b/ba/Bradshaw.jpg
524,07.06.2002,,"WWE Hardcore Title:Bradshaw(c) defeatsThe Big ShowWWE RAW House Show- House Show @ Rupp Arena in Lexington, Kentucky, USA",https://upload.wikimedia.org/wikipedia/commons/b/ba/Bradshaw.jpg
525,03.06.2002,,"WWE Hardcore Title:BradshawdefeatsSteven Richards(c) (2:44) -TITLE CHANGE !!!WWE RAW #471- TV-Show @ American Airlines Arena in Dallas, Texas, USA",https://upload.wikimedia.org/wikipedia/commons/b/ba/Bradshaw.jpg
526,02.06.2002,,"Booker T&The Big ShowdefeatBradshaw&Matt HardyWWE RAW House Show- House Show @ The Arena in New Orleans, Louisiana, USA",https://upload.wikimedia.org/wikipedia/commons/b/ba/Bradshaw.jpg
527,27.05.2002,,"The Big ShowdefeatsBradshaw(1:59)WWE RAW #470- TV-Show @ Skyreach Centre in Edmonton, Alberta, Canada",https://upload.wikimedia.org/wikipedia/commons/b/ba/Bradshaw.jpg
528,26.05.2002,,"The Big ShowdefeatsBradshawWWE RAW House Show- House Show @ Red Deer, Alberta, Canada",https://upload.wikimedia.org/wikipedia/commons/b/ba/Bradshaw.jpg
529,25.05.2002,,"The Big ShowdefeatsBradshawWWE RAW House Show- House Show @ The Arena in Winnipeg, Manitoba, Canada",https://upload.wikimedia.org/wikipedia/commons/b/ba/Bradshaw.jpg
530,24.05.2002,,"BradshawdefeatsBooker TWWE RAW House Show- House Show @ DECC in Duluth, Minnesota, USA",https://upload.wikimedia.org/wikipedia/commons/b/ba/Bradshaw.jpg
