date,event,result,location,image_url
1,26.01.2014,,"Royal Rumble:BatistadefeatsAlberto Del RioandAlexander RusevandAntonio CesaroandBig E. LangstonandCM PunkandCody RhodesandDamien SandowandDean AmbroseandDolph ZigglerandEl ToritoandErick RowanandFandangoandGoldustandJack SwaggerandJey UsoandJimmy UsoandJohn Bradshaw LayfieldandKaneandKevin NashandKofi KingstonandLuke HarperandR-TruthandRey MysterioandRoman ReignsandRybackandSeth RollinsandSheamusandThe Great KhaliandThe Miz(55:05)WWE Royal Rumble 2014- Pay Per View @ CONSOL Energy Center in Pittsburgh, Pennsylvania, USA",https://upload.wikimedia.org/wikipedia/commons/b/ba/Bradshaw.jpg
2,05.04.2009,,"Intercontinental Title:Rey MysteriodefeatsJohn Bradshaw Layfield(c) (0:21) -TITLE CHANGE !!!WWE WrestleMania 25 - ""The 25th Anniversary Of WrestleMania""- Pay Per View @ Reliant Arena in Houston, Texas, USA",https://upload.wikimedia.org/wikipedia/commons/b/ba/Bradshaw.jpg
3,30.03.2009,,"Rey MysteriodefeatsJohn Bradshaw Layfield(6:43)WWE Monday Night RAW #827- TV-Show @ American Airlines Center in Dallas, Texas, USA",https://upload.wikimedia.org/wikipedia/commons/b/ba/Bradshaw.jpg
4,17.03.2009,,"The UndertakerdefeatsJohn Bradshaw Layfield(11:40)WWE Friday Night SmackDown #500- TV-Show @ American Bank Center in Corpus Christi, Texas, USA",https://upload.wikimedia.org/wikipedia/commons/b/ba/Bradshaw.jpg
5,16.03.2009,,"Shawn Michaels&The UndertakerdefeatJohn Bradshaw Layfield&Vladimir Kozlov(8:50)WWE Monday Night RAW #825- TV-Show @ AT&T Center in San Antonio, Texas, USA",https://upload.wikimedia.org/wikipedia/commons/b/ba/Bradshaw.jpg
6,09.03.2009,,"Intercontinental Title:John Bradshaw LayfielddefeatsCM Punk(c) (9:35) -TITLE CHANGE !!!WWE Monday Night RAW #824- TV-Show @ Jacksonville Veterans Memorial Arena in Jacksonville, Florida, USA",https://upload.wikimedia.org/wikipedia/commons/b/ba/Bradshaw.jpg
7,23.02.2009,,"Shawn MichaelsdefeatsJohn Bradshaw Layfield(12:00)WWE Monday Night RAW #822- TV-Show @ Sommet Center in Nashville, Tennessee, USA",https://upload.wikimedia.org/wikipedia/commons/b/ba/Bradshaw.jpg
8,15.02.2009,,"All Or Nothing:Shawn MichaelsdefeatsJohn Bradshaw Layfield(13:19)WWE No Way Out 2009- Pay Per View @ KeyArena in Seattle, Washington, USA",https://upload.wikimedia.org/wikipedia/commons/b/ba/Bradshaw.jpg
9,25.01.2009,,"World Heavyweight Title:John Cena(c) defeatsJohn Bradshaw Layfield(15:30)WWE Royal Rumble 2009- Pay Per View @ Joe Louis Arena in Detroit, Michigan, USA",https://upload.wikimedia.org/wikipedia/commons/b/ba/Bradshaw.jpg
10,29.12.2008,,"World Heavyweight Title#1 Contendership Race To The Rumble Tournament Final Fatal Four Way Elimination:John Bradshaw LayfielddefeatsChris JerichoandRandy OrtonandShawn Michaels(24:50)WWE Monday Night RAW #814- TV-Show @ Verizon Wireless Arena in Manchester, New Hampshire, USA",https://upload.wikimedia.org/wikipedia/commons/b/ba/Bradshaw.jpg
11,22.12.2008,,"Race To The Rumble Tournament First Round:John Bradshaw LayfielddefeatsRey Mysterioby DQ (12:32)WWE Monday Night RAW #813- TV-Show @ Air Canada Centre in Toronto, Ontario, Canada",https://upload.wikimedia.org/wikipedia/commons/b/ba/Bradshaw.jpg
12,05.12.2008,,"CM Punk,Jeff Hardy&R-TruthdefeatJohn Bradshaw Layfield,John Morrison&The Miz(8:00)WWE Tribute To The Troops 2008- TV-Show @ Camp Victory in Bagdad, Irak",https://upload.wikimedia.org/wikipedia/commons/b/ba/Bradshaw.jpg
13,23.11.2008,,"Survivor Series Elimination:Cryme Tyme(JTG&Shad),Rey Mysterio,Shawn Michaels&The Great KhalidefeatJohn Bradshaw Layfield,John Morrison,Kane,Montel Vontavious Porter&The Miz(18:05)WWE Survivor Series 2008- Pay Per View @ TD Banknorth Garden in Boston, Massachusetts, USA",https://upload.wikimedia.org/wikipedia/commons/b/ba/Bradshaw.jpg
14,17.11.2008,,"John Bradshaw Layfield&KanedefeatCryme Tyme(JTG&Shad) (2:53)WWE Monday Night RAW #808- TV-Show @ Philips Arena in Atlanta, Georgia, USA",https://upload.wikimedia.org/wikipedia/commons/b/ba/Bradshaw.jpg
15,15.11.2008,,"World Heavyweight TitleTriple Threat:Chris Jericho(c) defeatsBatistaandJohn Bradshaw LayfieldWWE RAW Survivor Series Tour 2008 - Tag 9- House Show @ Press & Journal Arena in Aberdeen, Scotland, UK",https://upload.wikimedia.org/wikipedia/commons/b/ba/Bradshaw.jpg
16,14.11.2008,,"Shawn MichaelsdefeatsJohn Bradshaw LayfieldWWE RAW Survivor Series Tour 2008 - Tag 8- House Show @ Braehead Arena in Glasgow, Scotland, UK",https://upload.wikimedia.org/wikipedia/commons/b/ba/Bradshaw.jpg
17,13.11.2008,,"Shawn MichaelsdefeatsJohn Bradshaw LayfieldWWE RAW Survivor Series Tour 2008 - Tag 7- House Show @ Odyssey Arena in Belfast, Northern Ireland, UK",https://upload.wikimedia.org/wikipedia/commons/b/ba/Bradshaw.jpg
18,12.11.2008,,"Shawn MichaelsdefeatsJohn Bradshaw LayfieldWWE RAW Survivor Series Tour 2008 - Tag 6- House Show @ Newcastle Metro Radio Arena in Newcastle Upon Tyne, Tyne And Wear, England, UK",https://upload.wikimedia.org/wikipedia/commons/b/ba/Bradshaw.jpg
19,11.11.2008,,"Shawn MichaelsdefeatsJohn Bradshaw LayfieldWWE RAW Survivor Series Tour 2008 - Tag 5- House Show @ National Exhibition Centre in Birmingham, West Midlands, England, UK",https://upload.wikimedia.org/wikipedia/commons/b/ba/Bradshaw.jpg
20,03.11.2008,,"The UndertakerdefeatsJohn Bradshaw Layfieldby Count Out (2:53)WWE Monday Night RAW #806- TV-Show @ St. Pete Times Forum in Tampa, Florida, USA",https://upload.wikimedia.org/wikipedia/commons/b/ba/Bradshaw.jpg
21,27.10.2008,,"Batista&Shawn MichaelsdefeatChris Jericho&John Bradshaw Layfield(12:54)WWE Monday Night RAW #805- TV-Show @ Tucson Convention Center in Tucson, Arizona, USA",https://upload.wikimedia.org/wikipedia/commons/b/ba/Bradshaw.jpg
22,20.10.2008,,"John Bradshaw Layfielddefeats Stone Cold Steve Haastin (Charlie Haas) (0:59)WWE Monday Night RAW #804- TV-Show @ American Bank Center in Corpus Christi, Texas, USA",https://upload.wikimedia.org/wikipedia/commons/b/ba/Bradshaw.jpg
23,18.10.2008,,"Batista&Rey MysteriodefeatJohn Bradshaw Layfield&KaneWWE RAW House Show- House Show @ Jose Miguel Agrelot Coliseum in San Juan, Puerto Rico, USA",https://upload.wikimedia.org/wikipedia/commons/b/ba/Bradshaw.jpg
24,17.10.2008,,"Batistavs.John Bradshaw Layfield- No ContestWWE RAW House Show- House Show @ Juan Vicens Auditorium in Ponce, Puerto Rico, USA",https://upload.wikimedia.org/wikipedia/commons/b/ba/Bradshaw.jpg
25,17.10.2008,,"Batista,Rey Mysterio&Shawn MichaelsdefeatChris Jericho,John Bradshaw Layfield&KaneWWE RAW House Show- House Show @ Juan Vicens Auditorium in Ponce, Puerto Rico, USA",https://upload.wikimedia.org/wikipedia/commons/b/ba/Bradshaw.jpg
26,16.10.2008,,"Batista&Shawn MichaelsdefeatChris Jericho&John Bradshaw LayfieldWWE RAW House Show- House Show @ Manuel Iguina Coliseum in Arecibo, Puerto Rico, USA",https://upload.wikimedia.org/wikipedia/commons/b/ba/Bradshaw.jpg
27,13.10.2008,,"John Bradshaw Layfielddefeats Haas Hogan (Charlie Haas) (1:24)WWE Monday Night RAW #803- TV-Show @ Honda Center in Anaheim, California, USA",https://upload.wikimedia.org/wikipedia/commons/b/ba/Bradshaw.jpg
28,06.10.2008,,"World Heavyweight Title#1 Contendership Match (Special Referee: Chris Jericho):BatistadefeatsJohn Bradshaw Layfield(7:32)WWE Monday Night RAW #802- TV-Show @ KeyArena in Seattle, Washington, USA",https://upload.wikimedia.org/wikipedia/commons/b/ba/Bradshaw.jpg
29,05.10.2008,,"World Heavyweight Title#1 Contendership:BatistadefeatsJohn Bradshaw Layfield(5:20)WWE No Mercy 2008- Pay Per View @ Rose Garden in Portland, Oregon, USA",https://upload.wikimedia.org/wikipedia/commons/b/ba/Bradshaw.jpg
30,30.09.2008,,"Batista,Finlay,Jeff Hardy&Rey MysteriodefeatJohn Bradshaw Layfield,Kane,Montel Vontavious Porter&The Brian Kendrick(15:46)WWE Friday Night SmackDown #476 - All Star Kickoff- TV-Show @ Resch Center in Green Bay, Wisconsin, USA",https://upload.wikimedia.org/wikipedia/commons/b/ba/Bradshaw.jpg
31,22.09.2008,,"Three On Two Handicap:Chris Jericho,John Bradshaw Layfield&Lance CadedefeatBatista&Shawn Michaels(9:03)WWE Monday Night RAW #800- TV-Show @ U.S. Bank Arena in Cincinnati, Ohio, USA",https://upload.wikimedia.org/wikipedia/commons/b/ba/Bradshaw.jpg
32,15.09.2008,,"John Bradshaw LayfielddefeatsTommy Dreamer(1:21)WWE Monday Night RAW #799- TV-Show @ FedExForum in Memphis, Tennessee, USA",https://upload.wikimedia.org/wikipedia/commons/b/ba/Bradshaw.jpg
33,14.09.2008,,"World Heavyweight TitleTriple Threat:Chris Jericho(c) defeatsBatistaandJohn Bradshaw LayfieldWWE RAW House Show- House Show @ Jackson, Tennessee, USA",https://upload.wikimedia.org/wikipedia/commons/b/ba/Bradshaw.jpg
34,13.09.2008,,"World Heavyweight TitleTriple Threat:Chris Jericho(c) defeatsBatistaandJohn Bradshaw LayfieldWWE RAW House Show- House Show @ Alltel Arena in North Little Rock, Arkansas, USA",https://upload.wikimedia.org/wikipedia/commons/b/ba/Bradshaw.jpg
35,08.09.2008,,"Charlie HaasdefeatsJohn Bradshaw Layfieldby Count Out (0:48)WWE Monday Night RAW #798- TV-Show @ Allen Country War Memorial Coliseum in Fort Wayne, Indiana, USA",https://upload.wikimedia.org/wikipedia/commons/b/ba/Bradshaw.jpg
36,08.09.2008,,"Two On One Handicap:Chris Jericho&John Bradshaw LayfielddefeatBatista(2:56)WWE Monday Night RAW #798- TV-Show @ Allen Country War Memorial Coliseum in Fort Wayne, Indiana, USA",https://upload.wikimedia.org/wikipedia/commons/b/ba/Bradshaw.jpg
37,07.09.2008,,"World Heavyweight TitleChampionship Scramble Match (vakant):Chris JerichodefeatsBatistaandJohn Bradshaw LayfieldandKaneandRey Mysterio(20:00) -TITLE CHANGE !!!WWE Unforgiven 2008- Pay Per View @ Quicken Loans Arena in Cleveland, Ohio, USA",https://upload.wikimedia.org/wikipedia/commons/b/ba/Bradshaw.jpg
38,31.08.2008,,"Battle Royal:KanedefeatsBatistaandCM PunkandJohn Bradshaw Layfield(4:17)WWE Monday Night RAW #797- TV-Show @ Scottrade Center in St. Louis, Missouri, USA",https://upload.wikimedia.org/wikipedia/commons/b/ba/Bradshaw.jpg
39,25.08.2008,,"CM PunkdefeatsJohn Bradshaw Layfield(13:17)WWE Monday Night RAW #796- TV-Show @ Wachovia Center in Wilkes-Barre, Pennsylvania, USA",https://upload.wikimedia.org/wikipedia/commons/b/ba/Bradshaw.jpg
40,24.08.2008,,"World Heavyweight Title:CM Punk(c) defeatsJohn Bradshaw LayfieldWWE RAW House Show- House Show @ Stabler Arena in Bethlehem, Pennsylvania, USA",https://upload.wikimedia.org/wikipedia/commons/b/ba/Bradshaw.jpg
41,23.08.2008,,"World Heavyweight TitleSteel Cage:CM Punk(c) defeatsJohn Bradshaw Layfield(22:00)WWE RAW House Show- House Show @ Madison Square Garden in New York City, New York, USA",https://upload.wikimedia.org/wikipedia/commons/b/ba/Bradshaw.jpg
42,22.08.2008,,"World Heavyweight TitleNo Disqualification:CM Punk(c) defeatsJohn Bradshaw LayfieldWWE RAW House Show- House Show @ Arena At Harbor Yard in Bridgeport, Connecticut, USA",https://upload.wikimedia.org/wikipedia/commons/b/ba/Bradshaw.jpg
43,18.08.2008,,"John Bradshaw LayfielddefeatsJamie Nobleby referee's decision (2:52)WWE Monday Night RAW #795- TV-Show @ Allstate Arena in Rosemont, Illinois, USA",https://upload.wikimedia.org/wikipedia/commons/b/ba/Bradshaw.jpg
44,18.08.2008,,"DarkWorld Heavyweight Title:CM Punk(c) defeatsJohn Bradshaw LayfieldWWE Monday Night RAW #795- Dark Match @ Allstate Arena in Rosemont, Illinois, USA",https://upload.wikimedia.org/wikipedia/commons/b/ba/Bradshaw.jpg
45,17.08.2008,,"World Heavyweight Title:CM Punk(c) defeatsJohn Bradshaw Layfield(10:29)WWE SummerSlam 2008- Pay Per View @ Conseco Fieldhouse in Indianapolis, Indiana, USA",https://upload.wikimedia.org/wikipedia/commons/b/ba/Bradshaw.jpg
46,15.08.2008,,"CM Punk,John Cena&Triple HdefeatJohn Bradshaw Layfield,The Great Khali&William RegalWWE House Show- House Show @ Rockford, Illinois, USA",https://upload.wikimedia.org/wikipedia/commons/b/ba/Bradshaw.jpg
47,09.08.2008,,"World Heavyweight TitleNo Disqualification:CM Punk(c) defeatsJohn Bradshaw LayfieldWWE RAW House Show- House Show @ Newark, Delaware, USA",https://upload.wikimedia.org/wikipedia/commons/b/ba/Bradshaw.jpg
48,08.08.2008,,"World Heavyweight TitleNo Disqualification:CM Punk(c) defeatsJohn Bradshaw LayfieldWWE RAW House Show- House Show @ Wildwood, New Jersey, USA",https://upload.wikimedia.org/wikipedia/commons/b/ba/Bradshaw.jpg
49,04.08.2008,,"World Heavyweight Title#1 Contendership Two On One Handicap:Chris Jericho&John Bradshaw LayfielddefeatCM Punk(9:59)WWE Monday Night RAW #793- TV-Show @ Thompson-Boling Arena At Food City Center in Knoxville, Tennessee, USA",https://upload.wikimedia.org/wikipedia/commons/b/ba/Bradshaw.jpg
50,28.07.2008,,"Batista&John CenadefeatJohn Bradshaw Layfield&Kane(12:20)WWE Monday Night RAW #792- TV-Show @ Verizon Center in Washington, District Of Columbia, USA",https://upload.wikimedia.org/wikipedia/commons/b/ba/Bradshaw.jpg
51,28.07.2008,,"Cody Rhodes,John Bradshaw Layfield,Kane&Ted DiBiasedefeatBatista,Cryme Tyme(JTG&Shad) &John Cena(12:07)WWE Saturday Night's Main Event #36- TV-Show @ Verizon Center in Washington, District Of Columbia, USA",https://upload.wikimedia.org/wikipedia/commons/b/ba/Bradshaw.jpg
52,27.07.2008,,"World Heavyweight TitleTriple Threat:CM Punk(c) defeatsBatistaandJohn Bradshaw LayfieldWWE RAW House Show- House Show @ Jaffa Shrine in Altoona, Pennsylvania, USA",https://upload.wikimedia.org/wikipedia/commons/b/ba/Bradshaw.jpg
53,26.07.2008,,"World Heavyweight TitleNo Disqualification Triple Threat:CM Punk(c) defeatsBatistaandJohn Bradshaw LayfieldWWE RAW House Show- House Show @ WesBanco Arena in Wheeling, West Virginia, USA",https://upload.wikimedia.org/wikipedia/commons/b/ba/Bradshaw.jpg
54,21.07.2008,,"Cryme Tyme(JTG&Shad) &John CenadefeatCody Rhodes,John Bradshaw Layfield&Ted DiBiase(10:00)WWE Monday Night RAW #791- TV-Show @ Mohegan Sun Casino in Uncasville, Connecticut, USA",https://upload.wikimedia.org/wikipedia/commons/b/ba/Bradshaw.jpg
55,20.07.2008,,"New York City Parking Lot Brawl:John Bradshaw LayfielddefeatsJohn Cena(17:00)WWE The Great American Bash 2008- Pay Per View @ Nassau Veterans Memorial Coliseum in Uniondale, New York, USA",https://upload.wikimedia.org/wikipedia/commons/b/ba/Bradshaw.jpg
56,14.07.2008,,"Cryme Tyme(JTG&Shad) &John CenadefeatCody Rhodes,John Bradshaw Layfield&Ted DiBiaseby DQ (11:51)WWE Monday Night RAW #790- TV-Show @ Raleigh, North Carolina, USA",https://upload.wikimedia.org/wikipedia/commons/b/ba/Bradshaw.jpg
57,07.07.2008,,"Dark:John CenadefeatsJohn Bradshaw LayfieldWWE Monday Night RAW #789- Dark Match @ New Orleans Arena in New Orleans, Louisiana, USA",https://upload.wikimedia.org/wikipedia/commons/b/ba/Bradshaw.jpg
58,07.07.2008,,"World Heavyweight Title#1 Contendership Fatal Four Way:BatistadefeatsJohn Bradshaw LayfieldandJohn CenaandKane(12:29)WWE Monday Night RAW #789- TV-Show @ New Orleans Arena in New Orleans, Louisiana, USA",https://upload.wikimedia.org/wikipedia/commons/b/ba/Bradshaw.jpg
59,05.07.2008,,"John CenadefeatsJohn Bradshaw LayfieldWWE RAW House Show- House Show @ Gimnasio Nacional Adolfo Pineda in San Salvador, El Salvador",https://upload.wikimedia.org/wikipedia/commons/b/ba/Bradshaw.jpg
60,04.07.2008,,"John CenadefeatsJohn Bradshaw LayfieldWWE RAW House Show- House Show @ Figali Convention Center in Panama City, Panama",https://upload.wikimedia.org/wikipedia/commons/b/ba/Bradshaw.jpg
61,03.07.2008,,"Jeff HardydefeatsJohn Bradshaw LayfieldWWE RAW House Show- House Show @ Estadio Nacional in Lima, Peru",https://upload.wikimedia.org/wikipedia/commons/b/ba/Bradshaw.jpg
62,02.07.2008,,"John CenadefeatsJohn Bradshaw LayfieldWWE RAW House Show- House Show @ Arena Santiago in Santiago de Chile, Chile",https://upload.wikimedia.org/wikipedia/commons/b/ba/Bradshaw.jpg
63,30.06.2008,,"World Heavyweight Title:CM Punk(c) defeatsJohn Bradshaw Layfield(5:00)WWE Monday Night RAW #788- TV-Show @ Ford Center in Oklahoma City, Oklahoma, USA",https://upload.wikimedia.org/wikipedia/commons/b/ba/Bradshaw.jpg
64,28.06.2008,,"Batista&Triple HdefeatEdge&John Bradshaw LayfieldWWE RAW House Show- House Show @ Taylor County Expo Center in Abilene, Texas, USA",https://upload.wikimedia.org/wikipedia/commons/b/ba/Bradshaw.jpg
65,27.06.2008,,"Batista&Triple HdefeatEdge&John Bradshaw LayfieldWWE House Show- House Show @ City Bank Coliseum in Lubbock, Texas, USA",https://upload.wikimedia.org/wikipedia/commons/b/ba/Bradshaw.jpg
66,23.06.2008,,"John Bradshaw LayfielddefeatsKofi Kingston(5:04)WWE Monday Night RAW #787 - Draft 2008- TV-Show @ AT&T Center in San Antonio, Texas, USA",https://upload.wikimedia.org/wikipedia/commons/b/ba/Bradshaw.jpg
67,09.06.2008,,"John CenadefeatsJohn Bradshaw Layfield(10:12)WWE Monday Night RAW #785- TV-Show @ Oakland Arena in Oakland, California, USA",https://upload.wikimedia.org/wikipedia/commons/b/ba/Bradshaw.jpg
68,09.06.2008,,"Dark:Jeff Hardy,John Cena&Triple HdefeatJohn Bradshaw Layfield,Snitsky&UmagaWWE Monday Night RAW #785- Dark Match @ Oakland Arena in Oakland, California, USA",https://upload.wikimedia.org/wikipedia/commons/b/ba/Bradshaw.jpg
69,08.06.2008,,"John CenadefeatsJohn Bradshaw LayfieldWWE RAW House Show- House Show @ Stockton Arena in Stockton, California, USA",https://upload.wikimedia.org/wikipedia/commons/b/ba/Bradshaw.jpg
70,07.06.2008,,"John CenadefeatsJohn Bradshaw LayfieldWWE RAW House Show- House Show @ Convention Center in Redding, California, USA",https://upload.wikimedia.org/wikipedia/commons/b/ba/Bradshaw.jpg
71,02.06.2008,,"Intercontinental Title:Chris Jericho(c) defeatsJohn Bradshaw Layfieldby DQ (5:20)WWE Monday Night RAW #784- TV-Show @ Rabobank Arena in Bakersfield, California, USA",https://upload.wikimedia.org/wikipedia/commons/b/ba/Bradshaw.jpg
72,01.06.2008,,"First Blood:John CenadefeatsJohn Bradshaw Layfield(14:20)WWE One Night Stand 2008: Extreme Rules- Pay Per View @ San Diego Sports Arena in San Diego, California, USA",https://upload.wikimedia.org/wikipedia/commons/b/ba/Bradshaw.jpg
73,26.05.2008,,"John Bradshaw Layfield&UmagadefeatJeff Hardy&John Cena(9:30)WWE Monday Night RAW #783- TV-Show @ Pepsi Center in Denver, Colorado, USA",https://upload.wikimedia.org/wikipedia/commons/b/ba/Bradshaw.jpg
74,24.05.2008,,"Street Fight:John CenadefeatsJohn Bradshaw LayfieldWWE RAW House Show- House Show @ Palacio de los Deportes in Mexico City, Distrito Federal, Mexiko",https://upload.wikimedia.org/wikipedia/commons/b/ba/Bradshaw.jpg
75,22.05.2008,,"John CenadefeatsJohn Bradshaw LayfieldWWE RAW House Show- House Show @ La Plaza de Toros Santa Maria in Santiago de Queretaro, Queretaro, Mexiko",https://upload.wikimedia.org/wikipedia/commons/b/ba/Bradshaw.jpg
76,21.05.2008,,"John CenadefeatsJohn Bradshaw LayfieldWWE RAW House Show- House Show @ La Plaza de Toros La Monumental de Monterrey in Monterrey, Nuevo Leon, Mexiko",https://upload.wikimedia.org/wikipedia/commons/b/ba/Bradshaw.jpg
77,19.05.2008,,"John Bradshaw Layfield&Randy OrtondefeatJohn Cena&Triple H(10:00)WWE Monday Night RAW #782- TV-Show @ Kemper Arena in Kansas City, Missouri, USA",https://upload.wikimedia.org/wikipedia/commons/b/ba/Bradshaw.jpg
78,19.05.2008,,"Dark:John Cena,Shawn Michaels&Triple HdefeatJohn Bradshaw Layfield,Randy Orton&UmagaWWE Monday Night RAW #782- Dark Match @ Kemper Arena in Kansas City, Missouri, USA",https://upload.wikimedia.org/wikipedia/commons/b/ba/Bradshaw.jpg
79,18.05.2008,,"John CenadefeatsJohn Bradshaw Layfield(15:03)WWE Judgment Day 2008- Pay Per View @ Qwest Center in Omaha, Nebraska, USA",https://upload.wikimedia.org/wikipedia/commons/b/ba/Bradshaw.jpg
80,12.05.2008,,"Dark Steel Cage:D-Generation X(Shawn Michaels&Triple H) &John CenadefeatJohn Bradshaw Layfield,Randy Orton&UmagaWWE Monday Night RAW #781- Dark Match @ Joe Louis Arena in Detroit, Michigan, USA",https://upload.wikimedia.org/wikipedia/commons/b/ba/Bradshaw.jpg
81,11.05.2008,,"Chris Jericho&Shawn MichaelsdefeatJohn Bradshaw Layfield&UmagaWWE RAW House Show- House Show @ Breslin Center in East Lansing, Michigan, USA",https://upload.wikimedia.org/wikipedia/commons/b/ba/Bradshaw.jpg
82,10.05.2008,,"Chris Jericho&Shawn MichaelsdefeatJohn Bradshaw Layfield&UmagaWWE RAW House Show- House Show @ Wings Stadium in Kalamazoo, Michigan, USA",https://upload.wikimedia.org/wikipedia/commons/b/ba/Bradshaw.jpg
83,09.05.2008,,"Chris Jericho&Shawn MichaelsdefeatJohn Bradshaw Layfield&William RegalWWE RAW House Show- House Show @ Dow Event Center in Saginaw, Michigan, USA",https://upload.wikimedia.org/wikipedia/commons/b/ba/Bradshaw.jpg
84,05.05.2008,,"John Bradshaw LayfielddefeatsDH Smith(1:00)WWE Monday Night RAW #780- TV-Show @ Air Canada Centre in Toronto, Ontario, Canada",https://upload.wikimedia.org/wikipedia/commons/b/ba/Bradshaw.jpg
85,28.04.2008,,"John Bradshaw LayfielddefeatsRobbie(1:05)WWE Monday Night RAW #779- TV-Show @ Izod Center in East Rutherford, New Jersey, USA",https://upload.wikimedia.org/wikipedia/commons/b/ba/Bradshaw.jpg
86,27.04.2008,,"WWE Heavyweight TitleFatal Four Way Elimination:Triple HdefeatsJohn Bradshaw LayfieldandJohn CenaandRandy Orton(c) (28:12) -TITLE CHANGE !!!WWE Backlash 2008- Pay Per View @ First Mariner Arena in Baltimore, Maryland, USA",https://upload.wikimedia.org/wikipedia/commons/b/ba/Bradshaw.jpg
87,21.04.2008,,"Chavo Guerrero,Edge,John Bradshaw Layfield&Randy OrtondefeatJohn Cena,Kane,The Undertaker&Triple H(10:03)WWE Monday Night RAW #778 - King Of The Ring 2008- TV-Show @ Bi-Lo Center in Greenville, South Carolina, USA",https://upload.wikimedia.org/wikipedia/commons/b/ba/Bradshaw.jpg
88,19.04.2008,,"John Bradshaw LayfielddefeatsHardcore HollyWWE WrestleMania Revenge Tour 2008 - Tag 10 (RAW)- House Show @ Pavilhao Atlantico in Lissabon, Portugal",https://upload.wikimedia.org/wikipedia/commons/b/ba/Bradshaw.jpg
89,18.04.2008,,"John Bradshaw LayfielddefeatsHardcore HollyWWE WrestleMania Revenge Tour 2008 - Tag 9 (RAW)- House Show @ El Coliseo in La Coruna, Spanien",https://upload.wikimedia.org/wikipedia/commons/b/ba/Bradshaw.jpg
90,17.04.2008,,"Intercontinental Title:Chris Jericho(c) defeatsJohn Bradshaw LayfieldWWE WrestleMania Revenge Tour 2008 - Tag 8 (RAW)- House Show @ Plaza de Toros in Granada, Spanien",https://upload.wikimedia.org/wikipedia/commons/b/ba/Bradshaw.jpg
91,16.04.2008,,"Intercontinental Title:Chris Jericho(c) defeatsJohn Bradshaw LayfieldWWE WrestleMania Revenge Tour 2008 - Tag 7 (RAW)- House Show @ Stadthalle in Wien, Österreich",https://upload.wikimedia.org/wikipedia/commons/b/ba/Bradshaw.jpg
92,15.04.2008,,"WWE Heavyweight TitleThree Way:Randy Orton(c) defeatsJohn Bradshaw LayfieldandTriple HWWE Wrestlemania Revenge Tour 2008 - Tag 6- House Show @ Linzer Sports Stadium in Linz, Austria",https://upload.wikimedia.org/wikipedia/commons/b/ba/Bradshaw.jpg
93,14.04.2008,,"Triple HdefeatsJohn Bradshaw Layfieldby DQ (6:00)WWE Monday Night RAW #777- TV-Show @ O2 Arena in London, England, UK",https://upload.wikimedia.org/wikipedia/commons/b/ba/Bradshaw.jpg
94,13.04.2008,,"No Disqualification:John Bradshaw LayfielddefeatsWilliam RegalWWE WrestleMania Revenge Tour 2008 - Tag 4 (RAW)- House Show @ Nottingham Arena in Nottingham, Nottinghamshire, England, UK",https://upload.wikimedia.org/wikipedia/commons/b/ba/Bradshaw.jpg
95,07.04.2008,,"Two On One Handicap:John CenadefeatsJohn Bradshaw Layfield&Triple H(8:05)WWE Monday Night RAW #776- TV-Show @ Times Union Center in Albany, New York, USA",https://upload.wikimedia.org/wikipedia/commons/b/ba/Bradshaw.jpg
96,07.04.2008,,"Two On One Handicap:Triple HdefeatsJohn Bradshaw Layfield&Randy Orton(7:50)WWE Monday Night RAW #776- TV-Show @ Times Union Center in Albany, New York, USA",https://upload.wikimedia.org/wikipedia/commons/b/ba/Bradshaw.jpg
97,30.03.2008,,"Belfast Brawl:John Bradshaw LayfielddefeatsFinlay(9:10)WWE WrestleMania XXIV - ""The Biggest WrestleMania Under The Sun""- Pay Per View @ Florida Citrus Bowl in Orlando, Florida, USA",https://upload.wikimedia.org/wikipedia/commons/b/ba/Bradshaw.jpg
98,24.03.2008,,"No Disqualification:John Cena,Ric Flair,Shawn Michaels&Triple HdefeatJohn Bradshaw Layfield,Randy Orton,The Big Show&Umaga(12:00)WWE Monday Night RAW #774- TV-Show @ Colonial Center in Columbia, South Carolina, USA",https://upload.wikimedia.org/wikipedia/commons/b/ba/Bradshaw.jpg
99,17.03.2008,,"John Bradshaw LayfielddefeatsColin Delaney(1:20)WWE Monday Night RAW #773- TV-Show @ Cajundome in Lafayatte, Louisiana, USA",https://upload.wikimedia.org/wikipedia/commons/b/ba/Bradshaw.jpg
100,17.03.2008,,"17 On Two Handicap Elimination:John Cena&Randy OrtondefeatBrian Kendrick,Carlito,Charlie Haas,Cody Rhodes,DH Smith,Hardcore Holly,Jim Duggan,John Bradshaw Layfield,Lance Cade,Paul Burchill,Robbie,Santino Marella,Snitsky,Super Crazy,Trevor Murdoch,Umaga&Val Venisby DQ (8:35)WWE Monday Night RAW #773- TV-Show @ Cajundome in Lafayatte, Louisiana, USA",https://upload.wikimedia.org/wikipedia/commons/b/ba/Bradshaw.jpg
101,15.03.2008,,"Street Fight:FinlaydefeatsJohn Bradshaw LayfieldWWE RAW House Show- House Show @ Oil Palace in Tyler, Texas, USA",https://upload.wikimedia.org/wikipedia/commons/b/ba/Bradshaw.jpg
102,14.03.2008,,"Street Fight:FinlaydefeatsJohn Bradshaw LayfieldWWE RAW House Show- House Show @ Heart O' Texas Fair Coliseum in Waco, Texas, USA",https://upload.wikimedia.org/wikipedia/commons/b/ba/Bradshaw.jpg
103,09.03.2008,,"Street Fight:FinlaydefeatsJohn Bradshaw LayfieldWWE SmackDown/ECW House Show- House Show @ Five Flags Center in Dubuque, Iowa, USA",https://upload.wikimedia.org/wikipedia/commons/b/ba/Bradshaw.jpg
104,17.02.2008,,"WWE Heavyweight Title#1 Contendership Elimination Chamber:Triple HdefeatsChris JerichoandJeff HardyandJohn Bradshaw LayfieldandShawn MichaelsandUmaga(24:00)WWE No Way Out 2008- Pay Per View @ Thomas & Mack Center in Las Vegas, Nevada, USA",https://upload.wikimedia.org/wikipedia/commons/b/ba/Bradshaw.jpg
105,16.02.2008,,"Street Fight:Chris JerichodefeatsJohn Bradshaw LayfieldWWE RAW House Show- House Show @ Staples Center in Los Angeles, California, USA",https://upload.wikimedia.org/wikipedia/commons/b/ba/Bradshaw.jpg
