date,event,result,location,image_url
754,04.07.2000,,"War Games:Mark Henry,Mr. Black,Rob Conway&The CollectordefeatRico Costantino,Russ McCullough,Shelton Benjamin&Trailer Park TrashNWA OVW- Event @ St. Therese's Gym in Louisville, Kentucky, USA",https://upload.wikimedia.org/wikipedia/commons/7/7b/Laresistance.jpg
755,27.06.2000,,"Nick DinsmoredefeatsRob ConwayNWA OVW- Event @ St. Therese's Gym in Louisville, Kentucky, USA",https://upload.wikimedia.org/wikipedia/commons/7/7b/Laresistance.jpg
756,23.06.2000,,"(Special Referee: Mick Foley):Kane&The DamajadefeatD-Lo Brown&Rob Conway(12:27)NWA OVW Rockin' Rumble 2000: ""30th Anniversary Of Wrestling At The Gardens""- Event @ Louisville Gardens in Louisville, Kentucky, USA",https://upload.wikimedia.org/wikipedia/commons/7/7b/Laresistance.jpg
757,21.06.2000,,"Damaja&Nick DinsmoredefeatMr. Black&Rob ConwayNWA OVW TV- TV-Show @ Davis Arena in Jeffersonville, Indiana, USA",https://upload.wikimedia.org/wikipedia/commons/7/7b/Laresistance.jpg
758,06.06.2000,,"Four On Three Handicap:Jerome Crony,Mark Henry,Mr. Black&Rob ConwaydefeatNick Dinsmore,Russ McCullough&Trailer Park TrashNWA OVW- Event @ St. Therese's Gym in Louisville, Kentucky, USA",https://upload.wikimedia.org/wikipedia/commons/7/7b/Laresistance.jpg
759,24.05.2000,,"Mark Henry&Rob ConwaydefeatRuss McCullough&Scotty SabreNWA OVW TV- TV-Show @ Davis Arena in Jeffersonville, Indiana, USA",https://upload.wikimedia.org/wikipedia/commons/7/7b/Laresistance.jpg
760,23.05.2000,,"Four On Three Handicap:Jerome Crony,Mark Henry,Mr. Black&Rob ConwaydefeatNick Dinsmore,Russ McCullough&Trailer Park TrashNWA OVW- Event @ St. Therese's Gym in Louisville, Kentucky, USA",https://upload.wikimedia.org/wikipedia/commons/7/7b/Laresistance.jpg
761,20.05.2000,,"Nick DinsmoredefeatsRob ConwayNWA OVW- Event @ Walsh Park in La Grange, Kentucky, USA",https://upload.wikimedia.org/wikipedia/commons/7/7b/Laresistance.jpg
762,16.05.2000,,"Russ McCullough&Trailer Park TrashdefeatMark Henry&Rob ConwayNWA OVW- Event @ St. Therese's Gym in Louisville, Kentucky, USA",https://upload.wikimedia.org/wikipedia/commons/7/7b/Laresistance.jpg
763,15.05.2000,,"Bull BuchanandefeatsRob ConwayWWF Jakked #39- TV-Show @ Gund Arena in Cleveland, Ohio, USA",https://upload.wikimedia.org/wikipedia/commons/7/7b/Laresistance.jpg
764,10.05.2000,,"Mark Henry&Rob Conwayvs.Nick Dinsmore&Russ McCullough- No ContestNWA OVW TV- TV-Show @ Davis Arena in Jeffersonville, Indiana, USA",https://upload.wikimedia.org/wikipedia/commons/7/7b/Laresistance.jpg
765,09.05.2000,,"Rob Conwayvs.Russ McCullough- No ContestNWA OVW- Event @ St. Therese's Gym in Louisville, Kentucky, USA",https://upload.wikimedia.org/wikipedia/commons/7/7b/Laresistance.jpg
766,03.05.2000,,"Rob Conway&The Collectorvs.Russ McCullough&Trailer Park Trash- No ContestNWA OVW TV- TV-Show @ Davis Arena in Jeffersonville, Indiana, USA",https://upload.wikimedia.org/wikipedia/commons/7/7b/Laresistance.jpg
767,02.05.2000,,"Mr. Black&The CollectordefeatRob Conway&Russ McCulloughNWA OVW- Event @ St. Therese's Gym in Louisville, Kentucky, USA",https://upload.wikimedia.org/wikipedia/commons/7/7b/Laresistance.jpg
768,25.04.2000,,"NWA OVW Heavyweight TitleFatal Four Way:Damaja(c) vs.Flashvs.Nick Dinsmorevs.Rob Conway- No ContestNWA OVW- Event @ St. Therese's Gym in Louisville, Kentucky, USA",https://upload.wikimedia.org/wikipedia/commons/7/7b/Laresistance.jpg
769,19.04.2000,,"Rob ConwaydefeatsDamajaNWA OVW TV- TV-Show @ Davis Arena in Jeffersonville, Indiana, USA",https://upload.wikimedia.org/wikipedia/commons/7/7b/Laresistance.jpg
770,18.04.2000,,"NWA OVW Heavyweight TitleThree Way:Damaja(c) defeatsFlashandRob ConwayNWA OVW- Event @ St. Therese's Gym in Louisville, Kentucky, USA",https://upload.wikimedia.org/wikipedia/commons/7/7b/Laresistance.jpg
771,05.04.2000,,"Rob ConwaydefeatsChris MichaelsNWA OVW TV- TV-Show @ Davis Arena in Jeffersonville, Indiana, USA",https://upload.wikimedia.org/wikipedia/commons/7/7b/Laresistance.jpg
772,04.04.2000,,"Coal Miner's Glove:Nick DinsmoredefeatsRob ConwayNWA OVW- Event @ St. Therese's Gym in Louisville, Kentucky, USA",https://upload.wikimedia.org/wikipedia/commons/7/7b/Laresistance.jpg
773,29.03.2000,,"Coal Miner's Glove:Rob ConwaydefeatsTrailer Park TrashNWA OVW TV- TV-Show @ Davis Arena in Jeffersonville, Indiana, USA",https://upload.wikimedia.org/wikipedia/commons/7/7b/Laresistance.jpg
774,20.03.2000,,"Dark:The Dupps(Bo Dupp&Jack Dupp) defeatDanny Dominion&Rob ConwayWWF Jakked #31- Dark Match @ Allstate Arena in Rosemont, Illinois, USA",https://upload.wikimedia.org/wikipedia/commons/7/7b/Laresistance.jpg
775,15.03.2000,,"I Quit:Rob ConwaydefeatsNick Dinsmoreby referee's decisionNWA OVW March Madness- Event @ Louisville Gardens in Louisville, Kentucky, USA",https://upload.wikimedia.org/wikipedia/commons/7/7b/Laresistance.jpg
776,14.03.2000,,"Rico CostantinodefeatsRob ConwayNWA OVW- Event @ St. Therese's Gym in Louisville, Kentucky, USA",https://upload.wikimedia.org/wikipedia/commons/7/7b/Laresistance.jpg
777,08.03.2000,,"Trailer Park TrashdefeatsRob ConwayNWA OVW TV- TV-Show @ Davis Arena in Jeffersonville, Indiana, USA",https://upload.wikimedia.org/wikipedia/commons/7/7b/Laresistance.jpg
778,07.03.2000,,"Elimination:Damaja,Rico Costantino,Rob Conway&Russ McCulloughdefeatBull Buchanan,Flash,Mr. Black&Nick DinsmoreNWA OVW- Event @ St. Therese's Gym in Louisville, Kentucky, USA",https://upload.wikimedia.org/wikipedia/commons/7/7b/Laresistance.jpg
779,22.02.2000,,"Rob ConwaydefeatsJebediah BlackhawkNWA OVW- Event @ St. Therese's Gym in Louisville, Kentucky, USA",https://upload.wikimedia.org/wikipedia/commons/7/7b/Laresistance.jpg
780,20.02.2000,,"Nick DinsmoredefeatsRob ConwayNWA OVW- Event @ Davis Arena in Jeffersonville, Indiana, USA",https://upload.wikimedia.org/wikipedia/commons/7/7b/Laresistance.jpg
781,16.02.2000,,"Triple Threat:DamajadefeatsNick DinsmoreandRob ConwayNWA OVW St. Valentine's Massacre- Event @ Louisville Gardens in Louisville, Kentucky, USA",https://upload.wikimedia.org/wikipedia/commons/7/7b/Laresistance.jpg
782,25.01.2000,,"NWA OVW Heavyweight Title:Flash(c) defeatsRob ConwayNWA OVW- Event @ St. Therese's Gym in Louisville, Kentucky, USA",https://upload.wikimedia.org/wikipedia/commons/7/7b/Laresistance.jpg
783,19.01.2000,,"Damaja,Jim Cornette&Rob ConwaydefeatBull Buchanan,Kenny Bolin&Nick DinsmoreNWA OVW River City Rumble- Event @ Louisville Gardens in Louisville, Kentucky, USA",https://upload.wikimedia.org/wikipedia/commons/7/7b/Laresistance.jpg
784,19.01.2000,,"River City Rumble:Bull BuchanandefeatsAliandBJ PayneandDamajaandDerrick KingandFlashandJason LeeandJebediahandLow RiderandMr. BlackandNick DinsmoreandRandy RoyalandRip RogersandRobbie DandRob ConwayandRuss McCulloughandSean CaseyandThe EagleandTrailer Park TrashandVito AndrettiNWA OVW River City Rumble- Event @ Louisville Gardens in Louisville, Kentucky, USA",https://upload.wikimedia.org/wikipedia/commons/7/7b/Laresistance.jpg
785,18.01.2000,,"BJ Payne,Damaja,Rico Costantino&Rob ConwaydefeatBull Buchanan,Flash,Mr. Black&Nick DinsmoreNWA OVW- Event @ St. Therese's Gym in Louisville, Kentucky, USA",https://upload.wikimedia.org/wikipedia/commons/7/7b/Laresistance.jpg
786,11.01.2000,,"NWA OVW Heavyweight Title:Flash(c) defeatsRob ConwayNWA OVW- Event @ St. Therese's Gym in Louisville, Kentucky, USA",https://upload.wikimedia.org/wikipedia/commons/7/7b/Laresistance.jpg
787,05.01.2000,,"Nick DinsmoredefeatsRob ConwayNWA OVW TV- TV-Show @ Davis Arena in Jeffersonville, Indiana, USA",https://upload.wikimedia.org/wikipedia/commons/7/7b/Laresistance.jpg
788,04.01.2000,,"Rob ConwaydefeatsChris AlexanderNWA OVW- Event @ St. Therese's Gym in Louisville, Kentucky, USA",https://upload.wikimedia.org/wikipedia/commons/7/7b/Laresistance.jpg
789,26.12.1999,,"Coward Waves The Flag:Damaja&Rob ConwaydefeatBull Buchanan&Nick DinsmoreNWA OVW Christmas Chaos 1999- Event @ Louisville Gardens in Louisville, Kentucky, USA",https://upload.wikimedia.org/wikipedia/commons/7/7b/Laresistance.jpg
790,22.12.1999,,"Damaja&Rob Conwayvs.Jason Lee&Rip Rogers- Double DQNWA OVW TV- TV-Show @ Davis Arena in Jeffersonville, Indiana, USA",https://upload.wikimedia.org/wikipedia/commons/7/7b/Laresistance.jpg
791,09.12.1999,,"Rob ConwaydefeatsBull Buchananby DQNWA OVW TV- TV-Show @ Davis Arena in Jeffersonville, Indiana, USA",https://upload.wikimedia.org/wikipedia/commons/7/7b/Laresistance.jpg
792,08.12.1999,,"I Quit:Rob ConwaydefeatsBull BuchananNWA OVW- Event @ Louisville Gardens in Louisville, Kentucky, USA",https://upload.wikimedia.org/wikipedia/commons/7/7b/Laresistance.jpg
793,07.12.1999,,"Two On One Handicap Lumberjack:Rob ConwaydefeatsKenny Bolin&Nick DinsmoreNWA OVW- Event @ St. Therese's Gym in Louisville, Kentucky, USA",https://upload.wikimedia.org/wikipedia/commons/7/7b/Laresistance.jpg
794,01.12.1999,,"Dark:Rob ConwaydefeatsBull BuchananNWA OVW TV- Dark Match @ Davis Arena in Jeffersonville, Indiana, USA",https://upload.wikimedia.org/wikipedia/commons/7/7b/Laresistance.jpg
795,30.11.1999,,"Two On One Handicap:Rob ConwaydefeatsKenny Bolin&Nick DinsmoreNWA OVW- Event @ Louisville, Kentucky, USA",https://upload.wikimedia.org/wikipedia/commons/7/7b/Laresistance.jpg
796,26.11.1999,,"Rob ConwaydefeatsBull BuchananNWA OVW- Event @ Louisville Gardens in Louisville, Kentucky, USA",https://upload.wikimedia.org/wikipedia/commons/7/7b/Laresistance.jpg
797,25.11.1999,,"Flash Flanaganvs.Rob Conway- No ContestNWA OVW- Event @ Davis Arena in Jeffersonville, Indiana, USA",https://upload.wikimedia.org/wikipedia/commons/7/7b/Laresistance.jpg
798,17.11.1999,,"Rob ConwaydefeatsMr. Blackby DQNWA OVW- Event @ Davis Arena in Jeffersonville, Indiana, USA",https://upload.wikimedia.org/wikipedia/commons/7/7b/Laresistance.jpg
799,16.11.1999,,"Rob ConwaydefeatsNick DinsmoreNWA OVW- Event @ Louisville, Kentucky, USA",https://upload.wikimedia.org/wikipedia/commons/7/7b/Laresistance.jpg
800,10.11.1999,,"NWA OVW Heavyweight TitleCoal Miner's Glove:Rico CostantinodefeatsRob Conway(c) -TITLE CHANGE !!!NWA OVW- Event @ Louisville Gardens in Louisville, Kentucky, USA",https://upload.wikimedia.org/wikipedia/commons/7/7b/Laresistance.jpg
801,07.11.1999,,"Trailer Park TrashdefeatsRob Conwayby DQNWA OVW- Event @ Davis Arena in Jeffersonville, Indiana, USA",https://upload.wikimedia.org/wikipedia/commons/7/7b/Laresistance.jpg
802,03.11.1999,,"Rico CostantinodefeatsRob ConwayNWA OVW- Event @ Davis Arena in Jeffersonville, Indiana, USA",https://upload.wikimedia.org/wikipedia/commons/7/7b/Laresistance.jpg
803,27.10.1999,,"Bull Buchanan&Rob ConwaydefeatRico Costantino&Trailer Park TrashNWA OVW- Event @ Davis Arena in Jeffersonville, Indiana, USA",https://upload.wikimedia.org/wikipedia/commons/7/7b/Laresistance.jpg
804,20.10.1999,,"NWA OVW Heavyweight Title:Rob Conway(c) defeatsJebediah BlackhawkNWA OVW- Event @ Jeffersonville, Indiana, USA",https://upload.wikimedia.org/wikipedia/commons/7/7b/Laresistance.jpg
805,18.10.1999,,"D-Lo BrowndefeatsRob Conway(5:28)WWF Jakked #9- TV-Show @ Value City Arena At The Jerome Schottenstein Center in Columbus, Ohio, USA",https://upload.wikimedia.org/wikipedia/commons/7/7b/Laresistance.jpg
806,13.10.1999,,"Rob ConwaydefeatsTrailer Park TrashNWA OVW- Event @ Jeffersonville, Indiana, USA",https://upload.wikimedia.org/wikipedia/commons/7/7b/Laresistance.jpg
807,13.10.1999,,"Rob ConwaydefeatsTrailer Park TrashNWA OVW- Event @ Davis Arena in Jeffersonville, Indiana, USA",https://upload.wikimedia.org/wikipedia/commons/7/7b/Laresistance.jpg
808,12.10.1999,,"NWA OVW Heavyweight TitleBest Two Out Of Three Falls:Rob Conway(c) defeatsRico CostantinoNWA OVW- Event @ Louisville, Kentucky, USA",https://upload.wikimedia.org/wikipedia/commons/7/7b/Laresistance.jpg
809,12.10.1999,,"NWA OVW Heavyweight TitleBest Two Out Of Three Falls:Rob Conway(c) defeatsRico CostantinoNWA OVW- Event @ Louisville, Kentucky, USA",https://upload.wikimedia.org/wikipedia/commons/7/7b/Laresistance.jpg
810,07.10.1999,,"Dark:DamajadefeatsRob Conwayby DQNWA OVW TV- Dark Match @ Davis Arena in Jeffersonville, Indiana, USA",https://upload.wikimedia.org/wikipedia/commons/7/7b/Laresistance.jpg
811,06.10.1999,,"NWA OVW Heavyweight Title:Rob Conway(c) defeatsRico CostantinoNWA OVW- Event @ Louisville Gardens in Louisville, Kentucky, USA",https://upload.wikimedia.org/wikipedia/commons/7/7b/Laresistance.jpg
812,05.10.1999,,"Gauntlet:BJ Paynevs.Bull Buchananvs.Damajavs.Flash Flanaganvs.Jason Leevs.Low Ridervs.Nick Dinsmorevs.Rico Costantinovs.Rip Rogersvs.Rob Conwayvs.Trailer Park Trashvs.Vito Andretti- No ContestNWA OVW- Event @ St. Therese's Gym in Louisville, Kentucky, USA",https://upload.wikimedia.org/wikipedia/commons/7/7b/Laresistance.jpg
813,28.09.1999,,"Elimination:Damaja&Trailer Park TrashdefeatBull Buchanan&Rob ConwayNWA OVW- Event @ St. Therese's Gym in Louisville, Kentucky, USA",https://upload.wikimedia.org/wikipedia/commons/7/7b/Laresistance.jpg
814,21.09.1999,,"Piledriver:Rob ConwaydefeatsDamajaNWA OVW- Event @ St. Therese's Gym in Louisville, Kentucky, USA",https://upload.wikimedia.org/wikipedia/commons/7/7b/Laresistance.jpg
815,16.09.1999,,"Rob ConwaydefeatsAmerican EagleNWA OVW TV- TV-Show @ Davis Arena in Jeffersonville, Indiana, USA",https://upload.wikimedia.org/wikipedia/commons/7/7b/Laresistance.jpg
816,15.09.1999,,"Stretcher:Damaja&Jerry LawlerdefeatBull Buchanan&Rob ConwayNWA OVW- Event @ Louisville Gardens in Louisville, Kentucky, USA",https://upload.wikimedia.org/wikipedia/commons/7/7b/Laresistance.jpg
817,12.09.1999,,"Battle Royal:Russ McCulloughdefeatsBull BuchananandChris AlexanderandFlash FlanaganandLow RiderandNick DinsmoreandRico CostantinoandRob ConwayandStefan GamlinandTrailer Park TrashandVito AndrettiNWA OVW- Event @ Davis Arena in Jeffersonville, Indiana, USA",https://upload.wikimedia.org/wikipedia/commons/7/7b/Laresistance.jpg
818,12.09.1999,,"NWA OVW Heavyweight Title:Rob Conway(c) vs.Nick Dinsmore- No Contest (6:45)NWA OVW- Event @ Davis Arena in Jeffersonville, Indiana, USA",https://upload.wikimedia.org/wikipedia/commons/7/7b/Laresistance.jpg
819,07.09.1999,,"NWA OVW Heavyweight Title:Rob Conway(c) defeatsTrailer Park TrashNWA OVW- Event @ St. Therese's Gym in Louisville, Kentucky, USA",https://upload.wikimedia.org/wikipedia/commons/7/7b/Laresistance.jpg
820,01.09.1999,,"Dark:Rico Costantino&Russ McCulloughdefeatRob Conway&Stefan GamlinNWA OVW TV- Dark Match @ Davis Arena in Jeffersonville, Indiana, USA",https://upload.wikimedia.org/wikipedia/commons/7/7b/Laresistance.jpg
821,31.08.1999,,"Falls Count Anywhere:Bull Buchanan&Rob ConwaydefeatDamaja&Trailer Park TrashNWA OVW- Event @ St. Therese's Gym in Louisville, Kentucky, USA",https://upload.wikimedia.org/wikipedia/commons/7/7b/Laresistance.jpg
822,25.08.1999,,"Dark:Juan Hurtado,Russ McCullough&Trailer Park TrashdefeatGuido Andretti,Rob Conway&Stefan GamlinNWA OVW TV- Dark Match @ Davis Arena in Jeffersonville, Indiana, USA",https://upload.wikimedia.org/wikipedia/commons/7/7b/Laresistance.jpg
823,24.08.1999,,"NWA OVW Heavyweight TitleHardcore:Rob Conway(c) defeatsDamajaNWA OVW- Event @ St. Therese's Gym in Louisville, Kentucky, USA",https://upload.wikimedia.org/wikipedia/commons/7/7b/Laresistance.jpg
824,17.08.1999,,"NWA OVW Heavyweight Title:Rob ConwaydefeatsThe Damaja(c) -TITLE CHANGE !!!NWA OVW- Event @ Louisville Gardens in Louisville, Kentucky, USA",https://upload.wikimedia.org/wikipedia/commons/7/7b/Laresistance.jpg
825,15.08.1999,,"Rob ConwaydefeatsJohnny SpadeNWA OVW- Event @ Davis Arena in Jeffersonville, Indiana, USA",https://upload.wikimedia.org/wikipedia/commons/7/7b/Laresistance.jpg
826,11.08.1999,,"Rob ConwaydefeatsAmerican EagleNWA OVW TV- TV-Show @ Davis Arena in Jeffersonville, Indiana, USA",https://upload.wikimedia.org/wikipedia/commons/7/7b/Laresistance.jpg
827,10.08.1999,,"Rob ConwaydefeatsTrailer Park TrashNWA OVW- Event @ St. Therese's Gym in Louisville, Kentucky, USA",https://upload.wikimedia.org/wikipedia/commons/7/7b/Laresistance.jpg
828,04.08.1999,,"Dark:Jebediah Blackhawk,Johnny Spade,Russ McCullough&Trailer Park TrashdefeatChris Alexander, Rasputin,Rob Conway& Todd RaveNWA OVW TV- Dark Match @ Davis Arena in Jeffersonville, Indiana, USA",https://upload.wikimedia.org/wikipedia/commons/7/7b/Laresistance.jpg
829,03.08.1999,,"Nick Dinsmore&Trailer Park TrashdefeatDamaja&Rob ConwayNWA OVW- Event @ St. Therese's Gym in Louisville, Kentucky, USA",https://upload.wikimedia.org/wikipedia/commons/7/7b/Laresistance.jpg
830,01.08.1999,,"NWA OVW Heavyweight Title:Damaja(c) defeatsRob ConwayNWA OVW- Event @ Davis Arena in Jeffersonville, Indiana, USA",https://upload.wikimedia.org/wikipedia/commons/7/7b/Laresistance.jpg
831,28.07.1999,,"Dark:Flash Flanagan,Nick Dinsmore&Trailer Park TrashdefeatRob Conway,Russ McCullough& Todd RaveNWA OVW TV- Dark Match @ Davis Arena in Jeffersonville, Indiana, USA",https://upload.wikimedia.org/wikipedia/commons/7/7b/Laresistance.jpg
832,27.07.1999,,"NWA OVW Heavyweight Title:Damaja(c) vs.Rob Conway- No ContestNWA OVW- Event @ St. Therese's Gym in Louisville, Kentucky, USA",https://upload.wikimedia.org/wikipedia/commons/7/7b/Laresistance.jpg
833,25.07.1999,,"Nick DinsmoredefeatsRob ConwayNWA OVW- Event @ Davis Arena in Jeffersonville, Indiana, USA",https://upload.wikimedia.org/wikipedia/commons/7/7b/Laresistance.jpg
834,20.07.1999,,"NWA OVW Heavyweight TitleThree Way Elimination:The Damaja(c) defeatsNick DinsmoreandRob ConwayNWA OVW- Event @ Louisville Gardens in Louisville, Kentucky, USA",https://upload.wikimedia.org/wikipedia/commons/7/7b/Laresistance.jpg
835,18.07.1999,,"Rob ConwaydefeatsAmerican EagleNWA OVW- Event @ Davis Arena in Jeffersonville, Indiana, USA",https://upload.wikimedia.org/wikipedia/commons/7/7b/Laresistance.jpg
836,14.07.1999,,"Dark:Doug Basham,Flash Flanagan,Nick Dinsmore&Trailer Park TrashdefeatGuido Andretti,Rob Conway, Todd Rave &Vito AndrettiNWA OVW TV- Dark Match @ Davis Arena in Jeffersonville, Indiana, USA",https://upload.wikimedia.org/wikipedia/commons/7/7b/Laresistance.jpg
837,13.07.1999,,"Dark:Glen RuthdefeatsRob ConwayWWF RAW is WAR #321- Dark Match @ Rupp Arena in Lexington, Kentucky, USA",https://upload.wikimedia.org/wikipedia/commons/7/7b/Laresistance.jpg
838,11.07.1999,,"Rob ConwaydefeatsJebediah BlackhawkNWA OVW- Event @ Davis Arena in Jeffersonville, Indiana, USA",https://upload.wikimedia.org/wikipedia/commons/7/7b/Laresistance.jpg
839,06.07.1999,,"NWA OVW Heavyweight Title:Damaja(c) vs.Rob Conway- Double DQNWA OVW- Event @ St. Therese's Gym in Louisville, Kentucky, USA",https://upload.wikimedia.org/wikipedia/commons/7/7b/Laresistance.jpg
840,29.06.1999,,"Battle Royal:Rob ConwaydefeatsAmerican EagleandChad CollyerandCousin OtterandFlash FlanaganandGuido AndrettiandJason LeeandJebediah BlackhawkandJohnny SpadeandJuan HurtadoandKousin KrazyandNick Dinsmoreand Rasputin andRip RogersandRod SteeleandTrailer Park TrashandVito AndrettiNWA OVW- Event @ St. Therese's Gym in Louisville, Kentucky, USA",https://upload.wikimedia.org/wikipedia/commons/7/7b/Laresistance.jpg
841,29.06.1999,,"Coward Waves The Flag:Nick DinsmoredefeatsRob ConwayNWA OVW- Event @ St. Therese's Gym in Louisville, Kentucky, USA",https://upload.wikimedia.org/wikipedia/commons/7/7b/Laresistance.jpg
842,23.06.1999,,"Trailer Park TrashdefeatsRob Conwayby DQNWA OVW TV- TV-Show @ Davis Arena in Jeffersonville, Indiana, USA",https://upload.wikimedia.org/wikipedia/commons/7/7b/Laresistance.jpg
843,22.06.1999,,"I Quit:Rob ConwaydefeatsNick DinsmoreNWA OVW- Event @ St. Therese's Gym in Louisville, Kentucky, USA",https://upload.wikimedia.org/wikipedia/commons/7/7b/Laresistance.jpg
844,20.06.1999,,"Nick DinsmoredefeatsRob Conwayby DQNWA OVW- Event @ Davis Arena in Jeffersonville, Indiana, USA",https://upload.wikimedia.org/wikipedia/commons/7/7b/Laresistance.jpg
845,16.06.1999,,"Flash Flanagan&Trailer Park TrashdefeatRip Rogers&Rob ConwayNWA OVW TV- TV-Show @ Davis Arena in Jeffersonville, Indiana, USA",https://upload.wikimedia.org/wikipedia/commons/7/7b/Laresistance.jpg
846,15.06.1999,,"Lights Out:Nick DinsmoredefeatsRob ConwayNWA OVW- Event @ St. Therese's Gym in Louisville, Kentucky, USA",https://upload.wikimedia.org/wikipedia/commons/7/7b/Laresistance.jpg
847,13.06.1999,,"Cousin Otter&Jebediah BlackhawkdefeatRip Rogers&Rob Conwayby DQNWA OVW- Event @ Davis Arena in Jeffersonville, Indiana, USA",https://upload.wikimedia.org/wikipedia/commons/7/7b/Laresistance.jpg
848,12.06.1999,,"Cousin Otter,Flash Flanagan&Trailer Park TrashdefeatGuido Andretti,Rob Conway&Vito Andretti(10:45)NWA OVW- Event @ Morgan Community Center in Bedford, Kentucky, USA",https://upload.wikimedia.org/wikipedia/commons/7/7b/Laresistance.jpg
849,12.06.1999,,"Battle Royal:American EagledefeatsChris AlexanderandCousin OtterandDamajaandFlash FlanaganandGuido AndrettiandJason LeeandJebediah BlackhawkandKousin KrazyandNick Dinsmoreand Rasputin andRob Conwayand Todd Rave andTrailer Park TrashandVito AndrettiNWA OVW- Event @ Morgan Community Center in Bedford, Kentucky, USA",https://upload.wikimedia.org/wikipedia/commons/7/7b/Laresistance.jpg
850,10.06.1999,,"NWA OVW Southern Tag Team Title:Flash Flanagan&Trailer Park Trash(c) defeatRip Rogers&Rob Conway(18:05)NWA OVW- Event @ Crothersville High School in Crothersville, Indiana, USA",https://upload.wikimedia.org/wikipedia/commons/7/7b/Laresistance.jpg
851,09.06.1999,,"Rob ConwaydefeatsJohnny SpadeNWA OVW TV- TV-Show @ Davis Arena in Jeffersonville, Indiana, USA",https://upload.wikimedia.org/wikipedia/commons/7/7b/Laresistance.jpg
852,06.06.1999,,"Rod SteeledefeatsRob Conwayby DQNWA OVW- Event @ Davis Arena in Jeffersonville, Indiana, USA",https://upload.wikimedia.org/wikipedia/commons/7/7b/Laresistance.jpg
853,01.06.1999,,"NWA OVW Southern Tag Team Title:Flash Flanagan&Trailer Park Trash(c) defeatRip Rogers&Rob Conwayby Count OutNWA OVW- Event @ Louisville Gardens in Louisville, Kentucky, USA",https://upload.wikimedia.org/wikipedia/commons/7/7b/Laresistance.jpg
854,26.05.1999,,"Dark:Cousin Otter,Flash Flanagan,Jebediah Blackhawk&Rod SteeledefeatJason Lee,Rob Conway, Todd Rave &Vito AndrettiNWA OVW TV- Dark Match @ Davis Arena in Jeffersonville, Indiana, USA",https://upload.wikimedia.org/wikipedia/commons/7/7b/Laresistance.jpg
855,25.05.1999,,"Dark:Kurt AngledefeatsRob ConwayWWF Shotgun Saturday Night- Dark Match @ Mark Of The Quad in Moline, Illinois, USA",https://upload.wikimedia.org/wikipedia/commons/7/7b/Laresistance.jpg
856,20.05.1999,,"NWA OVW Southern Tag Team Title:Flash Flanagan&Trailer Park Trash(c) defeatRip Rogers&Rob Conway(9:20)NWA OVW- Event @ Carrollton High School in Carrollton, Kentucky, USA",https://upload.wikimedia.org/wikipedia/commons/7/7b/Laresistance.jpg
857,19.05.1999,,"Rob Conway&Tim HornerdefeatBull Pain&Flash Flanagan2nd Annual Brian Pillman Memorial Show- Event @ Cincinatti Gardens in Cincinnati, Ohio, USA",https://upload.wikimedia.org/wikipedia/commons/7/7b/Laresistance.jpg
858,16.05.1999,,"Flash Flanagan&Trailer Park Trashvs.Jason Lee&Rob Conway- No ContestNWA OVW- Event @ Davis Arena in Jeffersonville, Indiana, USA",https://upload.wikimedia.org/wikipedia/commons/7/7b/Laresistance.jpg
859,15.05.1999,,"Doug Basham&Trailer Park TrashdefeatRip Rogers&Rob ConwayNWA OVW- Event @ Walsh Park in La Grange, Kentucky, USA",https://upload.wikimedia.org/wikipedia/commons/7/7b/Laresistance.jpg
860,15.05.1999,,"Battle Royal:American EagledefeatsChris AlexanderandCousin OtterandDamajaandDoug BashamandGuido AndrettiandJason LeeandJebediah Blackhawkand Rasputin andRip RogersandRob ConwayandRod SteeleandTrailer Park TrashandVito AndrettiNWA OVW- Event @ Walsh Park in La Grange, Kentucky, USA",https://upload.wikimedia.org/wikipedia/commons/7/7b/Laresistance.jpg
861,12.05.1999,,"Rip Rogers&Rob ConwaydefeatCousin Otter&Jebediah BlackhawkNWA OVW TV- TV-Show @ Davis Arena in Jeffersonville, Indiana, USA",https://upload.wikimedia.org/wikipedia/commons/7/7b/Laresistance.jpg
862,12.05.1999,,"Dark:Cousin Otter&Jebediah BlackhawkdefeatDamaja&Rob Conwayby DQ (4:52)NWA OVW TV- Dark Match @ Davis Arena in Jeffersonville, Indiana, USA",https://upload.wikimedia.org/wikipedia/commons/7/7b/Laresistance.jpg
863,11.05.1999,,"Six Man Tag Team Street Fight:Flash Flanagan,Nick Dinsmore&Trailer Park TrashdefeatDamaja,Rip Rogers&Rob ConwayNWA OVW- Event @ St. Therese's Gym in Louisville, Kentucky, USA",https://upload.wikimedia.org/wikipedia/commons/7/7b/Laresistance.jpg
864,09.05.1999,,"Rip Rogers&Rob ConwaydefeatCousin Otter&Jebediah Blackhawk(13:01)NWA OVW- Event @ Davis Arena in Jeffersonville, Indiana, USA",https://upload.wikimedia.org/wikipedia/commons/7/7b/Laresistance.jpg
865,08.05.1999,,"NWA OVW Southern Tag Team Title:Flash Flanagan&Trailer Park Trash(c) defeatRip Rogers&Rob Conwayby DQ (10:30)NWA OVW- Event @ Morgan Community Center in Bedford, Kentucky, USA",https://upload.wikimedia.org/wikipedia/commons/7/7b/Laresistance.jpg
866,07.05.1999,,"NWA OVW Heavyweight Title:Nick DinsmoredefeatsRob Conway(c) -TITLE CHANGE !!!NWA OVW- Event @ Providence High School in Clarksville, Indiana, USA",https://upload.wikimedia.org/wikipedia/commons/7/7b/Laresistance.jpg
867,05.05.1999,,"Rip Rogers&Rob ConwaydefeatChris Alexander&Johnny SpadeNWA OVW TV- TV-Show @ Davis Arena in Jeffersonville, Indiana, USA",https://upload.wikimedia.org/wikipedia/commons/7/7b/Laresistance.jpg
868,05.05.1999,,"Dark:Dave The Rave,Rob Conway& Todd Rave vs.Flash Flanagan,Nick Dinsmore&Trailer Park Trash- No ContestNWA OVW TV- Dark Match @ Davis Arena in Jeffersonville, Indiana, USA",https://upload.wikimedia.org/wikipedia/commons/7/7b/Laresistance.jpg
869,04.05.1999,,"Rip Rogers&Rob ConwaydefeatFlash Flanagan&Trailer Park Trash(12:40)NWA OVW- Event @ Louisville Gardens in Louisville, Kentucky, USA",https://upload.wikimedia.org/wikipedia/commons/7/7b/Laresistance.jpg
