date,event,result,location,image_url
1,13.07.2025,,"Gauntlet:Sam Bealedefeats Groovy Grizzly and Mike The Agent andMouseandRob Conway5DPW Sunshine Daydream- Event @ Remarkable Wrestling School in Nesconset, New York, USA",https://upload.wikimedia.org/wikipedia/commons/7/7b/Laresistance.jpg
2,27.04.2024,,"La Resistance(Rene Dupree,Rob Conway&Sylvan Grenier) defeatDJ Powers,Randy Shawn&TKO KocenkoNEW Hat City Havoc 2024- Pay Per View @ Henry Abbott Technical High School in Danbury, Connecticut, USA",https://upload.wikimedia.org/wikipedia/commons/7/7b/Laresistance.jpg
3,19.11.2023,,"Supreme Mid-America Heavyweight Title:Rob ConwaydefeatsJosh Lewis(c) -TITLE CHANGE !!!Supreme Thanksgiving Throwdown- Event @ Racin' Mason Pizza and Fun Zone in Seymour, Indiana, USA",https://upload.wikimedia.org/wikipedia/commons/7/7b/Laresistance.jpg
4,28.10.2023,,"Rob ConwaydefeatsNick DeppRFW Boonville Bash- Event @ American Legion in Boonville, Indiana, USA",https://upload.wikimedia.org/wikipedia/commons/7/7b/Laresistance.jpg
5,17.09.2023,,"Supreme Mid-America Heavyweight Title:Josh LewisdefeatsRob Conway(c) -TITLE CHANGE !!!Supreme Strikes Back- Event @ Racin' Mason Pizza & Fun Zone in Seymour, Indiana, USA",https://upload.wikimedia.org/wikipedia/commons/7/7b/Laresistance.jpg
6,12.08.2023,,"Supreme Mid-America Heavyweight Title:Rob ConwaydefeatsJosh Lewis(c) -TITLE CHANGE !!!Supreme Fight The Good Fight- Event @ Southwestern Elementary School in Hanover, Indiana, USA",https://upload.wikimedia.org/wikipedia/commons/7/7b/Laresistance.jpg
7,20.05.2023,,"Eric DravendefeatsRob Conwayby DQSupreme The Coast Of War- Event @ Supreme Arena in Madison, Indiana, USA",https://upload.wikimedia.org/wikipedia/commons/7/7b/Laresistance.jpg
8,18.03.2023,,"Rob ConwaydefeatsEric DravenSupreme The Art Of War 2023- Event @ Supreme Arena in Madison, Indiana, USA",https://upload.wikimedia.org/wikipedia/commons/7/7b/Laresistance.jpg
9,26.03.2022,,"Golden Ticket Battle Royal:Sgt. Ledbetterdefeats ??? andRob ConwayBOTB Night Of Champions- Event @ River's Edge Indoor Sports in Cleves, Ohio, USA",https://upload.wikimedia.org/wikipedia/commons/7/7b/Laresistance.jpg
10,02.11.2019,,"Supreme United States Tag Team Title:Custom Made(Eric Draven&Roger Malcolm) (c) defeatLeon Elliot&Rob ConwaySupreme- Event @ Supreme Arena in Madison, Indiana, USA",https://upload.wikimedia.org/wikipedia/commons/7/7b/Laresistance.jpg
11,11.01.2019,,"Supreme Heavyweight Title:Rob ConwaydefeatsNic Noble(c) by DQSupreme Pinnacle 2019- Event @ Christ's Way Christian Church in North Vernon, Indiana, USA",https://upload.wikimedia.org/wikipedia/commons/7/7b/Laresistance.jpg
12,26.10.2018,,"AWA Central States Heavyweight Title:Rob ConwaydefeatsJosh Lewis(c) -TITLE CHANGE !!!Supreme Party On- Event @ Racin Mason Pizza & Fun Zone in Seymour, Indiana, USA",https://upload.wikimedia.org/wikipedia/commons/7/7b/Laresistance.jpg
13,22.09.2018,,"Match (Special Referee: Bobby Fulton):Rob ConwaydefeatsMr. HughesBOTB Armageddon- Event @ VFW's Cabana on the Whitewater in Harrison, Ohio, USA",https://upload.wikimedia.org/wikipedia/commons/7/7b/Laresistance.jpg
14,08.09.2018,,"UCW Heavyweight   TitleMatch (vakant):Rob ConwaydefeatsBuff Bagwell-TITLE CHANGE !!!UCW A Tribute Fit For A King- Event @ Owensboro Sportscenter in Owensboro, Kentucky, USA",https://upload.wikimedia.org/wikipedia/commons/7/7b/Laresistance.jpg
15,31.08.2018,,"AWA Central States Heavyweight Title:Josh Lewis(c) defeatsRob ConwaySupreme Unconquered- Event @ Southwestern High School in Hanover, Indiana, USA",https://upload.wikimedia.org/wikipedia/commons/7/7b/Laresistance.jpg
16,17.08.2018,,"Lions Pride Sports Title:Mike Dell(c) defeatsRob ConwayLions Pride High Voltage- Event @ Brazos County Expo Complex in Bryan, Texas, USA",https://upload.wikimedia.org/wikipedia/commons/7/7b/Laresistance.jpg
17,04.08.2018,,"AWA Central States Heavyweight Title:Josh LewisdefeatsRob Conway(c) -TITLE CHANGE !!!Supreme Explosion- Event @ Harmony Park in Seymour, Indiana, USA",https://upload.wikimedia.org/wikipedia/commons/7/7b/Laresistance.jpg
18,30.06.2018,,"Rob ConwaydefeatsKenny KageHPW Fill The Shelves 2018- Event @ 4-H Fairgrounds in Columbus, Indiana, USA",https://upload.wikimedia.org/wikipedia/commons/7/7b/Laresistance.jpg
19,29.06.2018,,"AWA Central States Heavyweight Title:Rob ConwaydefeatsJosh Lewis(c) -TITLE CHANGE !!!AWA Supreme Meltdown 2018- Event @ Christ's Way Christian Church in North Vernon, Indiana, USA",https://upload.wikimedia.org/wikipedia/commons/7/7b/Laresistance.jpg
20,16.06.2018,,"BOTB Heavyweight Title:Johnny Knockout(c) defeatsRob ConwayBOTB 7 Legends & All Stars- Event @ VFW's Cabana on the Whitewater in Harrison, Ohio, USA",https://upload.wikimedia.org/wikipedia/commons/7/7b/Laresistance.jpg
21,19.05.2018,,"AWA Central States Heavyweight Title:Josh LewisdefeatsRob Conway(c) -TITLE CHANGE !!!AWA Supreme- Event @ Southwestern High School in Hanover, Indiana, USA",https://upload.wikimedia.org/wikipedia/commons/7/7b/Laresistance.jpg
22,18.05.2018,,"AWA Central States Heavyweight Title:Rob ConwaydefeatsJosh Lewis(c) -TITLE CHANGE !!!AWA Supreme Next Level- Event @ Southwestern High School in Hanover, Indiana, USA",https://upload.wikimedia.org/wikipedia/commons/7/7b/Laresistance.jpg
23,17.03.2018,,"RCP Heavyweight TitleBest Two Out Of Three Falls:Gene Snitsky(c) defeatsRob Conway[2:1]RCP Blarney Blast- Event @ Boys & Girls Club in Newark, Delaware, USA",https://upload.wikimedia.org/wikipedia/commons/7/7b/Laresistance.jpg
24,24.02.2018,,"Rob ConwaydefeatsBrandon XavierBOTB 6: Night Of Champions- Event @ VFW's Cabana On The Whitewater in Harrison, Ohio, USA",https://upload.wikimedia.org/wikipedia/commons/7/7b/Laresistance.jpg
25,24.02.2018,,"20 Man Battle Royal:Brandon Xavierdefeats ??? and ??? and ??? and ??? andCree Fudoand Amos andBig MoeandEric Fallenand Hardcore Heather andHeidenreichandHooksandJackson StoneandKalamandKrimsonandRob ConwayandSgt. LedbetterandShawna ReedandShayla HydeandSuper OprahBOTB 6: Night Of Champions- Event @ VFW's Cabana On The Whitewater in Harrison, Ohio, USA",https://upload.wikimedia.org/wikipedia/commons/7/7b/Laresistance.jpg
26,17.02.2018,,"Rob ConwaydefeatsMike MicasNFW Saturday Night Wrestling- Event @ Salvation Army in Evansville, Indiana, USA",https://upload.wikimedia.org/wikipedia/commons/7/7b/Laresistance.jpg
27,09.02.2018,,"AWA Supreme United States Title King Of Supreme 2018 First Round:Josh LewisdefeatsRob Conway(c) -TITLE CHANGE !!!AWA Supreme King Of Supreme 2018 - Tag 1- Event @ Supreme Arena in Madison, Indiana, USA",https://upload.wikimedia.org/wikipedia/commons/7/7b/Laresistance.jpg
28,27.01.2018,,"AWA United States Title:Rob ConwaydefeatsJosh Lewis(c) -TITLE CHANGE !!!AWA Supreme Pinnacle 2018- Event @ Brownstown Central High School in Brownstown, Illinois, USA",https://upload.wikimedia.org/wikipedia/commons/7/7b/Laresistance.jpg
29,17.01.2018,,"Rob Conwaydefeats Johnny RichardsNFW Wednesday Tradition- Event @ Coliseum in Evansville, Indiana, USA",https://upload.wikimedia.org/wikipedia/commons/7/7b/Laresistance.jpg
30,09.12.2017,,"BOTB Heavyweight Title:Johnny KnockoutdefeatsRob Conway(c) -TITLE CHANGE !!!BOTB 5 Christmas Chaos- Event @ MVP Sportspark in West Harrison, Indiana, USA",https://upload.wikimedia.org/wikipedia/commons/7/7b/Laresistance.jpg
31,13.10.2017,,"Leon ElliotdefeatsRob ConwayAWA Supreme Friday The 13th- Event @ Supreme Arena in Madison, Indiana, USA",https://upload.wikimedia.org/wikipedia/commons/7/7b/Laresistance.jpg
32,08.10.2017,,"No Disqualification No Count Out:Rob ConwaydefeatsDerek NealUPW Hauntedween Havoc- Event @ The New South Arena in Franklin, Kentucky, USA",https://upload.wikimedia.org/wikipedia/commons/7/7b/Laresistance.jpg
33,09.09.2017,,"BOTB Heavyweight Title:Rob Conway(c) defeatsJackson StoneBOTB 4 Armageddon- Event @ 221 South State Street in West Harrison, Indiana, USA",https://upload.wikimedia.org/wikipedia/commons/7/7b/Laresistance.jpg
34,19.08.2017,,"Devin DriscolldefeatsRob ConwayNWA Smoky Mountain ReGenesis- Event @ Civic Auditorium in Kingsport, Tennessee, USA",https://upload.wikimedia.org/wikipedia/commons/7/7b/Laresistance.jpg
35,18.08.2017,,"NWA Supreme Tag Team Title:Custom Made(Eric Draven&Nic Noble) defeatJosh Lewis&Rob Conway(c) -TITLE CHANGE !!!NWA Supreme 20th Anniversary Show- Event @ Southwestern High School in Hanover, Indiana, USA",https://upload.wikimedia.org/wikipedia/commons/7/7b/Laresistance.jpg
36,15.07.2017,,"UPW TitleTournament First Round:Derek Nealvs.Rob Conway- Double Count OutUPW The Great American Clash- Event @ National Guard Armory in Bowling Green, Kentucky, USA",https://upload.wikimedia.org/wikipedia/commons/7/7b/Laresistance.jpg
37,14.07.2017,,"NWA Supreme Tag Team Title:Josh Lewis&Rob ConwaydefeatCustom Made(Eric Draven&Roger Malcolm) (c) -TITLE CHANGE !!!NWA Supreme- Event @ Supreme Arena in Madison, Indiana, USA",https://upload.wikimedia.org/wikipedia/commons/7/7b/Laresistance.jpg
38,01.07.2017,,"Rob Conwaydefeats Kahaji Khan (6:57)WWA Hysteria 46 - The Final Countdown 2017- Event @ Livermore City Hall in Livermore, Kentucky, USA",https://upload.wikimedia.org/wikipedia/commons/7/7b/Laresistance.jpg
39,23.06.2017,,"NWA Tri-State Television Title  /NWA Supreme Mid-America Heavyweight Title:Rob Conway(c) [Tri-State] defeatsRoger Malcolm(c) [Mid-America] by DQNWA Supreme Meltdown- Event @ Southwestern High School in Hanover, Indiana, USA",https://upload.wikimedia.org/wikipedia/commons/7/7b/Laresistance.jpg
40,17.06.2017,,"BOTB Heavyweight TitleThree Way Match (vakant):Rob ConwaydefeatsJackson StoneandJohnny Knockout-TITLE CHANGE !!!BOTB 3: Legends & All Stars- Event @ 221 South State Street in West Harrison, Indiana, USA",https://upload.wikimedia.org/wikipedia/commons/7/7b/Laresistance.jpg
41,13.05.2017,,"Devin Driscoll&Rob ConwaydefeatAustin Tyler Morris&Mickey MusclesNWA Smoky Mountain Collision Course 2017- Event @ Civic Auditorium in Kingsport, Tennessee, USA",https://upload.wikimedia.org/wikipedia/commons/7/7b/Laresistance.jpg
42,25.03.2017,,"DWO Heavyweight Title:Hobo Hank(c) defeatsRob ConwayDWO Pride Is A Sin- Event @ Westside Community Center in Albuquerque, New Mexico, USA",https://upload.wikimedia.org/wikipedia/commons/7/7b/Laresistance.jpg
43,12.03.2017,,"The Whirlwind Gentlemen(Jack Manley&Remy Marcel) defeatRob Conway&Royce IsaacsFSW When Stars Collide- Event @ Sam's Town Hotel & Gambling Hall in Las Vegas, Nevada, USA",https://upload.wikimedia.org/wikipedia/commons/7/7b/Laresistance.jpg
44,23.02.2017,,"NWA World Tag Team    Title:Kazushi Miyamoto&Rob TerrydefeatThe Iron Empire(Matt Riviera&Rob Conway) (c) (12:28) -TITLE CHANGE !!!DSW- Event @ Shin-Kiba 1st RING in Tokyo, Japan",https://upload.wikimedia.org/wikipedia/commons/7/7b/Laresistance.jpg
45,18.02.2017,,"BOTB Heavyweight TitleTournament Semi Final:Rob ConwaydefeatsKevin ThornBOTB Battle On The Border 2: Night Of Champions- Event @ MVP Sports in West Harrison, Indiana, USA",https://upload.wikimedia.org/wikipedia/commons/7/7b/Laresistance.jpg
46,27.01.2017,,"NWA World Tag Team    Title:The Sons Of Samoa(LA Smooth&The Samoan Storm) defeatThe Iron Empire(Matt Riviera&Rob Conway) (c) by Count OutNWA Big Apple- Event @ Hackensack High School in Hackensack, New Jersey, USA",https://upload.wikimedia.org/wikipedia/commons/7/7b/Laresistance.jpg
47,14.01.2017,,"Derek NealdefeatsRob ConwayUPW Starting Point- Event @ National Guard Armory in Bowling Green, Kentucky, USA",https://upload.wikimedia.org/wikipedia/commons/7/7b/Laresistance.jpg
48,13.01.2017,,"NWA World Tag Team    Title:The Iron Empire(Matt Riviera&Rob Conway) (c) defeatThe Penthouse Players(Christian James&Justin Grandberry)NWA New South- Event @ New South Arena in Franklin, Kentucky, USA",https://upload.wikimedia.org/wikipedia/commons/7/7b/Laresistance.jpg
49,29.10.2016,,"Rob ConwaydefeatsJR RocBOTB Battle On The Border- Event @ West Harrison, Indiana, USA",https://upload.wikimedia.org/wikipedia/commons/7/7b/Laresistance.jpg
50,16.10.2016,,"NWA CCW Tag Team Title:Rob Conway&Sean CaseydefeatThe Police Department(Deputy Dave&Rod Street) (c) -TITLE CHANGE !!!NWA CCW- Event @ German Park Turner Building in Indianapolis, Indiana, USA",https://upload.wikimedia.org/wikipedia/commons/7/7b/Laresistance.jpg
51,25.09.2016,,"NWA World Tag Team    TitleBest Two Out Of Three Falls:The Iron Empire(Matt Riviera&Rob Conway) (c) defeatMasakatsu Funaki&Rob TerryDSW- Event @ Shin-Kiba 1st RING in Tokyo, Japan",https://upload.wikimedia.org/wikipedia/commons/7/7b/Laresistance.jpg
52,27.08.2016,,"Seth AllendefeatsRob ConwayMidwest Championship Wrestling- Event @ Marion, Ohio, USA",https://upload.wikimedia.org/wikipedia/commons/7/7b/Laresistance.jpg
53,30.07.2016,,"Martin CasausdefeatsRob ConwayNRW Milestone 6- Event @ The Quarry in Golden, Colorado, USA",https://upload.wikimedia.org/wikipedia/commons/7/7b/Laresistance.jpg
54,23.07.2016,,"Rob ConwaydefeatsAlexander Knight(13:08)WWA Hysteria 18 -  endGame 2016- Event @ The Next Level Sportscenter in Owensboro, Kentucky, USA",https://upload.wikimedia.org/wikipedia/commons/7/7b/Laresistance.jpg
55,22.07.2016,,"NWA Southern Heavyweight Title:Rob ConwaydefeatsVic The Bruiser(c) by DQNWA New South- Event @ New South Arena in Franklin, Kentucky, USA",https://upload.wikimedia.org/wikipedia/commons/7/7b/Laresistance.jpg
56,04.06.2016,,"Rob ConwaydefeatsShawn CookHPW Justice 2016- Event @ 4-H Fairgrounds in Columbus, Indiana, USA",https://upload.wikimedia.org/wikipedia/commons/7/7b/Laresistance.jpg
57,07.05.2016,,"NWA World Tag Team    Title:The Iron Empire(Matt Riviera&Rob Conway) (c) defeat Jeremy Moore &Michael BarryNWA Mid-South- Event @ Resorts Casino II in Robinsonville, Mississippi, USA",https://upload.wikimedia.org/wikipedia/commons/7/7b/Laresistance.jpg
58,11.04.2016,,"NWA World Tag Team    Title:The Iron Empire(Matt Riviera&Rob Conway) (c) defeatThe Ballard Brothers(Shane Ballard&Shannon Ballard)Vendetta Pro Casino Royale - Tag 2- Event @ Gold Coast Casino in Las Vegas, Nevada, USA",https://upload.wikimedia.org/wikipedia/commons/7/7b/Laresistance.jpg
59,31.03.2016,,"NWA World Tag Team    Title:The Iron Empire(Matt Riviera&Rob Conway) (c) defeatOutlaw Inc.(Andy Dalton&Barrett Brown) (13:05)NWA/IHWE Parade Of Champions 2K16- Event @ Ridglea Theater in Fort Worth, Texas, USA",https://upload.wikimedia.org/wikipedia/commons/7/7b/Laresistance.jpg
60,09.01.2016,,"HPW Heavyweight Title:TJ Kemp(c) vs.Rob Conway- No ContestHPW Blast Off- Event @ 4-H Fairgrounds in Columbus, Indiana, USA",https://upload.wikimedia.org/wikipedia/commons/7/7b/Laresistance.jpg
61,02.01.2016,,"OVW Heavyweight Title:Ryan HowedefeatsRob Conway(c) -TITLE CHANGE !!!OVW Saturday Night Special- Event @ Davis Arena in Louisville, Kentucky, USA",https://upload.wikimedia.org/wikipedia/commons/7/7b/Laresistance.jpg
62,19.12.2015,,"NWA World Heavyweight Title:Jax Dane(c) defeatsRob ConwayNWA Smoky Mountain The Finale 2015- Event @ Civic Auditorium in Kingsport, Tennessee, USA",https://upload.wikimedia.org/wikipedia/commons/7/7b/Laresistance.jpg
63,09.12.2015,,"OVW Heavyweight Title:Rob ConwaydefeatsRyan Howe(c) -TITLE CHANGE !!!OVW TV #852- TV-Show @ Davis Arena in Louisville, Kentucky, USA",https://upload.wikimedia.org/wikipedia/commons/7/7b/Laresistance.jpg
64,04.12.2015,,"NWA World Tag Team    Title:The Iron Empire(Matt Riviera&Rob Conway) defeatThe Heatseekers(Elliot Russell&Sigmon) (c) -TITLE CHANGE !!!NWA Mid-South- Event @ Resorts Casino in Robinsonville, Mississippi, USA",https://upload.wikimedia.org/wikipedia/commons/7/7b/Laresistance.jpg
65,26.11.2015,,"Dru SkillzdefeatsRob ConwayNWA Circle City Wrestling- Event @ German Park in Indianapolis, Indiana, USA",https://upload.wikimedia.org/wikipedia/commons/7/7b/Laresistance.jpg
66,10.10.2015,,"NWA Mid-South Heavyweight Title  /NWA Southern Heavyweight Title:Greg Anthony(c) [NWA Southern] defeatsRob Conway(c) [NWA Mid-South] -TITLE CHANGE !!!NWA Mid-South Glory Last Forever- Event @ Herb Welch WrestlePlex in Dyserburg, Tennessee, USA",https://upload.wikimedia.org/wikipedia/commons/7/7b/Laresistance.jpg
67,03.10.2015,,"Rob ConwaydefeatsVince BrentNWA Smoky Mountain Jason Kincaid And The Quest For The Golden Quadrant- Event @ Civic Auditorium in Kingsport, Tennessee, USA",https://upload.wikimedia.org/wikipedia/commons/7/7b/Laresistance.jpg
68,02.10.2015,,"Rob ConwaydefeatsVan MartiganNWA Supreme- Event @ Shawe Memorial High School in Madison, Indiana, USA",https://upload.wikimedia.org/wikipedia/commons/7/7b/Laresistance.jpg
69,19.09.2015,,"Rob Conwaydefeats Darrious DouglasNWA SAW- Event @ Cookeville, Tennessee, USA",https://upload.wikimedia.org/wikipedia/commons/7/7b/Laresistance.jpg
70,19.09.2015,,"NWA National Heavyweight Title:Arrick Andrews(c) defeatsRob ConwayNWA SAW- Event @ Cookeville, Tennessee, USA",https://upload.wikimedia.org/wikipedia/commons/7/7b/Laresistance.jpg
71,29.08.2015,,"TCW Knoxville Unified Heavyweight Title:Devin Driscoll(c) defeatsRob ConwayTCW/ETW This Means War - Tag 2- Event @ Bon Street Arena in Lenoir City, Tennessee, USA",https://upload.wikimedia.org/wikipedia/commons/7/7b/Laresistance.jpg
72,08.08.2015,,"Rob ConwaydefeatsNick HammondsNWA Smoky Mountain Fire On The Mountain 2015- Event @ Civic Auditorium in Kingsport, Tennessee, USA",https://upload.wikimedia.org/wikipedia/commons/7/7b/Laresistance.jpg
73,04.07.2015,,"Danny Davis&Rob ConwaydefeatJason Lee&Vic The BruiserOVW Saturday Night Special- Event @ Davis Arena in Louisville, Kentucky, USA",https://upload.wikimedia.org/wikipedia/commons/7/7b/Laresistance.jpg
74,12.06.2015,,"Rob ConwaydefeatsNick HammondsNWA Smoky Mountain Summer Bash 2015- Event @ Civic Auditorium in Kingsport, Tennessee, USA",https://upload.wikimedia.org/wikipedia/commons/7/7b/Laresistance.jpg
75,15.05.2015,,"Eric DravendefeatsRob ConwayNWA Supreme- Event @ Shawe Memorial High School in Madison, Indiana, USA",https://upload.wikimedia.org/wikipedia/commons/7/7b/Laresistance.jpg
76,09.05.2015,,"Jax Danevs.Rob Conway- No ContestNWA Smoky Mountain Collision Course- Online Stream @ Kingsport Civic Auditorium in Kingsport, Tennessee, USA",https://upload.wikimedia.org/wikipedia/commons/7/7b/Laresistance.jpg
77,02.05.2015,,"HPW Heavyweight Title:Rob Ramer(c) defeatsRob ConwayHPW Derby Day Destruction 2015- Event @ 4-H Fairgrounds in Columbus, Indiana, USA",https://upload.wikimedia.org/wikipedia/commons/7/7b/Laresistance.jpg
78,28.02.2015,,"NWA Top Of Texas Tag Team Title:Nathan Briggs&Rob ConwaydefeatThe Dirt Road Dynasty(Jay Hazzard&Rex Logan) (c) by DQNWA Top Of Texas SuperSlam Saturday- Event @ WrestlePlex in Amarillo, Texas, USA",https://upload.wikimedia.org/wikipedia/commons/7/7b/Laresistance.jpg
79,14.02.2015,,"NWA World Heavyweight Title:Hiroyoshi TenzandefeatsRob Conway(c) (11:50) -TITLE CHANGE !!!NJPW The New Beginning In Sendai- Online Stream @ Sendai Sun Plaza Hall in Sendai, Miyagi, Japan",https://upload.wikimedia.org/wikipedia/commons/7/7b/Laresistance.jpg
80,11.02.2015,,"Chase Owens&Rob ConwaydefeatHiroyoshi Tenzan&Jushin Thunder Liger(7:53)NJPW The New Beginning In Osaka 2015- Online Stream @ Bodymaker Colosseum in Osaka, Japan",https://upload.wikimedia.org/wikipedia/commons/7/7b/Laresistance.jpg
81,06.02.2015,,"NWA World Heavyweight Title:Rob Conway(c) defeatsArrick AndrewsNWA SAW- Event @ Millersville, Tennessee, USA",https://upload.wikimedia.org/wikipedia/commons/7/7b/Laresistance.jpg
82,27.12.2014,,"NWA World Heavyweight Title:Rob Conway(c) defeatsJason KincaidNWA Smoky Mountain The Finale- Event @ Civic Auditorium in Kingsport, Tennessee, USA",https://upload.wikimedia.org/wikipedia/commons/7/7b/Laresistance.jpg
83,07.12.2014,,"TenKoji(Hiroyoshi Tenzan&Satoshi Kojima) defeatJax Dane&Rob Conway(9:10)NJPW World Tag League 2014 - Tag 11- TV-Show @ Aichi Prefectural Gymnasium in Nagoya, Aichi, Japan",https://upload.wikimedia.org/wikipedia/commons/7/7b/Laresistance.jpg
84,05.12.2014,,"World Tag League 2014 Block A:Jax Dane&Rob Conway[6] defeatLa Sombra&Tetsuya Naito[8] (7:46)NJPW World Tag League 2014 - Tag 10- TV-Show @ Osaka Center Gymnasium Sub Arena in Osaka, Japan",https://upload.wikimedia.org/wikipedia/commons/7/7b/Laresistance.jpg
85,03.12.2014,,"World Tag League 2014 Block A:BULLET CLUB(AJ Styles&Yujiro Takahashi) [8] defeatJax Dane&Rob Conway[4] (8:48)NJPW World Tag League 2014 - Tag 9- Online Stream @ Bebbu Beacon Plaza in Bebbu, Oita, Japan",https://upload.wikimedia.org/wikipedia/commons/7/7b/Laresistance.jpg
86,02.12.2014,,"Great Bash Heel(Togi Makabe&Tomoaki Honma) defeatJax Dane&Rob Conway(7:51)NJPW World Tag League 2014 - Tag 8- Online Stream @ Hakata Starlanes in Fukuoka, Japan",https://upload.wikimedia.org/wikipedia/commons/7/7b/Laresistance.jpg
87,30.11.2014,,"World Tag League 2014 Block A:Jax Dane&Rob Conway[4] defeatThe Kingdom(Matt Taven&Michael Bennett) [6] (6:31)NJPW World Tag League 2014 - Tag 7- Online Stream @ Tex Port Imabari in Imabari, Ehime, Japan",https://upload.wikimedia.org/wikipedia/commons/7/7b/Laresistance.jpg
88,29.11.2014,,"Jax Dane&Rob ConwaydefeatCaptain New Japan&Hiroshi Tanahashi(10:45)NJPW World Tag League 2014 - Tag 6- Online Stream @ Zentsuji Citizian Gymnasium in Zentsuji, Kagawa, Japan",https://upload.wikimedia.org/wikipedia/commons/7/7b/Laresistance.jpg
89,28.11.2014,,"Jax Dane&Rob ConwaydefeatBUSHI&Yohei Komatsu(6:37)NJPW World Tag League 2014 - Tag 5- Online Stream @ Hiroshima Green Arena Small Arena in Hiroshima, Japan",https://upload.wikimedia.org/wikipedia/commons/7/7b/Laresistance.jpg
90,27.11.2014,,"World Tag League 2014 Block A:CHAOS(Kazuchika Okada&YOSHI-HASHI) [6] defeatJax Dane&Rob Conway[0] (8:59)NJPW World Tag League 2014 - Tag 4- Online Stream @ Tottori Industrial Gymnasium in Tottori, Japan",https://upload.wikimedia.org/wikipedia/commons/7/7b/Laresistance.jpg
91,24.11.2014,,"Jax Dane&Rob ConwaydefeatSho Tanaka&Yohei Komatsu(4:36)NJPW World Tag League 2014 - Tag 3- TV-Show @ KBS Hall in Kyoto, Japan",https://upload.wikimedia.org/wikipedia/commons/7/7b/Laresistance.jpg
92,23.11.2014,,"World Tag League 2014 Block A:BULLET CLUB(Doc Gallows&Karl Anderson) [2] defeatJax Dane&Rob Conway[0] (7:29)NJPW World Tag League 2014 - Tag 2- Online Stream @ Toyohashi City Gymnasium #2 in Toyohashi, Aichi, Japan",https://upload.wikimedia.org/wikipedia/commons/7/7b/Laresistance.jpg
93,22.11.2014,,"World Tag League 2014 Block A:TenKoji(Hiroyoshi Tenzan&Satoshi Kojima) [2] defeatJax Dane&Rob Conway[0] (8:04)NJPW World Tag League 2014 - Tag 1- TV-Show @ Korakuen Hall in Tokyo, Japan",https://upload.wikimedia.org/wikipedia/commons/7/7b/Laresistance.jpg
94,15.11.2014,,"NWA World Heavyweight Title:Rob Conway(c) defeatsChase OwensNWA Smoky Mountain Cyclone Stampede- Event @ Elizabethton High Scool in Elizabethton, Tennessee, USA",https://upload.wikimedia.org/wikipedia/commons/7/7b/Laresistance.jpg
95,01.11.2014,,"Rob ConwaydefeatsFlash FlanaganHPW 16 Year Anniversary - Cheer Fund Show- Event @ 4-H Fairgrounds in Columbus, Indiana, USA",https://upload.wikimedia.org/wikipedia/commons/7/7b/Laresistance.jpg
96,25.10.2014,,"NWA World Heavyweight Title:Rob Conway(c) defeatsTyson DeanNWA Atlanta- Event @ Griffin, Georgia, USA",https://upload.wikimedia.org/wikipedia/commons/7/7b/Laresistance.jpg
97,04.10.2014,,"NWA World Heavyweight Title:Rob Conway(c) defeatsSigmonNWA Smoky Mountain- Event @ Millersville, Tennessee, USA",https://upload.wikimedia.org/wikipedia/commons/7/7b/Laresistance.jpg
98,20.09.2014,,"NWA World Heavyweight Title:Rob Conway(c) defeatsLance HoytNWA Texoma Back 2 School Bash- Event @ Sherman Elks Lodge in Sherman, Texas, USA",https://upload.wikimedia.org/wikipedia/commons/7/7b/Laresistance.jpg
99,19.09.2014,,"NWA World Heavyweight Title:Matt RivieradefeatsRob Conway(c) by DQNWA Texoma- Event @ Sherman Elks Lodge in Sherman, Texas, USA",https://upload.wikimedia.org/wikipedia/commons/7/7b/Laresistance.jpg
100,23.08.2014,,"Martin Van Buren Championship Tag Team Invitational Tournament Quarter Final:The DeathRage Cartel(Dextor Deranged&Josh Pain) defeatMartin Casaus&Rob ConwayDWO Martin Van Buren Championship Tag Team Invitational- Event @ Lubbock Memorial Civic Center in Lubbock, Texas, USA",https://upload.wikimedia.org/wikipedia/commons/7/7b/Laresistance.jpg
101,16.08.2014,,"Rob RamerdefeatsRob ConwayNEW 4th Annual Mark Kuhn Invitational- Event @ Shelbyville, Indiana, USA",https://upload.wikimedia.org/wikipedia/commons/7/7b/Laresistance.jpg
102,26.07.2014,,"NWA World Heavyweight TitleSteel Cage:Rob Conway(c) defeatsChris RichardsNWA Smoky Mountain Steel Cage Showdown- Event @ Civic Auditorium in Kingsport, Tennessee, USA",https://upload.wikimedia.org/wikipedia/commons/7/7b/Laresistance.jpg
103,07.06.2014,,"Donny Idol&TJ KempdefeatRob Conway&TJ Powersby DQHPW Justice- Event @ 4-H Fairgrounds in Columbus, Indiana, USA",https://upload.wikimedia.org/wikipedia/commons/7/7b/Laresistance.jpg
104,02.06.2014,,"NWA World Heavyweight Title:Rob ConwaydefeatsSatoshi Kojima(c) -TITLE CHANGE !!!Vendetta Pro Casino Royale 2014 - Tag 2- Event @ Gold Coast Hotel & Casino in Las Vegas, Nevada, USA",https://upload.wikimedia.org/wikipedia/commons/7/7b/Laresistance.jpg
105,25.05.2014,,"NWA World Tag Team    TitleThree Way:TenKoji(Hiroyoshi Tenzan&Satoshi Kojima) (c) defeatKiller Elite Squad(Davey Boy Smith Jr.&Lance Archer) andRob Conway&Wes Brisco(11:38)NJPW Back To Yokohama Arena- TV-Show @ Yokohama Arena in Yokohama, Kanagawa, Japan",https://upload.wikimedia.org/wikipedia/commons/7/7b/Laresistance.jpg
106,09.05.2014,,"AWA Supreme Heavyweight Title:Eric DravendefeatsRob Conway(c) -TITLE CHANGE !!!AWA Supreme- Event @ Hanover College in Hanover, Indiana, USA",https://upload.wikimedia.org/wikipedia/commons/7/7b/Laresistance.jpg
107,03.05.2014,,"UCW Heavyweight   Title:Chris Michaels(c) defeatsRob ConwayUCW Flash Point- Event @ The Next Level in Owensboro, Kentucky, USA",https://upload.wikimedia.org/wikipedia/commons/7/7b/Laresistance.jpg
