date,event,result,location,image_url
1,06.09.2025,,"Vaughn VertigodefeatsTJPTop Tier New Season- Event @ Hamilton Convention Centre in Hamilton, Ontario, Canada",
2,05.09.2025,,"MLP Canadian Title:Josh Alexander(c) defeatsTJP(25:47)MLP Sacred Ground- Online Stream @ Six Nations Sports & Cultural Memorial Centre in Ohsweken, Ontario, Canada",
3,29.08.2025,,"Grand Prix Internacional 2025 Torneo Cibernetico:Team Mexico (Angel de Oro,Atlantis Jr.,Difunto,Mascara Dorada,Mistico,Neon,Templario,Titan,Volador Jr.&Zandokan Jr.) defeat Team International (Action Andretti,Donovan Dijak,Lio Rush,Michael Oku,Mike Bailey,Robbie X,Rocky Romero,Taiji Ishimori,The Beast Mortos&TJP) (82:06)CMLL Grand Prix Internacional 2025- Online Stream @ Arena Mexico in Mexico City, Distrito Federal, Mexiko",
4,26.08.2025,,"Lucha De Naciones 2025 Torneo Cibernetico:Atlantis Jr.,Dulce Gardenia,El Hijo del Villano III,Explosivo,Ultimo Guerrero&Villano III Jr.defeatDark Magic,Donovan Dijak,Okumura,Taiji Ishimori,TJP&Yutani(29:24)CMLL Martes de Glamour- Online Stream @ Arena Coliseo de Guadalajara in Guadalajara, Jalisco, Mexiko",
5,25.08.2025,,"Lightning:Volador Jr.defeatsTJPCMLL Lunes Clasico- TV-Show @ Arena Puebla in Heroica Puebla de Zaragoza, Puebla, Mexiko",
6,24.08.2025,,"Relevos Increibles Best Two Out Of Three Falls:Donovan Dijak&TJPdefeatVolador Jr.&Zandokan Jr.[2:1]CMLL Domingo Familiar- Event @ Arena Mexico in Mexico City, Distrito Federal, Mexiko",
7,23.08.2025,,"Best Two Out Of Three Falls:Titan&United Empire(Templario&TJP) defeatLos Hermanos Chavez(Angel de Oro&Niebla Roja) &Volador Jr.[2:1] (12:50)CMLL Sabados De Coliseo- Online Stream @ Arena Coliseo de Mexico City in Mexico City, Distrito Federal, Mexiko",
8,22.08.2025,,"NJPW STRONG Openweight Tag Team Title:United Empire(Templario&TJP) (c) defeatLa Escuadra(El Hijo del Villano III&Villano III Jr.) (17:23)CMLL Viernes Espectacular- Online Stream @ Arena Mexico in Mexico City, Distrito Federal, Mexiko",
9,16.08.2025,,"Chandler Hopkins&Vito FratellidefeatRoyce Isaacs&TJ PerkinsNTLL Twisted Lucha- Event @ Transplants Brewing Company in Palmdale, California, USA",
10,01.08.2025,,"Atlantis Jr.&HologramdefeatHechicero&TJ PerkinsPromociones Lucka Libre- Event @ Auditorio de Tijuana in Tijuana, Baja California, Mexiko",
11,05.07.2025,,"Six Way Scramble:Michael Allen Richard ClarkdefeatsBhupinder GujjarandJonathan GreshamandMike BaileyandPsycho MikeandTJP(14:29)MLP Resurrection- Pay Per View @ Colisée de Laval in Laval, Quebec, Canada",
12,27.06.2025,,"NJPW STRONG Openweight Tag Team Title:United Empire(Templario&TJP) (c) defeatLos Hermanos Chavez(Angel de Oro&Niebla Roja) [2:1] (17:37)CMLL Viernes Espectacular- Online Stream @ Arena Mexico in Mexico City, Distrito Federal, Mexiko",
13,24.06.2025,,"Best Two Out Of Three Falls:United Empire(Francesco Akira,Templario&TJP) defeatHiromu Takahashi,Shingo Takagi&Titan[2:1] (14:27)CMLL Martes Populares- Online Stream @ Arena Mexico in Mexico City, Distrito Federal, Mexiko",
14,23.06.2025,,"Best Two Out Of Three Falls:United Empire(Francesco Akira,Templario&TJP) defeatBarbaro Cavernario&Galeon Fantasma(Difunto&Zandokan Jr.) by DQ [2:1]CMLL Lunes Clasico- TV-Show @ Arena Puebla in Heroica Puebla de Zaragoza, Puebla, Mexiko",
15,22.06.2025,,"United Empire(Francesco Akira,Templario&TJP) defeatLos Infernales(Averno,Euforia&Mephisto) [2:1]CMLL Domingo Familiar- Event @ Arena Mexico in Mexico City, Distrito Federal, Mexiko",
16,21.06.2025,,"United Empire(Francesco Akira,Templario&TJP) defeatLos Guerreros Laguneros(Gran Guerrero,Stuka Jr.&Ultimo Guerrero) (12:52)CMLL Sabados De Coliseo- Online Stream @ Arena Coliseo de Mexico City in Mexico City, Distrito Federal, Mexiko",
17,20.06.2025,,"Los Ingobernables de Japon(Hiromu Takahashi,Shingo Takagi&Titan) defeatUnited Empire(Francesco Akira,Templario&TJP) (15:31)CMLL Presenta NJPW Fantastica Mania Mexico 2025- Online Stream @ Arena Mexico in Mexico City, Distrito Federal, Mexiko",
18,31.05.2025,,"Adrian QuestdefeatsTJ PerkinsRPW Menace To Society- Event @ American Legion Post #241 in Baldwin Park, California, USA",
19,18.05.2025,,"TJ PerkinsdefeatsEpydemius Jr.Promociones Martinez Lucha Libre- Event @ El Toro Sinaloense Sports Bar in Arlington, Texas, USA",
20,09.05.2025,,"NJPW STRONG Openweight Tag Team Title:United Empire(Templario&TJP) defeatThe World Class Wrecking Crew(Jorel Nelson&Royce Isaacs) (c) (13:12) -TITLE CHANGE !!!NJPW Resurgence 2025- Pay Per View @ Toyota Arena in Ontario, California, USA",
21,27.04.2025,,"Three Way:Laredo KiddefeatsMetalikandTJPIWC Legacy- Event @ Legacy Event Center in Westminster, Colorado, USA",
22,26.04.2025,,"TJPdefeats El CucuyPWR- Event @ Mt. Pleasant High School Gym in San Jose, California, USA",
23,25.04.2025,,"NTLL Gladiator TitleFour Way:G. SharpedefeatsTJ Perkins(c) andChandler HopkinsandNinja Mack-TITLE CHANGE !!!NTLL Rumble In The Desert- Event @ Fantasy Springs Casino in Indio, California, USA",
24,17.04.2025,,"Lucky 7 Sin City Scramble:Danhausendefeats1 Called MandersandCheeseburgerandMike D VecchioandSuper CrazyandTJPandVaughn Vertigo(16:29)WrestleCon Mark Hitchcock Memorial SuperShow 2025- Pay Per View @ Pearl Theater At Palms Casino Resort in Las Vegas, Nevada, USA",
25,11.04.2025,,"TJPdefeatsTom Lawlor(12:13)NJPW Windy City Riot 2025- Pay Per View @ Wintrust Arena in Chicago, Illinois, USA",
26,29.03.2025,,"Relentless Heavyweight Title:Royce IsaacsdefeatsTJP(c) -TITLE CHANGE !!!Relentless The Run Around- Event @ Players & Spectators Event Center in Spokane Valley, Washington, USA",
27,22.03.2025,,"El Primohenio,G. Sharpe&Latigo BlancodefeatCiclon Ramirez Jr.,Rey Misterio Heredero&TJ PerkinsNTLL Lone Wolf- Event @ Transplants Brewing Company in Palmdale, California, USA",
28,20.03.2025,,"NJPW World Television Title:El Phantasmo(c) defeatsTJP(11:36)NJPW New Japan Cup 2025 - Tag 9- TV-Show @ Aore Nagaoka in Nagaoka, Niigata, Japan",
29,17.03.2025,,"United Empire(Callum Newman,Great-O-Khan,Jakob Austin Young,Jeff Cobb&TJP) defeatDaiki Nagai,El Phantasmo,Jado,Oleg Boltin&Toru Yano(9:10)NJPW New Japan Cup 2025 - Tag 8- Online Stream @ Big Palette Fukushima in Koriyama, Fukushima, Japan",
30,16.03.2025,,"El Phantasmo,Jado&Oleg BoltindefeatUnited Empire(Great-O-Khan,Jakob Austin Young&TJP) (8:12)NJPW New Japan Cup 2025 - Tag 7- TV-Show @ Twin Messe Shizuoka in Shizuoka, Japan",
31,15.03.2025,,"United Empire(Callum Newman,Great-O-Khan,Jakob Austin Young&TJP) defeatEl Phantasmo,Hiroshi Tanahashi,Oleg Boltin&Toru Yano(6:26)NJPW New Japan Cup 2025 - Tag 6- Online Stream @ Aichi Prefectural Gymnasium in Nagoya, Aichi, Japan",
32,14.03.2025,,"New Japan Cup 2025 Second Round:Drilla MoloneydefeatsTJP(15:05)NJPW New Japan Cup 2025 - Tag 5- Online Stream @ Osaka Kanaoka Park Gymnasium in Sakai, Osaka, Japan",
33,12.03.2025,,"United Empire(Callum Newman,Jeff Cobb&TJP) defeatTMDK(Hartley Jackson,Ryohei Oiwa&Zack Sabre Jr.) (8:24)NJPW New Japan Cup 2025 - Tag 4- Online Stream @ Uwajima City General Gymnasium in Uwajima, Ehime, Japan",
34,11.03.2025,,"United Empire(Callum Newman,Jeff Cobb&TJP) defeatBULLET CLUB(Bad Luck Fale,Chase Owens&Drilla Moloney) (8:48)NJPW New Japan Cup 2025 - Tag 3- Online Stream @ ZIP Arena Okayama in Okayama, Japan",
35,09.03.2025,,"TMDK(Hartley Jackson,Ryohei Oiwa&Zack Sabre Jr.) defeatUnited Empire(Jakob Austin Young,Jeff Cobb&TJP) (10:53)NJPW New Japan Cup 2025 - Tag 2- TV-Show @ Baycom Gymnasium in Amagasaki, Hyogo, Japan",
36,22.02.2025,,"NTLL Gladiator Title:TJ Perkins(c) defeatsSonico(20:03)NTLL Back To Action- Event @ Transplants Brewing Company in Palmdale, California, USA",
37,06.01.2025,,"United Empire(Francesco Akira,Great-O-Khan,Jakob Austin Young,Jeff Cobb&TJP) defeatEl Phantasmo,Jado,Master Wato,Shota Umino&Tomoaki Honma(10:50)NJPW New Year Dash !! 2025- Online Stream @ Ota City General Gymnasium in Tokyo, Japan",
38,04.01.2025,,"IWGP Junior Heavyweight Tag Team TitleLadder:Ichiban Sweet Boys(Kosei Fujita&Robbie Eagles) defeatIntergalactic Jet Setters(Kevin Knight&KUSHIDA) (c) andBULLET CLUB War Dogs(Clark Connors&Drilla Moloney) andCatch 22(Francesco Akira&TJP) (13:05) -TITLE CHANGE !!!NJPW Wrestle Kingdom 19 In Tokyo Dome- Pay Per View @ Tokyo Dome in Tokyo, Japan",
39,23.12.2024,,"BULLET CLUB War Dogs(Clark Connors&Drilla Moloney) vs.Catch 22(Francesco Akira&TJP) - No Contest (0:40)NJPW Road To Tokyo Dome 2024 - Tag 5- Online Stream @ Korakuen Hall in Tokyo, Japan",
40,21.12.2024,,"United Empire(Francesco Akira,Jakob Austin Young&TJP) defeatBULLET CLUB War Dogs(Clark Connors,Drilla Moloney&SANADA) by DQ (8:40)NJPW Road To Tokyo Dome 2024 - Tag 3- Event @ Light Cube Utsunomiya in Utsunomiya, Tochigi, Japan",
41,19.12.2024,,"Intergalactic Jet Setters(Kevin Knight&KUSHIDA) &Ryusuke TaguchidefeatUnited Empire(Francesco Akira,Jakob Austin Young&TJP) (9:21)NJPW Road To Tokyo Dome 2024 - Tag 2- Event @ Yamagata Big Wing in Yamagata, Japan",
42,18.12.2024,,"TMDK(Kosei Fujita,Robbie Eagles&Ryohei Oiwa) defeatUnited Empire(Francesco Akira,Jakob Austin Young&TJP) (9:30)NJPW Road To Tokyo Dome 2024 - Tag 1- Event @ Tokorozawa Citizen Gymnasium in Tokorozawa, Saitama, Japan",
43,15.12.2024,,"Four Way:TJPdefeatsClark ConnorsandKosei FujitaandKUSHIDA(10:24)NJPW Strong Style Evolved 2024- Online Stream @ Walter Pyramid in Long Beach, California, USA",
44,14.12.2024,,"Relentless Heavyweight TitleHoliday Rules:TJP(c) defeatsAria PerkinsRelentless Paying It Forward- Event @ Players & Spectators Event Center in Spokane Valley, Washington, USA",
45,09.11.2024,,"Relentless Heavyweight Title:TJP(c) defeatsAaron SoloRelentless Reign Supreme- Event @ Players & Spectators Event Center in Spokane Valley, Washington, USA",
46,08.11.2024,,"AEW International Title:Konosuke Takeshita(c) defeatsTJP(14:13)NJPW Fighting Spirit Unleashed 2024- Online Stream @ Lowell Memorial Auditorium in Lowell, Massachusetts, USA",
47,04.11.2024,,"Super Junior Tag League 2024 Final:Ichiban Sweet Boys(Kosei Fujita&Robbie Eagles) defeatCatch 22(Francesco Akira&TJP) (15:20)NJPW Power Struggle ~ Super Junior Tag League 2024- TV-Show @ EDION Arena Osaka in Osaka, Japan",
48,02.11.2024,,"Super Junior Tag League 2024 Block B:Catch 22(Francesco Akira&TJP) [6] defeatNinja Mack&The DKC[4] (15:03)NJPW Super Junior Tag League 2024 ~ Road To Power Struggle ~ - Tag 8- Online Stream @ Nagoya Congress Center Event Hall in Nagoya, Aichi, Japan",
49,01.11.2024,,"United Empire(Francesco Akira,Jakob Austin Young&TJP) defeatNinja Mack,Shoma Kato&The DKC(9:10)NJPW Super Junior Tag League 2024 ~ Road To Power Struggle ~ - Tag 7- Online Stream @ Suehiro Gymnasium in Komatsu, Ishikawa, Japan",
50,31.10.2024,,"Super Junior Tag League 2024 Block B:Catch 22(Francesco Akira&TJP) [4] defeatBULLET CLUB(Robbie X&Taiji Ishimori) [4] (16:02)NJPW Super Junior Tag League 2024 ~ Road To Power Struggle ~ - Tag 6- Online Stream @ Toyama Techno Hall West Hall in Toyama, Japan",
51,30.10.2024,,"United Empire(Francesco Akira,Jakob Austin Young&TJP) defeatBULLET CLUB(Gedo,Robbie X&Taiji Ishimori) (9:51)NJPW Super Junior Tag League 2024 ~ Road To Power Struggle ~ - Tag 5- Online Stream @ Niigata Tsubame Civic Gymnasium in Tsubame, Niigata, Japan",
52,28.10.2024,,"Super Junior Tag League 2024 Block B:The VeloCities(Jude London&Paris De Silva) [2] defeatCatch 22(Francesco Akira&TJP) [2] (12:55)NJPW Super Junior Tag League 2024 ~ Road To Power Struggle ~ - Tag 4- TV-Show @ Korakuen Hall in Tokyo, Japan",
53,27.10.2024,,"Super Junior Tag League 2024 Block B:Roppongi ReVice(Rocky Romero&YOH) [4] defeatCatch 22(Francesco Akira&TJP) [2] (24:37)NJPW Super Junior Tag League 2024 ~ Road To Power Struggle ~ - Tag 3- TV-Show @ Korakuen Hall in Tokyo, Japan",
54,26.10.2024,,"Super Junior Tag League 2024 Block B:Catch 22(Francesco Akira&TJP) [2] defeatIntergalactic Jet Setters(Kevin Knight&KUSHIDA) [0] (15:26)NJPW Super Junior Tag League 2024 ~ Road To Power Struggle ~ - Tag 2- Online Stream @ Culttz Kawasaki in Kawasaki, Kanagawa, Japan",
55,24.10.2024,,"Intergalactic Jet Setters(Kevin Knight&KUSHIDA) &Tomoaki HonmadefeatUnited Empire(Francesco Akira,Jakob Austin Young&TJP) (9:40)NJPW Super Junior Tag League 2024 ~ Road To Power Struggle ~ - Tag 1- Online Stream @ G Messe Gunma in Takasaki, Gunma, Japan",
56,13.10.2024,,"NTLL Gladiator Title:TJ PerkinsdefeatsG. Sharpe(c) -TITLE CHANGE !!!NTLL Into The Void- Event @ AV Event Center in Lancaster, California, USA",
57,04.10.2024,,"Relentless Heavyweight Title:TJPdefeatsWarhorse(c) -TITLE CHANGE !!!Relentless Pinnacle- Event @ Northern Quest Resort & Casino in Airway Heights, Washington, USA",
58,14.09.2024,,"Opera Cup 2024 Semi Final:KENTAdefeatsTJP(10:23)MLW Fightland 2024- Online Stream @ Center Stage Theater in Atlanta, Georgia, USA",
59,07.09.2024,,"TJPdefeatsFred RosserRelentless No Excuses- Event @ Players & Spectators Event Center in Spokane Valley, Washington, USA",
60,30.08.2024,,"Tetsuya NaitodefeatsTJP(14:54)NJPW Capital Collision 2024- Pay Per View @ Entertainment & Sports Arena in Washington, District Of Columbia, USA",
61,29.08.2024,,"Opera Cup 2024 Quarter Final:TJPdefeatsTom Lawlor(14:18)MLW Summer Of The Beasts 2024- Online Stream @ Melrose Ballroom in New York City, New York, USA",
62,11.08.2024,,"Chip DaydefeatsTJPSSP On Sight- Online Stream @ Steady Hand Beer Company in Atlanta, Georgia, USA",
63,10.08.2024,,"Relentless Heavyweight Title:WarhorsedefeatsTJP(c) -TITLE CHANGE !!!Relentless The Disrespect Issue- Event @ Players & Spectators Event Center in Spokane Valley, Washington, USA",
64,03.08.2024,,"Four Way:TJPdefeats Al Snook andSmileyandJust Jay3LW Red Rose Rumble 2- Online Stream @ Clipper Magazine Stadium in Lancaster, Pennsylvania, USA",
65,05.07.2024,,"United Empire(Francesco Akira,Great-O-Khan&TJP) defeatJust 5 Guys(SANADA,TAKA Michinoku&Yuya Uemura) (9:18)NJPW New Japan Soul 2024 - Tag 7- Online Stream @ Tokyo Budokan in Tokyo, Japan",
66,03.07.2024,,"G1 Climax 34 Block B Qualifying Tournament Semi Final:TaichidefeatsTJP(19:26)NJPW New Japan Soul 2024 - Tag 6- Online Stream @ Korakuen Hall in Tokyo, Japan",
67,01.07.2024,,"Three Way:Chris BassodefeatsMatt HayterandTJP(13:33)WSW Most Wanted - Tag 4- Pay Per View @ Adelaide Oval in Adelaide, South Australia, Australia",
68,30.06.2024,,"Jack CartwheeldefeatsTJP(15:10)WSW Most Wanted - Tag 3- Pay Per View @ Panthers Penrith in Sydney, New South Wales, Australia",
69,29.06.2024,,"WSW Australian Title:Shigehiro IriedefeatsTJP(c) (16:26) -TITLE CHANGE !!!WSW Most Wanted - Tag 2- Pay Per View @ Melbourne Pavillion in Melbourne, Victoria, Australia",
70,28.06.2024,,"WSW Australian Title:TJP(c) defeatsBrian CageandJack Cartwheel(12:40)WSW Most Wanted - Tag 1- Pay Per View @ Eatons Hill Grand Ballroom in Brisbane, Queensland, Australia",
71,23.06.2024,,"G1 Climax 34 Block B Qualifying Tournament First Round:TJPdefeatsSatoshi Kojima(12:50)NJPW New Japan Soul 2024 - Tag 5- TV-Show @ Kamisu Bousai Arena in Kamisu, Ibaraki, Japan",
72,22.06.2024,,"United Empire(HENARE,Jeff Cobb&TJP) defeatSatoshi Kojima,Tomoaki Honma&Tomohiro Ishii(9:30)NJPW New Japan Soul 2024 - Tag 4- Online Stream @ Toyota Crown Arena in Fukushima, Japan",
73,19.06.2024,,"United Empire(Great-O-Khan,HENARE,Jeff Cobb&TJP) defeatHiroshi Tanahashi,Katsuya Murashima,Satoshi Kojima&Shoma Kato(11:42)NJPW New Japan Soul 2024 - Tag 3- Event @ Iwate Prefectural Gymnasium in Morioka, Iwate, Japan",
74,18.06.2024,,"United Empire(Francesco Akira,Great-O-Khan,HENARE&TJP) defeatHiroshi Tanahashi,Katsuya Murashima,Satoshi Kojima&Shoma Kato(10:01)NJPW New Japan Soul 2024 - Tag 2- Event @ Aomori Martial Arts Hall in Hirosaki, Aomori, Japan",
75,16.06.2024,,"United Empire(Callum Newman,Francesco Akira,Great-O-Khan,Jeff Cobb&TJP) defeatKatsuya Murashima,Satoshi Kojima,Shoma Kato,Tomoaki Honma&Tomohiro Ishii(7:40)NJPW New Japan Soul 2024 - Tag 1- Online Stream @ Hokkaido Prefectural Sports Center in Sapporo, Hokkaido, Japan",
76,03.06.2024,,"Best Of The Super Junior 31 Semi Final:Taiji IshimoridefeatsTJP(19:37)NJPW Best Of The Super Junior 31 - Tag 13- TV-Show @ Korakuen Hall in Tokyo, Japan",
77,31.05.2024,,"United Empire(Callum Newman,HENARE&TJP) defeatLos Ingobernables de Japon(BUSHI,Shingo Takagi&Titan) (11:03)NJPW Best Of The Super Junior 31 - Tag 12- TV-Show @ Korakuen Hall in Tokyo, Japan",
78,30.05.2024,,"Best Of The Super Junior 31 Block A:TJP[10] defeatsTitan[10] (13:21)NJPW Best Of The Super Junior 31 - Tag 11- TV-Show @ Korakuen Hall in Tokyo, Japan",
79,28.05.2024,,"Los Ingobernables de Japon(Titan&Yota Tsuji) defeatUnited Empire(Callum Newman&TJP) (10:05)NJPW Best Of The Super Junior 31 - Tag 10- Online Stream @ Kira Messe Numazu in Numazu, Shizuoka, Japan",
80,26.05.2024,,"Best Of The Super Junior 31 Block A:TJP[8] defeatsEl Desperado[10] (21:10)NJPW Best Of The Super Junior 31 - Tag 9- TV-Show @ Yoyogi National Gymnasium #2 in Tokyo, Japan",
81,22.05.2024,,"Best Of The Super Junior 31 Block A:TJP[6] defeatsBlake Christian[8] (15:52)NJPW Best Of The Super Junior 31 - Tag 8- Online Stream @ EDION Arena Osaka #2 in Osaka, Japan",
82,21.05.2024,,"Best Of The Super Junior 31 Block A:TJP[4] defeatsKosei Fujita[4] (12:13)NJPW Best Of The Super Junior 31 - Tag 7- Online Stream @ Arcrea Himeji in Himeji, Hyogo, Japan",
83,19.05.2024,,"Best Of The Super Junior 31 Block A:TJP[2] defeatsHAYATA[4] (13:01)NJPW Best Of The Super Junior 31 - Tag 6- Online Stream @ Nagoya Congress Center Event Hall in Nagoya, Aichi, Japan",
84,18.05.2024,,"Best Of The Super Junior 31 Block A:BUSHI[2] defeatsTJP[0] (2:55)NJPW Best Of The Super Junior 31 - Tag 5- Online Stream @ Esforta Arena Hachioji in Hachioji, Tokyo, Japan",
85,16.05.2024,,"Los Ingobernables de Japon(BUSHI,Tetsuya Naito&Titan) defeatUnited Empire(Callum Newman&TJP) &Blake Christian(9:54)NJPW Best Of The Super Junior 31 - Tag 4- Online Stream @ G Messe Gunma in Takasaki, Gunma, Japan",
86,15.05.2024,,"Best Of The Super Junior 31 Block A:Clark Connors[4] defeatsTJP[0] (12:28)NJPW Best Of The Super Junior 31 - Tag 3- Online Stream @ Region Plaza Joetsu in Joetsu, Niigata, Japan",
87,13.05.2024,,"Best Of The Super Junior 31 Block A:Yoshinobu Kanemaru[2] defeatsTJP[0] (2:18)NJPW Best Of The Super Junior 31 - Tag 2- Online Stream @ Korakuen Hall in Tokyo, Japan",
88,11.05.2024,,"Best Of The Super Junior 31 Block A:Kevin Knight[2] defeatsTJP[0] (15:02)NJPW Best Of The Super Junior 31 - Tag 1- Online Stream @ YohaS Arena in Chiba, Japan",
89,04.05.2024,,"Relentless Heavyweight Title:TJP(c) vs.Tom Lawlor- No ContestRelentless Episode 25- Event @ Players & Spectators Event Center in Spokane Valley, Washington, USA",
90,22.04.2024,,"Faction Warfare Gauntlet:United Empire(Callum Newman,Francesco Akira,Great-O-Khan,Jeff Cobb&TJP) defeatJust 5 Guys(DOUKI,SANADA,Taichi,TAKA Michinoku&Yuya Uemura) (55:41)NJPW Road To Wrestling Dontaku 2024 - Tag 3- Online Stream @ Korakuen Hall in Tokyo, Japan",
91,21.04.2024,,"Just 5 Guys(SANADA,Taichi&Yuya Uemura) defeatUnited Empire(Francesco Akira,Great-O-Khan&TJP) (14:53)NJPW Road To Wrestling Dontaku 2024 - Tag 2- Event @ Chino Cultural Complex in Chino, Nagano, Japan",
92,20.04.2024,,"Just 5 Guys(Taichi&Yuya Uemura) defeatUnited Empire(Great-O-Khan&TJP) (12:54)NJPW Road To Wrestling Dontaku 2024 - Tag 1- Event @ Machida Gymnasium in Machida, Tokyo, Japan",
93,12.04.2024,,"Riot Rules:BULLET CLUB(Clark Connors,David Finlay,Gabe Kidd&KENTA) defeatEddie Kingston,Homicide&United Empire(Jeff Cobb&TJP) (17:58)NJPW Windy City Riot 2024- Pay Per View @ Wintrust Arena in Chicago, Illinois, USA",
94,06.04.2024,,"IWGP Junior Heavyweight Tag Team Title:BULLET CLUB War Dogs(Clark Connors&Drilla Moloney) (c) defeatCatch 22(Francesco Akira&TJP) andIntergalactic Jet Setters(Kevin Knight&KUSHIDA) (17:29)NJPW Sakura Genesis 2024- TV-Show @ Ryogoku Kokugikan in Tokyo, Japan",
95,04.04.2024,,"Catch 22(Francesco Akira&TJP) defeatKatsuya Murashima&Shoma Kato(8:26)NJPW Road To Sakura Genesis 2024 - Tag 4- Event @ Tatsunoko Arena in Ryugasaki, Ibaraki, Japan",
96,03.04.2024,,"Gauntlet:Intergalactic Jet Setters(Kevin Knight&KUSHIDA) &Tomohiro IshiidefeatUnited Empire(Callum Newman,Francesco Akira&TJP) andBULLET CLUB War Dogs(Clark Connors,Drilla Moloney&Gedo) (18:16)NJPW Road To Sakura Genesis 2024 - Tag 3- TV-Show @ Korakuen Hall in Tokyo, Japan",
97,31.03.2024,,"Los Ingobernables de Japon(BUSHI,Hiromu Takahashi&Yota Tsuji) defeatUnited Empire(Callum Newman,Francesco Akira&TJP) (10:10)NJPW Road To Sakura Genesis 2024 - Tag 2- Online Stream @ Act City Hamamatsu in Hamamatsu, Shizuoka, Japan",
98,20.03.2024,,"United Empire(Francesco Akira,Great-O-Khan&TJP) defeatRyusuke Taguchi,Tanga Loa&Tomohiro Ishii(10:11)NJPW New Japan Cup 2024 - Tag 12- TV-Show @ Aore Nagaoka in Nagaoka, Niigata, Japan",
99,18.03.2024,,"Los Ingobernables de Japon(BUSHI,Hiromu Takahashi&Tetsuya Naito) defeatUnited Empire(Francesco Akira,Jeff Cobb&TJP) (8:12)NJPW New Japan Cup 2024 - Tag 11- Online Stream @ Big Palette Fukushima in Koriyama, Fukushima, Japan",
100,17.03.2024,,"Guerrillas Of Destiny(El Phantasmo,Hikuleo&Tanga Loa) defeatUnited Empire(Francesco Akira,Great-O-Khan&TJP) (10:44)NJPW New Japan Cup 2024 - Tag 10- Online Stream @ Twin Messe Shizuoka in Shizuoka, Japan",
101,16.03.2024,,"TMDK(Mikey Nicholls&Zack Sabre Jr.) defeatUnited Empire(Callum Newman&TJP) (14:12)NJPW New Japan Cup 2024 - Tag 9- TV-Show @ Aichi Prefectural Gymnasium in Nagoya, Aichi, Japan",
102,15.03.2024,,"United Empire(Francesco Akira,Great-O-Khan,Jeff Cobb&TJP) defeatLos Ingobernables de Japon(BUSHI,Hiromu Takahashi,Shingo Takagi&Tetsuya Naito) (9:42)NJPW New Japan Cup 2024 - Tag 8- Online Stream @ Osaka Kanaoka Park Gymnasium   in Sakai, Osaka, Japan",
103,13.03.2024,,"CHAOS(Hirooki Goto,Tomohiro Ishii&YOSHI-HASHI) defeatUnited Empire(Callum Newman,Francesco Akira&TJP) (8:50)NJPW New Japan Cup 2024 - Tag 7- Online Stream @ ZIP Arena Okayama in Okayama, Japan",
104,12.03.2024,,"Catch 22(Francesco Akira&TJP) defeatEl Desperado&Ryusuke Taguchi(10:45)NJPW New Japan Cup 2024 - Tag 6- Online Stream @ Uwajima City General Gymnasium in Uwajima, Ehime, Japan",
105,11.03.2024,,"United Empire(Callum Newman,Francesco Akira,Great-O-Khan,Jeff Cobb&TJP) defeatLos Ingobernables de Japon(BUSHI,Hiromu Takahashi,Shingo Takagi,Tetsuya Naito&Yota Tsuji) (10:02)NJPW New Japan Cup 2024 - Tag 5- Online Stream @ Item Ehime in Matsuyama, Ehime, Japan",
106,10.03.2024,,"Los Ingobernables de Japon(BUSHI,Hiromu Takahashi,Shingo Takagi&Tetsuya Naito) defeatUnited Empire(Callum Newman,Francesco Akira,Great-O-Khan&TJP) (9:35)NJPW New Japan Cup 2024 - Tag 4- Online Stream @ Baycom Gymnasium in Amagasaki, Hyogo, Japan",
107,08.03.2024,,"United Empire(Francesco Akira,Great-O-Khan,Jeff Cobb&TJP) defeatLos Ingobernables de Japon(BUSHI,Hiromu Takahashi,Tetsuya Naito&Yota Tsuji) (9:53)NJPW New Japan Cup 2024 - Tag 3- Online Stream @ Aimesse Yamanashi in Kofu, Yamanashi, Japan",
108,07.03.2024,,"New Japan Cup 2024 First Round:David FinlaydefeatsTJP(16:17)NJPW New Japan Cup 2024 - Tag 2- TV-Show @ Korakuen Hall in Tokyo, Japan",
109,06.03.2024,,"United Empire(Callum Newman,Francesco Akira&TJP) defeatBULLET CLUB War Dogs(David Finlay,Gabe Kidd&Gedo) (7:55)NJPW 52nd Anniversary Event & New Japan Cup 2024 - Tag 1- Online Stream @ Ota City General Gymnasium  in Tokyo, Japan",
110,24.02.2024,,"Relentless Heavyweight Title:TJPdefeatsTom Lawlor(c) -TITLE CHANGE !!!Relentless Hypertension- Event @ Players & Spectators Event Center in Spokane Valley, Washington, USA",
111,11.02.2024,,"Steel Cage:BULLET CLUB War Dogs(Alex Coughlin,Clark Connors,David Finlay,Drilla Moloney&Gabe Kidd) defeatUnited Empire(Francesco Akira,HENARE,Jeff Cobb,TJP&Will Ospreay) (64:05)NJPW The New Beginning In Osaka 2024- TV-Show @ EDION Arena Osaka in Osaka, Japan",
112,09.02.2024,,"BULLET CLUB War Dogs(Alex Coughlin,Clark Connors,David Finlay,Drilla Moloney&Gabe Kidd) defeatUnited Empire(Callum Newman,Francesco Akira,Great-O-Khan,HENARE&TJP) (13:45)NJPW Road To The New Beginning 2024 - Tag 10- Event @ Koga City Central Athletic Park Gymnasium in Koga, Ibaraki, Japan",
113,08.02.2024,,"BULLET CLUB War Dogs(Alex Coughlin,Clark Connors,David Finlay,Drilla Moloney&Gabe Kidd) defeatUnited Empire(Callum Newman,Francesco Akira,Great-O-Khan,HENARE&TJP) (13:26)NJPW Road To The New Beginning 2024 - Tag 9- Event @ Iwaki City Gymnasium in Iwaki, Fukushima, Japan",
114,06.02.2024,,"BULLET CLUB War Dogs(Alex Coughlin,Clark Connors,David Finlay&Drilla Moloney) defeatUnited Empire(Callum Newman,Francesco Akira,Great-O-Khan&TJP) (12:33)NJPW Road To The New Beginning 2024 - Tag 8- Event @ Wing Hat Kasukabe in Kasukabe, Saitama, Japan",
115,05.02.2024,,"United Empire(Callum Newman,Francesco Akira,Great-O-Khan&TJP) defeatBULLET CLUB War Dogs(Alex Coughlin,Clark Connors,David Finlay&Drilla Moloney) (1:11) by DQNJPW Road To The New Beginning 2024 - Tag 7- Online Stream @ Korakuen Hall in Tokyo, Japan",
116,04.02.2024,,"IWGP Junior Heavyweight Tag Team Title:BULLET CLUB War Dogs(Clark Connors&Drilla Moloney) defeatCatch 22(Francesco Akira&TJP) (c) (18:33) -TITLE CHANGE !!!NJPW Road To The New Beginning 2024 - Tag 6- Online Stream @ Korakuen Hall in Tokyo, Japan",
117,03.02.2024,,"BULLET CLUB War Dogs(Alex Coughlin,Clark Connors,David Finlay,Drilla Moloney&Gabe Kidd) defeatUnited Empire(Callum Newman,Francesco Akira,HENARE,Jeff Cobb&TJP) (12:40)NJPW Road To The New Beginning 2024 - Tag 5- Event @ Saitama City Memorial Gymnasium in Saitama, Japan",
118,01.02.2024,,"BULLET CLUB War Dogs(Alex Coughlin,Clark Connors,David Finlay&Gabe Kidd) defeatUnited Empire(Callum Newman,Francesco Akira,HENARE&TJP) (12:34)NJPW Road To The New Beginning 2024 - Tag 4- Event @ Nagano Prefectural Budokan in Saku, Nagano, Japan",
